id,text_process
1589169853457661955,south china already chinese lake type make pact show
1589169837796126720,china leader worry covid 19
1589169793038716928,cia say 35
1589169778018914305,china russia india middle east
1589169769819037696,let hope claim wintershall kind gas condensate use airplane true cheap excuse however sanction gasprom use well deliver gas opportunist like india china etc
1589169748637777922,1 minority china exempt one child policy find basic research 2 china constitution state han chauvinism unacceptable show single western government found document denounces white supremacy exist
1589169731663273984,monday always clever come china profit call market power
1589169721286733824,oilprice amp copper fall monday china change tune amp still stick zero covid
1589169718086471680,average annual income rise 26 fold past three decade western imperialist make much china lift embargo 1979 choose redistribute wealth billionaire class instead ordinary people
1589169697085267969,wait italy invasion us annex little italy china invade take chinatown people like country anyway
1589169688818470915,honda exhibit new ev concept model china japan today
1589169624079556611,modernization revolution china eqpdsjv
1589169617456726018,paul keating say fan threat china china
1589169614550085633,point china give toss less 2 account think enough clarity want shore offshore confirm blade etc manufacture uk import china
1589169591632076800,1 china thucydydes trap activate 2 irrelevant western cultural narrative run us us still euro descended majority change us worldview delete yankee exceptionalism narrative dreamt mostly purchase white
1589169573445894145,free world cause two world war interested turn european issue world war easy say cz probably china pakistan neighbour russia reliable partner 1 4 billion people fee
1589169537211314176,know win bangladesh match fixer pakistan get money china amp whole world aid pay bangladesh
1589169526855409664,watch german chancellor olaf scholz defend controversial trip china worth due agreement oppose use nuclear weapon war ukraine
1589169521847599104,single tankie ever meet answered question live russia ironically even communist dprk china
1589169518437441536,china csi 300 index significant rebalancing tilt industrials
1589169509059170304,poor logical equivalence india proudly claim dead glorified amp give ex gratia kin china hid casualty number month amp idea compensation create make story last moment death mock nyt naming bridge seem face save
1589169501379362818,sounds much like jonathan spence change china
1589169471037612032,episode 0011 u china relation special guest ali wyne january 13 2019 smell victory podcast divergent option
1589169464364482560,learn tiktok face reckon west tech digital data privacy
1589169464330813441,oday update daily sceptic online safety bill risk make nicola sturgeon content moderator whole uk scholz refuse follow america lead china scottish government misrepresents mask guidance
1589169464171532289,time 1 eu member state germany become increasingly dependent china import export significant enlighten report major relevance germany foolish become dependant russia energy need china trade
1589169464154771460,guzheng performance photo provide china daily
1589169463437529088,sometimes parcel china get hold custom get release avoid situation altogether find import importfromchina onlinebusiness wholesale wholesaler dropshipping ecommerce onlinesales supplier retailer
1589169456932323328,china lady dive
1589169444953403392,one bout china
1589169439060422656,look like misgiving discretely travel china probably beg something
1589169437613363200,people think slavery start transatlantic slavery america discover slave pyramid great wall china black hunt africa black sell slave prophet black slave
1589169419414036482,uganda invest oil despite pressure go green bbc news uganda china national offshore oil corporation cnooc france totalenergies sign final investment decision fid climatecrisis
1589169396936744960,australian lithium refinery target carmaker diversify china
1589169391672754176,nah tory billionaire backer china russia people starve freeze death hovel decade squarely toffs tory
1589169385310400512,russia china africa latin america rest asia evils villain cheap labour force us uk empire extension europe us uk europe want war division blood destruction lucrative business fallacy
1589169350426390528,nah tory billionaire backer china russia people starve freeze death hovel decade squarely toffs tory
1589169338116083713,ccp president xijinping world version 21st century hitler nazi worry photo show china 40million shipment military hardware solomon islands sign alarm security pact
1589169333452050432,mongolia relationship china moment close ally read bit
1589169326699220994,marxism debunk fact matter marx analysis capitalism contain lot uncomfortable truth capitalist want reckon really understand china neoliberal capitalism global
1589169324807405569,chinese builder complete us 1 5 billion port nigeria
1589169321477296128,live work singapore live worked beijing china cairo egypt buenos aire argentina
1589169314497978369,china donate sa ofcourse dog watchman need salary
1589169314019807234,brics development bank promotes multilateralism boost global economy ndb president china
1589169297125167105,website
1589169287918673920,shiningroughstonesart ayaka brandy pure gold sorry pun paper say make china ink gold paint acrylic amp canvas title intrigue well w name like astringent persimmon fav love placement traditional scroll
1589169285372727296,monroe doctrine russia china right fair believe western hegemony believe multi polar world
1589169271888052224,think miss point time china drop zero covid regardless type vaccine currently administer population country strict control china argue vaccine well
1589169269094617090,remember pig talk cryptocart china know cryptocurrency allow everrywhere
1589169266980704257,fan russia china global politics sport want objective journalism global economy russia 11 earth land mass sanction hugely destructive destabilise west russia
1589169265747578882,china electronic pcb pcba manufacturer pcb toy oem pcba assembly pc wifi dongle vidoes board assembly pcba motherboard ship fee different country ask discount product price 10 00
1589169248802594816,use bilibili lt stream medium app china many good pronto buy video app like youtubu improve person image china lf desire buy call l call
1589169239533182976,pacific nation demand china address fact big cause climate damage well big polluter land marine australian newspaper
1589169236991447041,bro man busy dead as think never come back live china convince like yeahhhhhhhh make
1589169231953887232,china sunday report high number new covid 19 infection six month day health official say stick strict coronavirus curb likely disappointing recent investor hop ease
1589169228191764481,start 2017 china attack us since 1949 imperial medium merely ramp propaganda go overdrive 2017 fact china bad china something good cost story around way
1589169223766376448,love name china know name call born
1589169221485088769,cop14 open high level ministerial segment china chair assert importance advance wetland conservation action legislation designation wetlands international importance capacity building actforwetlands
1589169208914493440,plus inequality green job boom look china renewable manufacturing surge
1589169204326174720,umm afghanistan failure quid pro quo ukraine corrupt business dealing ukraine china treasonous open border policy unconstitutional collusion private company censor american violate 1a plunder emergency oil reserve name
1589169202971250689,japan pm vow strengthen military int l naval review japan prime minister fumio kishida say country urgently need strengthen military capability amid worsen security environment east south china sea threat
1589169193579995136,ship stock first become popular mid 2000s often view play ascendant china economy today situation temporary pullback sign serious trouble ahead china amp shipping container tanker drybulk
1589169176781852672,china mainland powerful taiwan weak taiwan call attack china mainland year ago see western country complain taiwan china mainland switch power watch iftaiwan threaten us
1589169153327472649,attention artist dj producer coast2coast hit hongkong china year come network
1589169141985837056,along matter many people say china never make corona virus technology explore mutual manufacturer vincible
1589169136852439040,70 year old legacy tea technique subliminal message refugee communism suck ccp rule china
1589169133362753537,get minecraft china edition
1589169119374757888,china product buy today would much high price tag
1589169108171763714,1 china even take taiwan dozen mile away 2 california texas majority minority substantially contribute us technology military hegemony high gdp per caput high gdp growth united state whole
1589169081324044290,valid china us country mentality think good others
1589169080124469250,china welcome
1589169070121046016,correct especially true term relation china
1589169051506724864,germany become economic satellite america new cold war russia china rest eurasia biden state dept stress ukraine beginning large dynamic dividing world two economic alliance
1589169048604246018,germany mega trade deficit china accordingly chancellor scholz try make big business deal reaffirm warm relationship jeopardy
1589169043642404864,business_friendly_environment diversification_of_international_economic_trade_landscape china high level open drive global economy
1589169021823643648,china quickly move bottom shelf top break heart witness uk fall quickly way
1589169021509042176,trudeau let china right trudeaumustgo admires basic dictatorship mirror cbdc work socialcredit system bs climate change
1589169014043217921,pretty cool tesla humanoid robot make china debut ciie2022 lift half ton weight help people repetitive task 特斯拉 人形 机器人 中国 首秀 就在 进博会 voiceofthebund
1589169001439326208,really appreciate point say reply believe shift substantially think true anymore chinese today trust china make product much year ago still vary bit depend category
1589168997756731392,farmer begin harvest rice plant salty soil weifang shandong province rice grow salt affected land salt tolerant yield per mu 0 067 hectare 698 4 kilogram
1589168997005524992,still enough number hold important holding war attrition still make profit sell resoruces country like china india
1589168988646694912,china oppose canada order lithium mining investment reuters breakingnews
1589168985022812160,bro joke would start war india china
1589168961891225601,blind man care trump brainwashed wake may god save soul ask come democracy end heil hitler putin china style good luck
1589168959605338112,open also fail covid bad us tho point look objectively trade politics influence us amp west increasingly isolated world amp china vice versa tho u believe
1589168955016368130,usa get western world high alert hype america cause set aussie politician crazy china intention invade country us invades china look like au stupid enough believe
1589168937480388608,china know since mar 2020
1589168930538786817,wonder want pick fight china amp others club together us someone hit red button way cancel debt cause nobody collect
1589168915057238016,uae government prestigious country world uae uaegovernment government dubai prestigious country world uk usa germany italy spain france sweden ksa canada china india pakistan
1589168914134884354,countryhumans ussr amp china
1589168911685406720,move china bigot
1589168907671465984,stead china basf expand business energy export country like saudi arabia complimentarity clear serf
1589168894027395072,wonder merchandise make sweatshop china
1589168892253175808,balance country walk middle ground play side neutral country well option pro western pro china say
1589168846463963136,conflict ukraine show us ability deter rival world stage military force decline wsj head strategic command us af admiral charles richard believe us little ability contain china compare us sink ship
1589168815694548993,china fuck
1589168813752602624,always always calculate push agenda social justice warrior liberal marxist agenda speak china
1589168754709389313,japan india taiwan support china rest western
1589168712732626944,covid rule dampen hong kong super connector role
1589168696714756098,china welcome must know every country poor rich happy tragic people undeniable china security really good crime rate personal attack low
