id,text_process
1589158408027926528,heavenly peach cost 125 debuted pvz2 china
1589158407898296320,well pay china
1589158406228963330,white boy china town
1589158397961961472,cool thing macau 2022 amp others tell us positive side china via
1589158391514996736,friendship end china netherlands new friend pakistan kabhi na bholo quadrat ka nizam pakistan qualify semi final new zealand pakvsban southafrica nederland t20iworldcup2022
1589158389648527360,imprison political enemy nazi esque communist china like soviet union like hate american democracy
1589158354899075075,ok fine simply point official us china taiwan policy state taiwan part china simple ask bring get say willing learn none officially declare taiwan independent nation ru say
1589158340885897216,india gdp 2014 2 039 trillion usd india gdp 2021 3 173 trillion usd china gdp 2014 usd 10 48 trillion china gdp 2021 usd 17 73 trillion make comparison
1589158316001079296,like china
1589158310510759937,thing make south korea 2nd rank country japan technological expertise china even advance technology rank 3rd south korea
1589158309713829893,hence reason china russia stockpile gold
1589158307817992193,3 19 emergingmarkets etf seriously lag developedmarkets etf mostly due disinvestment china southafrica might 1yr eza performance usd 15 9 still way ahead urth dm 22 2 amp eem em 28 9 period
1589158305578242048,umpire pay china
1589158302872612864,ealme 10 pro 5g curve display tease ahead launch china
1589158286057955329,china stop building coal fire power station would enough change mind
1589158270186704897,see look madly try justify thing clearly bad thing bad someone tout father position outcome must see china sa
1589158265056677888,china russia
1589158259247943681,get position throw dedicate vote choose electoral college delegate never hold another free amp fair election china nk russia etc fascist dictatorship
1589158248292438016,pcb take loan china pay south africa bangladesh enter semi final pcb icc
1589158244034805760,art amp life expert visit taiwan rare point contact taiwan welcome pair expert china help ail panda rare opportunity contact side
1589158221948022791,never underestimate begging amp cheat power pakistan wonder many fixer country separate team make well paid pakistan loan take china
1589158221046239234,pakistan take loan china buy umpire
1589158209192955906,icymi afeera firdous interview feroz khan topic theme cover subcontinent adrift cause consequence drift india pakistan u china role region potential avenue peace south asia
1589158189395841026,china complete first test liquid propellant rocket engine large thrust 500 tonne 4 time current engine type service country developer announce sit 5 11
1589158181984665600,well pay china
1589158178918375424,north korean missile launch may mean new nuclear test
1589158176280444931,german chancellor olaf scholz official china china sign deal worth 17 billion 140 airbus aircraft
1589158174317506561,gary try split hair ya admit taiwan country china bad orgasm
1589158165890928641,olaf scholz lead trade delegation china bearing mind germany lot lose policy maker pull car confrontation beijing write via
1589158163533922305,know live gaumutra drinker behave speak talk write like pakistan 6th large nuclear military power therefore important usa china
1589158162674118656,vote dr oz vote red ever forget american leave taliban forget love affair china russia iran
1589158160207593474,pakistan china agree use bullet proof vehicle outdoor movement chinese national work china pakistan economic corridor cpec project pakistan protect terrorist attack
1589158140234240000,china german chancellor think cooperate china help recover crumble popularity xi think meet olaf give new touch credibility
1589158140225810432,marketmasters amp talk market veteran christopher wood possible year end wall street rally feed rate trajectory unending worry china amp
1589158134404485120,hell ever start president bad joke kill america deport china iraq iran take killmalla hem
1589158128377298944,well pay china
1589158112942260224,currently beloved communist china starve civilian scavenge food trashcans
1589158109574201347,hmm think rather academic take practical one paper one china reality prc roc paper hold long status quo revise force masterpiece political subterfuge keep peace
1589158098056646656,participant join webinar understanding south china sea crisis right google meet joining link
1589158082675970048,xinjiang cultural tourism week open brussels amazingchina china 2 2
1589158074979581953,xi jinping olaf scholz condemn russia threat use nuclear weapon ukraine leader express desire conflict end china germany condemn russian threat use nuclear weapon ukraine
1589158071548678144,seem demand many sector
1589158049453051904,china api market way lax need cracked harder buy reagent cas number whatsapp
1589158027101605888,economy amp finance historic output import 2west locked amp china open work way swing back way amp open close balance external w internal demand domestic demand must slow ext trade drop cliff
1589158015105916928,case white people country 1900 1850 70 industrialisation unless develop bad pollution sort future india china
1589158014455787531,torn settle china korea graduate canada option well pero overrate na char eme bitaw nice sab sa china gyud
1589158013663080448,kid least mainland china
1589157995598217217,8cm cd rare well sure japan china 8cm cd rare
1589157957400690688,think time reimagine cultural identity beyond national question national construction phase skip favor civilizational model something see good china iran example
1589157947669905408,us china
1589157940002709504,german chancellor visit iran bring german company pretend public word make strategic corruption tour ok already screw much russia china iran obvious next choice
1589157927835045889,extort kyrie post picture documentary shut player enslavement treatment uighur muslim china one thing know yeast yeti cornstarch crusader bleach bandit pasty parasite gon show us really feel
1589157922973843456,really believe anyone vote democrat agent russia china
1589157922537623552,liberal love country love country 50 yr ago love today want live putin russia want live china communism mainstream liberal want either reassure
1589157921279340546,question china
1589157910751637505,well pay china
1589157898168504320,cursortek sell bulk data worldwide restaurant hotel email phone socialmedia restaurant newyork chicago lasvegas losangeles dubai china bangkok germany italy turkey istanbul london sydney toronto
1589157896696528897,japan china
1589157892804182018,100 million death mao reign alone plus war china wage korea vietnam etc repression citizen fool chinese propaganda chinese communist party evil organization
1589157889138380800,without usd supremacy china take
1589157870012358656,full article new impetus inject china pakistan relation chief news editor pakistan today
1589157853352587264,president need go china ask support biz china bad face fact us one screw everyone
1589157849720008705,space unit successfully pit china john kasich
1589157848512331776,china get early 90s icon way fenntanyl
1589157815746461701,group seven friday urge china abstain threat coercion intimidation use force
1589157791885045765,like kyrie didnt nike deal like nba football player arent get part check cut china yall wanna act like lebron cant take nigga serious
1589157788713775104,account use mislead follower advise buy bitcoin excuse except el salvador buy bitcoin say germany japan china say el salvador know much theel salvador poor
1589157779977408515,iphone 14 pro max recover shock begin rise price sharp reduction price china
1589157769600724997,andy vermaut share live airshow china 2022 closer look china modern weaponry thank
1589157757256863744,iphone 14 pro max recover shock begin rise price sharp reduction price china
1589157748323004416,imf chief say world need china spirit share development opportunity cctv youtube
1589157745470894081,yes especially china say maintain zero covid policy
1589157742425812992,china russia deploy hypersonic missile tactical nuclear warhead cuba nicaragua order deter us tactical nuclear weapon attack china taiwan crisis russia ukraine war
1589157739892441088,chief news editor believe visit china provide new impetus china pakistan relation bri way china share fruit development unprecedented bring hope develop country
1589157731726168064,china se loan le k
1589157722141794304,perhaps make interim president usa russia china worldpeace
1589157716748304384,money also china se lena padega pkmkbforever
1589157690852245504,india china change stop cutting rain forrests grow soya country agree reduce child birth die population cop die neglect yes
