id,text_process
1589154298478620673,china know virus long covid heart problem etc could try prevent may lack medical facility stage covid patient take hospital bed icu
1589154297458982914,hec provide skilled manpower national international market chairman high education commission focus digital transformation pakistan invite info tech expert tokyo learn china smart class model
1589154281407787010,cancel debt like china would love hey know owe trillion pay oh keep shit go try truck loan let know go
1589154279713288192,china fish fleet defy us standoff pacific ocean nz herald summer china fire missile sea taiwan protest house speaker nancy pelosi visit island much different kind post china fishing
1589154275300872193,pakistan sell mother sister china see proof al jazeera chinese men use woman well pkmkb pkmkbforever
1589154271710547970,yet accord logic okay china russia capture territory year right
1589154252882333696,bitter snub membership axis evil libya china syria today announce form axis evil say would evil stupid
1589154248578977796,russia need help usa threat iran china north korea need help
1589154243948466176,guarantee russia china north korea iran get pretty upset poke us definitely test okay biden bunker safe everyone else
1589154241381564416,think good depend country like china saudi arabia qatar human right lack democracy change moral standard need cooperate although might lead dependency
1589154228076888064,stop projecting onto china actually know china know chinese care politics amp want western style democracy
1589154219940274176,musk globalist technocrat like grandfather buy twitter accelerate agenda 2030 internet mind family idolize china someone need look history amp public statement deep talent pr amp strategy play
1589154211136425984,give energetic rich disperse individual yearn breathe free enact immigration reform target high skilled entreprenuer class russia china esp hk asap cc
1589154210788278272,un scam organization preach reason well future woman third world country kill child point unicef help child future kill never protest china
1589154206182686723,5 minuten geht los live tcr asia china tour car championship super cup zhejiang rennen 4 livestream livestream
1589154206157447169,charter institute journalist seek immediate release australian broadcaster cheng lei deny liberty china 815 day since 13th august 2020 see unjust terrible abuse human right
1589154199644045321,year long campaigns amp worry russia america china australia
1589154190924079105,funny thing happen gurudongmar iphon therefore watch shift china timezone actually 10 40am watch show 1 10pm start wonder hell hotel say back lunch 1pm driver
1589154172469149697,chinese stand ccp plan economy return china
1589154170770423808,welcome china
1589154169461800961,literally unbelievable watch til end tiktok advert rasism race china
1589154168576831488,fly fantastic adventure baby saunder gull ne china cop14
1589154163858214912,feel term accelerationism widely abuse dissident dissatisfied china status quo real knowledge seem masturbate kind talk
1589154160217182209,follow logic greek move china become chinese
1589154135059746817,sorry china get ukraine china begin take neutral stance conflict amp push negotiation
1589154129276211200,2027 generative ai ban eu protect child publish giant model train 70 year old content us china meanwhile agi
1589154126340194304,china secure
1589154123345448962,def research objective amp think pro con do germany cyprus middle east wld anyone happy chat china
1589154120308756480,country want upset indonesia host nation let honest indonesia need contain china choke point
1589154111509102592,aviationdaily c919 narrowbody jet make first public appearance china air show detail aviation aviationlovers avgeek avgeeks airline airline boeing737 boeing777x flight flight airport cabincrew aircraft pilot pilot airbus
1589154093607817216,methane cloud spot china high resolution satellite
1589154085315321856,inevitable nothing wrong good strong 2 us move contain china rise opposite effect asia xr metaverse fintech digital cx smartnation citizenexperience designthinking infinitejourneys
1589154071340277761,welcome live girl
1589154069754839042,reminder china could clear reputation 15 20 minute release viral database close 9 12 19 lab notebook safety log wiv
1589154067577638912,mean neutral people get fantasies russia china care neutrality even sweden finland ditch neutrality becoz always depend morality amp hope geopolitics always define equilibrium force
1589154066277728256,china lead world rich wetlands city set model wise solution conservation biodiversity cop14 delegate say 4 world wetlands china satisfied ecological productional need 1 5 world population
1589154063622770688,cop conference actually achieve mean decision make mean actually happen british tax back serfdom whilst china india russia amp germany surge ahead coal generation
1589154059474579457,although legacy first international treaty china russia write latin
1589154048087068672,capitalism greed literally thing capitalism definition extract much production possible work class rich people become rich excuse back ww2 country famine china become capitalist
1589154046694522880,north korea threaten nukes well nuclear test see china condemn
1589154030126858241,euters china post 6 month high covid count stick strategy
1589154022526976001,china yu 20 aerial tanker conduct flight performance rehearsal official opening airshowchina2022 three aerial refuel basket release video liu xuanzun gt
1589154011139440641,another matteo ricci letter china revise english translation w commentary hannafey j francis publish beijing center press 2019 think j mean society jesus formal name jesuit please correct wrong
1589154004600520704,come great china
1589153975622062080,ok policy pretend us policy china policy even taiwan policy say taiwan part china ya pretend fine
1589153958240874497,true want beat china
1589153955598467072,r modi sangh people u get u shit hole china xi jinping huge repercussion u pester people ill fuck u chinese bastard u road people land break ur shit country thousand piece bastard
1589153946094141440,xi jinping think bad idea china economy
1589153923298127872,responsibility one thing avoid acceptance poor leadership heck never rat president still cannot compare freight favourable country america amp africa close india amp china landlocked country
1589153919175127040,china take
1589153913781227520,remember cctv footage china january 2020 one person 10 second clip stiffen fall floor sometimes twitch remember first time realize whole thing make
1589153909746323456,russian gas go unsold china india consuming rerouted well embargo sanction stop county well affect oil gas price globally safe say sanction remove part
1589153908500631553,actually people like drew attack china every day every post lol call someone wumao mean know wrong want admit lol
1589153897028935680,china donate 40million military hardware solomon island
1589153890603532291,see strategic petroleum reserve much inflation artificially tamp sell spr much china hunter biden connect company keep fuel price extremely vulnerable time loom war
1589153867454783488,tell truth beyond capacity united state well co exist peacefully rest world include china well warmongering time
1589153848165568513,wow china show strength impress
1589153812438454275,anubaike kuwan xinjiang china men championship 2022 beijing marathon china 7th time
1589153792356122624,jp morgan saudi royal family qatari royal family chinese renowned human right free speech amp right assembly twitter effect many large town square share one platform china ban twitter amp fb
1589153785242611714,well pay china
1589153781933289472,wait till people find nba china
1589153761854861312,okay kid remember still need study actual revolution theory marx need revolution kid cry china
1589153758793334784,meanwhile china still lock still beat street
1589153750538915840,support kill innocent people home country china sick person
1589153743819649025,mean dictatorship require india growth match china
1589153737301368832,fair pole wannabe pole degrade lot last decade even five year ago live china westerner fine 12 year ago expats live moscow satisfy russia
1589153726727868417,russian govt involve disinfo everything russia china fault smfh
1589153716711874562,please focus fact 1 china feed 2 billion people indus valley cant even 20 crore equal agricultural resource 2 per acre production indus valley low world 3 feudal system create hunger 200 year ago still exist indus valley
1589153716606992384,china oppose canada order lithium mining investment ccp ccppureevil freedom china chinathreat chinawar taiwan defeatccp americaningenuity madeinusa madeinamerica quitchina ccpevilempire decouplechinapac decouplechina boardmanreport
1589153712722829312,jason lee mood extremely rare merch
1589153708923056128,neither chinperialism kim seriously believe china nation state per peking_duck quackery nothing hypocrite commie braindead black_lives_matter non_chinese chinese ccp_fascist_ruled_chinese_empire
1589153701805330432,beijing marathon back two year covid rule force
1589153683706875911,dear mr allen fan china saw tv age 15 impressed charm skill pay attention eternal idol hope get reply thank much
1589153670482231297,hinduo careful know congress play hindu amp hindustan lot conspiracy play name minority act place worship act waqf act disclose mou sign china congress mou sign 2 country jawab
1589153661267374081,nobody democracy force russia attack plot war china try harder
1589153647833010177,would ironic walmart produce china consider bitcoin ban china
1589153633404440577,chickity china chinese chicken oneweek
1589153620800376833,talk point date gop buddy everyone know biden amp obama billionaires hang billionaire club china get democrat chinese puppet string dems screw middle class obama amp biden bank account flood payoff xi
1589153586449379328,biden hugely consequential high tech export ban china explain expert
1589153581705629696,make china marc phishing hole know mean
1589153578895421441,ya india 55 china 69 heaven fall
1589153565788237825,lol western propagandist hop rift china russia gonna happen xi declare limit friendship russia smo
1589153561371643904,germany big trouble scholz dead man walk xi jinping school scholz quick trip china via
1589153545395535872,thank sir stand firm china continuously thuggish chinese consulate staff clearly show police state treat protester hold accountable violence free nation like uk standwithhongkong
1589153540026814465,yep sell product make china
1589153530082119681,cute china bear
1589153511056740352,tibet china
1589153501120466946,talk land mass population pakistan relate well china china part poor country world look china look nigeria population either utilize unutilised 1963 much dollar compare china currency
1589153500751360006,late legendary bappi lahiri song jimmy jimmy aaja aaja lockdown popular anthem china rego grandson declare proud moment india film music industry bappilahiri regolahiri jimmyjimmy jimmyjimmyaajaaaja trendingaudio
1589153496401530880,china town toe
1589153477330370560,rate china gonna roll lockdown like 2025 know much global supply chain shift away influence chinese policy maybe china begin relax covid zero policy believe see
1589153474528567297,must think china
1589153474113306627,look like china see shit like happen time thailand queue jumper
1589153456098803713,sign justice cat steal sell alleged meat slaughterhouse
1589153455469260800,anyone remember elon condemn covid shutdown us never peep abt china shutdown doesnt want piss china potential tesla car factory doesnt care abt worker production elon trust
1589153455314456577,still wonder find marxist leninist stuff china xd
1589153442903183360,simply china self interest russia use nuke country one move would consequences endanger china long run
1589153436653785088,learn solve press operational challenge respond change supply demand speed business supplychain
1589153435873869825,ceramic doll ornament fujian swanticeramic co ltd 753 fuping road pengxiang industrial zone dehua fujian china 362500 e mail tommy whatsapp 86 155 5906 0288 website factory direct sell welcome oem odm
1589153431805382656,mr xi jump great sun universe one could replace mainland china kill million chinese next ten year share experience last sun mao zedong hell one shake mind twitter even xi pass away
