id,text_process
1589148835972272129,lebron love china enough say
1589148796470300672,china take necessary step safeguard right interest company say ministry commerce sit canada last week order three chinese firm divest three lithium mine canada cite national security
1589148776437981184,use ccp covid tool create police state lockdown implement great wef nwo globalist reset build back good thing go want chinese style govern world un elect elitist china see opportunity
1589148730523279361,fool understand united state ukraine squeeze russia america democracy great danger war determine future democracy decade want become servant china stop help ukraine
1589148730489733125,natural always china refuse any1 go check 100 cover allow intl flight block nationwide flight therefore intentionally allow spread
1589148718137499648,great power competition china security assistance africa arm train influence
1589148718032654336,think rigid enough survive another trump presidency tandem large recession depression war europe potential new global conflict china russia iran know thing play
1589148710587359232,hm china se lene prhe gy phr toh
1589148708981329920,cool guy please come china chance let feel much deserve biblewichapas biblesumettikul bsumone
1589148694963945473,chill siapa nak dapat verify extra feature je twitter main goal like china wechat one app pay shop communicate
1589148690274746368,blame unep 3 un convention meeting november 2022 cop27egypt citescop19 panama ramsar wetlands wuhan china biodiversity december 2022 canada environmentalist amp goverments tired participate meaningfully shame
1589148689859506176,lecommunist realize factory condition china
1589148683186339840,come china third year
1589148679763533824,china agree approve biontech covid 19 vaccine foreign resident scholz xi jinping also discuss pathway approve biontech vaccine broad population china
1589148664018370568,agree yuan trash forcibly use china china back russia middle east help gonna wreck usd even usd last breath save stable coin back btc way else continue
1589148655436578818,another china make shoe
1589148630577213440,ook two dax short friday 20x 30x first one littlebit early size 0 5 portfolio hop strong pullback reading china stick covid zero plan
1589148627444043777,currently china previously korea japan lot great place live worldwide teach
1589148622653861889,mister mosquito become leader china
1589148622377172992,wall street journal critical renew china vatican agreement immediately learn renew endorsement agreement china vatican amer asia world abuse asia atheism bishop cardin
1589148609945432064,pakistani kill 25000 palestinian still mourn black september people sell 1942 square kilometre kashmir land china money shameless beggar think nobody know
1589148607600787457,difference u kejriwal cong sp tmc u guy miss chance malign india india always pressure west like manmohan singh time india rule cong chief support china pak
1589148583076327424,people say china pollute say usa say whatever need stop
1589148581101207552,strategic deception cover china emperor xi jinping via excellent analysis friend dr yan astute insight chinese culture ccp agenda dangerous psychopathy emperor xi
1589148576734666752,vatican renews china deal second time provisional agreement vatican china first sign september 2018 renew another two yea asia newsdeskinbox world sinicization asia bishop cardin
1589148543209521152,google obscure latino sexualize china
1589148522850717696,scmp article one month ago decent update china mrna development trial etc
1589148518060797954,didnt edg v damwon reach 20 million viewer china
1589148503141650432,china buying 1400 acres florida primate research
1589148475132116993,probably china
1589148448137555969,postarea 9 fortify south china sea island help project beijing power expert prin
1589148429179310081,many case china apply join iss back day america reject china china build space station back nuclear weapon icbms nuclear submarine etc etc
1589148423831588865,evedence show people east ukraine want independent kiev close russia understood un eu africa china india usa russia win zelensky suspend democracy imprisoned opposition party
1589148419356241921,feed pellet machine china factory poultry livestock fcnfm twitter elonmusk feedpelletmachine
1589148413748469760,ppl buying gate china thats scary
1589148407448604672,china cause pandemic
1589148403551719424,say president oga shift
1589148391581548545,amp evidence china plan anything outside respond necessity ratchet tension north atlantic nation amp tag alongs economically us back rcep asean take lead china
1589148389266329601,yeah yeah anti vaxxers anti masker like trump lead us obscene 1m death toll corrupt gop still want play tired anti china card evidence would laugh court
1589148385482657792,china others fare land migrate elsewhere msn group social medium wild end twitter nigh
1589148382953865216,affraid affiliate chinese state china repressive autoriterian regime
1589148371386003458,classic example deliberate misinformation china name 11 bridge 4 u creep pay write tweet usa pak
1589148368772923392,china manipulate place block
1589148360183017472,dholera china big political party us democrats republican tory rich people interested longterm thing like religion
1589148356290707456,try stay topic take china
1589148354138996736,collaboration china deep state democrat compromise cdc hs dept absolute mess nancy know need flight china u spread virus faster pushback trump cancel flight
1589148327605833729,yes tank china wait gonna perform arena bp stadium 85k attendance per show
1589148324279771136,current situation rural china
1589148304105168896,come conclusion murdoch look authoritarian china russia come conclusion democracy way go undermining medium empire call alternative fact herald sun year go fox news
1589148253563793409,icymi rare earths china accuse canada suppression govt order chinese firm via
1589148243333906432,true fine ukraine manmade famine also exceptionally well great famine cultural revolution china
1589148231807954944,china russia superpower great china great russia
1589148227970174978,esla bot optimus make first appearance debut china international import expo shanghai first debut outside america tesla teslachina teslabot ciie2022 tsla
1589148226657333249,china international import expo shanghai draw 400 japanese own business despite risk relate spread novel coronavirus change security environment
1589148215429169152,anyone come china ghana tuesday
1589148211138400256,china know
1589148211092271105,kinda set do cry china china full preparation take game another level korean peninsula go get hot follow geopolitic chess game russia already corner garden corner
1589148207741038594,interest first heard heard saudi go accept china yuan addition us dollar soon would even big threat us dollar country move away usd universally accepted currency
1589148199180152839,joe tsai support muslim concentration camp china sensitivity training proper donation
1589148195476627459,bannon call doj fbi open secret sell out ccp time clean corruption see love country tue hurt know people sell usa china
1589148191844610048,exactly government government control 1 4 billion people without love secondly people china criticize government give complaint local government near instead vandalize community
1589148189835563009,bull shit planet lot wealth share everyone issue 1 corrupt ruling class 2 prophecy fulfilment bastard 3 power control amp domination subject 4 holier thou mentality russia china putin ukraine lula saudi
1589148172395286528,nonsense bridge finance china india loan higher rate pile debt without take strict measure cut expenditure increase revenue keep people happy debt exactly need
1589148171737116672,great achievement mankind need china need people world
1589148171636445185,family would lot good good economic situation maybe good enough decent life enough go high well economic level india need people take position require skill china labour intensive like us
1589148139818487813,actually need trump back handle china
1589148138748928001,well pay china
1589148136358178816,worry china take mineral russia instead
1589148133787062275,con man kelly biden china puppet
1589148132973199362,china 2019 county function
1589148130611957761,china complete test liquid propellant rocket engine via
1589148130385485824,na bro china meray liye go zone im one rash drive idiot
1589148128019718144,ecent gallery amp studio bts chinaheights chinaheightsgallery china height gallery
1589148117022420992,although impressive still think china continue enhance offensive defensive military capability
1589148116741427200,another revolution process xi era come end new china form
1589148112827944960,eu chief back investigation covid 19 origin say china involve
1589148103395119105,sure education camp china
1589148100169723904,op japan u diplomat agree monitor china upon xi third term japan time
1589148098160652290,return china
1589148079785390081,imagine right voting deprive happen hong kong let alone china corruption us government never compare autocracy
1589148079353364480,look like out
1589148047371829255,ciie share priority un development agency promote fair trade unido chief ciie2022 ciie china credit
1589148038500868102,go antarctica problem india make akhand bharat merge southern china pakistan afghanistan amp myanmar great leadership yogi ji yogi make hindu rashtra earth surface thermosphere use burnol
1589148028581339138,china make chip
1589148024307318786,like fine china plate
1589147992896200705,china block internet include google wikipedia mention social medium
1589147979252109313,worried rise fascism right country china sit back watch us implode infighting plant seed division diverse people country racists fall
1589147976928493568,hate america move ask china get anything want
1589147970033025024,pay elon musk run twitter ground maga china russia
1589147913145307136,wow say
1589147911480258561,finish ait think son live china come learned english go military rate higher rat even get 100 point low regardless apply need near army reserve base
1589147893029830656,china belt road initiative successful economic strategy fail soft power tool
1589147867104497664,beautiful want go see personal lazy impossible pay visit china one day actually want travel care place go
1589147861920649216,pakistan take loan china instead develop country buy south africa player empires cheap beggar
1589147856648441857,try shut coal plant china
1589147845638369280,current situation rural china
1589147819671425025,whats china definition severe covid line global standard
1589147803078774785,word serican relevant translation chinese want nothing china nothing prove languages speak china banner leave china sina continental east asia behind choose god vanity
