id,created_at,full_text
1588812604704575488,Sat Nov 05 08:36:58 +0000 2022,@99_andriy_ @Biz_Ukraine_Mag It is a lie
1588812601387290624,Sat Nov 05 08:36:57 +0000 2022,"US military forces present in Ukraine working with ""partners."" Boots on the ground, old US playbook. https://t.co/E94R1HH8nd via @YouTube"
1588812600758136832,Sat Nov 05 08:36:57 +0000 2022,"@SovrednavvVd @BotFella4000 In Europe Kryvyi Rih, Ukraine, is the longest (126 km).  We'll ask @tintinandsnowy3 to provide some 🐘🐘🐘 maybe 😄."
1588812599462096896,Sat Nov 05 08:36:57 +0000 2022,"@Maurice17270448 @SecBlinken @ForeignOfficeKE disgusting statement from you, bombing of Somalia civilians from our territory is despicable, look at Libya, Yemen, Ukraine; GMOs in Kenya=disaster in the making etc. go back to school to study some history."
1588812599298502656,Sat Nov 05 08:36:57 +0000 2022,"@DMinghella UNBELIEVABLE... If they could, Remoaners would blame everything including the Ukraine WAR, the WORLD energy cost explosion, the global cost of living crisis and rising inflation on Brexit. 🙄
History is NOT yours to change. GET OVER IT. REMOANERS LOST. That includes Carney. 🥴"
1588812593447473152,Sat Nov 05 08:36:55 +0000 2022,@tedcruz Ukraine
1588812568889815041,Sat Nov 05 08:36:49 +0000 2022,@unexmlm @elonmusk @Ukraine @SpaceX @ZelenskyyUa I can't imagine that there is a man behind this account. https://t.co/WJiR599Scx
1588812560018870273,Sat Nov 05 08:36:47 +0000 2022,"@RoyalNavy @RNASYeovilton #Ukraine #UkraineRussiaWar #UkraineWar #nazis #Russia #RussiaIsATerroristState

Today in the menu, asian militants

US Army officer Captain Paul Kim, was eliminated by Russian forces near Kherson. 

He was previously part of the US 82nd airborne and took part in the war in Iraq. https://t.co/n1fzS5gjuV"
1588812553433804800,Sat Nov 05 08:36:46 +0000 2022,Putin criminally uses military powers to kill Ukraine civilians. https://t.co/XQWP3P3twd
1588812540372733952,Sat Nov 05 08:36:42 +0000 2022,"@HomerSi25687423 @A1paca01 @MoD3ans @QUzelman @Raman10Ag @Flxtxyz @elonmusk Lmao we gave 50 billion+ to ukraine this year. But apparently we can't spare 6 billion to ""solve"" world hunger."
1588812536350388224,Sat Nov 05 08:36:42 +0000 2022,"@Nymphomachy I mean, Russian soldiers in Ukraine can defect and yet"
1588812528590950401,Sat Nov 05 08:36:40 +0000 2022,"GREAT VICTORY! Ukraine Gained Its Territory Back In Kherson!
#Canada #Germany #UnitedStates #Kherson #Ukraine https://t.co/k6lYCpmFez"
1588812521448013824,Sat Nov 05 08:36:38 +0000 2022,@shadowcrewtroll @Elliot51116418 @JuliaDavisNews Lots of Republican house members have been vowing to stop aid to Ukraine should they regain the house. It’s not just a fringe few anymore.
1588812517781868545,Sat Nov 05 08:36:37 +0000 2022,"@ScribblingWalls @NafoBrotherD @vasilina_orlova @briebriejoy I hate them too. They are willing to go fight in Ukraine, for nothing."
1588812516150632448,Sat Nov 05 08:36:37 +0000 2022,@jimmeblacksmith @BBCSteveR You understand that Russia could leave Ukraine tomorrow and stop this war? If NATO doesn't support Ukraine there wouldn't be a war or a Ukraine. Russia could have got more from threats and negotiations. Now all their neighbours are looking for protection from them.
1588812515613773827,Sat Nov 05 08:36:37 +0000 2022,@BrainIsaTool1 @ZelenskyyUa @Ukraine Prisoner exchanges prove humanity finds a way in the darkest of times. I pray all prisoners of Ukraine return to there family's and their minds stay strong. God bless the victims of Putin's war.
1588812510748348416,Sat Nov 05 08:36:35 +0000 2022,"New ruZZian conscripts are likely being sent to the frontline with “minimal or no training at all”, British defence chiefs have said.

https://t.co/O6lKoNXQGs"
1588812503613870080,Sat Nov 05 08:36:34 +0000 2022,@laHubbard3 @AndyOstroy another 400$ million send to Ukraine ... they can't even VOTE BLUE
1588812501814214656,Sat Nov 05 08:36:33 +0000 2022,"Russia-Ukraine war: List of key events, day 255 https://t.co/EN0lHhM6mE"
1588812501042724866,Sat Nov 05 08:36:33 +0000 2022,Russia Launches More Drones Into Central Ukraine As Fierce Fighting Under Way In The East - Radio Free Europe / Radio Liberty https://t.co/GvObfQz5Wz
1588812498664558592,Sat Nov 05 08:36:33 +0000 2022,"ISW Russian Offensive Campaign Assessment, November 4 - Kyiv Post - Ukraine's Global Voice https://t.co/tGZPl4QXH0"
1588812495573385222,Sat Nov 05 08:36:32 +0000 2022,"Train crossed from North Korea into #Russia on Friday, after the #USA said #Pyongyang is covertly supplying Russia with artillery shells for its war in #Ukraine. 38-North project which monitors N_Korean, said it was 1st time such train movement in several years. #UkraineRussiaWar"
1588812493065183232,Sat Nov 05 08:36:31 +0000 2022,"BREAKING: The Pentagon has announced $400 million in new military assistance for Ukraine.

It’s basically made up of old 1970’s equipment 🤣🤣 I guess they don’t have much confidence in the Ukrainian military otherwise they’d be given top of the line equipment."
1588812490296950784,Sat Nov 05 08:36:31 +0000 2022,"@Liam09094 @TomBlenkinsop @PaulBennoFlynn @scoobysusan10 @CampaignSouth @Michelle_htimS @IanByrneMP Instead of tweeting anonymously, I have been publicly supporting Ukraine Solidarity.

It is quite possible to support some of what a campaign does and not others.

I note you sidestepped that I have put a Ukraine Solidarity motion to Liverpool City Council."
1588812489344831488,Sat Nov 05 08:36:30 +0000 2022,"@Manuel4All @capt_calhoun @pslweb I don't support the embargo on Cuba. I'm just sick of people giving Ukraine, the democracy, defending itself from a fascist invader shit. I have looked into every pro-Russian talking point, it's always at best a kernel of truth buried under a mountain of lies."
1588812485628669952,Sat Nov 05 08:36:29 +0000 2022,@BBCWorld China's position is consistent and crystal clear. NATO must stop supplying Ukraine with weapons.
1588812475905892352,Sat Nov 05 08:36:27 +0000 2022,"@legendofcheese @DoctorFishbones @EndlessNexus @thehill What peace deal? The one where Russia got to keep half of Ukraine because Putin felt ""scared?"" Gfy."
1588812475004116992,Sat Nov 05 08:36:27 +0000 2022,@GeromanAT @ukraine_map Something very wrong with your thought processes
1588812473070923777,Sat Nov 05 08:36:26 +0000 2022,"Pentagon confirms Ukraine's role in ""biodefense"" with 46 biolabs there. Conspiracy theory is now just another confirmed Pentagon press release. https://t.co/kUJ9rMsNAG"
1588812459263115264,Sat Nov 05 08:36:23 +0000 2022,"..One of the stands is dedicated to different types of drones from the private design office A.A. Gorbounov. - Wagner Press

#Russia #Ukraine #UkraineRussiaWar #Kyiv #Kharkiv #Kherson #zaporijia"
1588812457174511616,Sat Nov 05 08:36:23 +0000 2022,"@grahamprecey @kowedamarowin @DefensieMin @MinPres We have a history of supporting terrorist, like ISIS
So why not support some nazi's ( Ukraine ) along the way
We are doing good💪"
1588812454527897601,Sat Nov 05 08:36:22 +0000 2022,"Betrayal from Germany. More than 70% of Germans are against increasing military aid to Ukraine. 
This is evidenced by the Deutschland Trend survey. Of these 70% of respondents: 41% of respondents consider Germany's assistance sufficient, 30% – excessive."
1588812453357694976,Sat Nov 05 08:36:22 +0000 2022,"@nexta_tv I’d not be surprised if all these Twitter and Starlink things recently happened due to the midterms in the US and Russians failing in Ukraine. Elon doesn’t care about people, he cares about money."
1588812451683909632,Sat Nov 05 08:36:21 +0000 2022,I Thought About My Two Students | Nancy Byrne Iannucci | The BeZine Spring 2022 Issue's special Ukraine Peace section. #UkrainePeace #poetry https://t.co/N5qJSSn5EL
1588812439210307585,Sat Nov 05 08:36:18 +0000 2022,"@Rotterdam_anon @shadesisla @DefensieMin @oleksiireznikov Hungary after getting the land border with Russia would turn into another Belarus. Serbians, who are aready braindead, also get the direct link via Hungary. 
Can you imagine that sh* all this situation would cause? 
Ukraine is vital for YOUR stability as well."
1588812426157633537,Sat Nov 05 08:36:15 +0000 2022,British Defence Intelligence Update Ukraine – 5 November 2022 - Kyiv Post - Ukraine's Global Voice https://t.co/hNXVuRPqhF
1588812423212896256,Sat Nov 05 08:36:15 +0000 2022,Instead of printing American $ for America you're launderi oh I mean giving it to other countries like Ukraine..... https://t.co/vSkpCEyMbM
1588812416242290689,Sat Nov 05 08:36:13 +0000 2022,"@BrunoTheBridge @BeowulfSchaefer @LeftBehindPoet @N1geTro115T1ts @The_Leaver @GeoffreyKeey @Davidmetroland @LordOfFreedom2 @MediaVentus @Rayjudd7 @Martin020455 @boomer_ish @wobski421 @displacedyoon @Obohobofromnobo @cathyby @David19531501 @somechewlip @ChrisEv06631592 @GeoffBarton9 @JohnRya13591294 @Roblev0 @EuOutta @andrewsibley15 @just2sayin @Gazza41 @Musc1esbri2 @of_flocks @Chr1s_not_a_bot @stevesdog1 @sunick51 @Jimbo12449841 @leftstance @ThatAndreCamara @thegrimbarian @NewforestStock @Swen_2017 @Ivana202020 @IanGianni @SamanthaFoxy1 @HWick_Chris @UndercoverDane @LabLostHeHe @ConraddKonnrad @PaddyM10128237 @Christinauk53 @DAOBarry @SgtVance @AngelusPatris @Cuidad10 Hay bumbo
 Even military historians are taking pi** of belgiums support for Ukraine. how come you don't provide weapons toukraine but have increased trade with Russia? https://t.co/hjeCUGy4dX"
1588812413738307584,Sat Nov 05 08:36:12 +0000 2022,"weaker £, expensive non tariff barriers to trade, shortages of staff across num sectors as a result of Brexit are all inflationary as is the war in Ukraine &amp; supply chain issues from Covid. We would inflation with no Brexit but Brexit makes our much worse than it would have been https://t.co/0iLIJPgJWX"
1588812406897004544,Sat Nov 05 08:36:11 +0000 2022,"Russia-Ukraine war live: Moscow struggling to train conscripts as officers and trainers either on front line or killed, says UK https://t.co/pNCF5OBuLV"
1588812406830297088,Sat Nov 05 08:36:11 +0000 2022,"@CheburekiMan @MarkSleboda1 People have argued the War between Russia &amp; Ukraine ended in Istanbul when peace was prevented by Biden &amp; Boris as he rushed to Kiev.
Therefore since April the War has been between Russia &amp; NATO.  
There’s certainly something to that.  Each day we hear how NATO is more invested."
1588812388526325760,Sat Nov 05 08:36:06 +0000 2022,@TiMoudou Starlink was given free by Elon Musk.  I don't see your countries stepping up to pay for the Starlink access for Ukraine?
1588812385103773697,Sat Nov 05 08:36:05 +0000 2022,"@OnyaitCharles @raj_2109 @OlegLazarenko8 @McFaul Here it's how it will end: 🇷🇺realizes that Putin made a huge mistake. Russian troops leave Ukraine and stop bombing 🇺🇦 territories.

Negotiations begin leading to a sustainable peace that discourages every dictator in the world to ever start a war as  #PedoPutin did.

The end."
1588812377101045760,Sat Nov 05 08:36:04 +0000 2022,Bring Peace to Ukraine! No to wars in Europe!
1588812376006332416,Sat Nov 05 08:36:03 +0000 2022,"Ukraine returned 19 border guards from captivity in the Russian Federation, - SBGS https://t.co/fH1DNKR0MZ"
1588812374857113600,Sat Nov 05 08:36:03 +0000 2022,"@ingermanlander @ChanBanTue @Biz_Ukraine_Mag Oh, of course!"
1588812364165832704,Sat Nov 05 08:36:00 +0000 2022,"A few insights following Scholz's visit in China:
1. The visit could not have taken place without approving the Hamburg port deal first. 

https://t.co/SG0AU0AQap"
1588812363104256001,Sat Nov 05 08:36:00 +0000 2022,@unexmlm @elonmusk @Ukraine @SpaceX @ZelenskyyUa Who is aggressive? Why are you defending not sees?
1588812345765433345,Sat Nov 05 08:35:56 +0000 2022,"@CalltoActivism Dont forget bringing us closser to a Nuclear War, carrying on Obamas/Victoria Nulands policies in the Ukraine. Taking illegal money from the corrupt Burisma deals. Sniffing young girls hair.

https://t.co/x008LXnIWJ"
1588812331303448576,Sat Nov 05 08:35:53 +0000 2022,"On why the extreme right and extreme left are converging to wind down aid to #Ukraine.
Adversity makes strange bedfellows. https://t.co/vBkOasezAf"
1588812330456207361,Sat Nov 05 08:35:52 +0000 2022,"Residents of Russia’s Central Asia territory, and specifically Tajiks, who hail from neighbouring Tajikistan, have been recruited at rates far higher than ethnic ruZZians for Putler’s war in Ukraine.

https://t.co/xMPKdceBeN"
1588812320989675520,Sat Nov 05 08:35:50 +0000 2022,@0_geirfugl @UaUkraini @Ua6Ua @TobiAyodele @ukraine_map @GeromanAT You are here to annoy me. Lemme just mute you so I don't pay too much attention to a troll with 1 tweet and an account creation date of October 2022
1588812319957843969,Sat Nov 05 08:35:50 +0000 2022,G7 Rejects Russia's False Claims About Ukraine's 'Dirty Bomb' - Kyiv Post - Ukraine's Global Voice https://t.co/ocRM3W78uh
1588812318426759170,Sat Nov 05 08:35:50 +0000 2022,"Devastating 96.5% Collapse As Lockdowns Smash Chinese Economy | US-China Technology Ukraine. Military Summary And Analysis 04.11.2022. Concerning this next video, I want to say some things that have… News, Sat., Nov. 5, 2022 | https://t.co/pySmhGmSLc"
1588812311833497600,Sat Nov 05 08:35:48 +0000 2022,"@MatthewStadlen Not sure about that. The decade under Blair saw the Iraq war, the cover up of the grooming gangs and the financial crash. 
The decade under Cameron, May and Boris saw the invasion of Ukraine, Brexit and the Pandemic.
Brexit was the only (good 👍) one decided by the people."
1588812310206115840,Sat Nov 05 08:35:48 +0000 2022,...at which point they won't need it as the control over Crimea will be regained by Ukraine. https://t.co/F83Wh4u9Ip
1588812309492662272,Sat Nov 05 08:35:47 +0000 2022,"@akinder71 @NadiaInBC @ukraine_map @GeromanAT Do you have any idea ? Or just throw crap out like all you dog turds ?
Both this towns have been entrenched and reinforced by the Kiev army for 8 years.
It’s probably the best built there has even been after 8 years of preparation."
1588812300718608385,Sat Nov 05 08:35:45 +0000 2022,"@yurachkivskyi @ukraine_map @GeromanAT And I posted a pic with all the news articles that you can find out from archives, answering your question about Nazi marches. Is it hard to see those articles mentioned?"
1588812299183484928,Sat Nov 05 08:35:45 +0000 2022,"Quiz time.

I give you a gun and a guy that uses it, that guy gets your logo on its uniform so it doesn’t look it’s from me.

Who is to blame for the escalations after the guy shoots your enemy?

Now I am US, NATO and you are Ukraine and war started in 2014! https://t.co/wvvf6V0xig"
1588812297765806081,Sat Nov 05 08:35:45 +0000 2022,Putin endorses evacuation of parts of Ukraine's Kherson region https://t.co/EQ3IfW6byP
1588812295404023808,Sat Nov 05 08:35:44 +0000 2022,"And take many of his followers onboard his new app and not overpaying fortune of $44 billion with inefficient management of Twitter that's losing $4 millions a day.
Musk could have given 44 billion to end world hunger and end ukraine war. $44 enough for both global issues."
1588812287447646209,Sat Nov 05 08:35:42 +0000 2022,Follow the latest news and updates on Russia's invasion of Ukraine https://t.co/onUT8rUMru
1588812285367439362,Sat Nov 05 08:35:42 +0000 2022,"@erdneyeva Ukraine has had too much interference from the EU and US that's the difference 
https://t.co/XqwGHZGiYl"
1588812281042718721,Sat Nov 05 08:35:41 +0000 2022,"More Russian equipment scrapped.
#Ukraine https://t.co/n4K1sWux0n"
1588812274596458497,Sat Nov 05 08:35:39 +0000 2022,"One half of Ukraine's answer to Ant and fucking Dec is the face of US/Nato imperialist aggression towards Russia.

Zelensky continues to needlessly offer up his peoples blood for US interests. https://t.co/xELqVcBllR"
1588812274428366848,Sat Nov 05 08:35:39 +0000 2022,President’s Office Expects G20 Summit to Become Another Platform for Supporting Ukraine - Kyiv Post - Ukraine's Global Voice https://t.co/wUzAO6jyHe
1588812272251850753,Sat Nov 05 08:35:39 +0000 2022,"That's not surprising, not supporting a racist country like Ukraine, apparently makes you a Russian sympathizer https://t.co/1ZFFEkYPMm"
1588812263850385410,Sat Nov 05 08:35:37 +0000 2022,"Refurbished Soviet tanks, HAWK missiles and more Phoenix Ghost drones coming soon to Ukraine https://t.co/wbzihKOy3b #tech"
1588812263258935297,Sat Nov 05 08:35:36 +0000 2022,"Gianna Clavell's daughter during the ""Prometey"" -  ""Joventut"" match 😍

Instagram video:
@basket_ukraine
@mirimuse https://t.co/4vV0Drd7qZ"
1588812255239479296,Sat Nov 05 08:35:35 +0000 2022,"In Ukraine’s south, two Russian Ka-52 helicopters, six Shahed-136 drones shot down https://t.co/avnQX1EwUb #tech"
1588812242665246726,Sat Nov 05 08:35:32 +0000 2022,@n5iln @RonColeman @rashadrobinson Only 1 Ukraine flag?  How is anybody supposed to take you serious?  A** clown!
1588812229688057858,Sat Nov 05 08:35:28 +0000 2022,Iran confirms it has delivered “a limited number of drones” to Russia before the war in Ukraine. https://t.co/gl717DIbJG
1588812224654475265,Sat Nov 05 08:35:27 +0000 2022,"@GaziirHabbas @ChanBanTue @Biz_Ukraine_Mag Because it is a kremlin bot, registrated at 2022"
1588812214110134274,Sat Nov 05 08:35:25 +0000 2022,"Armed Forces of Ukraine repelled attacks of occupiers in areas of 14 settlements in Luhansk region and Donetsk region, - General Staff https://t.co/NN8BIC07d4 - https://t.co/lgmtpwi6yu #WarInUkraine #StandWithUkraine"
1588812212608839682,Sat Nov 05 08:35:24 +0000 2022,Refusing to be Putin's Cannon Fodder: Tajiks Resisting Kremlin's Manipulation - Kyiv Post - Ukraine's Global Voice https://t.co/x3dcyxZWKc
1588812211891621888,Sat Nov 05 08:35:24 +0000 2022,"Russia Ukraine War Live : Top EU Official Cites This Development To Claim Putin's Kherson Retreat
#Canada #Germany #UnitedStates #Kherson #Ukraine https://t.co/fppUTnYvD8"
1588812210763096064,Sat Nov 05 08:35:24 +0000 2022,17 EU countries sent 500 power generators to Ukraine https://t.co/5UL0lTGcFl - UaPosition #WarInUkraine #StandWithUkraine
1588812206061547524,Sat Nov 05 08:35:23 +0000 2022,@martinvars Can merely pushing #Russia troupes out of #Ukraine really guarantee long term peace? How do we make sure they don’t re-group and attack again? What are the guarantees of non-repetition? How do we make #Moscow pay for the damage caused?
1588812199648448512,Sat Nov 05 08:35:21 +0000 2022,"@GeorgeMo @ukraine_map ""distributed artillery network""
What happens when you can't network them or the network is down? Are they blind?
""Barrel life""
Heard it's a problem with more modern NATO artillery, but not for Russia beyond replacing barrels as required when they start to wear out."
1588812196510765058,Sat Nov 05 08:35:21 +0000 2022,"@ChrisHaworth368 @JamesGRickards I can protest against the British invasion of Iraq and maintain my freedom. 

Russian's that protest against the war in ukraine get sent to the gulag! 

This, in a nutshell, illustrates the differences between democracies and autocracies (Russia). 1/2"
1588812192924979200,Sat Nov 05 08:35:20 +0000 2022,"@PandasAndVidya I hope this thread ruins that kids life for dressing up as something that I think is a nazi!

Anyway, I fully support biden sending cutting edge military equipment to the azov battalion in ukraine."
1588812173069152256,Sat Nov 05 08:35:15 +0000 2022,The Telegraph story - Ukraine to get ‘most advanced tanks on the battlefield’ for counter-offensive against Russia https://t.co/TuQ5Xmr8bb
1588812164336582656,Sat Nov 05 08:35:13 +0000 2022,"As if Boris couldn’t stoop any lower he actually had the gall to say that our rising cost of living in the UK is a direct impact of us supporting Ukraine. Why would you say such a thing? So to support Ukraine, people here have to suffer ? So our taxes count for nothing?"
1588812145504190464,Sat Nov 05 08:35:08 +0000 2022,"I hope the dwmons in hell treat ya well, toolbag
#UkraineRussianWar #RussianUkrainianWar
https://t.co/0T1ZvmsklV"
1588812144979873795,Sat Nov 05 08:35:08 +0000 2022,"@HadesShawn @hinki75041212 Here is a written version, by an author who was involved throughout:

https://t.co/bmE5vWTUdk
https://t.co/8encX9muE3"
1588812134846464000,Sat Nov 05 08:35:06 +0000 2022,@Reuters An air raid alert was announced on Saturday morning throughout Ukraine.
1588812122859110400,Sat Nov 05 08:35:03 +0000 2022,@ophardy @UaUkraini @Ua6Ua @TobiAyodele @ukraine_map @GeromanAT It’s more complicated. There was a grey zone in the middle and some parts of it were under Ukraine
1588812113568731136,Sat Nov 05 08:35:01 +0000 2022,"@juliodyarzagar1 @KimLZ9 @ukraine_map And Ofcourse Ukraine is winning. 100 dead soldiers so far. As per Zelensky a million went to the frontlines during June, again now they are recruiting asking for another 150k. If my calculations are correct, there should be around 1.5m on Ukraine front. https://t.co/a9qu72MxJR"
1588812096556634114,Sat Nov 05 08:34:57 +0000 2022,"My July 1 forecast unfolds as predicted. 
The CIA should pay me for this!

1) No mention of Syria and Yemen these days in the news. 2) Israel re-elects Netanyahu. 3) Anger in Lebanon over food prices. 4) Israel avoids Ukraine's Jewish president drawing it into the Russia war. https://t.co/yOzryILRA7"
1588812095587770370,Sat Nov 05 08:34:56 +0000 2022,"@StuyvesantAnna @PolAg19746971 @deFerrers1005 Government may well be laundering money via Ukraine, but we all do not agree with the intervention of our country in something we have nothing to do with.
I do not agree with it. It is more than obvious why they want to invade Russia or provoke war."
1588812083705044993,Sat Nov 05 08:34:54 +0000 2022,"Russia-Ukraine war: List of key events, day 255 https://t.co/grpbleoMcE"
1588812081322950656,Sat Nov 05 08:34:53 +0000 2022,@ZssBecker do not rule out Eastern Europe. Google how many people live in Ukraine :)
1588812079246774273,Sat Nov 05 08:34:53 +0000 2022,"@unexmlm @elonmusk @Ukraine @SpaceX @ZelenskyyUa So I made not sees? I created the world, created Ukraine, and created a raging not see issue there haha! You have no SUBSTANCE! You're an empty, hollow shell that is meaningless."
1588812072602652672,Sat Nov 05 08:34:51 +0000 2022,@ZelenskyyUa @POTUS Maybe if the coup that happened in Ukraine in 2014 that put you in power didn't happen we wouldn't be here? But here we are. Still have bags of cash showing up from the big guy?
1588812066311540737,Sat Nov 05 08:34:49 +0000 2022,"@upholdreality @MintPressNews Why would People around the world live with your Value??? Why did Whole World Means Europe???

   The American and European Dedicated for this War in Ukraine. Russia need Help from Rest of the World Sooner than Later."
1588812065577238529,Sat Nov 05 08:34:49 +0000 2022,"Russia-Ukraine war: List of key events, day 255 https://t.co/blnoc7WN7b"
1588812044081729536,Sat Nov 05 08:34:44 +0000 2022,"@Carly_Rose_1986 @lesiavasylenko Still less than we owe. Ukraine gave up nukes because we promised safety. We are failing to keep our promise.
#ArmUkraineNow #ATACMSforUkraine #CloseTheSky"
1588812037874159617,Sat Nov 05 08:34:43 +0000 2022,"@RyanNg26101 @theworldindex Nonsense, when Nazi-Ruzzia invaded in 2014, Ukraine used them to fight the Nazi-Ruzzians. 

If my country was invaded by Nazi-Ruzzia, I would use whatever people I had available to fight the Nazi invaders.

It's better to use them to stop Nazi-Ruzzia, than anything else."
1588812007247343617,Sat Nov 05 08:34:35 +0000 2022,"""#Ukraine began war with around 2,500 tanks""

""They lost 350 in 8 months""

= 2000+ tanks left...

Why the f#€% are they now begging world for tanks????

#UkraineRussiaWar
#ukrainewar
#Russia
#UkraineRussianWar

https://t.co/EfT0QtZsJK"
1588812005561229312,Sat Nov 05 08:34:35 +0000 2022,Zelensky plans to carry out an economic upheaval in Ukraine https://t.co/tPLVxkmBOi via @YouTube
