id,created_at,full_text
1588958157740597253,Sat Nov 05 18:15:20 +0000 2022,"Cardinal Tagle Supports Renewal of Secret Vatican-China Accord 
In a lengthy interview, the Pro-Prefect of the Dicastery for Evangelization, defended the extension of the 2018 provisio...
https://t.co/VjntQRBwSF
#Newsdeskinbox #TheInterview 
#Asia #bishop #car... https://t.co/KWgmbmUeTh"
1588958143916433409,Sat Nov 05 18:15:17 +0000 2022,this china vs korea thing in short track is literally a drama it self
1588958133602627584,Sat Nov 05 18:15:15 +0000 2022,"@xuchuanmei @JohnCulver689 Why hasn't China engaged in basic airborne virus infrastructure like:

Installing massive amounts of air filters, CO2 monitors, upper room UVC?"
1588958133481017344,Sat Nov 05 18:15:15 +0000 2022,@KlayMan76927995 @SpokespersonCHN I know too well the policy for China visas - you're ethnicity effects your visa application.   Let me know if you are successful.  I bet you £10 you won't get a visa.
1588958132201721858,Sat Nov 05 18:15:14 +0000 2022,@basketballtalk LeBron has a lot of nerve after sucking up to China the biggest human rights violators on this planet!
1588958125150810112,Sat Nov 05 18:15:13 +0000 2022,"Auto fill ""in light of recent events I will""

In light of recent events in the world of politics in general and the global economic situation of China in general have made it difficult to understand what the future is and what is the best course for us. https://t.co/oMXj2HNBI2"
1588958122743582721,Sat Nov 05 18:15:12 +0000 2022,"@0kRouge @Akshans38367106 @JackSibur @rshereme @olgatokariuk We are ready for a two-front conflict.
It's as same as China-Taiwan war."
1588958111058235392,Sat Nov 05 18:15:09 +0000 2022,"@daai_jan @usefulhaiku @bane_tweets @PhumlaniMMajozi @CyrilRamaphosa No one is forcing you as an entrepreneur to work and do business in this Republic. You dont like how we do business , you go on to china and lets see how they hang you for just having an opinion."
1588958102011117568,Sat Nov 05 18:15:07 +0000 2022,@greg_price11 Where the hell is this end of Democracy coming from?  If voters believe this move to China or Cuba and get back to me on your thoughts...I'll wait.
1588958099117076480,Sat Nov 05 18:15:06 +0000 2022,"5/5 need lithium for our country to run. In the trillion dollar plus green plan, lithium is the new oil. It’s almost like you’re family is being exploited by China. I sure hope not! Hunter and James are. Not you though. Why are you risking our security. Is the Chinese helping"
1588958097321906176,Sat Nov 05 18:15:06 +0000 2022,"Easily. Not even including Super Techmo Bo, Bo Jackson, Versace Tape, and price of tea in China. Incredible run at the moment https://t.co/6x1ypWIom0"
1588958093639323649,Sat Nov 05 18:15:05 +0000 2022,"3/3 to the Taliban. I wonder why our embassy is not open in Kabul? With you’re plan of all electric vehicles, yet you left the worlds 2nd largest lithium deposits in Afghanistan for China? I think the Chinese workers sleeping in the same bunks as our soldiers. The Taliban is"
1588958089625018368,Sat Nov 05 18:15:04 +0000 2022,@LONGCONVEXITY @SCMPNews Where is South China Morning Post's journalism relative to Reuters in your opinion?
1588958074232246272,Sat Nov 05 18:15:00 +0000 2022,"@sbabones @sardesairajdeep @IndiaToday People of India will reject anti india &amp; anti hindu , upa mafia &amp; fake intellectual s soon . Jai Hindustan.
He11 for pak ,china ,upa mafia, prestitute, global illuminati.."
1588958071862317056,Sat Nov 05 18:15:00 +0000 2022,Deluxe edition street breakfast in China.😅A 卷饼 with three eggs added.😋😋😋 https://t.co/AileljbICn
1588958071711272962,Sat Nov 05 18:15:00 +0000 2022,ORF’s foreign policy survey by Harsh V Pant @PremeshaSaha @antaragsingh @gs_aditya @Renita0911 @MattooShashank found overwhelming concern that #China poses a challenge to #India’s rise as a global power. https://t.co/tjbw1fw0mR
1588958062467231744,Sat Nov 05 18:14:58 +0000 2022,"&gt;before 'anything-else' remember this. you 'all' trained-myself to become now! cyber-terrorist-hunter called knightmare! 
+here/there 'dosen't-matter' to-me? my-hunt is against #china #russians #northkorea #Iran anyways? 
=know my kind citizens..."
1588958059648679942,Sat Nov 05 18:14:57 +0000 2022,"I’m not impressed by the things your kids can make.

I’m typing this on a device that kids their age are making in China."
1588958050140184576,Sat Nov 05 18:14:55 +0000 2022,"@JohnBur10123558 @RyLazChi @johniadarola So as more conglomerates buy up our neighbourhoods and jack up the prices to both buy and rent, people have less time to focus on career building than they do on survival. Domestic conglomerates aren’t off the hook either, because they get their money from selling to China."
1588958038987223040,Sat Nov 05 18:14:52 +0000 2022,PICS: US Customs finds dangerous invasive species on ship from China https://t.co/4Q3dojJtVB via @amermilnews
1588958034109530113,Sat Nov 05 18:14:51 +0000 2022,@SpokespersonCHN China beating its own drum. Most hatred  powerful  nation in the globe.
1588958032696086528,Sat Nov 05 18:14:51 +0000 2022,"@Christo15458446 @DrNancySPierce @Liquids_Right @EdwardMallon5 @BetoORourke California where
people pay more than 50% of income as income tax
-It takes 1.7 million $ to build a toilet
-Homelessness prevails
-Crime runs rampant
-once beautiful cities like LA &amp; SF turned to giant skid rows

China has a pretty great economy doesn't mean its good for people"
1588958026970542080,Sat Nov 05 18:14:49 +0000 2022,"but when your shoes are made in China, and your trash bags are made in Bangladesh, and your car is made in Japan it seems that everything aside from your very person is removed from your society. Even now “Made in America” carries some sort of nationalist weight…"
1588958010550157312,Sat Nov 05 18:14:45 +0000 2022,"@CittiMedia @sbabones People of India will reject anti india &amp; anti hindu , upa mafia &amp; fake intellectual s soon . Jai Hindustan.
He11 for pak ,china ,upa mafia, prestitute, global illuminati.."
1588958009270493184,Sat Nov 05 18:14:45 +0000 2022,@ShamsCharania Man has had Covid more than all of China 😂
1588958006045462528,Sat Nov 05 18:14:44 +0000 2022,@johnrackham82 They should glue themselves to walls in Chinese factories for realism. Every comparable product  from China is ~30% more damaging to the environment than its US counterpart.
1588958004283465728,Sat Nov 05 18:14:44 +0000 2022,"@sukarnoNFT Not a Haz supporter but considering who the western media hires as China experts, I can’t be mad about this. It’s exactly the sort of petty thing I would do in that position"
1588957995462930432,Sat Nov 05 18:14:42 +0000 2022,@ChinaAmbUN Shame on China
1588957979503742978,Sat Nov 05 18:14:38 +0000 2022,Analysis: China's markets clutch at economy reopening straws | Reuters https://t.co/EbWZHzeA5U
1588957972205514752,Sat Nov 05 18:14:36 +0000 2022,@newsmax Every executive order has been over reach. Illegal activity in Ukraine and China. If they won’t just remove you for Alzheimer’s and dementia then impeachment it is.
1588957955319549952,Sat Nov 05 18:14:32 +0000 2022,"@AsimKhaan1233 PAKISTANI ACTRESS TO MARRY ZIMBABWE PLAYER .IF INDIA IS BEATEN LINK https://t.co/oTzt4SG9mp
ZIMBABWE NEW DAMAAD OF PAKISTAN AFTER CHINA AND USA https://t.co/kgJJJhVHrS"
1588957953952198656,Sat Nov 05 18:14:32 +0000 2022,"@HariCarysGhost @overushkalapa @Ukraine66251776 @roaming_free Oh, and about yesterday and China...

""Ukraine War: China Comes In Full Support Of Russia; Calls For Impartial Investigation Into ‘Bio Military Activities’""

You have been disinformed about everything.

https://t.co/7BSDCxnrV4"
1588957938961780736,Sat Nov 05 18:14:28 +0000 2022,@moodyangela The end goal of the Communist Party of China and it's leaders like Xi to realize socialism for the betterment of the Chinese people as a whole. @MarxMidwest has written about this extensively https://t.co/y9eHdimpfd - start reading and learning if this is a serious question
1588957938957180928,Sat Nov 05 18:14:28 +0000 2022,"@KatiePavlich Destruction of coal puts our society in peril. Green energy cannot replace cheap, high output sources. It's called physics. Unless we start building nuclear plants again, we need coal. Just ask China and India. Or ask Germany how green energy is working out for them."
1588957932850667521,Sat Nov 05 18:14:27 +0000 2022,"@OdgerTheViking @catturd2 @kjducy Then move to China, Commie. Bye!!!"
1588957925476687872,Sat Nov 05 18:14:25 +0000 2022,@newsmax What about selling our reserves to China
1588957913334575104,Sat Nov 05 18:14:22 +0000 2022,"@NiMingda_GG @Yods60938027 @madeINTheUSA006 Falun Gong is a cult, and while their criticism of China isn't always false, it isn't always true either."
1588957905738674178,Sat Nov 05 18:14:20 +0000 2022,@zach08981853 @bresla_linda @RobertS42608839 @newsmax And influence peddling with China!
1588957904807559168,Sat Nov 05 18:14:20 +0000 2022,"Jews Tactics &amp; Strategy lobby on Islamophobia all over world, especially ethnic cleansing in Myanmar, China, India &amp; Sri Lanka. 

https://t.co/t7TaGyq9mW"
1588957903473373189,Sat Nov 05 18:14:20 +0000 2022,@uz3r87 @SatyrMagik @KyivIndependent Crimea has always been Russian (charge of the light Brigade?). It was ceded to Ukraine for the first time EVER in 1991 &amp; the population ALWAYS wanted to be Russian. Yet you support independence for Taiwan against the will of China? Your political stance is contradictory
1588957898889367553,Sat Nov 05 18:14:19 +0000 2022,"@grant_melson @POTUS Lets not forget, he’s giving 3/4ths of our reserved energy to CHINA over the next few years!  We will run out!"
1588957887191478272,Sat Nov 05 18:14:16 +0000 2022,"What more education does German leader @OlafScholz need, to understand the need to decouple from the tyrannical regimes of Russia and China?
Germans, You have the wrong man at the wrong time in world history. He bans tanks going to Ukraine and instead visits China?"
1588957885912223745,Sat Nov 05 18:14:16 +0000 2022,"@Danijela071 Countries have been removing their assets over the past 6mths. China's bought tons of gold as have many others &amp; they've been dumping US bonds &amp; debt holdings, the wests implosion is well underway, besides Russias recouped 2/3 of the held assets already with oil/gas sale profits."
1588957883584385024,Sat Nov 05 18:14:15 +0000 2022,Qingdao City Exhibition is about to debut at the 5th China International Import Expo https://t.co/3PQGH0ntZC
1588957882271535104,Sat Nov 05 18:14:15 +0000 2022,"""Fundamentally, the biases don't creep in because the organizations are anti-India. They creep in because, and forgive me, India's intellectual class is anti-India; as a class and not as individuals.""

India ranks 2nd, after China, where largest numbers of journalists are killed. https://t.co/36BWhxPvIV"
1588957877951430656,Sat Nov 05 18:14:14 +0000 2022,"@Prathit21 @sidhant China lacks force projection but its military is second only to the USA.

Far superior to India's"
1588957877225783296,Sat Nov 05 18:14:13 +0000 2022,"@JohnBur10123558 @RyLazChi @johniadarola It’s basically these giant, usually Chinese corporations buying into the government. To be clear, my problem isn’t with Chinese people living in Canada — please come in—but Canada selling out to China. Also, homes are treated like investments instead of… homes."
1588957866324807680,Sat Nov 05 18:14:11 +0000 2022,"@IndiaToday @sbabones @sardesairajdeep People of India will reject anti india &amp; anti hindu , upa mafia &amp; fake intellectual s soon . Jai Hindustan.
He11 for pak ,china ,upa mafia, prestitute, global illuminati.."
1588957863632056320,Sat Nov 05 18:14:10 +0000 2022,"Wall Street wavers after October jobs data, hopes for China rebound | PBS NewsHour https://t.co/Pg6hrspK5w"
1588957855008591872,Sat Nov 05 18:14:08 +0000 2022,"@RepMTG You push against China so much, is this not what you want for the states? https://t.co/VJpyeyt8Ws"
1588957854563979264,Sat Nov 05 18:14:08 +0000 2022,#PFDJ is destabilizing The Horn of Africa &amp; is giving regional influence to Russia and China. @GlobalYiakil condemns the involvement of #Eritrea/n army in the #Tigray war @_AfricanUnion @AUC_MoussaFaki @POTUS @SecBlinken @UN @BaytoYiaklUSA @Globalyiakl @SenatorMenendez…
1588957853838356481,Sat Nov 05 18:14:08 +0000 2022,"China’s Global Maritime Access: Alternatives to Overseas Military Bases in the Twenty-First Century (Isaac B. Kardon)

https://t.co/B11Po4gajL"
1588957844644450304,Sat Nov 05 18:14:06 +0000 2022,"@leadlagreport @FreightAlley Bilateral trade figures between US and China. From the US point of view is China 'closed'?

https://t.co/uHLgxI187i"
1588957834812993536,Sat Nov 05 18:14:03 +0000 2022,"Carolyn Broe believes Mexican drug cartels are being aided by China to bring fentanyl that looks like candy into the United States, so that little kids will get a hold of it and they will die.

Fin

We had a good run, America"
1588957832933965826,Sat Nov 05 18:14:03 +0000 2022,"Can I say it if I pay you $8 @elonmusk ??

Nationalist China? https://t.co/Z6XkOGw1ix"
1588957826353098753,Sat Nov 05 18:14:01 +0000 2022,"@TennAssembly Stop detoxing people, fight it to your last breath.
Do not allow your body to heal itself, we have special toxins to fight your natural efficiency of your terrain.

We fight against anything you ""catch"" from ferry-monkeys-bats-cows-swine-birds &amp; China.
Don't let yourselves heal. https://t.co/Eh6fDeDOSM"
1588957822838255618,Sat Nov 05 18:14:01 +0000 2022,"During the Cultural Revolution in China, seven massacres more were mainly led by Chinese Communist Party, in which, the SCHOLARS died at least 300,000 in these massacres. Death toll to be 20 million during a CCP working conference in December, 1978."
1588957821827022848,Sat Nov 05 18:14:00 +0000 2022,"Fan Zhi, who died OTD in 964, served under 12 emperors of 6 dynasties during imperial #China's Five Dynasties and Ten Kingdoms period https://t.co/PSlmSC6Irn #travel #history"
1588957818379702272,Sat Nov 05 18:13:59 +0000 2022,"@sbabones @IndiaToday People of India will reject anti india &amp; anti hindu , upa mafia &amp; fake intellectual s soon . Jai Hindustan.
He11 for pak ,china ,upa mafia, prestitute, global illuminati.."
1588957798918127616,Sat Nov 05 18:13:55 +0000 2022,@FranceskAlbs Have you called out China on Tibet? Russia on Crimea? Turkey on Cyprus? Do you know that Israel was attacked in Judea &amp; Samaria by Jordan in 1967 which led to the current impass? Have you called out Palestinian govt. which is unwilling to sign a peace treaty? I didn't think so.
1588957798708441088,Sat Nov 05 18:13:55 +0000 2022,"most of the days I get up like 8 or 9 am and start to feel quite exhausted at around 3 pm. it's impossible for me to work eight hours a day. It's anti-life, anti-human and anti-me😭
Mind you, high schools in China work students from 6 am to 10 pm. And it was hell."
1588957797697585152,Sat Nov 05 18:13:55 +0000 2022,"LIE: “No one is building new coal plants.” - Joe Biden, Nov.4, 2022

TRUTH: China is adding 43 new coal plants, India 10, and even Germany is reopening 5.

https://t.co/AztasrLo6S"
1588957789556477952,Sat Nov 05 18:13:53 +0000 2022,"@DeeLeftMom I don't understand why Saudi, Russia, and China are allowed to own anything in America."
1588957785290833921,Sat Nov 05 18:13:52 +0000 2022,"@todd_ramos @GaloOsc @casperj33081634 @bobbyheard There’s big electric cement trucks in China that roll through a battery swap station instead of waiting in location to be charged. Then the station charges the batteries on the rack. Plus, unlike diesel, all these materials are reusable at the end of a battery’s life."
1588957783021748225,Sat Nov 05 18:13:51 +0000 2022,@0Sargent2 North Korea and Taiwan are just bait for China as Ukraine was for Russia.
1588957772678209536,Sat Nov 05 18:13:49 +0000 2022,"@archaeologyart The famous 2500 year old Chinese bronze sword: Swords of King Fuchai of Wu.
9 swords of Fuchai were found. Still sharp after 2500 yrs.
Fuchai became King of Wu in 495 BC, defeated King Goujian of Yue the next year. Became Hegemon of China. https://t.co/F2bToU5E6w"
1588957770602405888,Sat Nov 05 18:13:48 +0000 2022,@GBNEWS What utter BS Net zero will impoverish our nation whilst China laugh all the way to the bank
1588957749135777794,Sat Nov 05 18:13:43 +0000 2022,Scholz: Xi opposing nuclear weapons in Ukraine reason enough to visit China https://t.co/204KP8GXV9
1588957741795938304,Sat Nov 05 18:13:41 +0000 2022,@Nigel_Farage Join China. Just kidding! #Peace
1588957733717684224,Sat Nov 05 18:13:39 +0000 2022,"@TenzingLamsang Well, it's okay for Bhutan to do what it thinks is right and in its interest. Hope this interest is not at the behest of China. I hope not. 
Whether these policies help the country or not only time will tell. 
I've never visited Bhutan, maybe sometimes."
1588957705561309187,Sat Nov 05 18:13:33 +0000 2022,"China to Strive for 'Better' Economic Outcome, Premier Li Says https://t.co/VuWXBipyD5"
1588957696077991937,Sat Nov 05 18:13:30 +0000 2022,Bro was super quiet when it came to speaking against China but of course he’s gonna speak up against his fellow man. Bro a puppet https://t.co/gLEP890C55
1588957690759630848,Sat Nov 05 18:13:29 +0000 2022,"@jarvisbruder @RnaudBertrand Nah if dems win Republicans will blame china,  if Republicans win they blame Russia"
1588957687379013633,Sat Nov 05 18:13:28 +0000 2022,@brtrnkng @cityafreaks Saudi Arabia is a much larger oil producer than China and Saudi oil is also nationalized.
1588957686527590400,Sat Nov 05 18:13:28 +0000 2022,"@elonmusk @BillyM2k really hope someday you can ""let that Sink in"" China, and wash our old brain!"
1588957672623468544,Sat Nov 05 18:13:25 +0000 2022,"@ElbridgeColby China's problem is fully at display in the COVID senario. The power structure of the entire country/gov is not based on law, and can loosely control its people and beuracrats, who often are bad actors within/out of CN. When they violate local/intl laws, the CN gov is expected to"
1588957654806056961,Sat Nov 05 18:13:20 +0000 2022,"@sbabones People of India will reject anti india &amp; anti hindu , upa mafia &amp; fake intellectual s soon . Jai Hindustan.
He11 for pak ,china ,upa mafia, prestitute, global illuminati.."
1588957652687605760,Sat Nov 05 18:13:20 +0000 2022,@RonLPitts @ddale8 You would have to ask his son who got paid millions to be on a board for an energy company and then ask about his ties to china
1588957648707538944,Sat Nov 05 18:13:19 +0000 2022,Traveling the world via Twitter thanks to Dream Pictures. Today we are in China. https://t.co/bYpraFHj7v
1588957631708028930,Sat Nov 05 18:13:15 +0000 2022,"@MiriamMLex You said you love God on your profile but you continue to peddle lies about China and create hates towards China and the Chinese.  Are you sure about your love for God? Btw, nothing about the video you showed says anything about China or indicates it was in China."
1588957627106459648,Sat Nov 05 18:13:14 +0000 2022,#maryland #electra #linotype #digging #echo #fluidity #poet #power end the state run lottery bullshit #pennsylvania #scranton #extreme #speed #iceni #trident #elon #tesla #electric #china #drought #water #distrobution https://t.co/Q35p6hNRnZ
1588957623646552064,Sat Nov 05 18:13:13 +0000 2022,"@Brad_IN_Texas The biggest star in China. Actor, singer and so on. He was also in Crouching Tiger Hidden Dragon."
1588957604478619650,Sat Nov 05 18:13:08 +0000 2022,@Fact @Tommy_Jnr1 @SimonSimonJr1 y'all better stay away from China😂😂😂😂
1588957603882995712,Sat Nov 05 18:13:08 +0000 2022,"Submitted for your approval....Imagine a world where the FBI arrests the people who provided proof there was election fraud &amp; that China had personal  information on our pole workers stored on servers but did nothing to those who committed the crime

Welcome to the Twilight Zone! https://t.co/BpPEx6bouk"
1588957601521631232,Sat Nov 05 18:13:08 +0000 2022,"@jamesbirch11 @CynicalOldBag @GBNEWS China has a massive carbon footprint and the UK has made huge progress in reducing emissions (to our own considerable detriment). She should learn Chinese and start shouting at different people.
#softtarget"
1588957591564341248,Sat Nov 05 18:13:05 +0000 2022,Gemstone Expert Natural Rectangle Shape Gemstone Made In China   - LINK JD GEMS https://t.co/tME3Zi1wQq
1588957589345554432,Sat Nov 05 18:13:05 +0000 2022,"@HarrietSergeant The answer is they know they can protest here with impunity given the behaviour of @metpoliceuk who are more likely to talk to them &amp; offer them a water than arrest them. Whereas they don't have the courage to go to China where their treatment would be rather more ""robust""."
1588957586845585408,Sat Nov 05 18:13:04 +0000 2022,"#RaviVisvesvarayaSharadaPrasad  https://t.co/VTUxwyFi0j  'Rehearsal to strike': Russia, China rip U.S over North Korea sanctions | Watch the faceoff"
1588957579790557184,Sat Nov 05 18:13:03 +0000 2022,"@ARoseAndThorne @RonFilipkowski That's what I was thinking. Are they shipping in votes? After all, didn't (D) ship votes from China on bamboo paper for 2020? 🤣🤣"
1588957575412084736,Sat Nov 05 18:13:02 +0000 2022,"Despite China's illustrious history with UB, WXY is only their 2nd gymnast to win 2 UB titles (the other being FYL)"
1588957573658865664,Sat Nov 05 18:13:01 +0000 2022,"5th China International Import Expo #CIIE2022 #Shanghai 5 to Nov 10,China 2nd largest destination for 🇵🇰 exports.this year gemstones,textiles, &amp; handicrafts are the main Pakistani products that would be exhibited,trade volume  upward.past 3 years,positive sign #CPFTA #cpec #cen https://t.co/BCPgslz2vW"
1588957571540451328,Sat Nov 05 18:13:01 +0000 2022,@Peston And yet we (quite properly) condemn the likes of China and Iran for doing likewise
1588957564989210625,Sat Nov 05 18:12:59 +0000 2022,@CNN The same company who uses slave labor in China and promoted Colin Kaepernick? Gotcha!
1588957563504427008,Sat Nov 05 18:12:59 +0000 2022,We ain't forget about China either lebron. You stay dancing for you masters. You'll say whatever your told huh? Fucking sucka https://t.co/XJS4YWf2q4
1588957561859997699,Sat Nov 05 18:12:58 +0000 2022,"Looking for the market,  export products, develop enterprise, go to China. https://t.co/gugkodDcTF"
1588957559138193408,Sat Nov 05 18:12:58 +0000 2022,"@dom_potwor @danwaterfield Apart from its use to maintain the authoritarian government in China, I think it's pretty good on mobile, less so on PC."
1588957558961627136,Sat Nov 05 18:12:58 +0000 2022,"#AI
✅#China hasn’t only radically expanded its presence in the global #technology sector since then, but is stepping up engagement with standards-setting bodies just as private-sector led efforts by #Western nations drops off.
https://t.co/HqXCwBdVmF
https://t.co/07N6AXi6ev"
1588957557661765634,Sat Nov 05 18:12:57 +0000 2022,@ClownWorld_ Lol. You want commies? Move to China
1588957554008559617,Sat Nov 05 18:12:56 +0000 2022,"Operational Metro Rail Systems
🇨🇳 China - 48
🇮🇳 India - 15
🇺🇸 US - 15
🇯🇵 Japan - 13
🇰🇷 South Korea - 8
🇧🇷 Brazil - 8
🇷🇺 Russia - 7
🇮🇹 Italy - 7
🇫🇷 France - 6
🇮🇷 Iran - 6
🇬🇧 UK - 5
🇩🇪 Germany - 4
*China has 8,684km Metro with 5386 stations.
*India has 814km Metro with 631 stations"
1588957542809759744,Sat Nov 05 18:12:54 +0000 2022,"@ChristoFBG @dbongino Rise in the 1st place with their revolving door jail system✔️KBJ was only put in the SCOTUS because of her color, adding more division✔️further pissed off a former ally by allowing more Russia neighbors to join NATO ✔️Biden family dealing in China aided in the chip shortage 2of3"
