id,created_at,full_text
1588683048119328772,Sat Nov 05 00:02:09 +0000 2022,China – Genocide in Xinjiang: 800 people in one room with no medication https://t.co/CCKjAOOxJG
1588683035809316864,Sat Nov 05 00:02:06 +0000 2022,"15/ For anyone unfamiliar w/ China’s Social Credit Score, this system is a combination of Government and business surveillance that gives citizens a “score” that can restrict the ability of individuals to take actions-such as purchasing plane tickets acquiring property or taking-"
1588683023142518784,Sat Nov 05 00:02:03 +0000 2022,@StonkSleeper Cramer at mad money was linking mrna to China and saying all the goods on mrna gonna be big short boost on mrna.
1588683022370410497,Sat Nov 05 00:02:03 +0000 2022,"@JoeBiden Lies lies and more lies.   You caused the inflation Joe. You and happy Chuck.  Talk about inflation, the boarder, High Crime,  The money you took from China.  But don't tell us lies about the Republicans..  We're too smart for that."
1588683022072942592,Sat Nov 05 00:02:03 +0000 2022,"@Jazz_Phan @OmnipresentTaco @katalin_pota @caitoz @JustaCoinToss The only person threatening nuclear is Putin, 

But Putin is not insane…

He knows &amp; has been briefed by the west how completely that technological deck is stacked against him

India &amp; China also oppose the use of nukes. Russia would be deeply hated by the entire world"
1588683016289026048,Sat Nov 05 00:02:02 +0000 2022,"Halftime at East China:
Mountaineers: 14
@CardinalMooneyC: 7

@MIPrepZone @StudentAthlete"
1588683009024094208,Sat Nov 05 00:02:00 +0000 2022,"If that's China White, then I'm Dwight Gooden."
1588683008579899392,Sat Nov 05 00:02:00 +0000 2022,"@Shamele72777451 I'd suspect that -- for the wrong reasons IMO -- inflation is more of a political factor now than 1980 because it came out of nowhere; China covid lockdowns, war, oil/corporate profiteering and the way over-done covid stimulus, happening all at once. In 1980 we were used to it."
1588683000996585472,Sat Nov 05 00:01:58 +0000 2022,@memepoopumper Do it!  My son got out but they needed civilian contractors to work on FA-18 hornets so he’s making good money at China Lake Naval Weapons Station in CA.  But don’t give up on a degree…admin jobs in the BP would require a degree.
1588683000912695296,Sat Nov 05 00:01:58 +0000 2022,@newsmax Hmmmm.  Let’s start with your family financial gains when you were VP.  Then move to how you giving China our fuel reserves.  How about the BS mandates during BS Covid?   What about your mental state?  Can you count to 10?
1588682991324495872,Sat Nov 05 00:01:56 +0000 2022,"A million dollars isnt cool, you know what is cool? Cashing on on centuries of European adventure colonialism by perpetuating offshore labor to India, The Philippines, and China."
1588682986341666816,Sat Nov 05 00:01:54 +0000 2022,@juneslater17 WEF is china
1588682969740644352,Sat Nov 05 00:01:50 +0000 2022,The biggest drop off of offshore enrolment is in students from China.
1588682941307166722,Sat Nov 05 00:01:44 +0000 2022,"China's People's Liberation Army 63880部队 has a Extreme Risk Level 
 https://t.co/pcAJiFUGjQ #china #osint #beijing #technology #military #research #security https://t.co/9moh9t87i9"
1588682941110288385,Sat Nov 05 00:01:44 +0000 2022,You banned china's tiktok..very good!!🙌🏻🙌🏻🙌🏻🙌🏻 Well done!! Ban bollywood and do the world immense good🙏🏻🙏🏻
1588682940422029313,Sat Nov 05 00:01:43 +0000 2022,"My name is Grillie Shull,  was born in Canton and will go back to  China on December 1908"
1588682938715353090,Sat Nov 05 00:01:43 +0000 2022,Yea that's the wife related to the North Korean Generals big time Scientist 🥼 and Engineers others Communist reservations settling in could be South • Korean spies Taiwan China being they Motherland in North Korea Agency like China PLA
1588682935364116480,Sat Nov 05 00:01:42 +0000 2022,Broke Nonna'a china; Zia's funeral today; North Girls tonight. This calls for some divine shit. https://t.co/uU9TZe1Maa https://t.co/ck3U37RHi3
1588682933187252226,Sat Nov 05 00:01:42 +0000 2022,@TheMegeralis @TiMoudou @elonmusk Asking questions? Positing already debunked known lies were potential truths weren't questions - they were the perpetuation of dangerous and harmful lies. You gaslighting about China doesn't fool anybody. You're surprised U.S. advertisers want no part of that kind of malice?
1588682929726701570,Sat Nov 05 00:01:41 +0000 2022,"US, allies clash with China, Russia over NKorea missiles https://t.co/8hlF8FSWMs"
1588682925373259776,Sat Nov 05 00:01:40 +0000 2022,"@KRubacek @PurpleBarb3121 @IAMTOMMACDONALD Carried on, so in other words NATO controlled by the USA is the world's biggest threat to communism under the disguise of being not being, at China keeps it in their country, USA/NATO can invade whoever they want to when a place like Russamia stands up against them they get"
1588682920356896768,Sat Nov 05 00:01:39 +0000 2022,@SariArhoHavren Trade with China should only be for goods the EU doesn’t deem critical.
1588682918020677632,Sat Nov 05 00:01:38 +0000 2022,"What can other countries learn from China's ideas? 
Africa can benefit from China's model, but it needs to be properly tested, says analyst Koffi Kouakou at our forum on #Chinesemodernization. https://t.co/WS3Gy0LcIb"
1588682912169603072,Sat Nov 05 00:01:37 +0000 2022,"A very good special report on #CCP #XiJinping #China by @TheEconomist 

https://t.co/qBWSFbwpBm"
1588682899351818240,Sat Nov 05 00:01:34 +0000 2022,@OurNewHomecoach China Town-Haymarket.
1588682896420016128,Sat Nov 05 00:01:33 +0000 2022,"@Ian_M_Easton Republic of China...as in they're part of China... Taiwan is a territory of Republic of CHINA (China). And stop referring to everyone as ""Taiwanese"" that is indigenous genocide. 97% in Taiwan are Han Chinese only 2.3% are indigenous Taiwanese. https://t.co/0JdBcSW3TJ"
1588682895132184577,Sat Nov 05 00:01:33 +0000 2022,"@Flash_news_ua New US/Ukraine Commerce? Empty-headed, leaving empty-handed? 

Buyer sets price, Seller must sell? LOL 😂 

Seller has product ALL want and need! Saudi Arabia, US best ally, cut production! Keep price stable!

China/India opening up, will buy it all! No longer Russian, right! https://t.co/tATNQZ4SpV"
1588682892309561344,Sat Nov 05 00:01:32 +0000 2022,Modern China https://t.co/WiC8bpypjw
1588682874970308610,Sat Nov 05 00:01:28 +0000 2022,"@RepMattGaetz @JoeBiden And China have been waiting for. Putin is a cold blooded killer, none of you are old enough to know what he has done, but you’ve seen him bomb a maternity ward, aim bombs at children, promise safe escape routes and pick innocent families off like with rifles, and really you don’t"
1588682837443874816,Sat Nov 05 00:01:19 +0000 2022,"“ #China &amp; the US must inevitably work together to do the things we need to do to win this battle. And I’m really very concerned about the interruption that has taken place due to events that are nothing to do with #climate ” - @ClimateEnvoy 

https://t.co/QaR9JgB843"
1588682834608521216,Sat Nov 05 00:01:18 +0000 2022,@EpochTimesChina @SayNoToSino Canadian government needs to show its courage to boycott China and close these Chinese thug’s unofficial police stations.
1588682823128739842,Sat Nov 05 00:01:15 +0000 2022,"@townhallcom By doing this Germany, Russia, and China can increase use of coal. Other than Germany these countries had no intention of stopping coal use! By bankrupting the U. S. and imposing all this Green dodo, our green policies will have little affect on Mother Nature. No plan just lunacy"
1588682814056456193,Sat Nov 05 00:01:13 +0000 2022,"@VarminWay @HelleneRobins @rupasubramanya Look it up.  ""China crushes protest""  ""protest crushed in Aizerbaijan"" (sp)  It's what authoritarian governments like Trudeau's do."
1588682808960356353,Sat Nov 05 00:01:12 +0000 2022,"@ycinnewyork @leezeldin This man's political party (@GOP) fueled hate crimes against Asian Americans by labelling COVID the ""China virus"" or ""Wuhan virus"". Why welcome a man who keeps such degenerate company a welcome like this in such a predominantly Asian American community?"
1588682798130290690,Sat Nov 05 00:01:10 +0000 2022,@JoshManuel “Yoooo so sick actually can I borrow your double kick pedal and your China cymbal too?” https://t.co/KZhmjkNlkt
1588682797090492419,Sat Nov 05 00:01:09 +0000 2022,"@cubiculum @salvetti_matt @SRomanum @StuartKLau So trading with political strings attached? It was the West that looted China (and rest of the world) to become rich in the first place. Would you really believe that them, from their pespective and past experiences, would accept those conditions?"
1588682790190698503,Sat Nov 05 00:01:08 +0000 2022,China Bans Celebs With ‘Lapsed Morals’ From Endorsing Products https://t.co/2wZUc1z2q2
1588682788597026817,Sat Nov 05 00:01:07 +0000 2022,"""Xi Jinping did everything in his power to be anointed to a third term, but at this point in China's trajectory, it is not without reason to suggest that his forceful power grab will result in misdirection and disaster."" https://t.co/S0maZw5O6n"
1588682770918014976,Sat Nov 05 00:01:03 +0000 2022,"@vitaliqubuterin @ShangguanJiewen How do you define “shit ”, bro?, any place could be turned into shit by “shit man”,in this land of china,for 5000 years, we’ve never really leave it,although there were lots of “shit man ” in the past,they could be Chinese, they could be foreigners, but look,we still be here"
1588682757399490561,Sat Nov 05 00:01:00 +0000 2022,How a Mysterious China Screenshot Spurred $450 Billion Rally #DigifinexAirdrop
1588682740459012099,Sat Nov 05 00:00:56 +0000 2022,"""There're 1001 evil ways of CCP (Chinese Criminal Party) ""handling"" its own ppl."" 

Rhapsody from @SpokespersonCHN ""Have you been to china, seen how safe &amp; fortunate🇨🇳/Xinjiang are today? If they really visit here, I believe everyone would abundantly admire us being chinese."" https://t.co/FyVMyqodb5 https://t.co/sbpAEIPQCO"
1588682736772198400,Sat Nov 05 00:00:55 +0000 2022,"Former Dilworth School music teacher living in China wanted by NZ police

#CSA Child Sexual Abuse #AbuseByTeacher 

New Zealand
https://t.co/5S3QaHXRVJ"
1588682730304593921,Sat Nov 05 00:00:53 +0000 2022,@caitoz Ummm u know what it they might twist the policy a little bit. But not out of some peace loving reasons. They gonna divert resources because of China.
1588682723086176257,Sat Nov 05 00:00:52 +0000 2022,@htsfhickey Sure looking like capitulation on the $NEM weekly chart. But imo gold won’t rally in earnest until US + China pivot. Won’t be long.
1588682708481605632,Sat Nov 05 00:00:48 +0000 2022,"@mantico83258495 The news is the China reopening hopium

https://t.co/JUp2lNnGHr"
1588682704303886336,Sat Nov 05 00:00:47 +0000 2022,Rumours of zero-Covid easing spread in China amid anger at restrictions https://t.co/WQGiEnkSLj
1588682698088157184,Sat Nov 05 00:00:46 +0000 2022,"@fomocapdao What chocked me the most in China in 2019 was that usually my gf would always pay using wechat or alipay on her phone, then one day out of nowhere the cashier asked her to look at a small camera at the counter when we were paying in a shop, and she paid just using her face. Scary"
1588682693189206018,Sat Nov 05 00:00:45 +0000 2022,"@Liz_Cheney Actually Biden still buying oil from Russia and all our pharmaceutical come from China, who is in need of you Liz?"
1588682692929163264,Sat Nov 05 00:00:44 +0000 2022,"@Missfortuneskin @TaliqeG @Salty_NZ @MadHatt65364470 @MFA_China Lol if I'm not invested in the Ukraine conflict why would I research it.
So when did the CCP rule Taiwan ?"
1588682689384939521,Sat Nov 05 00:00:44 +0000 2022,"@downix @brianAburman @wyattreed13 ""But at what cost?"" Really is a genuine question when it's applied to the US instead of China."
1588682685123362816,Sat Nov 05 00:00:43 +0000 2022,"Top stories – US, allies clash with China, Russia over NKorea missiles https://t.co/u4H8pYcic2"
1588682680719347712,Sat Nov 05 00:00:42 +0000 2022,High tea on fine china made our Community Care Wellness group feel like royalty! Pinkies-up! Read more: https://t.co/HpE39MiWSA | 1300 244 000 https://t.co/AFWqvss45L
1588682676047052800,Sat Nov 05 00:00:40 +0000 2022,@Liz_Cheney Republicans like this only care if it's China.
1588682666181767168,Sat Nov 05 00:00:38 +0000 2022,"@j_hilling @Bishop_Of_Souls @thecoastguy It is 💯 correct.

China is a WTO designated Developing Nation (thx. to Clintons) and the 🏭 exhaust pipe of the world.

China Belt&amp;R is now economically colonizing Africa / Third World.

“Climate Justice” defines allocating Gigatons of CO2 to this bloc to INCREASE 🌎 emissions."
1588682666110779392,Sat Nov 05 00:00:38 +0000 2022,"@zerohedge Who’s actually stupid enough to buy a giant EV that harms the environment and needs hourly refills for two hours, refilled by electricity produced by coal plants that @TheDemocrats just announced will all be closed down, and has a battery that costs $21,000 (to China) to replace?"
1588682659978678272,Sat Nov 05 00:00:37 +0000 2022,"How do I keep stoopid spam from posting in my comments. Just had to block Toktik, Geez they're relentless. I'm NEVER going to use you China app"
1588682650205958144,Sat Nov 05 00:00:34 +0000 2022,Wuhan backtracks on plan to support NFTs amid China’s crypto ban - South China Morning Post https://t.co/1s54S5SDQN
1588682650046300160,Sat Nov 05 00:00:34 +0000 2022,Note that China is one huge single time zone. https://t.co/ATelqtC8dl
1588682650021396480,Sat Nov 05 00:00:34 +0000 2022,Wuhan backtracks on plan to support NFTs amid China’s crypto ban - South China Morning Post https://t.co/kuYFTyirNT
1588682649832656896,Sat Nov 05 00:00:34 +0000 2022,Wuhan backtracks on plan to support NFTs amid China’s crypto ban - South China Morning Post https://t.co/GGYmZFoKLc #NFTs #HongKong #Blockchain
1588682647068459008,Sat Nov 05 00:00:34 +0000 2022,"Geopolitical risks have come to the fore recently, with tensions over #Taiwan prompting a review of exposure to Chinese assets. We take a step back and re-evaluate the role of #China #equities from a total portfolio perspective. https://t.co/CPGZE65zNc #wealth #investing https://t.co/I9pd0JXcFt"
1588682634179510275,Sat Nov 05 00:00:30 +0000 2022,Democrats and the cia have figured elon musk out. They have taken over with china's help. Elon doesn't know it yet but he will.
1588682601673392130,Sat Nov 05 00:00:23 +0000 2022,"Last week brought news of the renewal of the Vatican agreement with China on the selection of Catholic bishops. Along with this news, predictably, came biased and ill-informed negative coverage from various Catholic media outlets https://t.co/Dm1pfTcSfh"
1588682590953041920,Sat Nov 05 00:00:20 +0000 2022,I be like... whom.. south china sea huh..
1588682590168711168,Sat Nov 05 00:00:20 +0000 2022,"@ICUVua I hope their is airlift to Taiwan for when China invades 

God Speed Mighty Warrior!"
1588682581943500800,Sat Nov 05 00:00:18 +0000 2022,"Today I am joined by Lee and Jing who have an amazing outlook on life. Born in China and made the move to New Zealand, then to Brisbane, Australia where they are living the good life.

To check the episodes, click the link below ⬇️
https://t.co/Q1lLph4cA1 https://t.co/etfQjBnQ6A"
1588682558367490048,Sat Nov 05 00:00:12 +0000 2022,@Renaissans2025 Remember when the NBA refused to talk about (and still refuse to talk about) the concentration camps in China even though numerous players tried to talk about it and get the NBA to cut ties with China?
1588682547978207233,Sat Nov 05 00:00:10 +0000 2022,@LeoMallet14 @brianlilley Libs have attempted many times to push censorship bills masquerading as CRTC content bills. If you don’t want to end up like China wake up because it’s baby steps cuz before you know it you have no voice. Its kool-aid if you can’t see that you’re being taxed to death. Wake up!
1588682535898583040,Sat Nov 05 00:00:07 +0000 2022,"@TulsiGabbard South China Morning Post? Really Tulsi? 
What's next TASS? Moscow Daily News?"
1588682535214940161,Sat Nov 05 00:00:07 +0000 2022,The German chancellor's visit to China is as worthwhile as that of any Western leader. He immediately and expectedly secured China's purchase of 140 Airbus planes worth $17b. He is smart enough to deliver a satisfactory promise of not wanting to decouple from China in return. https://t.co/sh92WpNTVH
1588682534971392001,Sat Nov 05 00:00:07 +0000 2022,"industry in more than three decades. It has leapfrogged from operating seven aircraft in few local routes to having over 40 aircraft in its fleet, connecting not only states in Nigeria but becoming the nation’s gateway to the world via its international routes—Dubai, China,"
1588682531742048256,Sat Nov 05 00:00:06 +0000 2022,Rishi Sunak seeks to score easy political points by closing down Chinese institutes https://t.co/vSW882uLfI
1588682529044824066,Sat Nov 05 00:00:05 +0000 2022,"Fri Nov  4 20:00:00 2022

Shiori is left alone in a China shop."
1588682523877421056,Sat Nov 05 00:00:04 +0000 2022,"@abcd123kkkkkk @gosaliya_ashik @MFA_China ""The Russian delegation warned that any strengthening or expanding of NATO could “seriously slow down democratic transformations” in Russia, and called on their NATO interlocutors to gradually decrease the military functions of the alliance.""😉
https://t.co/AFTBxyX1P6"
1588682520417402881,Sat Nov 05 00:00:03 +0000 2022,"@dvasishtha False everyone knows the best hackers are in Russia, China, Israel and Ukraine"
1588682519645388802,Sat Nov 05 00:00:03 +0000 2022,China is using Buddhist narratives to promote its soft power in Sri Lanka – and bolster its image as a harmonious regional power. https://t.co/0v5L6zrHiJ https://t.co/LK5H9sTLbW
1588682517699497984,Sat Nov 05 00:00:03 +0000 2022,Health advice may not mix well with your friendships at the mo... More for Gemini https://t.co/nIa8DrkZox
1588682515467730944,Sat Nov 05 00:00:02 +0000 2022,China is only winning in the Olympics because they made all the equipment.
1588682512737472512,Sat Nov 05 00:00:01 +0000 2022,"In pre-recorded interviews for the Global Financial Leaders' Investment Summit in Hong Kong, senior officials from China's central bank #DigifinexAirdrop"
1588682512720707586,Sat Nov 05 00:00:01 +0000 2022,"While renewable integration at scale is giving rise to grid instability in China, #energy storage will be the answer to this challenge, said a top company official. #ChineseEnterprises
https://t.co/tpA5I6PnMy"
1588682511936200704,Sat Nov 05 00:00:01 +0000 2022,Why does the Belt and Road Initiative matter? Former Brazilian Tourism Minister Alessandro Teixeira says the BRI is a mechanism that works for more than China's benefit. Hear from our forum on #Chinesemodernization. https://t.co/2Aby4dwmT9
1588682510560464896,Sat Nov 05 00:00:01 +0000 2022,"一时引退声明

I will retire from racing for a few months because I am going back to China. See everyone next year 🗿🖖 (hopefully)"
1588682510376079360,Sat Nov 05 00:00:01 +0000 2022,"Germany’s Scholz calls on China to use ‘influence’ on Russia
https://t.co/Pbt3Cdg0CU"
1588682509772021764,Sat Nov 05 00:00:01 +0000 2022,"At 08:00 Saturday, 05 November 2022 (GMT +08:00) in Loudi, China it was 11.0°C and sunny. 
Wind direction: NNW. Wind speed: 4.3kph. 
Pressure: 1026.0mb. Humidity: 80%"
1588682509533020165,Sat Nov 05 00:00:01 +0000 2022,On Dangerous Ground: America’s Century in the South China Sea by AMTI Director @GregPoling provides a robust yet accessible history of U.S. involvement in the world’s most dangerous waterway. Order now on Amazon: https://t.co/oyehVVPzdk https://t.co/19mLecw0DQ
1588682508979298306,Sat Nov 05 00:00:01 +0000 2022,China is barring its celebrities from endorsing things like private tutoring and health foods to boost the country’s traditional values - Yahoo Finance https://t.co/884f70NEVn via @GoogleNews
1588682508975030272,Sat Nov 05 00:00:01 +0000 2022,"The United States accused Russia and China on Friday of providing ""blanket protection"" to North Korea from further UN Security Council action and said the pair had ""bent over backwards"" to justify Pyongyang's ballistic missile launches.

https://t.co/wJPOI0NRCx"
1588682508354330624,Sat Nov 05 00:00:00 +0000 2022,"#China is trying to build an ecosystem that benefits only Chinese #tech firms

Watch The Mandarin Poser: Offline, Online or On The Line with @rajepant1, @adschina, @YukaKoshino, Nele Leosk, @Gnyandeje &amp; @SameerP_IND

#CyFy2022
@orfgeotech 
https://t.co/TDbcwrxfms"
1588682507775578112,Sat Nov 05 00:00:00 +0000 2022,"Photo taken on Nov. 1, 2022 shows the view of Yeya (Wild Duck) Lake national wetland park in Yanqing District of Beijing, capital of China. Yeya Lake Wetland Reserve became Beijing's first wetland conservation area in 1997. https://t.co/r0sAEcgUVU"
1588682506370433030,Sat Nov 05 00:00:00 +0000 2022,"PHOTOS: Friday's individual all-around final at the Liverpool World Gymnastics Championships 

In a reversal of their duel last year, Japan's Daiki Hashimoto took home the gold over China's Zhang Boheng
Read more: https://t.co/oV1IJfPQRN

#AFPSports
📷 Paul Ellis &amp; Ben Stansall https://t.co/Ey2mimr5ly"
1588682506227912705,Sat Nov 05 00:00:00 +0000 2022,"#Germany and #China are opposed to the use of any nuclear weapons in the #Ukraine war, German Chancellor Olaf Scholz says on a visit to Beijing.

https://t.co/rvleGhzLUC"
1588682505703522305,Sat Nov 05 00:00:00 +0000 2022,Check out this item in my Etsy shop https://t.co/e0W5XUO8xu
1588682505699225602,Sat Nov 05 00:00:00 +0000 2022,"Analyst Klaus Larres discusses the significance of German Chancellor Olaf Scholz’s trip to Beijing. 

Scholz is the first Western leader to visit China since the start of COVID-19 pandemic. #heat https://t.co/7NdnPxvRr3"
1588682505468649472,Sat Nov 05 00:00:00 +0000 2022,China love simply spectacular cooperation.
1588682505317761027,Sat Nov 05 00:00:00 +0000 2022,"For #SriLanka, the primary challenge would be to seek concessions from its largest lender — #China, explain Harsh V Pant &amp; @gs_aditya https://t.co/ykxVNbT7Ns"
1588682491023400960,Fri Nov 04 23:59:56 +0000 2022,"China Eastern Airlines flight #CES7577 spotted at 11,075 feet! https://t.co/BRU9OAXQ2c"
1588682464959950849,Fri Nov 04 23:59:50 +0000 2022,this is China，there is no democracy. https://t.co/AbTe2m6isW
1588682446207594496,Fri Nov 04 23:59:46 +0000 2022,"Westerners like to flatter themselves that Chinese ""tech"" is just a copycat of their own when the dark reality is that Western tech is simply where China was 5 years ago. The deteriorating search service (first Baidu now google), the nickel and dimeing of every service provider,"
1588682441942007808,Fri Nov 04 23:59:45 +0000 2022,"@montaguethecat @pftravers77 @jamiesonmurph There are only three projects in the west. Vogtle in US, Flamaville France &amp; Hinkley Point in UK, all expansions. The last's had cost &amp; time blowouts, now estimated for 2027/8. Biggest builder is China then India. So where's the venture capital for your projects? It's not there"
1588682441669349382,Fri Nov 04 23:59:45 +0000 2022,"@NPRinskeep I assume the people in China who matter (top of the Party) can separate Musk &amp; his stands from Twitter.  It's easier than weighing the Right as a whole.  As for how the Right or others he wants to please take him, I doubt Twitter can be derailed to the point it merges with Musk."
