id,created_at,full_text
1588838874788528128,Sat Nov 05 10:21:21 +0000 2022,"@Frostvk_11 @DaFlanker12 @TheLegateIN That's why China 🇨🇳changed your country map in 2020 occupying ladakh 🤷...
And forgot about  border clash with Bangladesh in 2001?You're 80 chaiwala armies were killed by Bangladesh border guard😆"
1588838873567985665,Sat Nov 05 10:21:21 +0000 2022,"@DrKinKam @SCMPNews debris falls downwards doesn't it?

and Spain is not going to invade China 🙄"
1588838852185427968,Sat Nov 05 10:21:16 +0000 2022,"@asimnyazee And he plans to convert this similar to Chinese App called WeChat, which is all-in-one kind of a app, if you have WeChat in your mobile you don't need any other app here in China. It offers all services as well as mini programs of different apps. https://t.co/NmmTjuHZK9"
1588838843075428353,Sat Nov 05 10:21:14 +0000 2022,"@MrKRudd Why not America Kevin, ? Just because Putin has a ear for Xi. 
If Xi is crucial in assisting the world to prevent a nuclear war then start being nice to him. Doesnt Joe and Co know how to do that.? Teach him Kevin , use your China insights to teach these Americans who never learn"
1588838841473196032,Sat Nov 05 10:21:13 +0000 2022,@IndoPac_Info @SayNoToSino It is utmost important to stop China but the world needs to be mindful of US' intentions as well.
1588838840110034944,Sat Nov 05 10:21:13 +0000 2022,"@frodo73395212 @Bundeskanzler Only 24.9% equity, not ownership of land. Because Hamburg Port is too inefficient for China, it wants to modernize science and technology and add artificial intelligence.Don't be brainwashed by your media."
1588838820191272961,Sat Nov 05 10:21:08 +0000 2022,"@stackhodler My general assumption is that every video originating from China is a fake. 

I learned this lesson from those early March 2020 videos where people where dropping dead on the spot after contracting Covid.

We’re seeing these videos for a reason, that much I’m sure of."
1588838817284313088,Sat Nov 05 10:21:07 +0000 2022,"Pakistani products on display at 5th China International Import Expo, the world's largest Import themed Expo, being held in Shanghai from Nov 05 to 10. https://t.co/n0DTJkee7e"
1588838809437081600,Sat Nov 05 10:21:06 +0000 2022,Chinese Automaker Geely Enters EU Market | Article | China Daily https://t.co/0HWEWY0c57
1588838795050639360,Sat Nov 05 10:21:02 +0000 2022,"FED FUD is the new China Fud, this too shall pass. #crypto #bitcoin"
1588838785269243908,Sat Nov 05 10:21:00 +0000 2022,"The decision, coming soon after China opened its market to Brazil corn imports, is another boost to trade between the world’s biggest agricultural exporter and the biggest buyer of soybeans. #DigifinexAirdrop"
1588838781553356800,Sat Nov 05 10:20:59 +0000 2022,"@cnnbrk Please help me! My name is Lin donglong, an employee of China telecom fuzhou branch. Company manager huang fei (communist party of China) organized the leadership of the gang of evil forces brutal persecution: surveillance location, insult,abuse, framed to take nude photos of me"
1588838781251043330,Sat Nov 05 10:20:59 +0000 2022,"@Thehuck_59 @emilyhewertson Curious to know if commentators/pundits in F1 are abused for going to Saudi or China?
Is paying for a season ticket at Man City an apolitical action given your cash goes to Qatari business?  Newcastle season tickets ditto.

Sport is riven with hypocrisy but picking and choosing?"
1588838779871281157,Sat Nov 05 10:20:58 +0000 2022,"The aubergine was introduced to Spain in the 13th century and subsequently made its way to Italy. The first verifiable examples of it being cultivated can be traced back to China, although this is also suspected to have taken place in India. #bloodflow

https://t.co/TGAiEMxX97 https://t.co/I6n6i3bZC8"
1588838776566329344,Sat Nov 05 10:20:58 +0000 2022,"@cnnbrk Please help me! My name is Lin donglong, an employee of China telecom fuzhou branch. Company manager huang fei (communist party of China) organized the leadership of the gang of evil forces brutal persecution: surveillance location, insult,abuse, framed to take nude photos of me"
1588838775547133952,Sat Nov 05 10:20:57 +0000 2022,Strong yesterday after China rumours and lower USD. DJ Ind says buy buy sell in my daily weekly monthly charts. We are now around SMA200 with sudden ups and downs. Too early for a decisive break through I think. Rates still increasing and we have a strong slow down globally.
1588838755515133952,Sat Nov 05 10:20:53 +0000 2022,@FrRonconi @enilev @mvollmer1 @JeroenBartelse @Hana_ElSayyed @CurieuxExplorer @PawlowskiMario @Khulood_Almani @anand_narang @Shi4Tech @Fabriziobustama @BetaMoroney @TheAdityaPatro https://t.co/leAXQMH9sQ - China did this years back..
1588838745721438208,Sat Nov 05 10:20:50 +0000 2022,"I've been wondering, 
did the end of ancient Rome,
the fall of every dynasty in ancient China,
etc,
feel like 'the end of civilisation' for the people at that time?

Is this the same feeling now?"
1588838739752914944,Sat Nov 05 10:20:49 +0000 2022,"@aurizons @ChrisJ_2211 @BWFScore Well, it was a talk between coach and his players, not to your player. As I said, in here saying attack yang China and attack yang India is the racist one, rather than attack yang Hitam and attack yang putih.

He said sorry when people told him about this"
1588838725525860352,Sat Nov 05 10:20:46 +0000 2022,"@USAmbUN We z people of z horn of Africa, will never forget nor forgive ur evil intentions 2destabilise Ethiopia &amp; z region as a whole by supporting TPLF.  We stood firm &amp;united against z misguided policy of US. U tried 17 times @ UN security council but failed! Thanks2 Russia &amp; China! https://t.co/STLvCnhudE"
1588838723143098368,Sat Nov 05 10:20:45 +0000 2022,"Rishi Sunak has family ties to a tech partner of the WEF.
His family run a China-Linked WEF partner company pushing Digital ID &amp; Social Credit Scores
Advocated for a CCP style economy with trackable digital currency
This Is F*cking Concerning! https://t.co/qnrPBA0dJe via @YouTube"
1588838720178094083,Sat Nov 05 10:20:44 +0000 2022,Chinese defence ministry criticises Pentagon for calling China leading security threat to US – SCMP https://t.co/QgbrRpOmJM
1588838710446940160,Sat Nov 05 10:20:42 +0000 2022,"Hi! Let me introduce myself. I'm carol. Don't you want to find delicious cuisine with me around the world? The country where now I am in is China🇨🇳. The weather now is ☁️☁️🌞☁️☁️. 

 I love🥩🥤🍩"
1588838707083124736,Sat Nov 05 10:20:41 +0000 2022,"@LarsLowgren The attainment of true ""communism"" is described as the CCP's and China's ""ultimate goal"".
https://t.co/EajB0sXNA6"
1588838703127879681,Sat Nov 05 10:20:40 +0000 2022,"@billbirtles With all that is at stake - politically, economically, geopolitically etc, #China is continuing to pursue #ZeroCovid policy.
It makes you wonder, what do they know about Covid, we in the West are constantly denying?
🤔🫣"
1588838693061939200,Sat Nov 05 10:20:38 +0000 2022,"@KeithZhai Thats why the whole is trying to stop them, because they are doing so bad, right 🤣 US will be left behing with this rhetoric, all day long China this China that, what a sh!!t show of a country US ic becoming!"
1588838690927054848,Sat Nov 05 10:20:37 +0000 2022,"@selinane2 @DefenceU Colonial exploitation particularly in Indian sub-conti. pushed th economy badly! Besides ,'british divide &amp; rule"" policy poisoned the society , their education policy was made only to produce ""British-servents""! Now, we r coming out of the colonial irony like China !!"
1588838687667888131,Sat Nov 05 10:20:36 +0000 2022,Reports Suggest China Aiming for Less Disruptive COVID Policies https://t.co/uI8AN7gjif
1588838681191714816,Sat Nov 05 10:20:35 +0000 2022,"@first_rights @DrewPavlou @DanielDumbrill Why should they do whatever it is you have in mind when their system is working so well? Violations of basic human rights are happening on an industrial scale around the world, often perpetrated or tolerated by the very loud mouthed preachers of human rights who accuse China."
1588838633393770496,Sat Nov 05 10:20:24 +0000 2022,"#ZhuhaiAirShow2022

China's🇨🇳 defense company NORINCO's GB100, GB500 &amp; 500A &amp; GB500C bombs at Zhuhai Airshow 2022. https://t.co/9fzEEXGlYa"
1588838631141421057,Sat Nov 05 10:20:23 +0000 2022,@espn #Nba Are a bunch of hypocrites. They suspended #enesKanter for speaking out about atrocities in China. They have no moral authority.
1588838630361272321,Sat Nov 05 10:20:23 +0000 2022,"With all that is at stake - politically, economically, geopolitically etc, #China is continuing to pursue #ZeroCovid policy.
It makes you wonder, what do they know about Covid, we in the West are constantly denying?
🤔🫣 https://t.co/bmQ9VVAkHo"
1588838625462345728,Sat Nov 05 10:20:22 +0000 2022,"@BBCWorld Please help me! My name is Lin donglong, an employee of China telecom fuzhou branch. Company manager huang fei (communist party of China) organized the leadership of the gang of evil forces brutal persecution: surveillance location, insult,abuse, framed to take nude photos of me"
1588838601747726337,Sat Nov 05 10:20:16 +0000 2022,@spectatorindex one reason Scholz went to China
1588838592860008448,Sat Nov 05 10:20:14 +0000 2022,"#news #morning #Video #SaturdayMorning 
Driver license exam station in China...🔥🚗 https://t.co/BrUPxRX5aL"
1588838591941206017,Sat Nov 05 10:20:14 +0000 2022,"How to enjoy Asian food on the keto diet in Hong Kong, where rice, noodles and corn starch are king | South China Morning Post https://t.co/ssoXD3iNeB via @scmp_news #ketorecipes #ketomenu"
1588838589277868033,Sat Nov 05 10:20:13 +0000 2022,NASA condemns China as unguided rocket debris crashes to Earth #Nasa #ui via https://t.co/u14WxAYdRI https://t.co/uEWXt1SCjl
1588838571049639936,Sat Nov 05 10:20:09 +0000 2022,@TeslaAndDoge Now you're getting somewhere. We become a nation of producers again. Americans produce nothing and that's how China has us tied up right now.
1588838562597928960,Sat Nov 05 10:20:07 +0000 2022,"#KungFu enthusiasts were playing #broadswords freely in N China’s Tianjin. The broadsword is a traditional weapon popular in areas of Beijing &amp; Tianjin in ancient times. It is an intangible cultural heritage in Tianjin, &amp; is a sport that integrates strength &amp; skill. https://t.co/yYlaZObSai"
1588838553655857152,Sat Nov 05 10:20:05 +0000 2022,"The CIIE shows the world that China's door will not close, but will open wider. China's opening up has not changed, while the principle of mutual benefit and welcoming globalization has not changed as well."
1588838547393376256,Sat Nov 05 10:20:03 +0000 2022,"@wallacemick It's called democracy Mick, not violent dictatorships like your favorite countries, Russia and china"
1588838538753503232,Sat Nov 05 10:20:01 +0000 2022,"@LeilaniDowding They don't care they want their hands on the cash because they won't stop spending.
We have a communist in The Chancery who is a lap dog to China"
1588838535796342787,Sat Nov 05 10:20:00 +0000 2022,Alibaba’s Yitian 710 Is China’s First Homegrown Cloud-Native CPU to Be Put Into Large-Scale Use #roboticsainews #ai #artificialintelligence #china #cloud #cloudscape #largescale #alibaba #scale #cloudy #aiartificialintelligence https://t.co/qrJPpofsRl
1588838533783064576,Sat Nov 05 10:20:00 +0000 2022,"🇨🇳 China said on Saturday that it would ""unswervingly"" stick to its zero-Covid policy, dampening the outlook for global markets following their recent surge on hopes that Beijing would cast aside some of its economically damaging virus curbs.
Full story: https://t.co/cy9MhGv0j1 https://t.co/L6SYCgPQFn"
1588838533548089347,Sat Nov 05 10:20:00 +0000 2022,"Local authorities locked down an area where Foxconn Technology Group’s biggest iPhone plant is located until Nov. 9, after workers fled the factory in fear of infection and isolations.

https://t.co/avqHrLT2zj"
1588838520667443201,Sat Nov 05 10:19:57 +0000 2022,"Chinese health officials said they would stick to their zero-tolerance Covid-prevention strategy, dampening hopes that had built up in recent days for an easing of its pandemic measures https://t.co/MZrR0OYNJW"
1588838494025449480,Sat Nov 05 10:19:50 +0000 2022,"China is developing so fast that some people can't sit still, so they all spread rumors and slander. Do you know that you feel something by yourself, not by listening to people, and have no independent thoughts?"
1588838488908378113,Sat Nov 05 10:19:49 +0000 2022,@GalLuft Why would China care?
1588838483807936512,Sat Nov 05 10:19:48 +0000 2022,"Nigeria, other African countries in trouble as China slows down lending &gt;&gt;&gt; Click to READ https://t.co/HBfIyx0WZb"
1588838483363188736,Sat Nov 05 10:19:48 +0000 2022,"Have you read “The Crypto Story ”yet? The full cover-to-cover analysis by Bloomberg's Matt Levine explains.We will rely on China's leading financial media,Biz Industry magazine, to build a professional media matrix for the global Crypto &amp; Web3 industry! Please look forward to it! https://t.co/VayiWavYSe"
1588838465827110915,Sat Nov 05 10:19:44 +0000 2022,"You can even spot the fruits of Buddha in China, Japan and Korea but can you spot any fruits of a Christian God? She's just tired. She's cracked."
1588838465256292352,Sat Nov 05 10:19:43 +0000 2022,China's central bank deputy governor Fan Yifei under corruption probe https://t.co/1iPShSDL85  @wionews
1588838461133320192,Sat Nov 05 10:19:42 +0000 2022,@ehehcuri @KorizonEsports @EDG_Edward @dlwjdxo4771 It’s the only way China can compete. People will say if this guy starts winning that he developed in the LPL.
1588838459401457666,Sat Nov 05 10:19:42 +0000 2022,"@BBCWorld Please help me! My name is Lin donglong, an employee of China telecom fuzhou branch. Company manager huang fei (communist party of China) organized the leadership of the gang of evil forces brutal persecution: surveillance location, insult,abuse, framed to take nude photos of me"
1588838452724129794,Sat Nov 05 10:19:40 +0000 2022,@darrengrimes_ So move to China 👍
1588838444482334721,Sat Nov 05 10:19:39 +0000 2022,"@runews there is no handshake in china, japan...."
1588838438891311104,Sat Nov 05 10:19:37 +0000 2022,"@elasticas_ @DavidGiglioCA @disclosetv VW as a brand used to be very popular in the US between the 1980s and 2010s. They declined big time. From personal experience, the same holds true in China, Singapore, and Taiwan. Not that it matters, it's just sad they can't keep their noses out of politics."
1588838432490786816,Sat Nov 05 10:19:36 +0000 2022,"@agnostoxxx @agnostoxxx What's your view on EUR/USD towards the end of this year? Do you hold mostly USD at this moment? (Higher energy prices are negative for EUR, but China reopening bullish?)"
1588838413373165568,Sat Nov 05 10:19:31 +0000 2022,"@GustavsaK @alex1790kimo @wuwuti @LiuDasheng1123 @funchi168 Up to you🤗
Mr.China"
1588838409430536192,Sat Nov 05 10:19:30 +0000 2022,China collapsing is a bit like Russia running out of missiles: a wet dream of the globalist empire that we're told on a weekly basis yet fails to ever materialize
1588838395388002305,Sat Nov 05 10:19:27 +0000 2022,"Historic achievements have been made in wetlands conservation in China and its area of wetlands has increased to 56.35 million hectares, Xi said. https://t.co/JAp5b2bALj"
1588838377629298688,Sat Nov 05 10:19:23 +0000 2022,"Premier Li Keqiang will attend the 25th China-ASEAN (10+1) Leaders' Meeting, the 25th ASEAN and China, Japan and South Korea (10+3) Leaders' Meeting and the 17th East Asia Summit (EAS) and pay an official visit to Cambodia.
https://t.co/taElQDu1Py"
1588838368271818752,Sat Nov 05 10:19:20 +0000 2022,"An Australian who used to be an American is being arrested and extradited to the U.S. because he was apparently an instructor for China’s (fighter jet?) pilots.

The U.S. doesn’t follow any international rules, thanks to American Exceptionalism.🙄 

 https://t.co/c8Az6WD3D5"
1588838341499555841,Sat Nov 05 10:19:14 +0000 2022,"@reliefweb @UNDRR #UN is #failed for us keeping the peace on Earth but they can't #controling #Disaster. #Risk, #Reduction, #resilience, #climatechange and #otherstaff like helping #Ukrainians #winning the war against #RussianBarbarians, we need to make go to #NATO go towar with #Russia and #China"
1588838338790068224,Sat Nov 05 10:19:13 +0000 2022,@BLSchmitt Managing Germany is for China on the same level as managing a medium sized city in their country.
1588838328795037697,Sat Nov 05 10:19:11 +0000 2022,"You know the US push to EVs is a scam because China has a monopoly, and controls 90% of the world's lithium."
1588838307689267200,Sat Nov 05 10:19:06 +0000 2022,"@TuckerCarlson Brazil following the mold of China, you no longer have the freedom to say anything, it's a totalitarian censorship of darkness...."
1588838282573807617,Sat Nov 05 10:19:00 +0000 2022,Ordered a really cute belly bar off etsy weeks ago just to realise it’s coming all the way from China.. come to terms with the fact it will probably arrive at Christmas 😭
1588838282418618369,Sat Nov 05 10:19:00 +0000 2022,"I am perplexed at the @UN, @EUCouncil and Western govt in general.
When exactly did economic growth/excellence become a global threat to humanity?
Was it when China decided not to outsource their manufacturing industry or when Russia made multi billions from natural gas reserves"
1588838245986873344,Sat Nov 05 10:18:51 +0000 2022,"@Star_BLM Why would you want to live in this country then. Iran is more your style or perhaps Russia, China or North Korea. The world is your oyster. Or perhaps you are between jobs at present and on Benefits."
1588838234813079560,Sat Nov 05 10:18:49 +0000 2022,Squirrel Status: Sir Finn of the west is on a scouting mission at Beijing (China) - it was a success (as of 11/5/2022 5:18:45 AM CST).
1588838233248792578,Sat Nov 05 10:18:48 +0000 2022,"@donnandavidson @thesiriusreport Did you read the article?

Is Boston in China?

https://t.co/1ctY4AFIqm"
1588838231046787073,Sat Nov 05 10:18:48 +0000 2022,"@StevenRobertsh8 Most societies in the world are patriarchal, except for a few matriarchal tribes such as the Woodabe of Nigeria or the Mosuo of China."
1588838224210055169,Sat Nov 05 10:18:46 +0000 2022,"@BigBossSniper @mjmayo68 @AZgeopolitics The difference is that nato offers the supplies and money for free to Ukraine, Russia exports weapons the same as US France Germany India China just to name a few for other countries that no one accuses for war"
1588838223325069316,Sat Nov 05 10:18:46 +0000 2022,"Who dares to correct his mistakes? Who dares to stand up and lead China to freedom and democracy? Without freedom and democracy, what is modernization? Falling away from feudalism is getting closer 🤐"
1588838221013999617,Sat Nov 05 10:18:45 +0000 2022,"As a Chinese, I thought that China just lacked a certain degree of freedom and democracy, but now even the leader of a country, Xi Jinping  （current president), is blatant at the 20th Congress of the so-called freedom from justice. Infringing the rights of the previous chairman https://t.co/WKRauVNDh9"
1588838217750810624,Sat Nov 05 10:18:44 +0000 2022,"@intotheskyguy @AceJaceu Wow what made you an expert?  Then why did India and China purchased S-400 from Russia?  Buddy you’re a joke, go read some comic books. 😂"
1588838176046878720,Sat Nov 05 10:18:35 +0000 2022,@Shekelhertz's account is temporarily unavailable because it violates the Twitter Media Policy. Learn more.
1588838159017992192,Sat Nov 05 10:18:30 +0000 2022,"History shows that Powerful Nations that are in terminal Decline like to go to War to try to Extend their control, whilst Rising Powers like to Avoid War, as they know their Power will continue to increase. I am watching tussle between US/NATO versus Russia/China with interest https://t.co/KoJDIhExzJ"
1588838152047046656,Sat Nov 05 10:18:29 +0000 2022,"@WeLoveNATO It's more of a revenue share thing, we'll split the profits after we sell Russia to China."
