id,created_at,full_text
1588528693785550848,Fri Nov 04 13:48:48 +0000 2022,@vickneswarang What about china....😂
1588528690035556352,Fri Nov 04 13:48:47 +0000 2022,"🥑🍇🍓🍐🥨🍎🍳🥚🥨🥩🍖🍗🍍🍑🥓🥙🍑🍳🥚🍤🍖🍗🍊🍇Live news updates from August 15: China’s central bank lowers rates, Third Point pushes for Disney overhaul"
1588528689138237442,Fri Nov 04 13:48:47 +0000 2022,"China will establish 29 more demonstration zones in regions including Beijing and Shanxi to promote imports, the Ministry of Commerce said on its website. https://t.co/MfGGmZlTeC"
1588528681974378498,Fri Nov 04 13:48:45 +0000 2022,@CaptainGort @PS_Alpha1 @DineshDSouza Rather sell myself out to a man who wants to put US citizens first in our own country than sell out to socialists aligned with China
1588528681684815883,Fri Nov 04 13:48:45 +0000 2022,"Such a disingenuous quote.
But revealing in its own way.

Going back to China this year was not an option under any circumstances. ""Values"" or not. https://t.co/dIqKpcXhiA"
1588528680351199232,Fri Nov 04 13:48:45 +0000 2022,"@janeqiuchina @past_is_future @stuartjdneil @joshrogin @washingtonpost Jane the ""Independent writer in China"" 🤡🤡🤡"
1588528679625555969,Fri Nov 04 13:48:45 +0000 2022,"@josh_brust @KalebManuel8 @NBAPR @AkronJackson What about the Nets owner in regards to the Uyghurs situation in China? You can’t in your good conscience tell me NBA cares, because they don’t."
1588528678363090946,Fri Nov 04 13:48:45 +0000 2022,"For #SriLanka, the primary challenge would be to seek concessions from its largest lender — #China, explain Harsh V Pant &amp; @gs_aditya https://t.co/SqlXw4Z4aK"
1588528670742024192,Fri Nov 04 13:48:43 +0000 2022,If China decides to fully open now it will really throw a wrench in everything . They have kept their zero covid policy in place mostly to offset inflation…starting up that economy will pull a lot of the worlds scare and expensive resources
1588528670138044417,Fri Nov 04 13:48:43 +0000 2022,@benshapiro China just laughing at what America has become.
1588528668233838592,Fri Nov 04 13:48:42 +0000 2022,"@spaghettilisbon the DAX is up on China bs, it will go down next week"
1588528665389715463,Fri Nov 04 13:48:41 +0000 2022,@hornycatdad1989 @Lucvend @David_Mulroney So the only reason someone joins is so they can monetize the training with China?  Ridiculous.
1588528660914802689,Fri Nov 04 13:48:40 +0000 2022,China COVID cases surge to six-month high https://t.co/giuZeJPcRv
1588528658607910914,Fri Nov 04 13:48:40 +0000 2022,Finished Imperial China chapter of Live a Live. Didn’t expect it to make me so teary
1588528656959569925,Fri Nov 04 13:48:39 +0000 2022,$SBUX continues to see buyers with them opening more stores in China and covid possibly subsiding. Bullish long!
1588528650710036481,Fri Nov 04 13:48:38 +0000 2022,"@SteveWeaverTEFL Germany is being smart. The rest of Europe is trying to distance themselves from China, which has created a field free of competition. It's a golden business opportunity which Germany will take advantage of, leaving the rest of the European nations in the dust."
1588528641683558401,Fri Nov 04 13:48:36 +0000 2022,"@SoundOfHope_SOH [Tsai Ing-wen meets members of the IPAC delegation: I should tell Beijing that the cost of aggression against Taiwan will outweigh the benefits] On the morning of the 3rd, the President of the Republic of China #蔡英文 met with the delegation of the ""Inter-Parliamentary Alliance"
1588528638022254594,Fri Nov 04 13:48:35 +0000 2022,@TheLeoTerrell @ThinkingTramp Nope. Retire. China-GL0BALIST.
1588528637342797826,Fri Nov 04 13:48:35 +0000 2022,"@akhivae @Empty_America 50 loyal clients willing to spend 200USD/month, and the eventual guests is all you need. Aim at expat families, high government officials, local businessmen. No local competition because standards low.
What I mean about Trust: medicaments imported mostly from NL. Oil from China."
1588528635920928768,Fri Nov 04 13:48:34 +0000 2022,U.S. audit inspectors finish on-site China work ahead of plan https://t.co/ZU5yzvGTPX https://t.co/1OfXAtQmyU
1588528634046087169,Fri Nov 04 13:48:34 +0000 2022,@MittRomney One China agent defending another. 🖕🖕
1588528628958400514,Fri Nov 04 13:48:33 +0000 2022,U.S. audit inspectors finish on-site China work ahead of plan https://t.co/zDbyAiaIp6 #Tax #Accounting #News https://t.co/sUmoSZq40c
1588528627133521923,Fri Nov 04 13:48:32 +0000 2022,"Tech industry squeezed by U.S.-China rift: ""The music is going to stop"" https://t.co/Lrl4rdSmJ1"
1588528614508998656,Fri Nov 04 13:48:29 +0000 2022,@SITARMS Spies all over ireland communists too russians china and others
1588528612776771584,Fri Nov 04 13:48:29 +0000 2022,@GoodAmerica1 Has to go to China and back!!!
1588528602966298624,Fri Nov 04 13:48:27 +0000 2022,"@ngahpham I cannot help but it is unfair to blame Scholz. Scholz himself knew China supports Russia, but situation forced Germany to be calculated. But his trip to Vietnam means something else... diversifying chain supply?"
1588528589120618498,Fri Nov 04 13:48:23 +0000 2022,WTF China. https://t.co/R3OoRQrxBA
1588528587510251520,Fri Nov 04 13:48:23 +0000 2022,"Its pretty obvious Russia / China was the spark to the entire trucking convoy. They played us all 

Now they are clearly doing the same thing to push this whole, the West is controlled by Nazis narrative...

Give your head a shake. Everyone knows someone who had family die in WW2"
1588528582019715074,Fri Nov 04 13:48:22 +0000 2022,"Alibaba, https://t.co/pXASmy1w1V, and Tencent Climb on Optimism Over U.S. Audits, China Reopening https://t.co/rtr7RTMltf"
1588528567092142080,Fri Nov 04 13:48:18 +0000 2022,China shifts stance on Ukraine
1588528564194148353,Fri Nov 04 13:48:17 +0000 2022,"While the Taiwan issue and the unresolved India-China border dispute are not comparable, Beijing’s determination to link territoriality with national sovereignty could alter the nature of the border issue with India, writes C Uday Bhaskar.

https://t.co/eyUyU51slN"
1588528556346597376,Fri Nov 04 13:48:15 +0000 2022,@realDailyWire He’s probably right. Everybody knows he’s balls deep in with communist China
1588528553985200129,Fri Nov 04 13:48:15 +0000 2022,"Crazy day - my gold, energy and material stocks are up huge on China news, yet US market trading back in yesterdays range $GDX $XLE"
1588528553196650496,Fri Nov 04 13:48:15 +0000 2022,"@h_desires There is human rights abuse everywhere including in the #UK #USA #SaudiArabia #China #isreal #Iran &amp; more. Like most things, the West has decided that we are the torch bearer of democracy. Qatar has the right to its laws and visitors to obey them. #Qatar2022 #Qatar #FIFAWorldCup"
1588528550524878848,Fri Nov 04 13:48:14 +0000 2022,"Dollar softens on China reopening hopes, U.S. jobs data in focus - https://t.co/HAsZk7SBwM"
1588528545067720706,Fri Nov 04 13:48:13 +0000 2022,I want to drive to Montgomery just to go to Top China cause the Chinese food here is ass.
1588528541867855873,Fri Nov 04 13:48:12 +0000 2022,"(3/3) Though limited, #Baochistan is rich in resources, &amp; civilians are deprived of it. There are allegations of illegal land grabbing by #China's elites,to whom #PakArmy provides security but these elites have no accountability to Pakistan forces or leaders.
@timothynunan https://t.co/ngQPGAO54i"
1588528541087719426,Fri Nov 04 13:48:12 +0000 2022,"And here I thought we were saving the earth with renewables. Instead it’s going to be a polluting fight to the death bet wealthy nations, (around global South resources), and maybe a nuclear war with China, for Western dominance, during this time of impending human demise! 😫😫 https://t.co/PIEwi9Vfm3"
1588528540445646848,Fri Nov 04 13:48:12 +0000 2022,"The explicit threat to end Kim regime is radically different from declaratory language used to deter Russia/China, which in the NPR does not mention regime change."
1588528534762717184,Fri Nov 04 13:48:10 +0000 2022,"2022 in review
Part 3: Africa's debt trap
- When African governments cut back on recurring expenses to repay China's loans, suppliers, gig organisers, and vendors suffer. Civil servants have fewer allowances, so services and shops see slower business, hence the current pain."
1588528533168881672,Fri Nov 04 13:48:10 +0000 2022,"A sea of blooming galsang flowers turns a tourist site in Kunming, southwest China's Yunnan Province, into a pinkish paradise, attracting streams of tourists to appreciate.
https://t.co/L5SwrhNxHd"
1588528511358480385,Fri Nov 04 13:48:05 +0000 2022,"Pleased to be invited by Secretariat of the Chinese Follow-up Committee of FOCAC to speak at China-Africa Harvest Night. FAO will continue to partner with China in supporting African countries to achieve Zero Hunger, defeat poverty and accelerate sustainable inclusive growth. https://t.co/L0Fg5QNIJ6"
1588528509538177025,Fri Nov 04 13:48:04 +0000 2022,even if taylor comes to asia im sure shes not coming here shell probably go to china japan korea etc
1588528507252277250,Fri Nov 04 13:48:04 +0000 2022,"@RnaudBertrand US has been freeing Asia since Philippines atrocities of 120 years ago, using roughly the same methods.
Russia, China, Iran, Korea, they'll all be free, and open to US corporate development."
1588528505343643648,Fri Nov 04 13:48:03 +0000 2022,World’s largest iPhone plant rushes to tame fear in bid to keep production running under China’s zero-Covid policy https://t.co/hkbtkrfEPI
1588528501212073984,Fri Nov 04 13:48:02 +0000 2022,"Its pretty obvious Russia / China was the spark to the entire trucking convoy. They played us all 

Now they are clearly doing the same thing to push this whole, the West is controlled by Nazis narrative...

Give you head a shake. Everyone knows someone who had family die in WW2"
1588528495524970496,Fri Nov 04 13:48:01 +0000 2022,time to go to china https://t.co/MIzgBpWMRm
1588528494543515648,Fri Nov 04 13:48:01 +0000 2022,"As a number of incidents sparked public concerns over rigid COVID prevention in parts of China, Ordos city in N.China's Inner Mongolia published a notice Thu, saying that no matter what happens, safeguarding people's lives will always be their priority. https://t.co/FzGAx3EIF2"
1588528490584117248,Fri Nov 04 13:48:00 +0000 2022,"@realDailyWire Yeah and I’m pretty sure he meant possibilities as in how much money they could drain from our country. He’s working with communist China but not to keep them at bay, but to bring them into our home."
1588528489158017024,Fri Nov 04 13:47:59 +0000 2022,"@a_palf as the French are planning a trip in January, probably not happy because they won't have any Airbus contracts to celebrate... and planes are a major part of their bilateral trade with China"
1588528488604397568,Fri Nov 04 13:47:59 +0000 2022,@Luiz_Fernando_J So thoughts on Avatar china release?
1588528484309032960,Fri Nov 04 13:47:58 +0000 2022,@DonLew87 So does China
1588528476595752962,Fri Nov 04 13:47:56 +0000 2022,"@Morning_Joe @jonathanvswan He is a bull in a China shop! Just saying and doing what he wants to do! Trump tactics, lie enough and they will believe and join my cult! We have to Vote BLUE!"
1588528475518177283,Fri Nov 04 13:47:56 +0000 2022,"#China: Chip makers in trouble
#WarOnChina #USA #semiconductors
 https://t.co/Fld6HwK2nc"
1588528469675503619,Fri Nov 04 13:47:55 +0000 2022,"‘Sloppy’ US Talk on China’s Threat Worries Some Skeptical Experts
https://t.co/wL1VDd5uf9
#USA #China"
1588528458363441154,Fri Nov 04 13:47:52 +0000 2022,@ChrisPappasNH @kleavittnh So how are you doing stopping Russia and China ftom polluting. How about politicians and Hollywood jetting around???? Please stop.
1588528448833605632,Fri Nov 04 13:47:50 +0000 2022,"Habla de  Brazil, Russia, India, China and South Africa. https://t.co/k9Pocy3QWY"
1588528445746999296,Fri Nov 04 13:47:49 +0000 2022,"@RnaudBertrand The Western world needs China's fossil fueled manufacturing.
Net zero in the West cannot exist without them."
1588528441057431552,Fri Nov 04 13:47:48 +0000 2022,Hey @China don't drink and fly rockets. It's a pain in the ass for travellers in Europe. Bravo and big up you fools.
1588528439581372416,Fri Nov 04 13:47:48 +0000 2022,"@RepMTG Russia, China, North Korea, Iran, Syria, Saudi Arabia, Hungary, and MAGA are forming an international axis against democracy. But go ahead and forget about the Ukraine. Wait until the come knocking on your door. What will you do then. https://t.co/F3C1a0GBNS"
1588528438809284608,Fri Nov 04 13:47:47 +0000 2022,"@GBNEWS His dear mama loved jewels he loves trees, just like her he won't give up the trees for all the tea in China!"
1588528437576073216,Fri Nov 04 13:47:47 +0000 2022,China rolls out first 'inhalable' Covid vaccine https://t.co/sAd6IfV1ss
1588528432132259840,Fri Nov 04 13:47:46 +0000 2022,"@StopAntisemites @NorthwesternU @susanspiesroth @StudentAffNU @norriscenter Interesting. No other international conflict is posted in that wall?Only Israel/Palestine? No Ukraine? No Syria?, No Ethiopia?, No Iran? No North Korea? No Venezuela? No China? Anti Zionism= Antisemitism"
1588528428650987520,Fri Nov 04 13:47:45 +0000 2022,"China is reportedly planning to send monkeys to its Tiangong Space Station to have sex &amp; reproduce in space. 🐒🐵 👩‍🚀🚀

Well, in line with efforts to colonize space, this is an important experiment."
1588528428382228481,Fri Nov 04 13:47:45 +0000 2022,@FaithhLawrence @kanyewest @SHAQ Yeah because who doesn’t like supporting a man who is okay with child sweat shops in China
1588528427501772802,Fri Nov 04 13:47:45 +0000 2022,China sends another spy ship into the Indian Ocean days ahead of a planned Indian missile test off the coast of Visakhapatnam.
1588528423307476993,Fri Nov 04 13:47:44 +0000 2022,@ajamubaraka The China visit is only to stop the US from twisting the blade in the wound.  To take the blade out of their back Gemany has to reject US hegemony and join the BRICS+. Together with Russia in BRICS+ Germany has a real future. #NoMore
1588528412448403458,Fri Nov 04 13:47:41 +0000 2022,"@NiMingda_GG All empires are murdering conquerors: Nazi, Japanese, Chinese, British, Russian, Ottoman, Mongolian, etc, all try to justify their actions: ie, bring cilisation, education, infrastructure &amp;/or trade. 

Prove me right, try to justify China's many conquests, you know you want to."
1588528412125466624,Fri Nov 04 13:47:41 +0000 2022,@summert19155705 @TheDragonFeeder Are you receiving any payment for forwarding conspiracies? Actually there are laws in US and EU etc. China had only laws that are hoax laws.
1588528409277530114,Fri Nov 04 13:47:40 +0000 2022,@rising_serpent @Followt96844528 China wouldn't allow it to play.  No video or TV ad is going to stop the Dems Voter fraud next week.  You want a Red Wave we have to have another American Revolution against Tyranny
1588528405016104962,Fri Nov 04 13:47:39 +0000 2022,@BambinoJalapeno Wait until they find out that China has been manipulating the weather off the west coast with drones. @dbongino @JackPosobiec https://t.co/27mBX3qQb2
1588528399051821056,Fri Nov 04 13:47:38 +0000 2022,"How is my representative replacing American flags with China made flags? Let's put her on blast, since she voted for 1.4 trillion dollars in infrastructure and can't even get our own Patriotic American flag right. https://t.co/sdfUijqbhv https://t.co/cvlsmdHsdI"
1588528397567029250,Fri Nov 04 13:47:38 +0000 2022,@zerohedge lolz ahead of the curve on everything from fomc to China rotation and today’s movement https://t.co/6S9gsIv6L7
1588528387387453440,Fri Nov 04 13:47:35 +0000 2022,@JamesHMackay How confident are you that china is actually opening? Seems like every prior headline on this was a great opportunity to sell.
1588528382618148864,Fri Nov 04 13:47:34 +0000 2022,"Absolutely huge news for China, wowow. https://t.co/rNIVS3nIOk"
1588528368307572737,Fri Nov 04 13:47:31 +0000 2022,shit we doing that rn with muslims in china https://t.co/ITdEYcBtVt
1588528363945480192,Fri Nov 04 13:47:30 +0000 2022,"Over 7.2 million passengers have used the China-built Cat Linh-Ha Dong metro line in the Vietnamese capital, Hanoi, after nearly a year of operation, local media reported. It is the first metro line in the country to start commercial operation. https://t.co/SiknHRgq24"
1588528362892726273,Fri Nov 04 13:47:29 +0000 2022,"The vessel, carrying magnesite 97, was certified by a third-party surveyor as AGM-free in Tianjin, China

Finding any which way to destroy the country @JoeBiden gypsy moth invasion https://t.co/vJ2kGqzus5"
1588528358085648385,Fri Nov 04 13:47:28 +0000 2022,"@BrooklynNetcast I dont blame Kyrie for apologizing.  Joe Tsai probably showed him screenshots of his family  during their private meeting and said ""Apologize or I will genocide your people like I did with those fucking Muslims in China...make me believe it or else."""
1588528348439117825,Fri Nov 04 13:47:26 +0000 2022,"🎊🎊❤️💕
Love to Yuzu from China,celebration for Prologue,which is the first ever One Man Ice Show.Miracle boy,so proud of you, always be with you.
@YUZURUofficial_
@jp_prologue
#プロローグ
#プロローグinYOKOHAMA 
#羽生結弦プロローグ全力応援
#HANYUYUZURU𓃵 https://t.co/ZMiQQIwKIe"
1588528347650220032,Fri Nov 04 13:47:26 +0000 2022,"@MirzaKunjahi @ANI Ur PM is now in China to beg for money right? 
Got enough"
1588528340511911936,Fri Nov 04 13:47:24 +0000 2022,"5. At the end of the thousand-year reign by Jesus, Satan will be loosed on the earth again, and China, Russia, and some other countries will assemble on the border to Israel."
1588528338401828864,Fri Nov 04 13:47:23 +0000 2022,China’s TikTok Admits Its Staff Can Spy on User Data in Other Countries https://t.co/IlHHqhaXYp via @news_ntd
1588528338326671361,Fri Nov 04 13:47:23 +0000 2022,@DianaUmuhoza_ Welele inganekwane once Kimberly always Kimberly finish and klaar https://t.co/kX78diSB4B
1588528322715205632,Fri Nov 04 13:47:20 +0000 2022,China investors drive frenzy for ‘Sino-Russian trade’ stocks
1588528318017835010,Fri Nov 04 13:47:19 +0000 2022,now the US is puppet of China 🤣🤣🤣🤣🤣🤣 https://t.co/xEItwRssnC
1588528313256943616,Fri Nov 04 13:47:17 +0000 2022,"@OfficialDGISPR @ImranKhanPTI @ECP_Pakistan @SkyNews @BBCWorld @trtworld @TalkTV @ImranRiazKhan @samiabrahim @arsched @RTErdogan @HassanRouhani @Haqeeqat_TV @ARYNEWSOFFICIAL @BOLNETWORK @UNHumanRights @amnestysasia @zlj517 @KremlinRussia_E @ghaziusama @MaleehaHashmey @ARYSabiirShakir @PAKSupremeCourt @SdqJaan @ArifAlvi @MFA_China @OmarCheemaPTI @fawadchaudhry @TariqJamilOFCL @QasimKhanSuri @Asad_Umar @ShkhRasheed @BabarAwanPK @SenateCA @IntlCrimCourt @IHRCEU @CIJ_ICJ @MalBokhari @SafinaKhann @SHABAZGIL @amnesty @ChParvezElahi @JustinTrudeau @ShireenMazari1 @meherbokhari @JacksonLeeTX18 Rather than investigating @arsched murder the #PDMterrorists made up committee is receiving awards from  Kenya Police, what shameful behavior and criminals installed by #terroristbajwaandcorruptgenerals https://t.co/iyzGRymxbe"
1588528311843840000,Fri Nov 04 13:47:17 +0000 2022,Of course he is blackmailed! He is in bed with China... He is what is wrong with republican party! https://t.co/6Ot9jdrPVk
1588528307074699264,Fri Nov 04 13:47:16 +0000 2022,China reopening remains the bigger pivot story for markets than the Fed pivot
1588528306068287489,Fri Nov 04 13:47:16 +0000 2022,"@CNN #Live: @jimsciutto : @DavidMalpassWBG nailed at from the jump. Since The @federalreserve is fighting #Inflation, bad news is good news in The unemployment report is in fact good news but #China is in a stronger position than The #USA. Why? They did not engage in #QE!!"
1588528301706211328,Fri Nov 04 13:47:15 +0000 2022,Republicans stood by and let 1.1 Million Americans die from Cvd. Trump to Woodward when asked about how he was going to lead the country through Covid: “I got no responsibility for it- that’s on China. I got nothing to do with it.”
1588528298035793921,Fri Nov 04 13:47:14 +0000 2022,"@Flash_news_ua This is his problem: ""neutral China is closer US A than Germany or Russia..."
1588528297230880768,Fri Nov 04 13:47:14 +0000 2022,"@JodyBelcher13 If I was China, this is around the time where I would attack."
1588528296064843777,Fri Nov 04 13:47:13 +0000 2022,China…. All four did 500%+ lmao what a Friday 🤣🤣 https://t.co/1QyMRY44dS
1588528294613618688,Fri Nov 04 13:47:13 +0000 2022,"@AbrasiveTea @STAMERCA @Reuters Chinese income comes from capitalism. Fact

Taiwan is free. Fact

China will be joining Russia, Iran &amp; North Korea as global pariahs"
1588528284354035713,Fri Nov 04 13:47:11 +0000 2022,"the true Antivexer FEAR CORONA PREVENTION?!
https://t.co/uHOTDOdR8e

#coronavirus #china #RussiaUkraineWar #UkraineRussianWar #vegan #explorepage #ExtinctionRebellion #FYP #fypシ #nftphotography #NFTcollections #nftcollectors #NFTCommumity #nft https://t.co/tz7fms2REL"
