id,created_at,full_text
1589425464405204992,Mon Nov 07 01:12:15 +0000 2022,"Entire column of Russian tanks destroyed by Ukrainian forces in Donetsk
#Canada #Germany #UnitedStates #Kherson #Ukraine
https://t.co/HeiaZJeloV"
1589425454662160404,Mon Nov 07 01:12:13 +0000 2022,"My crayon box is all out of 'Surprise.' 🙄
https://t.co/0sjF69oC7U"
1589425451684237312,Mon Nov 07 01:12:12 +0000 2022,@LongDesertTrain @Euan_MacDonald @kirkmurphy Ukraine is already a nuclear mess
1589425446953029632,Mon Nov 07 01:12:11 +0000 2022,Boris is of course in Ukraine - hello missing in action man we need as much as support you are rightfully giving to Ukraine. Swear he’s been to that country more than he’s attended meeting about the cost of living
1589425442049601536,Mon Nov 07 01:12:10 +0000 2022,"@warmachineofgod @JimBowersclimb @Shopdogg2 @8BrianVogel4 @Particl05533599 @italia_antihero @RAGINxCAJUN @Pepevineyard @ThereseOSulliv2 @ghost321 @JamesCa70626795 @tallnblonde1 @tRick_the_only @OriginalGoalie @MJB24681 @rosegar17673310 @RGanley @Merry_Hippie @JulieMu36442360 @fwe1991 @ChubbsNShooter @JLiRD808 @TrumpLOST5 @MikeBetts43 @Krensharpaw @itisjustmebabe @Deborah9731827 @2_drac @RonFancy @mgarcia523 @VinceGottalotta @Vanessa76_1 @LaProudam13 @dirk_fasshauer @HuntersArtWork @fireball_lady @_CapitalOffense @DigiMalice @jkoff609 @GoFishLynn @theTennPatriot @SKillr666 @najjar_richard @Pennell10Dan @Sketchyjgaming @__TeekeeMon @sammk1964 @thomasCoster4 @MCXSpearThumb @BlackCa28867722 And a Ukraine comedian making things to warm fer Russians , it's funny cause war guy won't share his tampons with Russian conscripts ..   https://t.co/Rmu3svh75T"
1589425439574925312,Mon Nov 07 01:12:09 +0000 2022,"@poroshenko Hey, buddy. Your time has passed, Your train has gone. There was no plans for you to be a president. You are dark horse and you are trying to keep afloat because you want to repeat 2014! Its not going to work, mate! People of Ukraine hate you 3% @poroshenko. Thats right, only 3%!"
1589425403860426753,Mon Nov 07 01:12:01 +0000 2022,"@poroshenko @GBNEWS Hey, buddy. Your time has passed, Your train has gone. There was no plans for you to be a president. You are dark horse and you are trying to keep afloat because you want to repeat 2014! Its not going to work, mate! People of Ukraine hate you 3% @poroshenko. Thats right, only 3%!"
1589425382482378752,Mon Nov 07 01:11:55 +0000 2022,"Denazification, demilitarization, and desatanization of Ukraine must continue. https://t.co/gnpTDq5w39"
1589425369161302016,Mon Nov 07 01:11:52 +0000 2022,"@poroshenko Hey, buddy. Your time has passed, Your train has gone. There was no plans for you to be a president. You are dark horse and you are trying to keep afloat because you want to repeat 2014! Its not going to work, mate! People of Ukraine hate you 3% @poroshenko. Thats right, only 3%!"
1589425364308463616,Mon Nov 07 01:11:51 +0000 2022,@jeffmccroskey77 @AdamForColorado Ukraine should’ve said no to NATO agenda 2050.
1589425352665100288,Mon Nov 07 01:11:48 +0000 2022,@JuliaDavisNews Or … you could leave Ukraine.
1589425349263523841,Mon Nov 07 01:11:48 +0000 2022,"@daniel___610 @briebriejoy Thank her for what?

She rolls her eyes when genocide in Ukraine is mentioned.  She seems to think child abduction, rape, murder, plundering and ethnic cleansing are just first-world problems.

If you're thanking her for that, I guess you're just okay with genocide."
1589425348269248512,Mon Nov 07 01:11:47 +0000 2022,Putin Has A Problem: Iran Says It Gave Russia Drones Before Ukraine War #SmartNews  https://t.co/9swYppK1ky
1589425333799104514,Mon Nov 07 01:11:44 +0000 2022,"@poroshenko Hey, buddy. Your time has passed, Your train has gone. There was no plans for you to be a president. You are dark horse and you are trying to keep afloat because you want to repeat 2014! Its not going to work, mate! People of Ukraine hate you 3% @poroshenko. Thats right, only 3%!"
1589425333597622277,Mon Nov 07 01:11:44 +0000 2022,"Ukraine war news from March 3: Russian forces continue missile strikes, US unveils new sanctions on oligarchs"
1589425332213669889,Mon Nov 07 01:11:43 +0000 2022,@juliaioffe @russell_cramp GOP totally supports Russia in Ukraine…. That includes their substantial war crimes….
1589425314001997825,Mon Nov 07 01:11:39 +0000 2022,"@Cappyarmy Trump oversaw big changes in the Middle East, with more peace deals with Israel than ever before. 

Likely if Trump had remained President, then we wouldn't have the mess we have no in Ukraine, or the disaster that was Afghanistan."
1589425300349550593,Mon Nov 07 01:11:36 +0000 2022,short &amp; sweet summary of the reasons why Ukraine can't negotiate before either recovering its 1991 borders or Putin getting deposed. V. good catchup. https://t.co/RM9o51XDSR
1589425298382389248,Mon Nov 07 01:11:35 +0000 2022,"@poroshenko Hey, buddy. Your time has passed, Your train has gone. There was no plans for you to be a president. You are dark horse and you are trying to keep afloat because you want to repeat 2014! Its not going to work, mate! People of Ukraine hate you 3% @poroshenko. Thats right, only 3%!"
1589425295882596352,Mon Nov 07 01:11:35 +0000 2022,"@TDF_UA Ahh the Free World, something of which Ukraine is not a part of."
1589425293999030272,Mon Nov 07 01:11:34 +0000 2022,@JUANCHO91927812 @DeuNachrichten Those are Ukraine dead from occupied areas.
1589425293395374080,Mon Nov 07 01:11:34 +0000 2022,U.S. crude oil producers have made $200 billion since the Russia-Ukraine conflict
1589425291612794880,Mon Nov 07 01:11:34 +0000 2022,"@broe_jake @elonmusk Jake, stick to Ukraine."
1589425289805066240,Mon Nov 07 01:11:33 +0000 2022,@laurenboebert And they do t care they support NAZIs in Ukraine while at the same time calling other people NAZIs and terrorists. Democrats=Death Cult
1589425282263678983,Mon Nov 07 01:11:32 +0000 2022,@JuliaDavisNews @Kasparov63 Visited US recently. So many Ukrainian flags posted by regular people I didn’t see in Canada. Many republicans support Ukraine because they hate communist russia. I truly believe these russian clowns are wrong.
1589425278710710272,Mon Nov 07 01:11:31 +0000 2022,"I think that the argument that if Russia is given what it wants now in Ukraine, this would be detrimental not just to Ukraine’s future security, but also of that of a much broader space, is not convincing enough for a lot of people. Not because they see flaws in it, 1/"
1589425271303680000,Mon Nov 07 01:11:29 +0000 2022,"…nine months has demonstrated beyond reasonable doubt that Putin is not merely the cause of Russian aggression but also the symptom of a larger disease that is not likely to be cured by reclaiming Ukraine alone, or even by Putin’s passing from power… https://t.co/Iap7Jy7hnq"
1589425266358571008,Mon Nov 07 01:11:28 +0000 2022,"@AConstituio1 @BystrickyChris @nntaleb What do you think will happen, do you expect Ukraine to surrender? Soviets fought 9 years in Afghanistan at the height of their power and lost. That was a 13m third world country. Ukraine is 40m with modern weapons. They overstepped very badly."
1589425265582968832,Mon Nov 07 01:11:28 +0000 2022,"@vijayprashad I don't take your point 100% seriously, but I do think US and Ukraine have to play games because Russia will most of the time negotiate in bad faith."
1589425260964679680,Mon Nov 07 01:11:26 +0000 2022,"@StephenKing Blue equals high crime,shitty economy,mostly peaceful protest (damages in the billions and how many lives lost),involved in a war cause money is being made by the president off Ukraine, over 8 percent inflation.and possibly going to get nuked

FJB"
1589425259853320193,Mon Nov 07 01:11:26 +0000 2022,Grains and vegetable oil from Ukraine and Russia are crucial to national diets across the region
1589425259174064128,Mon Nov 07 01:11:26 +0000 2022,"@poroshenko Hey, buddy. Your time has passed, Your train has gone. There was no plans for you to be a president. You are dark horse and you are trying to keep afloat because you want to repeat 2014! Its not going to work, mate! People of Ukraine hate you 3% @poroshenko. Thats right, only 3%!"
1589425258456846337,Mon Nov 07 01:11:26 +0000 2022,Tens of thousands of Italians marched through Rome on Saturday calling for Ukraine to surrender to Russia and urging Italy to stop sending weapons to fight the Russian invasion. Crazy people! https://t.co/G6If57486m
1589425257223524356,Mon Nov 07 01:11:26 +0000 2022,"The original Antifa stormed the beaches of Normandy, to defeat Nazi Germany.

But this was opposed by Nazi sympathizers like Allen at the time.

Republicans will repeat history, by withdrawing support for the #Ukraine

#msnbc #pbs #cnn #foxnews #newsmax #oann https://t.co/KINW70mnLv"
1589425255843762176,Mon Nov 07 01:11:25 +0000 2022,@ProudCitizen7 @Trump2094578522 @RpsAgainstTrump Stop name calling like it’s a elementary school playground. The same people chanting “slava Ukraini” are the same that chanted “weapons of mass destruction”. Not to mention just how badly Ukraine is losing even with BILLIONS in “aid”. Who could’ve known
1589425247945572352,Mon Nov 07 01:11:23 +0000 2022,"Tumblr!

Czech RSZV RM-70 Vampire, working on enemy positions

#Kyiv #Ukraine 🇺🇦
#Kherson #Kharkiv
#Bakhmut #Donetsk
#Svatove #Kreminna
#Luhansk #Lysechhansk
#Zaporozhye #Crimea https://t.co/37735EAIkZ"
1589425236730351617,Mon Nov 07 01:11:21 +0000 2022,"@Biz_Ukraine_Mag Ah, so it's not about the hats then!"
1589425227771125761,Mon Nov 07 01:11:19 +0000 2022,"The atrocities, deaths and destruction caused by Russia’s invasion have made negotiations unpalatable to many Ukrainians.

US says Zelenskiy risks allies’ ‘Ukraine fatigue’ if he rejects Russia talks – report | #UkraineWar https://t.co/Rwp6jvDyfw"
1589425225099530240,Mon Nov 07 01:11:18 +0000 2022,"@poroshenko Hey, buddy. Your time has passed, Your train has gone. There was no plans for you to be a president. You are dark horse and you are trying to keep afloat because you want to repeat 2014! Its not going to work, mate! People of Ukraine hate you 3% @poroshenko. Thats right, only 3%!"
1589425221437911040,Mon Nov 07 01:11:17 +0000 2022,@TheTeaTotaller @MattWallace888 I bet the people of Ukraine appreciated when he reestablished it internet in their country during the war.
1589425212369403904,Mon Nov 07 01:11:15 +0000 2022,@Tendar I support Ukraine in this conflict but I object to the soundtrack in this video. I object to an entertainment being made out of the death and destruction of war.
1589425211753271298,Mon Nov 07 01:11:15 +0000 2022,Russia Looks to Private Militia to Secure a Victory in Eastern Ukraine https://t.co/YgfFYMdykj
1589425201284284416,Mon Nov 07 01:11:12 +0000 2022,"@dauofmosthigod Yes. But they are apparently sending OUR sovereign AMERICAN #MILITARY to #Ukraine, preparing for engagement, these traitors for the occult globalist cabal."
1589425197031247872,Mon Nov 07 01:11:11 +0000 2022,"@OrkishAmerican @DavidSoulsby11 @jeffintokyo1 @RALee85 You are right, Russia is expert at demilitarising their own forces. 
https://t.co/WJG4jdRqua"
1589425195961700353,Mon Nov 07 01:11:11 +0000 2022,"@Flash_news_ua russian people are complicit in russia's genocidal war against Ukranian people 

russian terrorists in Ukraine and russian terrorist regime are commiting grave crimes, crimes against humanity and war crimes in russian people's name"
1589425195433209856,Mon Nov 07 01:11:11 +0000 2022,"Armed Forces of Ukraine: Russian army is scared of #HIMARS🚀

HIMARS hit the Russians hard in Dnipro, Kherson Oblast, Donetsk Oblast, Luhansk Oblast. 

Be afraid, Russian Nazis. Leave Ukraine, go back to Russia. Say hi to Putin.😳😱😭😂 🤣#UkraineRussianWar #Vatnik #Kyiv #Kherson https://t.co/TttngiOZKG"
1589425192170029057,Mon Nov 07 01:11:10 +0000 2022,"@poroshenko Hey, buddy. Your time has passed, Your train has gone. There was no plans for you to be a president. You are dark horse and you are trying to keep afloat because you want to repeat 2014! Its not going to work, mate! People of Ukraine hate you 3% @poroshenko. Thats right, only 3%!"
1589425188969803776,Mon Nov 07 01:11:09 +0000 2022,@NahBabeeNah @andersoncooper If they would'nt send billions to Ukraine maybe they could do their jobs. As it is they should all be fired.
1589425185668861952,Mon Nov 07 01:11:09 +0000 2022,"Russian Offensive Campaign Assessment, November 6 https://t.co/1w8KxfZB84 #Ukraine #Analysis"
1589425170501971968,Mon Nov 07 01:11:05 +0000 2022,@Guelderrose02 @Seele_2022 @DefenceU Economically they tend to live in industrial areas and are employed as such especially as miners. Historically they have seen themselves as highly independent and have not identified with UKRAINE or efforts at Ukrainian nationalism. And since 2014 they chose not to be Ukrainians.
1589425162671493120,Mon Nov 07 01:11:03 +0000 2022,"Another video to make you smile from the same two guys that did the “I will always love you” slo-mo video
 #UkraineWar #RussianWarCrimes #russiaisateroriststate #UkraineUnderAttack #UkraineRussiaWar  #StandWithUkraine #RussianUkrainianWar #Ukraine #UkraineWillWin https://t.co/YKTlEUFBSq"
1589425159068209152,Mon Nov 07 01:11:02 +0000 2022,"@Isabulle24 @andrewmichta @comp4dev you do not understand. We are talking about the transfer of heavy weapons. art systems, tanks, planes, air defense. and first you need to learn how to handle it. and what heavy weapons was Canada preparing to transfer to Ukraine?"
1589425156182913025,Mon Nov 07 01:11:01 +0000 2022,"#Military #Summary &amp; Analysis, Nov. 6.
Situation in #Ukraine.

Azov Battalion pushes Ukra Soldiers to attack Russian troops North in Kherson Bridgehead.
Clashes along all Frontlines, no breakthroughs.
The Quiet before the Storm continues:

https://t.co/600cHLMPhE via @YouTube"
1589425151480762368,Mon Nov 07 01:11:00 +0000 2022,@ejmalrai There isn't anything to negotiate with that doesn't rightfully belong to Ukraine
1589425146502483970,Mon Nov 07 01:10:59 +0000 2022,"@poroshenko Hey, buddy. Your time has passed, Your train has gone. There was no plans for you to be a president. You are dark horse and you are trying to keep afloat because you want to repeat 2014! Its not going to work, mate! People of Ukraine hate you 3% @poroshenko. Thats right, only 3%!"
1589425145084809219,Mon Nov 07 01:10:59 +0000 2022,@CWynnykWilson @KyivIndependent Pretty sure this US administration is talking with Ukraine at the same time.
1589425136465502208,Mon Nov 07 01:10:57 +0000 2022,@JoeBiden Start funding America instead of Ukraine and the Pentagon and I’ll contemplate voting Blue you bloodthirsty Warhawk.
1589425130341826561,Mon Nov 07 01:10:55 +0000 2022,"ALIEN invaders. Biden just has to put me on the cover of magazines, next to Hussein, to stop this war in Ukraine. Hussein won't teach any colored children about the complexity of the atomic nucleus. Hussein will ONLY asks for their SERVICE to the ""color""!"
1589425121814798336,Mon Nov 07 01:10:53 +0000 2022,"@Rothmus The same Russian narrative was spread for a long time in Ukraine before the invasion, and then they came to kill us.  so when I see this in you, don't be surprised when a Russian missile flies into your city."
1589425121516609537,Mon Nov 07 01:10:53 +0000 2022,"@TheClassicLib1 @GiveEmHellHorns @Dmitry_US_UA @SamRamani2 Wy not all Ukraine and Latvia, Lithuania,  Poland? Russia is the most imperialistic country in the world. Enslaved native people of Asia. You are Russian stay in Moscow, live other nations alone!"
1589425120153858048,Mon Nov 07 01:10:53 +0000 2022,"@BBCNews Attack drones🛩️, these ""mosquito"" bomber aircraft have become practically ubiquitous and, apparently, are becoming an integral part of modern warfare. The🇺🇦79th Air Assault Brigade of the Armed Forces of Ukraine attacks enemy infantry and armored vehicles in the Donetsk direction https://t.co/CiR6rf1eYM"
1589425119218511873,Mon Nov 07 01:10:53 +0000 2022,"@AniaKoniec @oceanvandal1 @vcherazavtra I've heard this. I had a russian gf in Ukraine and she got along in some cities, but couldn't understand anyone in Lviv where the accent was more Ukrainian (her english was pretty good)"
1589425118996205571,Mon Nov 07 01:10:53 +0000 2022,@albertspahiu Except that the illegal annexation of Kosovo is used to justify the Ukraine war.
1589425117582721025,Mon Nov 07 01:10:52 +0000 2022,"@HubertHurkacz @atptour Congrats on a great season, @HubertHurkacz. Thx for all you do to help raise awareness for Russia’s unprovoked invasion of Ukraine. Poland rocks. 👏🏼"
1589425110158835713,Mon Nov 07 01:10:51 +0000 2022,"@JoeBiden So how much is Ukraine funneling back to you folks, I'm guessing most of it after they take their cuts! When you know, you know"
1589425103892537346,Mon Nov 07 01:10:49 +0000 2022,"@A_SHEKH0VTS0V So it sounds like the priest is planning for this war to last a while, if expects children born 9 months from now to be dying in the Ukraine war. They have already lost +70,000 soldiers."
1589425102600687618,Mon Nov 07 01:10:49 +0000 2022,@CWynnykWilson @KyivIndependent Bro Ukraine would not even exist without the backing if West what you talk about? West dont just throw money its not a charity for them they will take everything valuable from Ukraine at the end of the day
1589425098812891136,Mon Nov 07 01:10:48 +0000 2022,"@poroshenko Hey, buddy. Your time has passed, Your train has gone. There was no plans for you to be a president. You are dark horse and you are trying to keep afloat because you want to repeat 2014! Its not going to work, mate! People of Ukraine hate you 3% @poroshenko. Thats right, only 3%!"
1589425090856636418,Mon Nov 07 01:10:46 +0000 2022,"@Thom_Hartmann Putin liberate Crimea from Ukraine under Obama and donbas and a few regions under biden. Unless, you're saying trump is still the president you not making sense"
1589425082405097473,Mon Nov 07 01:10:44 +0000 2022,"@Tendar Yeah...us midterms says otherwise :/

Maybe Europe won't abandon ukraine"
1589425077346791427,Mon Nov 07 01:10:43 +0000 2022,"@boguslawawysoc1 @GiveEmHellHorns @Dmitry_US_UA @SamRamani2 We don't. I don't hate Ukrainian people. I am in the US currently, I work with a lot of Ukrainian refugees and I very much feel for them. They are not responsible for their government's failure.

We can call out Ukraine for supporting followers of Bandera..e.g the Azov battalion."
1589425071923564544,Mon Nov 07 01:10:41 +0000 2022,@mamaprogressive @osiris_neits Horrible. Zelensky on the orders of the US wants to do what Israel is doing to the Palestinians to the ethnic Russians living in Ukraine. Unlike the Palestinians Russia has the strength militarily to stop it. I guess we would’ve supported two ethnic cleansings.
1589425065174913024,Mon Nov 07 01:10:40 +0000 2022,@RandPaul @narutoline STOP the War in Ukraine !  Send in the peacemakers
1589425061567819776,Mon Nov 07 01:10:39 +0000 2022,"@valdemings Well, that's if Brandon doesn't declare war on Russia.  We DO have boots on the ground in Ukraine."
1589425055767072769,Mon Nov 07 01:10:38 +0000 2022,"Ukrainian forces destroy column of Russian 'Z' tanks in Donetsk
#Canada #Germany #UnitedStates #Kherson #Ukraine https://t.co/IfxSqpTnFd"
1589425051169918976,Mon Nov 07 01:10:36 +0000 2022,The “Battle of Stalingrad” is upon us in Ukraine https://t.co/3T12nE0UBC
1589425045557764096,Mon Nov 07 01:10:35 +0000 2022,"@poroshenko Hey, buddy. Your time has passed, Your train has gone. There was no plans for you to be a president. You are dark horse and you are trying to keep afloat because you want to repeat 2014! Its not going to work, mate! People of Ukraine hate you 3% @poroshenko. Thats right, only 3%!"
1589425045444886530,Mon Nov 07 01:10:35 +0000 2022,"Thread detailing some of how pushing back against Russian aggression, Ukraine makes things safer for the US all around the world. And the US gets massive security very affordably by helping Ukraine do this. https://t.co/L8Zzdy4l84"
1589425033193349120,Mon Nov 07 01:10:32 +0000 2022,"@theMRC Wait till they hear how unenthusiastic #Lula is about supporting #Ukraine. Not sure the ""Liberal celebrities"" will still be that happy with him."
1589425024955736064,Mon Nov 07 01:10:30 +0000 2022,"@CWynnykWilson @KyivIndependent But ""discussions"" aren't the same as ""negotiations"". I'm all for Ukraine being a party to any negotiations but discussions in which the US is warning Russia against using nukes, etc. don't need Ukraine at the table (if that's the discussions actually were)."
1589425012611887104,Mon Nov 07 01:10:27 +0000 2022,"I haven't heard any breathless reporting about Ukraine or Russian nukes in the last week.

I'm sure it's coincidental that there's an election on the 8th."
1589425010073997312,Mon Nov 07 01:10:27 +0000 2022,"@poroshenko @Ukrzaliznytsia Hey, buddy. Your time has passed, Your train has gone. There was no plans for you to be a president. You are dark horse and you are trying to keep afloat because you want to repeat 2014! Its not going to work, mate! People of Ukraine hate you 3% @poroshenko. Thats right, only 3%!"
1589425008455344130,Mon Nov 07 01:10:26 +0000 2022,"Video appears to show Ukrainian troops killing captured Russian soldiers
#Canada #Germany #UnitedStates #Kherson #Ukraine
https://t.co/a5dpHFO7fo"
1589425007582916608,Mon Nov 07 01:10:26 +0000 2022,"Good night ❤️  #thefallofputin  #Ukraine #getputin #evilputin  #Russia #thefallofrussia 
#FreedomOfRussia #Pahonia https://t.co/CzYajnWETV"
1589425003648675841,Mon Nov 07 01:10:25 +0000 2022,"@ZvikaKlein We've been saying since Maidan 2014 that this Nazi-Ukraine thing was a staggering reality. 
And being tagged as Putin propagandists as a result. 
Never mind.
Truth always comes to the fore."
1589424984606543875,Mon Nov 07 01:10:21 +0000 2022,"@CesrFlrs @KyivIndependent Nice try vatnik, but ya also thought Ukraine was going to great Russians with flowers! How’s that 3 day special military action going? Just like the Moscova! Sunk! 🇺🇦🇺🇸🇺🇦🇺🇸🇺🇦💪"
1589424976700280832,Mon Nov 07 01:10:19 +0000 2022,@AdinOfCrimea @Euan_MacDonald You are from Crimea and support Ukraine taking over?? Isn't most of the country ethnic Russian didn't Ukraine just cut off your water?  I'm confused.
1589424974875746304,Mon Nov 07 01:10:18 +0000 2022,"@poroshenko @netanyahu Hey, buddy. Your time has passed, Your train has gone. There was no plans for you to be a president. You are dark horse and you are trying to keep afloat because you want to repeat 2014! Its not going to work, mate! People of Ukraine hate you 3% @poroshenko. Thats right, only 3%!"
1589424969720602629,Mon Nov 07 01:10:17 +0000 2022,"👿 Russian 'priest' Mikhail Vasilyev, who recently said that if women in Russia gave birth more, it would be easier for them to send their sons to war, died in the war in Ukraine on Sunday.

#ukraine 🇺🇦

https://t.co/yZYgoOQmvl https://t.co/zZZyXOxX1g"
1589424967015403521,Mon Nov 07 01:10:16 +0000 2022,Analyst warns 100+ kamikaze drones in development around world. Alarm raised as Iran for first time admits sending UAVs to Russia. Ukraine’s president describes claim deliveries were “limited” as lies #Iran #UkraineWar #drones https://t.co/nwazIG5Qt5 https://t.co/kdhRIGylXZ
1589424956504670208,Mon Nov 07 01:10:14 +0000 2022,@thehill Biden will cause a nuclear holocausts in Ukraine if he keeps funding this war https://t.co/ajpkbBkfCV
1589424953304453121,Mon Nov 07 01:10:13 +0000 2022,@CWynnykWilson @KyivIndependent Ukraine doesn't need a seat at the table when the US is warning Putin not to bomb them.
1589424947012816896,Mon Nov 07 01:10:12 +0000 2022,Western air-defence systems help Ukraine shoot down more missiles | The Economist https://t.co/SeZzIWD4Fy
1589424936455909377,Mon Nov 07 01:10:09 +0000 2022,@kimHi99 @ray_bassman @BillyBaldwin Biden is partnered with REAL NAZI’s in Ukraine. Stop the lies
1589424935596097537,Mon Nov 07 01:10:09 +0000 2022,"#Ukraine will be FORCED to negotiate with #Russia because, according to the US, the West reached #UkraineFatigue.
#Zelensky could have negotiated with #Russia before he lost a single soldier, but the #Ukrainians paid the price for his treason.

https://t.co/Epd0xQWiDQ"
1589424930755842048,Mon Nov 07 01:10:08 +0000 2022,"@poroshenko @netanyahu Hey, buddy. Your time has passed, Your train has gone. There was no plans for you to be a president. You are dark horse and you are trying to keep afloat because you want to repeat 2014! Its not going to work, mate! People of Ukraine hate you 3% @poroshenko. Thats right, only 3%!"
1589424922719555588,Mon Nov 07 01:10:06 +0000 2022,@snow_cyclist @JayinKyiv He doesn't understand that the majority of republicans support Ukraine. He has this mistaken view that we somehow favor pootin.
1589424914825871360,Mon Nov 07 01:10:04 +0000 2022,@mommabraindoc @Jonatha29922335 @jacksonhinklle And why do the majority of Ukraine supporters have similar looking pfp? Kinda gives me bot vibs NGL https://t.co/sL1WhH763G
1589424912770699265,Mon Nov 07 01:10:03 +0000 2022,"@RpsAgainstTrump Sure, Reagan would have supported the Obama created government of Ukraine and pushed NATO right up and into Russian territory."
1589424907045462017,Mon Nov 07 01:10:02 +0000 2022,Putin's nukes for Ukraine. Discuss. Bonus round. Putin keeps nukes at 1% stock.
