id,created_at,full_text
1589434776913842177,Mon Nov 07 01:49:15 +0000 2022,"because China is peaking economically and strategically--so it will be tempted to use force to grab what it can, while it can. https://t.co/a14Ed2Nsgr"
1589434775323828224,Mon Nov 07 01:49:15 +0000 2022,Cruise ships desert China as Beijing reaffirms zero-Covid commitment https://t.co/uK0P0oa1f9
1589434759259852800,Mon Nov 07 01:49:11 +0000 2022,"China successfully sent a Zhongxing-19 satellite carried by Long March 3B into orbit from the Xichang Satellite Launch Center yesterday, according to China Satellite Communications. https://t.co/Vc0txBMioH"
1589434754448863232,Mon Nov 07 01:49:10 +0000 2022,China's Plan to Take Over the World https://t.co/9c9cGhzIuO
1589434754428186625,Mon Nov 07 01:49:10 +0000 2022,@JamesMelville It's a bad work.But Zero Covid in China is a great policy!
1589434749533450240,Mon Nov 07 01:49:09 +0000 2022,It's like having venmo and imessage in the same app. It's universally used in China so every shop accepts payments by generating a QR code and then the funds go direct from WeChat to the shop. It was extremely useful. It's ease of use made me buy little things more frequently.
1589434744722579457,Mon Nov 07 01:49:08 +0000 2022,"Imagine what DHT would do about China buying up
America, among myriad other problems Progressives have created, if he had 4 years without having to constantly shake off ankle biting PETs-Progressive Establishment Tools!?
Sanity would be restored to the world."
1589434736606339072,Mon Nov 07 01:49:06 +0000 2022,"🍞🥐🥖🥞🍯🍞🥐🥖🍎🍐🍊🥫🍳🥚🍋🍌🍉🥦🍎🍍🍑🍇🍓🍅🥕🌽🍳🥚🍲🍐🍳🥚🍤🥕Live news updates from May 16: Putin signals acceptance of Nordic Nato agreements, China economic activity slows on Covid lockdowns"
1589434734991609857,Mon Nov 07 01:49:05 +0000 2022,Apple warns of iPhone shipment delays because of China lockdowns https://t.co/CADYo82LlF
1589434734882717697,Mon Nov 07 01:49:05 +0000 2022,"China Stock Market May Test Resistance At 3,100 Points https://t.co/QCzrCae3GB #news #stocks #stockmarketnews"
1589434734836584449,Mon Nov 07 01:49:05 +0000 2022,"China's health authority recently called for the quick rectification of irregular COVID-19 control practices, such as extending quarantine periods and imposing prolonged lockdowns, and vowed to hold those responsible for such actions accountable. https://t.co/8r6PnGT8vY https://t.co/m6oGrM8Vja"
1589434733884493826,Mon Nov 07 01:49:05 +0000 2022,"So the US military is trying to start a war with China, as if the economy wasn't crumbling enough already https://t.co/gxLRsDuSyq"
1589434730986213377,Mon Nov 07 01:49:04 +0000 2022,"@POTUS Hopefully this time next year “Big Guy” will be on trial for treason for selling the US out to china ,"
1589434727647555584,Mon Nov 07 01:49:03 +0000 2022,Girl in China reasons with dad for more play time https://t.co/UBbulyQUTL via @FacebookWatch
1589434725755916288,Mon Nov 07 01:49:03 +0000 2022,"@iluminatibot Both Gates and China are driving up the price of farmland so regular people can't afford it. China owns a large share of hog and poultry industry.  Gates wants to turn farmland into nature preserves and get rid of livestock. Or experiment with ""sustainable"" farming practices."
1589434711876653056,Mon Nov 07 01:49:00 +0000 2022,"Oriental Skylark sings Good day from #China. My prayers for you all.

🌹🌹😎
#nature #travel #birds
#wildlife #love #peace 
#TwitterNatureCommunity https://t.co/1xLvVPNduo"
1589434702829871105,Mon Nov 07 01:48:58 +0000 2022,The side event on the theme of 'Digital Economy Helps Address Climate Change' was held at the China Corner of COP27 - #climate_change #climate #economy #china #side https://t.co/YurfPhlZif
1589434699805765632,Mon Nov 07 01:48:57 +0000 2022,@CrestonePeak Bet that took less than a minute. Glad some are still in business after Polis over reacted closing business for china flu
1589434698622980096,Mon Nov 07 01:48:57 +0000 2022,were melting on #china re-open ..YAWN... china markets were tanking .. but 5 min after opening they turn and burn higher...🐎 our futures are following..must be the #redtsunmi alerts going nuts...
1589434686220435456,Mon Nov 07 01:48:54 +0000 2022,"So getting a blue check mark means people must use their real full name. Lol, Get ready for that. They are making it easier for people to hunt you down in real life. 🤣🤦‍♂️🤡

They can already track our tweets now they want to know our real names. 

Sounds like China type of shit"
1589434679018803201,Mon Nov 07 01:48:52 +0000 2022,"@quanyi_li2 How much does a factory worker get when retired in China? 1000 rmb / 70 usd a month? Not enough to buy anything else then food. Healthcare is still unadorable, apart from the most basic needs."
1589434675537272832,Mon Nov 07 01:48:51 +0000 2022,@ZGregJennings @inthegreentrade Check out respective (china vs us) algorithms on tik tok.
1589434672316321793,Mon Nov 07 01:48:50 +0000 2022,"@RealAndyLeeShow @globeandmail Andy, the @TheHubCanada  has an awesome podcast on China and if you have not listened to it, I believe it may be worth your while to do it. I'll see if I can share it with you"
1589434667924869121,Mon Nov 07 01:48:49 +0000 2022,Why?   Just do what they do to us in China.  Tax the hell out of them and force them to get approvals for everything they want to do. https://t.co/6T3yEibZz7
1589434657267134466,Mon Nov 07 01:48:47 +0000 2022,"@SawyerMerritt @TSLAFanMtl @TeslaBoomerMama @elonmusk US customer is more independent thinking than china, I think that's why US PR team is not necessary."
1589434655669129216,Mon Nov 07 01:48:46 +0000 2022,@kylegrantham you  want  luxury you  pay  for  more this  is  not  new and  use  that  china  smartphone with  stupid american  finger and  research  when  articles  are  posted that  is  called free thinking
1589434651818733568,Mon Nov 07 01:48:45 +0000 2022,"@AshleyRindsberg Insane times. China’s gotten away with a mass genocide, crashed economies and what not. Of course not without some self styled medical Dr. Frankenstein who hasn’t been tried as yet."
1589434644541628416,Mon Nov 07 01:48:44 +0000 2022,"@polijunkie_aus @mikepompeo Thank you for sticking your neck out here when we Chinese Chinese are afraid to speak out.
https://t.co/vJLiO7kWHf"
1589434642633224192,Mon Nov 07 01:48:43 +0000 2022,"Hey, it’s not like there were ever any indications that single sourcing production in China might be an issue. https://t.co/iG7f1RvYe2"
1589434642590859264,Mon Nov 07 01:48:43 +0000 2022,@FrankAlvzh @elonmusk No American kids ruind the earth not elon musk china Russia africa india brazil other places but only new york and texas American kids ruined the earth nobody else some other places have people too and America still has real people but what is wrong with their heads?
1589434641442041857,Mon Nov 07 01:48:43 +0000 2022,"@JosephPolitano @bdquinn So we can get more immigrants to boost the supply chain and trade with other friendly countries to have various options other than china . 
People : not like that"
1589434635863617537,Mon Nov 07 01:48:42 +0000 2022,"#AmericaNeedsChineseREE  China's rare earth smelting industry has shown a unilateral rise, and even acquired one of the largest rare earth smelting companies in the United States. https://t.co/06DtgYautE"
1589434631841284096,Mon Nov 07 01:48:41 +0000 2022,@RuDauntless Xi will oppress his political rivals and hassle westerns factories in china. With his covid controls.
1589434624526413825,Mon Nov 07 01:48:39 +0000 2022,@BeecoInspire are they coming from China?
1589434621670068224,Mon Nov 07 01:48:38 +0000 2022,"11/6/2022 Miles Guo: Xi Jinping became a true dictator after the 20th Party Congress. However, the political rogues of Communist China whitewash it as “Political Openness and System Openness”! 
https://t.co/wZCWdYn2In"
1589434614103572481,Mon Nov 07 01:48:36 +0000 2022,@Swamy39 China can't be believed.
1589434610756513793,Mon Nov 07 01:48:36 +0000 2022,"#rollerblindmachine #pleatingmachine #curtain #rollerblind 
Accordion Folding Curtain Pleating Machine Click to quickly check key information of this product, and we recommend this for you:  https://t.co/sksWwOzbb8 via @madeinchina_b2b"
1589434609825378304,Mon Nov 07 01:48:35 +0000 2022,@SugarsGone @Breaking911 Agreed! That and he let China buy an absurd amount of land for labs! What's that all about! China shouldn't get to buy shit here anymore!
1589434576820064257,Mon Nov 07 01:48:28 +0000 2022,"@newsmax Mental incapacity, funneling money through Ukraine, cutting deals with Russia, China, Iran, and North Korea. Mostlyfor selling your own nation out to enemy states. You're a really bad person. No one fu**s with the Bidens right? You're about to find out we aren't scared of you."
1589434576715354112,Mon Nov 07 01:48:28 +0000 2022,"Investors ask what is plaguing Tencent as stock goes downhill since failing to reach US$1 trillion in market cap - South China Morning Post

⁦@SCMPNews⁩ ⁦@TencentGlobal⁩  https://t.co/LsefddLbzT"
1589434570713317376,Mon Nov 07 01:48:26 +0000 2022,费正清中国研究中心报告：The 20th Party Congress saw Xi Jinping extend control through his appointment to a 3rd term and the removal of Hu Jintao’s allies. Our updated infographic shows the new lineup for China’s central leadership: a short https://t.co/MgHcq4tLTQ
1589434566363996160,Mon Nov 07 01:48:25 +0000 2022,@StevenBeschloss Shut up. Let’s talk about joe bring in bed with China
1589434565139263488,Mon Nov 07 01:48:25 +0000 2022,"@WBrettWilson Like everything  else this jerk does, it's just another scam to steal our hard earned money. UK finished paying off WW2 debt in 2016! It will be 2200 before our kids pay off Trudeau debt! Unless we are New China by then!"
1589434549762940929,Mon Nov 07 01:48:21 +0000 2022,"Is it too soon to call Jeff Scott, a bull and a China shop?"
1589434544645885954,Mon Nov 07 01:48:20 +0000 2022,"In this edition of SILC Nodes from STL’s Sustainability Innovation &amp; Law Circle, #COP27 begins, what the outcomes of the CPC National Congress mean for ‘green development’ in China, &amp; the 1st #climatetech progress report: https://t.co/ETvMJa4qh3"
1589434525318533120,Mon Nov 07 01:48:15 +0000 2022,"@chineseciv @evenstevenmb @Rebecca3745091 So don't try to fool me as I've been to China. And another expat has been to Japan and China. He says Japanese are the ones who don't share their thoughts openly. But with the Chinese, their blunt straightforwardness is a whole new level in a good way.

https://t.co/nbmJ3AMaca"
1589434515822256128,Mon Nov 07 01:48:13 +0000 2022,@Lancegooden Trump increased the deficit by almost $8 Trillion. How much $ has Trump's tariffs on goods from China cost the average American?? 🧐
1589434506872000512,Mon Nov 07 01:48:11 +0000 2022,@davidhogg111 This my last tweet but I followed you because I liked your mission but please don’t tell me you think NATO isn’t the problem? It was started because the US needed to look stronger against China and Russia….how can you see anything good about NATO besides violence and destruction
1589434506855215104,Mon Nov 07 01:48:11 +0000 2022,"@humspot1 @LottoDogecoin @UrbinaE1 @POTUS Learn the economic difference between inflation and price increase ... Prices increased due to increased demand and decreased supply due to covid restrictions, descriptions etc. and china's pursuit of COVID zero policy"
1589434503856095232,Mon Nov 07 01:48:10 +0000 2022,"""Apple Could Be Short of iPhones Because of Factory Disruptions in China"" by BY TRIPP MICKLE via NYT https://t.co/CZDfA3MlyO https://t.co/DrLkxdYBOj"
1589434497686441984,Mon Nov 07 01:48:09 +0000 2022,"@stution12345 @Kalii10697663 @edwardrussl @ChrisPardal @POTUS BTW, I’m talking about the people of the US.  Enough is enough, they aren’t doing enough for their own people in this country.  They just sold off some oil reserves to China for God’s sake, instead of keeping for the people in the US suffering.  It’s bad policies over and over"
1589434476660412416,Mon Nov 07 01:48:04 +0000 2022,"China Aerospace Co branded Goose down jacket, fill power 800+, cleanliness 18cm+, honeycomb heat storage lining, can resist - 30°C degrees https://t.co/W0qcRKFZ1M"
1589434468703797248,Mon Nov 07 01:48:02 +0000 2022,$HSI wow doesnt give af about China lol
1589434466572767232,Mon Nov 07 01:48:01 +0000 2022,"Sad in America,as in Russia China Cuba Venezuela - Trump has been illegally impeached speaking the Truth - &amp; this November Election..Republicans will in fact begin the process to use Subpoenas to bring all these criminals to the Court Room.Think what these Rats did to Trump https://t.co/MpL1IPcChZ"
1589434463884554242,Mon Nov 07 01:48:01 +0000 2022,"@snipinamerican @lu12121212 Yeah, there's a whole lot of ground that America can make up on here without nearly reaching the level of exploitative that countries like China, Singapore, and the Gulf States are to these workers."
1589434463490289664,Mon Nov 07 01:48:01 +0000 2022,"#2022CIIE The fifth China International Import Expo (CIIE) officially opened at the National Exhibition and Convention Center (Shanghai) on Nov. 5th. Let's take a look at the wonderful exhibits displayed on the first day!
#AmazingChina #hianhui https://t.co/KR8vklfGcL"
1589434461825171456,Mon Nov 07 01:48:00 +0000 2022,"Higer Attends A Video Conference On November 1 and 2, Pakistani Prime Minister Shehbaz Sharif, led a team of high-level government official and paid a state visit to China. https://t.co/Hkq9tjPDaI"
1589434460319236102,Mon Nov 07 01:48:00 +0000 2022,A mushroom-growing area in China's Zhejiang has been formally recognized as Globally Important Agricultural Heritage System (GIAHS) by the FAO. https://t.co/CMVgxOye8C
1589434460222607360,Mon Nov 07 01:48:00 +0000 2022,"In pics: airshow in Doha, #Qatar. https://t.co/LCHFTToTS5"
1589434449602973698,Mon Nov 07 01:47:57 +0000 2022,"Xi is a threat to the peaceful world!
#China #XiJingping #HumanRights #Autocracy https://t.co/em91h2EZzX"
1589434433471672320,Mon Nov 07 01:47:53 +0000 2022,"@IPCC_CH Rich countries might loan disadvantaged countries the capital to decarbonize, the way China has loaned them capital to develop, putting everyone more firmly in financial and political debt 🔥🌏💸"
1589434433010274307,Mon Nov 07 01:47:53 +0000 2022,@No_More_China I can live with that. 🥰
1589434417390686208,Mon Nov 07 01:47:50 +0000 2022,"Here’s the link to our Apple story — they warned of shipment delays for the lucrative iPhone 14 Pro and Pro Max models. Some quick thoughts in a thread:

Apple warns of iPhone shipment delays because of China lockdowns https://t.co/knhuFzgPug"
1589434410721759232,Mon Nov 07 01:47:48 +0000 2022,"Audi manufacturing plants include: Germany, Hungary, Belgium, Mexico, Slovakia, Spain, Russia, Brazil, India, and China. See USA anywhere ? Canada ?"
1589434395059924992,Mon Nov 07 01:47:44 +0000 2022,@CCMbuilds @PolitiBunny @BillKristol Exactly. China gave him the code to hack the machines.  Again.
1589434382414016512,Mon Nov 07 01:47:41 +0000 2022,"@ANeonGreenCity Twitter's C-suite was simping for DHS, so there is also a non-zero chance that Uncle Sam throws a bunch of loot at Musk to restart that agreement.

I suspect, but can't prove, that DHS et al used Twitter the same way China uses Tiktok."
1589434377771311105,Mon Nov 07 01:47:40 +0000 2022,"@NyrZenovka @DrewPavlou It isn't happening now , and Australia said sorry( it means state accepted). I guess China will reach that level 1000 years later."
1589434364957724672,Mon Nov 07 01:47:37 +0000 2022,Apple warns Covid restrictions in China are hurting iPhone production  https://t.co/gZFqfgONQV
1589434364542087168,Mon Nov 07 01:47:37 +0000 2022,"@KamalaHarris Democracy is on the ballot EVERY SINGLE TIME! You have nothing original to say.   EVER! #Marxists like @TheDemocrats want to destroy the USA, as they did Cuba, Venezuela, North Korea, and China. #VoteRedToSaveAmerica https://t.co/9cbe6bEF8O"
1589434363456147456,Mon Nov 07 01:47:37 +0000 2022,"China firmly opposes Canada's disruptions of regular business cooperation between Chinese and Canadian companies on the pretext of national security, the Chinese Ministry of Commerce (MOC) said Sunday. https://t.co/14tbdTbpjB https://t.co/w5kEHDgFm4"
1589434363200311296,Mon Nov 07 01:47:37 +0000 2022,"Shortly after the successful convening of the 20th National Congress of the Communist Party of China (CPC), leaders of four countries visited Beijing within a week. https://t.co/3MOVp2wssh https://t.co/0vFXZS8Qbe"
1589434359446376448,Mon Nov 07 01:47:36 +0000 2022,Apple says iPhone output at China plant reduced due to Covid restrictions https://t.co/yMgkiy0pGI #Apple
1589434358855008256,Mon Nov 07 01:47:36 +0000 2022,@jimcramer Going long all ideas from those that claim they know what China is going to do at market Monday morning at the open.
1589434330215874560,Mon Nov 07 01:47:29 +0000 2022,"@w_terrence Atleast  we can all admit Biden loves America &amp; is trying to do right by us. None of that is true of Musk who is tied in with China,  Russia and other countries he has operations"
1589434324377796608,Mon Nov 07 01:47:27 +0000 2022,"What the 20th Party Congress Report Tells Us About China’s AI Ambitions.

https://t.co/NeqsRzZ4dI"
1589434321915416576,Mon Nov 07 01:47:27 +0000 2022,@kollackwalker @neiltyson I’m so down with that I’m in China!
1589434321420845057,Mon Nov 07 01:47:27 +0000 2022,@C10wnw0r1d @SawyerMerritt sure i can care less where the car is made in. since 90% of the stuff u use or were are made in china and u dont care about it...
1589434316349935616,Mon Nov 07 01:47:25 +0000 2022,"@LiarinChina @Mashimaro77 @daoistpoet They can go to UK too, fine with me. Nobody needs to die. Nor am I talking of THE PEOPLE of Taiwan, I'm talking of a small group of extremists who want to separate Taiwan from the rest of China"
1589434311463555081,Mon Nov 07 01:47:24 +0000 2022,Don't do business in China https://t.co/E08arBEBWL
1589434283487154176,Mon Nov 07 01:47:18 +0000 2022,"Western nations only love the #WorldCup when it's played in  Western country. 
Remember South Africa? China? Russia, Brazil Now Qatar.
There's always something they don't like."
1589434264327974914,Mon Nov 07 01:47:13 +0000 2022,"@TheeRougarou 2 The Qanon connection, the machine stuff, the Fox news connection.

I found relicts of a thread with extreme interesting connections:

It's still online. There is this random thread about China, but than you see it's part of a longer conversation. https://t.co/bSV8QmcIvr"
1589434255293091841,Mon Nov 07 01:47:11 +0000 2022,"Dems are good at two things, lying and cheating.. they suck at everything else.. Vote Red. They sold us out to China and China wants us dead."
1589434255222112256,Mon Nov 07 01:47:11 +0000 2022,"@jimcramer Because Xi is almost an uneducated communist, and He pretends he is a great leader. He wants free-covid China, and no one can say a word against it due to it makes him liar"
1589434255004033024,Mon Nov 07 01:47:11 +0000 2022,"Here’s a clue how… destroying our country. Corruption with Ukraine, China and Russia. Just check hunters lap top. And plenty more. https://t.co/3roASZkHI9"
1589434247903072256,Mon Nov 07 01:47:09 +0000 2022,"@hlysprtIV Considering I just learned the term ""hyperscat"" today...

I think its applicable to these protestors.  Not sure why they don't all hop a flight and make their way as a small invading force down to india or china and protest their carbon behaviors."
1589434238654615552,Mon Nov 07 01:47:07 +0000 2022,"BREAKING:  Australia, NZ dlrs on back foot as China reaffirms zero-COVID policy: Reuters"
1589434224846966785,Mon Nov 07 01:47:04 +0000 2022,@WhiteHouse Lol. China Joe doesn’t know how to tie his shoes…or change his diaper.
1589434222955356161,Mon Nov 07 01:47:03 +0000 2022,"@RpsAgainstTrump you mean like CLUELESS Herschel will just say/do what he's told by the GOP (AKA Trump CULT) tell him -- he's the ""too many trees"" &amp; the completely incomprehensible ""good US air/bad China air"" speech) guy when he's allowed off his chain. So just follow what we TELL you, PERIOD!"
1589434211072892929,Mon Nov 07 01:47:00 +0000 2022,@CollinSLKoh They are illegal. China should be forced to leave.
1589434203720282115,Mon Nov 07 01:46:59 +0000 2022,"@zicyd We are gooseneck factory in China, if have any question or request,do not hesitate to email us at lucyzen@163.com"
1589434198020030464,Mon Nov 07 01:46:57 +0000 2022,"Russia’s invasion of Ukraine revealed the fading power of America’s military deterrent, and a senior flag officer is now acknowledging the danger. https://t.co/llbFxGot8K"
1589434164641935360,Mon Nov 07 01:46:49 +0000 2022,"@JoeBiden Where is all the money from 100 Million barrels of oil you sold to China!
Our Strategic Reserves that our Real President Donald J Trump stored.. not The Biden.
All this Treason Criminal does is Lie and Steal!!!"
1589434154613354496,Mon Nov 07 01:46:47 +0000 2022,"@daoistpoet I am really happy for thoese people who fled India to China or US, they are having a good lives there now. 
Meanwhile, I am praying for this woman.

https://t.co/mFLksAxb2S"
1589434150666194944,Mon Nov 07 01:46:46 +0000 2022,@chenweihua @ianbremmer China created covid crisis and support to Russian war has a large part to it.
1589434131129470977,Mon Nov 07 01:46:41 +0000 2022,"@ClimateHuman The seas will rise one hundred of one percent in the next three hundreds years. What made the ice age go away....mammoth farts?...cmon man!
This is a de-industrialization attempt promoted by globalists and China. Total BS."
1589434128088588288,Mon Nov 07 01:46:41 +0000 2022,"@kimmie_c_ Is that Japan, Korea or China?"
1589434125693640705,Mon Nov 07 01:46:40 +0000 2022,"@DonMiami3 $AAPL Apple warns Covid restrictions in China are hurting iPhone production Good Fucking Luck FOMO
$XLF $C Citi Next Lehman Brothers Bear Sterns 
$CS Credit Suisse $DB All On The Verge Of Bankruptcy
$BAC $JPM $WFC $GS $MS $BX $BLK $PNC
$SPY $QQQ $SPX PUTS https://t.co/a4HjvwHQkH"
1589434124208570369,Mon Nov 07 01:46:40 +0000 2022,China shares fall sharply on concerns over Covid outbreak and Ukraine war
1589434108622491649,Mon Nov 07 01:46:36 +0000 2022,The collared crow (Corvus torquatus) is a member of the family Corvidae native to China and north of Vietnam. https://t.co/vxz2uOTOQ3
1589434098497781760,Mon Nov 07 01:46:33 +0000 2022,"@MeandI58526555 @CGMeifangZhang hi,brother you are right.But you should take off your cloth that make in china."
