id,created_at,full_text
1590019257039204352,Tue Nov 08 16:31:46 +0000 2022,"@SedLoquitur @lotsofmilk1 @Sputnik_Not About #Zelensky , I view him differently. He is a national leader of Ukraine when Ukraine is objectively weak and he is masterfully playing the role of David to Russia's Goliath. I respect the talent &amp; disciplined execution. I don't idolize him as a selfless global leader.
2/2"
1590019247639756801,Tue Nov 08 16:31:44 +0000 2022,"Zelensky is looking the fool he is. First he said there would be no talks if Russia held referendums, then their would be no talked if they annexed captured territories, then no talks unless Russia left Ukrainian territory, and now this… #Ukraine #Russia #Kherson #Donbass https://t.co/0oCJWe9Ujv"
1590019244691173376,Tue Nov 08 16:31:43 +0000 2022,"@amritabhinder NaMo is the only one who can stop Russia-Ukraine crisis/war...Said this way back on Feb 24....Nobody was even thinking on those lines in Feb!
Rest will be sidekicks...

https://t.co/tSE1fMGoDb"
1590019243898191872,Tue Nov 08 16:31:43 +0000 2022,Biden Agrees to Putin Summit Provided Russia Pulls Back From Ukraine Attack - WSJ https://t.co/S09RrsCA9R
1590019233001672706,Tue Nov 08 16:31:40 +0000 2022,"This time around, our newsletter focuses on stories from our colleagues and allies, covering Armenia, Kazakhstan, Russia, Tajikistan, Ukraine and Uzbekistan: https://t.co/SrRzsyv4lX"
1590019227762987008,Tue Nov 08 16:31:39 +0000 2022,@BrynnTannehill What they refuse to understand is that spending money to support Ukraine *IS NATIONAL DEFENSE*.
1590019223631560705,Tue Nov 08 16:31:38 +0000 2022,"@xjadewarrior @Promodkumar_ @KyivIndependent Peace=asking Ukraine to accept a dictator who engaged in war crimes against them. Asking that when they vote, it doesn't matter because Putin wins!"
1590019221399937024,Tue Nov 08 16:31:38 +0000 2022,"Ukraine’s president has suggested he’s open to peace talks with Russia, softening his earlier refusal to negotiate with Moscow while President Vladimir Putin is in power — while sticking to Kyiv’s demands. https://t.co/ie1olsP8jT"
1590019215796318209,Tue Nov 08 16:31:36 +0000 2022,"@AE_ua_ @rajraj_id @TarasChmut Well, to be honest, for a Finn, Ukraine is like embodiment of sisu. 💪 https://t.co/HKCyAAve6q"
1590019215104147457,Tue Nov 08 16:31:36 +0000 2022,"@junienotjune @anonymous_cloak @MSNBC All of the spending from the last year of Trump's term up until today, billions given to Ukraine. Where have you been?"
1590019207756152832,Tue Nov 08 16:31:34 +0000 2022,@McFaul BS Ukraine fascists banned all opposition parties
1590019203641540608,Tue Nov 08 16:31:33 +0000 2022,Ukraine Openly Rejects Reported White House Pressure to Negotiate https://t.co/X4lGRlaMRm #SocialMedia #News #BreakingNews
1590019200416116736,Tue Nov 08 16:31:33 +0000 2022,"@2020Berner @DaBoy2450 @KyleKulinski Billions for ukraine self defense against a fascist is good actually. The reason dems pander to right wing views on police, economy, healthcare is because old conservatives come out to vote, young progressives stay home. That needs to change"
1590019200130912259,Tue Nov 08 16:31:33 +0000 2022,Jaishankar-Lavrov talks dominated by Ukraine and economic ties https://t.co/XZ5bzYDyWt
1590019198763556865,Tue Nov 08 16:31:32 +0000 2022,"@kharchg @JakeStewartMN @KyivPost Indeed. Putin said during the annexation speech that there would be no negotiation on the annexed territories and Crimea.

Unless he is willing to compromise on the above, there is nothing of interest to Ukraine to negotiate."
1590019195692908545,Tue Nov 08 16:31:32 +0000 2022,"Ukraine's Zelensky Sets Conditions for 'Genuine' Peace Talks With Russia (Wall Street Journal)

https://t.co/uvC2mbWSha
https://t.co/7naOIZSiWA"
1590019186373558274,Tue Nov 08 16:31:29 +0000 2022,Ukraine War: Russian frontline soldiers 'shot for retreating' https://t.co/MA9RKbEeK2 via @YouTube
1590019181332029440,Tue Nov 08 16:31:28 +0000 2022,"@minna_alander Victory and defeat are compensible but inappropriate words. What Ukraine really wants is only parity: 2013 borders and war damages reparations. Return to civilization. 

Conquering Moscow could be a victory - but Ukraine never wanted it"
1590019166626795520,Tue Nov 08 16:31:25 +0000 2022,"@Arthur40215061 @SecDef @mblaszczak So far Ukraine has gotten tanks related to the T-55 and T-72 which they are most familiar with. Why no others could be logistics, training, not wanting Russia to grab any or get any experience shooting at them, or perhaps something else. Not getting any clear answers."
1590019162872901632,Tue Nov 08 16:31:24 +0000 2022,"@LalewiczAnna @NikaMelkozerova yes, there are many dark pages between Ukraine and Poland, going back all the way to the Polish Lithuanian commonwealth. I'm glad our two peoples moved on and choose to be brothers."
1590019158884093952,Tue Nov 08 16:31:23 +0000 2022,Sweden’s prime minister meets with his Turkish counterpart over a bid to join NATO. https://t.co/BJ9h5AoPUj
1590019153921835008,Tue Nov 08 16:31:22 +0000 2022,"@richsignorelli You forgot to finish your sentence “…from this fraudulent president and his corrupt administration.” There, I fixed it for you. #bidencrimefamily #Ukraine #moneylaundering #tiestochina #arrestjoebiden #pedojoe #whereshunter @HillaryClinton @SpeakerPelosi @BarackObama"
1590019151183360001,Tue Nov 08 16:31:21 +0000 2022,"@EmbassyofRussia @mfa_russia @PMSimferopol @RussiaUN @RusEmbUSA @RussianEmbassy @RusConsCapetown @SABCNews @insightfactor @EmbRusBotswana @RusEmbJakarta So Russian scum jas learned to print false news. If they want peace, stop the murderous attack on the Ukraine"
1590019150252244994,Tue Nov 08 16:31:21 +0000 2022,@AdeldMeyer @elonmusk And didn't Trump run into some issues with funding and Ukraine? Can't recall but that didn't embolden Putin at all. Couldn't have.
1590019148155060227,Tue Nov 08 16:31:20 +0000 2022,"@mgubrud The West pressing Ukraine to ceasefire escalates the risk of NW, because every country would want to get Nuclear Weapons seeing what happened to Ukraine. So the West must have Ukraine win to prevent nuclear war."
1590019147182010368,Tue Nov 08 16:31:20 +0000 2022,PM wearing more protective equipment on the gravel driveway than he did in an active war zone when he visited Ukraine. https://t.co/or5VWeo9dc
1590019144740614144,Tue Nov 08 16:31:19 +0000 2022,Ukraine frets about US midterms https://t.co/CklTQ9MrCj
1590019143776219136,Tue Nov 08 16:31:19 +0000 2022,"@olex_scherba @ohiostateneo Yes,catholicism is very hard to understand and to live. But you will understand if you realise that most of the help for Ukraine came from catholic Poland. The pope is not the judge, but sometime we all wish more direct speech."
1590019140609511424,Tue Nov 08 16:31:18 +0000 2022,"@nextDoorDom_GR @noe_enklere @Tinta19689015 @noclador Putin was a KGB agent, educated by marxism leninism culture imposed by Stalin, who killed millions of russians , ukrainians &amp; ethnic minorities. &amp; Putin want to restore a new russian empire.  Many of the world SOCIALISTS support Putin : ""the invasion of Ukraine is AntiNazi""."
1590019139405754368,Tue Nov 08 16:31:18 +0000 2022,Cabinet of Ministers of Ukraine Logo PNG Vector #logo #vector https://t.co/RbzNvTFF1R
1590019136327122945,Tue Nov 08 16:31:17 +0000 2022,"#UkraineRussianWar #Ukraine #Russia
Many important topics for Ukraine were discussed today with a member of the Cabinet of the President of the United States, the Permanent Representative of the United States to the United Nations Linda Thomas-Greenfield - @ZelenskyyUa https://t.co/dM6gOrHYKU"
1590019134472867840,Tue Nov 08 16:31:17 +0000 2022,"Elon needs a government handout this year + some special favors

burning bridges...

LA put a parking lot on the hole you left

Vegas needs theirs filled in too but someone parked a car down there for attention

+ Ukraine needs reliable internet
@elonmusk"
1590019132430241794,Tue Nov 08 16:31:16 +0000 2022,"it means there is one had hit it, whom could be the groups structure of Ukraine whom has the role being ordered to have revive the attcks without even knowing how and where to hit, that hit empty side of garden one beng waited to tke the picture for the hit as we talked that day"
1590019131113357312,Tue Nov 08 16:31:16 +0000 2022,Analysis: Putin's take on history may lay groundwork for war | AP News https://t.co/ofhmzNKRJi
1590019127351336961,Tue Nov 08 16:31:15 +0000 2022,@BBCNews I bet he wishes he stayed in the Ukraine 🙈
1590019124612435968,Tue Nov 08 16:31:15 +0000 2022,"@UelandJohn @sherimoh @BernieSanders People are so weak. Family friend lost theirs on a battlefield in Ukraine two days ago. You whine about millions in aid when Russians meddled and ruined enough lives already. For you in your safe, cozy chairs t's ok when it's far away, but it won't be forever."
1590019123467399168,Tue Nov 08 16:31:14 +0000 2022,"@Imhotep_22 @SKmacro @ZvikaKlein @AAhronheim @ZelenskyyUa @Jerusalem_Post @Ukraine @MFA_Ukraine Russian Fake Masters. 
Only Thing they can https://t.co/uiL74fLr26"
1590019104089726976,Tue Nov 08 16:31:10 +0000 2022,"@PhilaHowieRose @JohnFetterman Dog avi, dog + resist +Ukraine banner, tweeting some weird incomprehensible dog map picture.

How does it feel to be a boomer with nothing to live for but mainstream Democrat politics? I would end myself, not even kidding."
1590019100239368193,Tue Nov 08 16:31:09 +0000 2022,"@dim0kq I watch the videos and view the images you and others post showing the destruction in Ukraine, and I am continually perplexed, saddened and mad that it is all caused by the actions of one demented and homicidal man.  The US will continue to support Ukraine no matter what!"
1590019098096062465,Tue Nov 08 16:31:08 +0000 2022,@akafacehots @POTUS USA stands for freedom and democracy the day we stop funding Ukrainian people and anyone fighting for freedom is a day they both die. Ukraine deserves freedom and they didn't cause this Putin did blame him not Biden and all those funds were voted by house and Congress
1590019095327490048,Tue Nov 08 16:31:08 +0000 2022,"Berislav in Kherson region was shelled today, reports of deads and wounded.
#Ukraine https://t.co/duoTD0wViw"
1590019091406151680,Tue Nov 08 16:31:07 +0000 2022,"@Bluechiks1 Hey, fam. It was a pleasure being one of the listeners here 🙌 I would like to use this opportunity to promote our campaign. We are helping ukrainian children who lost everything due to war in Ukraine. You may donate any amount thru this link https://t.co/ZF1Gvd6xSM 🇺🇦"
1590019084703305729,Tue Nov 08 16:31:05 +0000 2022,"Whoever comes to power after Putin will blame him for the war in Ukraine, the loss of life, the embarrassment that Russia has felt as its army has performed well below expectations, for the reunification and strengthening of NATO which he has in fact caused."
1590019083084656640,Tue Nov 08 16:31:05 +0000 2022,"In fact, NATO and was even divided and might have been on the verge of breaking apart.  That is what he could have had.  Instead he invaded Ukraine.  Regardless of what happens in that war, one thing is certain."
1590019082673590273,Tue Nov 08 16:31:05 +0000 2022,"@U24_gov_ua @MarkHamill If Ukraine needs these things, I guess they need to pony up and start BUYING them."
1590019079213285377,Tue Nov 08 16:31:04 +0000 2022,How the war in #Ukraine is affecting the world. @RolandBerger #OEMIndustrySummit https://t.co/qjoc3YJubd
1590019076382130176,Tue Nov 08 16:31:03 +0000 2022,"Putin's evil and disastrous war on Ukraine is killing thousands of Russian conscripts. Russia, force this criminal out! ""‘We were completely exposed’: Russian conscripts say hundreds killed in attack | Russia | The Guardian"" https://t.co/EWy7wALucz"
1590019072741474304,Tue Nov 08 16:31:02 +0000 2022,"Ukraine says it never refused to negotiate with Russia, wants talks with Putin successor via @Reuters 

https://t.co/D3Wp5lZCYj 

#Ukraine #Russia #Belarus #war #NATO #EU #UK #US #UN #Diplomacy #sanctions #refugees #humanity #Defense #RegionalSecurity #Coalition #StandWithUkraine"
1590019063438536705,Tue Nov 08 16:31:00 +0000 2022,@ChrisMusson I bet they are not wearing white poppies in Ukraine
1590019063404986368,Tue Nov 08 16:31:00 +0000 2022,"@SkyNews Ukraine is doing its bit by reducing electricity usage all across the country, thanks to Russia.

Why is he pretending to be in his old office?"
1590019061609803776,Tue Nov 08 16:31:00 +0000 2022,"@scottnz411 Their election process isn't fair and if republicans gain control they will make it even less fair. 
On my bingo card is the withdrawal of any further aid to Ukraine. 
Though I suspect you think that's probably ok with you going by your dismissal of women's reproductive rights"
1590019053326041088,Tue Nov 08 16:30:58 +0000 2022,Russian missiles blitz cities across Ukraine with ‘hundreds’ of casualties as Putin orders full-scale invasion | The Sun https://t.co/hPcPASiR46
1590019050385551362,Tue Nov 08 16:30:57 +0000 2022,"This will be a disaster for Ukraine, but also a danger for all of us, since this would send a signal that the use of force allows you to achieve political goals to gain control over neighboring countries,”

said Stoltenberg."
1590019046405476357,Tue Nov 08 16:30:56 +0000 2022,"President @RTErdogan:

""In addition to our bilateral relations, we reviewed Türkiye-European Union relations and regional and global issues, particularly the Russia-Ukraine war."""
1590019045604352002,Tue Nov 08 16:30:56 +0000 2022,"@USAmbUN They never once, in eight years, visited the victims of azov and the Ukraine nazi military. They knew about it and wrote article about it, but didn’t do anything because they were funding them. https://t.co/kIw7uHZCnD"
1590019044190883840,Tue Nov 08 16:30:55 +0000 2022,@MrMacpherson That looks a very young Donald he grew up and proved himself right!they did and still do vote in their millions for him!we wouldn’t have Ukraine war or have suffered Afghanistan debacl if he had been president!
1590019036309770240,Tue Nov 08 16:30:54 +0000 2022,"We are currently in Warsaw at our FES Dialogue Eastern Europe seminar for Journalists in Exile. Many inspiring stories from #Ukraine, #Belarus, #Georgia and #Azerbaijan! https://t.co/8rrHYpizfB"
1590019034267148288,Tue Nov 08 16:30:53 +0000 2022,"#Hungary 1.7 million #Ukraine refugee receive, 30,000 stay harsh asylum stance. Forint &lt; 400/euro, anti-corrupt agency setup. Release condition $7.5 billion EU fund sequester, 15 law promise yr-end tick. Cenbank H1 $500 million loss, govt budget 5-yr reimburse. #EmergingMarkets"
1590019033503772673,Tue Nov 08 16:30:53 +0000 2022,@ZvikaKlein @ZelenskyyUa @Jerusalem_Post @Ukraine @MFA_Ukraine So you are an Analyst?
1590019030173507584,Tue Nov 08 16:30:52 +0000 2022,"@MichaelHeasle10 @HuntersArtWork @RonFancy @JamesLauder12 @sammk1964 @Godslightangel7 @ghost321 @alshadowdancer @tRick_the_only @najjar_richard @ShellyRKirchoff @CarIosLopez_ @LifeNyc2 @realZacharyKent @tallnblonde1 @2_drac @lostandlovinit @VinceGottalotta @MJB24681 @jbizzy6969 @izmks16 @NatForTrump2024 @MusubiBrand @BlakDragonClaw @HamRadioJoe @dogsdontliket @JamesCa45920153 @SiLvErKnIfEo3i1 @ShepsuTera @Vanessa76_1 @Rich2Al @nitros1954 @MatthewGlenn_ @4JOC1 @TheFlailer @imrednow @FredTho28943397 @ThereseOSulliv2 @jbirdthoughts @LibertyOfThe2nd @nedorton @CMcfunster @SuspendThis73 @SeptRose70 @LadyOfTheOcean1 He is the son of Biden who is also the president of Ukraine.. common my dear puppet, reply.. 🤡😂"
1590019027031986176,Tue Nov 08 16:30:51 +0000 2022,@big69foot69 @nytimes Biden is doing everything he can to help Ukraine pound the 💩 out of Russians and you think that’s soft.  What an i——t.
1590019026037936128,Tue Nov 08 16:30:51 +0000 2022,Can we enlist this guy's help to bring an end to the conflict in Ukraine?? https://t.co/IawGMYSsFb
1590019025882710016,Tue Nov 08 16:30:51 +0000 2022,@MabeRuth2 @silvalynin @JoohnChoe @briebriejoy @Cirincione @BadFaithPod You're ignoring the feelings of Ukrainians themselves by saying this https://t.co/MI8ZDOdOeL
1590019020551786496,Tue Nov 08 16:30:50 +0000 2022,"@ThinkPrague @JSAscension @ukrainetrain @briebriejoy @aaronjmate @BadFaithPod 2/ in the Maidan massacre of the protesters and the police,"" https://t.co/LJcQwAUV6u
See also, John Mearsheimer, eminent US professor of political science, ""Why the Ukraine Crisis is the West's Fault"", https://t.co/4AT052Vonw"
1590019014738481152,Tue Nov 08 16:30:48 +0000 2022,"@TaylorRMarshall USA, Stop arms deliveries to Ukraine, they only prolong the suffering of all involved"
1590019011458527241,Tue Nov 08 16:30:48 +0000 2022,"Military units and units of the Marine Corps Command of the Armed Forces of Ukraine, continue to the destroy the Russian invaders.

Glory to the heroes 🇺🇦 https://t.co/uNnnoVfQ98"
1590019000091959298,Tue Nov 08 16:30:45 +0000 2022,@MargoGontar Here's my great grandma photo from Ukraine... https://t.co/Miy1VRlnyK
1590018998997254147,Tue Nov 08 16:30:45 +0000 2022,"@ZvikaKlein @Shtirlitz53 @ZelenskyyUa @Jerusalem_Post @Ukraine @MFA_Ukraine No, you're just an opportunist; a grifter trying to make a buck out of every tragedy regardless of the people you hurt. It's even worse!
There are thousands of vermin like you on Twitter.
Your mother would be ashamed!"
1590018998472970242,Tue Nov 08 16:30:45 +0000 2022,"@NewVoiceUkraine No. Negotiations must start when the Russian retreat from ALL of Ukraine, &amp; I mean ALL."
1590018997420163072,Tue Nov 08 16:30:44 +0000 2022,"@KathyHo23759402 Who was it helping Russia take Ukraine by stopping $100 m in aid but the tyrant trump when he was president after all he had to do something like take secret papers or stop aid to a country Putin wanted, bought and sold by Putin that’s trump"
1590018996497444864,Tue Nov 08 16:30:44 +0000 2022,from #Toronto to #Ukraine https://t.co/ZNtSSZAn85
1590018991120343040,Tue Nov 08 16:30:43 +0000 2022,"@SenTedCruz If Republicans win majority, Cruz also promises that they will solve without delay the global supply chain problems caused by the pandemic and the Ukraine war. Moreover, Cruz wants voters to know Trump had no role in causing the Afghanistan collapse!"
1590018988888801280,Tue Nov 08 16:30:42 +0000 2022,"13K+ pieces of footage from #Ukraine have been captured by the @eyewitnessorg app, developed by @IBAnews &amp; @LexisNexis, which could help prosecute Putin and other Russian political or military leaders at the international criminal court. Learn more: https://t.co/eqZD2XEEC4"
1590018971566473216,Tue Nov 08 16:30:38 +0000 2022,"Meanwhile, shifting ideologies in the GOP make the potential for Republican governance a bit more interesting. @RepMTG and @mattgaetz are demanding investigations into the administrative state and a stop to funding to Ukraine. 

They also have the biggest mics in the House. https://t.co/ZQLtgYfrR7"
1590018968332685313,Tue Nov 08 16:30:37 +0000 2022,"A month after Ukrainian troops liberated this picturesque village in Ukraine’s southern Kherson region, the once close-knit community of Shevchenkivka remains cleaved in two over allegations that some residents collaborated with the Russians. https://t.co/BxnPSK45nK"
1590018965090185216,Tue Nov 08 16:30:37 +0000 2022,"@Schnilos69 @MFA_Ukraine @ZelenskyyUa Not true. Was that happening before 2014? No, any violence in the region was a result of russia's invasion. Also if NATO is a threat, why isn't it attacking russian territory? Doesn't annexation get russia closer to NATO? Aren't there NATO countries already bordering russia?"
1590018956659937280,Tue Nov 08 16:30:35 +0000 2022,@LoriAldenHoluta @yoyoel Now do tens or hundreds of thousands dead in Ukraine and Afghani boys and girls being raped by Islamic extremists.
1590018951341568000,Tue Nov 08 16:30:33 +0000 2022,@RobertC43556505 @XVirtualBoyX @mac__steele @briebriejoy So do you only support Ukraine because this time it’s your people - the Nazis? Your right to be a nazi. Or are you simply unaware of what Ukraine is about?
1590018950804668417,Tue Nov 08 16:30:33 +0000 2022,"@FoxNews So much delusion on the Left.  What you delivered was a destroyed economy, Afghanistan back in the Taliban's hands, Ukraine invaded, and because you weaponized and overexaggerated the ""pandemic"", small businesses destroyed by unnecessary shutdowns and mandates."
1590018947574771712,Tue Nov 08 16:30:32 +0000 2022,@washingtonpost Has it been validated by what has happened in Zaporizhzhia and other sites in Ukraine? hardly.
1590018944852979712,Tue Nov 08 16:30:32 +0000 2022,Exactly and well described 👇🏻Did NATO provoke the invasion of Ukraine? | Fiona Hill and Lex Fridman https://t.co/XqE9OFPqT8 via @YouTube https://t.co/5B59gETBoU
1590018943108153344,Tue Nov 08 16:30:31 +0000 2022,"When we retake Congress, Ukraine aid stops."
1590018940125974530,Tue Nov 08 16:30:31 +0000 2022,"Ukraine war: US confirms 'communications' with Kremlin

https://t.co/zfQ5qnFMuZ"
1590018936875384834,Tue Nov 08 16:30:30 +0000 2022,"@2Russophobic4u And these people says Ukraine is corrupted. Lol, Miami FL gives diploma to every idiot with money, or whatever she paid for it."
1590018934396563457,Tue Nov 08 16:30:29 +0000 2022,"@ashsoles @PeterZeihan The point is, no one believed that Ukraine could manage that war so well.
And no one believed that a country of Russian size, that is knowing for selling military hardware to everyone that praise a military culture is such a huge shit show when it comes to a fight."
1590018931045326849,Tue Nov 08 16:30:28 +0000 2022,@Longtstanding 🇩🇪 stands with Ukraine!
1590018917740974080,Tue Nov 08 16:30:25 +0000 2022,"""China has been weakened by Russia's invasion of #Ukraine. Europe's experience over the past year makes it more suspicious of the authoritarian government in #Beijing"" 

Latest #geopolitical update from @marcmakingsense breaks it down as the US votes today
https://t.co/60YSnFwRXA"
1590018914301493248,Tue Nov 08 16:30:24 +0000 2022,"“The sense of sheer terror I felt at the beginning of the invasion has gone. It has been replaced by anger and a desire to persevere.” | A Ukraine Diary 🇺🇦
https://t.co/1wJoF5Dr6x"
1590018912972075010,Tue Nov 08 16:30:24 +0000 2022,"Amid intense backlash, progressive lawmakers retract letter pressing Biden to talk with Russia about Ukraine https://t.co/xjrLVN2EM4 https://t.co/gkNzOp0wAg"
1590018912250630144,Tue Nov 08 16:30:24 +0000 2022,"@Biz_Ukraine_Mag What's Putin's real excuse? As every dictator plundering his own people, he has created internal &amp; external enemies whilst playing on nationalism. This ancient trick to fender off internal opposition almost always works, rallying people behind their REAL enemy. Unbelievable!"
1590018911168143360,Tue Nov 08 16:30:24 +0000 2022,"📰 via @WSJ: 
Ukraine said it has evidence of Iranian instructors training Russians to operate drones used to hit civilian targets across the country in attacks so damaging that the capital’s mayor urged residents to consider temporarily leaving the city.
https://t.co/qiIoc5znLx"
1590018910937845762,Tue Nov 08 16:30:24 +0000 2022,"An illustration called ""#PersonalPope"", has become increasingly popular on the Internet, which compares the good relations of the #Pope (#PiusXII) with #Hitler and the Pope (#Francis) with #Putin.

#RussiaUkraineWar #RussianMobilization #Ukraine #Ukrayna #StopRussiaNow https://t.co/XOkS2w42rU"
1590018909326884865,Tue Nov 08 16:30:23 +0000 2022,@jilevin Like the man who started an un congressional war in Ukraine?
1590018904054988800,Tue Nov 08 16:30:22 +0000 2022,"I am not American, but those of you who are #VoteBlueToday . What U.S. does concerns also us in Europe, especially those in #Ukraine."
1590018901303513091,Tue Nov 08 16:30:21 +0000 2022,"Since the beginning of the full-scale Russian war, Ukraine is aware of the death of almost 8 thousand civilians, including 430 children. Around one million of Ukrainians stays in occupation, ~15% of Ukrainian territory is still occupied by russia"
1590018895552954369,Tue Nov 08 16:30:20 +0000 2022,Ukraine war latest: Ukraine braces for more power blackouts – as Zelenskyy warns of fresh Russian attacks on energy infrastructure | World News | Sky News https://t.co/eiRZI3yJqp
1590018890821931008,Tue Nov 08 16:30:19 +0000 2022,"@Colchesterviews In no other situation outside, perhaps, the Ukraine conflict zone would you see a fully functioning adult try to mow down a child. A sad reflection on British society."
1590018887730372608,Tue Nov 08 16:30:18 +0000 2022,"@Aristotles23 @YouTube Hungary not interested in any cash donations to bail Ukraine out  .    Those who called the tune ,can pay the piper ."
1590018884647911428,Tue Nov 08 16:30:17 +0000 2022,@USAmbUN All of this is American involvement in 2004 coup in Ukraine that led to 8 years of war and refusing to broker a deal between Ukraine on Russia about NATO's expansion and Nazi in Ukraine. You make a mess and pretend to comfort? Total foreign policy disaster.
1590018873339695106,Tue Nov 08 16:30:15 +0000 2022,"i will make you see how we can know this issue, ukraine recived information that the plant being hit, directly bec shallow leding will accuse russia, but russia inside and wont hit themselves in this case"
