id,created_at,full_text
1590862097491308545,Fri Nov 11 00:20:55 +0000 2022,"@Halsrethink Isn't it just to adapt or die?
Germany was dependent on cheap, reliable energy. That's gone. 
Germany is an engineering powerhouse, China badly needs those solutions, same as buying dutch high-tech indoor food production. 
Will the US buy a 1000s km high speed rail? Chemicals? 🤷"
1590862088448012289,Fri Nov 11 00:20:53 +0000 2022,@DanRather China and the Saudis are definitely getting their money's worth.
1590862067359440896,Fri Nov 11 00:20:48 +0000 2022,"@Angry_Juli @POTUS Angry, Biden (AKA: The Big Guy) has already prospered through China payments! So, your wish for his prosperity through China payments has already been fulfilled! Biden also destroyed our energy independence making the US much weaker!"
1590862060749197312,Fri Nov 11 00:20:46 +0000 2022,@jamesmc65143284 @foxnewspolitics Why??  China does business here all the time!
1590862055212736512,Fri Nov 11 00:20:45 +0000 2022,The COVID situation in China is worse than we’ve seen in 6 months - I expect oil prices will fall further this winter unless COVID zero ends
1590862053555769346,Fri Nov 11 00:20:45 +0000 2022,@KingJames Don’t matter about China though
1590862048363425793,Fri Nov 11 00:20:43 +0000 2022,@ClownWorld_ TicTok educating again so obviously from inside China 🥴
1590862045985247233,Fri Nov 11 00:20:43 +0000 2022,@Fiskorama You're pro-Taiwan. That's all I need to know about you - enjoy your block and don't cry when China comes a knockin' 😎
1590862043821010944,Fri Nov 11 00:20:42 +0000 2022,"#RYDEIMAGING #VIDEO #MICROENCODING
#APPLE #UNITEDSTATES #JAPAN #AUSTRALIA #MEXICO #RUSSIA #CANADA #ISRAEL #CHINA #TAIWAN #UKRAINE #SWITZERLAND #NORTHKOREA #SOUTKOREA #SAUDIARABIA #EUROPE #INDIA
CLICK ON NEW ZERO TIME MICROENCODED IMAGE 👇
https://t.co/NuZR36dY28"
1590862029283545089,Fri Nov 11 00:20:39 +0000 2022,"🛢#Oil drops for fourth day on China demand concerns

▪️Brent crude was down 27 cents, or 0.3%, to $92.38 a barrel at 0903 GMT. U.S. West Texas Intermediate (#WTI) crude was down 33 cents, or 0.4%, at $85.50.

#oilprice #Trader #Commodities #news #tradingnews #marketnews"
1590862015354273793,Fri Nov 11 00:20:35 +0000 2022,@tinpinho @DavidGiglioCA @POTUS Ok china made a virus that got accidentally released through a lab leak since the original virus had glycoproteins from both bats and pangolins and there was a lab doing gain of function research in Wuhan https://t.co/oZO9kQsEAp
1590862008630808577,Fri Nov 11 00:20:34 +0000 2022,Asia's Richest Man Challenges China in Show of Support for Modi https://t.co/AoCsQQC1dC
1590862006823047174,Fri Nov 11 00:20:33 +0000 2022,China’s Singles’ Day shopping festival fuels smartphone price war as major vendors seek to stimulate demand in weak market https://t.co/wd3yZ9Mf6J
1590862006525263872,Fri Nov 11 00:20:33 +0000 2022,Asia's Richest Man Challenges China in Show of Support for Modi https://t.co/qSI1yreb96
1590862003262099456,Fri Nov 11 00:20:33 +0000 2022,'Value Annihilation' Haunts Investors in China Property Bonds https://t.co/Rk3W5U6t0O
1590862001152327680,Fri Nov 11 00:20:32 +0000 2022,'Value Annihilation' Haunts Investors in China Property Bonds https://t.co/GRtTdRRfg5
1590861995737493505,Fri Nov 11 00:20:31 +0000 2022,"China believes “they have a very narrow window to make a move on Taiwan,” Ambassador and former NSC adviser @robertcobrien says, calling the potential attack one of the biggest currently national security threats. https://t.co/cyReKAwFIV"
1590861993090908160,Fri Nov 11 00:20:30 +0000 2022,"@Shokio_YT Phuck Europe, come to China bro! 🇨🇳"
1590861976628269056,Fri Nov 11 00:20:26 +0000 2022,"ii.""one China from all over the world, and it is time to deal with the vague policy‼️How did it change?⁉️Xi and the Communist Party of China have failed both offensive and defensive in ultra-restricted warfare, so they let the opponent ""subdue the enemy without fighting""🤪 ↓ https://t.co/Jwy3Mq90vj"
1590861975042822145,Fri Nov 11 00:20:26 +0000 2022,"“The defense of human rights by liberal-minded lawyers, the insistence that the government must respect the rights of their clients ... has now become an activity that is seen as politically subversive in Hong Kong.""  https://t.co/tnW089IhEl"
1590861940925992960,Fri Nov 11 00:20:18 +0000 2022,"Who is FBI’s Mike Dzielak? How the Hunter Biden laptop saw the light of day – World Tribune: U.S. Politics and Culture, Geopolitics, East Asia Intelligence, China, Geostrategy, Military, National security, Corporate Watch, Media Watch, North Korea, Iran https://t.co/PWTvqRZNh3"
1590861938590117888,Fri Nov 11 00:20:17 +0000 2022,"@MrBeast Love your videos , you should consider making videos in hk/china, just people talking about your videos got millions of views"
1590861922240704512,Fri Nov 11 00:20:13 +0000 2022,"A media outlet in Europe reported that Aleksandar ""Saša"" Đorđević, who was recently a candidate to take charge of Real Madrid, is set to become the new head coach of China men's basketball team. No Chinese media outlet has verified or refuted this report yet. https://t.co/8MlWjdBpVv"
1590861906465935360,Fri Nov 11 00:20:09 +0000 2022,"Watch ""The horrors of China &amp; Iran remind Democracies we've got it good 🧧"" on YouTube https://t.co/cYHT71qEOh"
1590861882784899072,Fri Nov 11 00:20:04 +0000 2022,What a joke China meddled in our elections and got @JustinTrudeau elected I hope @PierrePoilievre speaks out more about this #TrudeauForTreason https://t.co/K4tvE8ieZl
1590861875813617664,Fri Nov 11 00:20:02 +0000 2022,"🚻  Much of global $wealth is concentrated in the biggest economies, with households in #China and the #USA combining to make up half of all personal wealth in the world. 
This infographic from Visual Capitalist  Capitalist shows data from Credit Suisse’s…https://t.co/GNZ2sKecUR"
1590861875340013568,Fri Nov 11 00:20:02 +0000 2022,"Rubio &amp; Gallagher: “TikTok offers the CCP a unique ability to monitor over 1 billion users worldwide, including nearly 2⁄3 of American teens. We must ban this potential spyware before it is too late — not encourage its use in the U.S., as Biden is doing.”
https://t.co/J7mCEJnYVo"
1590861872215261184,Fri Nov 11 00:20:01 +0000 2022,"@long_dlong722 @DemocraticDaisy @maggieNYT @grantstern There was no energy independence, &amp;  “cleanest” energy? 
Iran injured our troops &amp; he downplayed it. Putin walked all over his puppet, he gave NK what they wanted &amp; got nothing in return, &amp; his trade deal w/ China failed. Not the best economy, &amp; unemployment is lower now. Plus… https://t.co/0nGGoqVmcI"
1590861867073011718,Fri Nov 11 00:20:00 +0000 2022,"President Joe #Biden is extending a Trump-era national emergency this week, which prohibits U.S. companies or individuals from investing in companies linked to #China’s #military. 
https://t.co/qH7qMurMIM"
1590861866976555014,Fri Nov 11 00:20:00 +0000 2022,"@DonghuapLol China isn't stick in the same death trap that Russia is. It'll go through tough times, yes. Exceedingly tough ones at that. But it can come out on top without resorting to drastic action. I think the Chinese leadership is reasonable enough not to go through with an invasion"
1590861853277958145,Fri Nov 11 00:19:57 +0000 2022,@tize4PF America is the future. Not India or China.
1590861826958692352,Fri Nov 11 00:19:50 +0000 2022,Clearance Sale Colorful chalcedony with low price manufacturer from China - LINK JD GEMS https://t.co/n172fqk664
1590861822504349696,Fri Nov 11 00:19:49 +0000 2022,"China just announced to reduce tariffs for 98% of goods from 10 African LDC to 0% starting next month. This means they can export agricultural goods free of tariffs, benefiting local farmers and Chinese consumers. EU should do this, instead of complicated schemes over 25 years. https://t.co/inPAIrNIns"
1590861801792892928,Fri Nov 11 00:19:44 +0000 2022,"@1fr33dom @VeBo1991 Wish more people were aware of these insidious investment companies. Blackrock, Blackstone, and Vanguard have assets over $10 trillion, greater than the GDP of every country except the US and China. They leverage that wealth to bully other companies and control vital assets."
1590861796369629184,Fri Nov 11 00:19:43 +0000 2022,"@TheLastRefuge2 hey hold up, Air China delivery of ""paper products"" hasn't even arrived yet"
1590861790618845184,Fri Nov 11 00:19:42 +0000 2022,"@NneMikkelsen @windowkitten @SGMWorldnews @Random_Chikel https://t.co/ANg7nTr7EI
Africa benefits from it in the long term, and China gets a future busniess partner. It’s a win win."
1590861790124322816,Fri Nov 11 00:19:42 +0000 2022,"@TeslaSg Not till this goes away
https://t.co/l0NR5eY93x"
1590861766581706752,Fri Nov 11 00:19:36 +0000 2022,@ScottAdamsSays I think the fentanyl is China's way to attack us for Pelosi visiting Taiwan.
1590861747753451521,Fri Nov 11 00:19:32 +0000 2022,"@desertdave2012 That seems unlikely, because China weakened its growth significantly. Maybe the one or other propagandist declares to a welcome side-effekt of their grandiose Covid strategy, but I don't think that was or is really a motive. Their motive was and is Dummstolz --&gt; stupid pride. -&gt;"
1590861735208321024,Fri Nov 11 00:19:29 +0000 2022,"@TheProblem @steve_hanke @ApplePodcasts The thing nobody says out loud is the Fed is private!
The treasury borrows from Fed to print money.
This is interest owed to tax payers.
Currently it's 900 billion a year to private Fed in interest.
China has a state run bank, they don't do that.
Smart"
1590861723602677760,Fri Nov 11 00:19:26 +0000 2022,"@WhiteHouse So if everyone buys a electric car from China the debt can be paid, looks like this is part of BIDEN plan https://t.co/apjzcMjWg6"
1590861708712714240,Fri Nov 11 00:19:22 +0000 2022,"Biden and Xi will meet next week in Indonesia, US confirms
“PEACE/World Already Hanging By A Thread, Both China/United States Better Start Acting Like It, Taiwan/ Small Issue, When Both China/United States Cooperation Can Change The World, For The Better.” https://t.co/QE1n32aZCW"
1590861701444145152,Fri Nov 11 00:19:21 +0000 2022,@QTRResearch You are so twisted when it comes to China bro. Ever got dumped by a Chinese girl? Can’t think of other reasons tbh
1590861699674177536,Fri Nov 11 00:19:20 +0000 2022,"@IsmeWaldo @BrianKarem But you’re totes ok with the China &gt; Hunter &gt; POTUS business dealings, amirite?"
1590861690308009984,Fri Nov 11 00:19:18 +0000 2022,"China’s top climate negotiator used the U.N.’s ongoing climate conference to spread Chinese Communist Party propaganda about Taiwan. | @james_t_quinn  

https://t.co/MtEnEol8HV"
1590861685442895872,Fri Nov 11 00:19:17 +0000 2022,China Media Group (CMG) to put high-tech at forefront of Qatar World Cup coverage https://t.co/UEhCAdcFEt
1590861672062722048,Fri Nov 11 00:19:14 +0000 2022,"TikTok, time’s up. The app should be banned in America. https://t.co/GdlYXdA0Tu"
1590861670884466694,Fri Nov 11 00:19:13 +0000 2022,"At the end of the Ming Dynasty, jadeite was brought into China from Burma by the horse gang. It has been favored by the nobility, and good jadeite is still in short supply
 #翡翠运动"
1590861657823412224,Fri Nov 11 00:19:10 +0000 2022,@BrianKarem Why didn't you ask weather he's compromised by Ukraine??? or CHINA 🇨🇳??? I KNOW WHY!! Your dady GEORGE SOROS wouldn't pay your bonus 😉!! Clown
1590861655654952960,Fri Nov 11 00:19:10 +0000 2022,China Just Won the Space Race Against America...NASA is in Shock! https://t.co/dGxkikCZyx via @YouTube
1590861641159163906,Fri Nov 11 00:19:06 +0000 2022,#NowPlaying The Doobie Brothers - China Grove - 2006 Remaster https://t.co/NkXkU9OTol
1590861631919394817,Fri Nov 11 00:19:04 +0000 2022,Has Trade with China Really Cost the U.S. Jobs? https://t.co/HL8SXRE23W #Trade #Governmentpolicyandregulation #Internationalbusiness https://t.co/EbvowH1ZFE
1590861629927067650,Fri Nov 11 00:19:04 +0000 2022,"@RFA_Chinese The scene of Hu Jintao's exit at the CCP convention. The reaction of the Japanese media and intellectuals is mostly as described in this tweet.
#RFA #China #CCP"
1590861624608690178,Fri Nov 11 00:19:02 +0000 2022,"@BarryAndrewsMEP Thank you #Ireland, a small country on the map but bigger than Russia &amp; China combined in reality"
1590861622645764096,Fri Nov 11 00:19:02 +0000 2022,"@AmyLynnStL Democrat are PATHETIC..and got you BAMBOOZLED..and the rest of Democrat who voted,Democrat and want to turn this country into another Venezuela, Cuba,China, or Russia..PATHETIC"
1590861620162412544,Fri Nov 11 00:19:01 +0000 2022,@DanAlbas Harper signed the FIPA deal with China. Don’t pretend you don’t know all about that! You are deliberately spreading misinformation. FIPA gives China ridiculous control in certain areas in Canada. Place blame where it belongs.
1590861619571347457,Fri Nov 11 00:19:01 +0000 2022,China’s Harsh Covid Curbs and an Economic Slump Have Erased Hundreds of Billionaires https://t.co/scKdxdSAVb
1590861618896072704,Fri Nov 11 00:19:01 +0000 2022,@realQuackAlert @actor_Nikhil @elonmusk But companies can have VOIP with blocks of DID's which are individual phone numbers.  When signing up using a phone number Twitter wouldn't know it's a DID number which is used by say a China company to send out BOTs on Twitter or Facebook right?
1590861603423256576,Fri Nov 11 00:18:57 +0000 2022,China Factory Muticolor fancy chalcedony abacus spacer loose beads with good price - LINK JD GEMS https://t.co/6XPD9eRdnA
1590861594464223235,Fri Nov 11 00:18:55 +0000 2022,"@alexbruesewitz Desantis should not go with the rhino party, Ian sure he understands they are left wing people who go the liberal agenda because they to want a piece of the China pie . At least he needs to know that us conservative s know this real well ."
1590861592279011328,Fri Nov 11 00:18:55 +0000 2022,"50 Years ago, Gough was Labor's-Australia's saviour re China. https://t.co/quFljtt8R8 Can PM Albanese do same next week when he meets Xi Jinping? https://t.co/quFljtt8R8 https://t.co/FcpsDY2PtH"
1590861578198736897,Fri Nov 11 00:18:51 +0000 2022,Alert: Xi Jinping tells China’s army to focus on preparation for war  https://t.co/DwznY7Sv4v
1590861571332329472,Fri Nov 11 00:18:50 +0000 2022,"@Mick__Mel @Isawhitney2 @DoctaShed @LuckyHeronSay @JustStop_Oil I don't live in China. I live here, in the UK. I understand the confusion, but those are two separate countries.
I don't like at infant mortality in the UK and say ""No need to do better, Namibia is doing worse"""
1590861570611245056,Fri Nov 11 00:18:49 +0000 2022,@Bharatiya_4 @homekong0701 @MaitreyaBhakal @SidtheCat_ Bhai I really hope this dialog happens. I hope the border disputes can be figured out. I hope that Xi and Modi can see eye to eye. A relationship of India and China will be like no other. Both nations of 1+ BILLION people.  But my major concern is situation of Indian Muslims
1590861568233082881,Fri Nov 11 00:18:49 +0000 2022,@drajm TikTok is run out of China (ByteDance)
1590861564378484736,Fri Nov 11 00:18:48 +0000 2022,"@Chicago1412 @katiehobbs “Our election system is safe” — machines don’t work, printers outta ink, “transporting votes to another location”, boarding up windows to stop election monitors, CEO of Konnech arrested for sharing voter data with China - but yeah! Safe as fuck! 😂😂😂🤡🤡🤡🤡"
1590861558225465344,Fri Nov 11 00:18:46 +0000 2022,"@Kengog @NannieAnnie1960 @RealDeniseWelch Me too, I lost Mum, Oct 20, I don’t blame the government entirely, they made huge errors &amp; achieved some good, that’s every govt I’ve known. I do blame bloody China, furious they have not been held accountable &amp; compensation sought, after all, they’ve made so much money out it."
1590861555805040645,Fri Nov 11 00:18:46 +0000 2022,Bron the flawest one. How you speak on Kyrie but didn't say anything about China when it was time.
1590861550570852352,Fri Nov 11 00:18:45 +0000 2022,"@WatkinsCB65 @myscotlandtoday @McFaul The propaganda here has been transparent, over and over saying all Russia has to do is choose a leader the US likes, simple, imagine the opposite!  You want a Zelensky in charge of Russia before China gets their own puppet in and becomes the dominant superpower, see it as it is.."
1590861549752963072,Fri Nov 11 00:18:44 +0000 2022,@MAKSIMYQY How can you do tweeter in China?? 🤔Because you are a Diplomat?
1590861533806211073,Fri Nov 11 00:18:41 +0000 2022,@KingJames Gotcha - Lebron is good with anti-semitism and pretty much anything China does.
1590861525581180929,Fri Nov 11 00:18:39 +0000 2022,guys why is ant farm genuinely so funny china kinda killed this
1590861517485838336,Fri Nov 11 00:18:37 +0000 2022,@mtaibbi His willingness to cow-toe to China to get produce Teslas there
1590861514143330306,Fri Nov 11 00:18:36 +0000 2022,"@Smizzy777 50 Years ago, Gough was Labor's-Australia's saviour re China. https://t.co/quFljtt8R8 Can PM Albanese do same next week when he meets Xi Jinping? https://t.co/quFljtt8R8"
1590861508883668995,Fri Nov 11 00:18:35 +0000 2022,"lfg, Very beautiful collection, genius artists love @MelJellyrol @china_block @Sams_ala @madsnake36 @JhuanKhunan @QstuVgalp @UmasNft @magicposeidon_ @a_pushover @stephent8581 @JillHof98930946 @RachelC14228093 https://t.co/RWWekkSoMG"
1590861503435280384,Fri Nov 11 00:18:33 +0000 2022,"Carbon dioxide emissions rising globally, but drop in China https://t.co/7UUkjfeHo4"
1590861501531033602,Fri Nov 11 00:18:33 +0000 2022,"Carbon dioxide emissions rising globally, but drop in China https://t.co/geeXBgggTd"
1590861501082275840,Fri Nov 11 00:18:33 +0000 2022,@MFA_China We are Chinese Canadian. We hate you.  We hate communist China
1590861500658647041,Fri Nov 11 00:18:33 +0000 2022,"@Sue10242069 @vote_democracy @jeanvas5 @umichvoter People were shipping jobs to china for years, lots of blame to go around.  Idk why vote democracy blocked me for calling out their bs about SF or NY being healthy.  At least they admitted dems aren't the party of the working class anymore."
1590861481541005314,Fri Nov 11 00:18:28 +0000 2022,China’s key cooperation projects with neighboring countries have made positive progress.🌇🌇🏙🏙🎇🎇
1590861479208972288,Fri Nov 11 00:18:28 +0000 2022,"@KremlinSlayer @nftnark @WallStreetSilv China (lock up millp of ppl for months)
US (send millions of ppl to hell forever)"
1590861471289937920,Fri Nov 11 00:18:26 +0000 2022,"I google searched reality tv from china and Russia…gonna find something there next…seent big brother UK…I currently watched survivor and am watching big brother from US. I used to watch big brother weekly, catching up on seasons I’ve missed."
1590861469553655809,Fri Nov 11 00:18:25 +0000 2022,China has neither the intent nor the capability to attack us - https://t.co/WHnFJVs5SR
1590861467209064449,Fri Nov 11 00:18:25 +0000 2022,"@PamAndriole @Mcbain875917 @CurtisHouck Loved America? He hires immigrants to work at his Golf Clubs, he hired illegals from Poland to build his Tower rather then American union workers. He set up a fake University to rip off Americans, a fake Foundation,his crap is made in China🤦‍♀️"
1590861464730234881,Fri Nov 11 00:18:24 +0000 2022,@townhallcom @elonmusk His exceptionally and dependent close ties with China ofcourse make him a security threat. The owner and or management of Tesla [china] should not be allowed near SpaceX and Twitter
1590861462976679936,Fri Nov 11 00:18:24 +0000 2022,"China’s top leaders on Thursday met to discuss the nation’s handling of Covid-19, and urged officials to be more targeted with their restrictions https://t.co/fXc43NaY1O"
1590861458099015680,Fri Nov 11 00:18:23 +0000 2022,"@TroyTeslike Comparing prices and that we are talking abouth China, to be second by sold ev is big deal, just to keep it"
1590861453300334594,Fri Nov 11 00:18:21 +0000 2022,I'm sure Biden's Administration is loving every minute of this. Trump is like a bull in a china shop. https://t.co/OtBJMS1yId
1590861442638831618,Fri Nov 11 00:18:19 +0000 2022,"@eddiepullman75 @Philzfacts Abd Russia deciding to show everyone that they’re a paper tiger and that the west can stay together is bad? They’ll keep selling discounted oil to India and China, but grinding down an opponent is bad?"
1590861437093974016,Fri Nov 11 00:18:18 +0000 2022,@ColindAckermann @thePSLt20 @ESPNcricinfo @ICC @KKRiders @ImranKhanPTI @ImRo45 @_FaridKhan @elonmusk @babarazam258 @daniel86cricket And only the EAGLE (US) and DRAGON (China) can give your country pocket funds to run it😂😂😂 Always a dependency on others to reach where you are. Buzurg ho gaye ho sahara le le k
1590861425274408960,Fri Nov 11 00:18:15 +0000 2022,@MoNDefense Mr. Biden said during a news conference on Wednesday that he wanted to draw “red lines” in the working relationship with #China - reestablishing the de facto median line would be a good start...
1590861422363553792,Fri Nov 11 00:18:14 +0000 2022,@FrankZaTank268 @DavidTaylor123 @Tfreema94181255 @encrypyted_2J @nicTBone @akafacehots @POTUS He cannot even spell English. Look at the third world bots spelling. 😂 Probably from one of those 💩 hole countries in Europe or China
1590861421088329734,Fri Nov 11 00:18:14 +0000 2022,@Riflemanscreed2 That a great pic and thank you for your service. 🇺🇸
1590861403333820418,Fri Nov 11 00:18:09 +0000 2022,"The bulk carrier SEA HOPE that left the Russian port Vostochnyy on 26 Oct 2022 changed course now heading for China Qinzhou, scheduled to arrive ETA 04 Nov 2022 06:30 UTC. I can still see you SEA HOPE 🤖 https://t.co/y8CrkqsAUo"
1590861402436141056,Fri Nov 11 00:18:09 +0000 2022,"@mearmstrong77 @GregJam09875343 @chadsp70 Xenophobic, maybe.

But it doesn’t misrepresent the law. 

The law Schmitt voted for allowed foreign ownership of farmland for farming purposes, which was not allowed prior to the change - i.e. China could not have purchased PSF without the change."
1590861401241026561,Fri Nov 11 00:18:09 +0000 2022,"@TroyTeslike Full delivery of parts has been made in China since Nov. It is predicted that China will produce more than 90K units in November and more than 100K units in Dec. For the whole of the 3Q, production is expected to be 495K. Proportional to production, delivery will be at least 450K"
1590861398258896896,Fri Nov 11 00:18:08 +0000 2022,Trudeau is cozy with China donating large sums of money to Trudeau personally and the Liberal party of canada. https://t.co/gteZdHxLnT
1590861393154039809,Fri Nov 11 00:18:07 +0000 2022,"SF Partners are invited to discover the latest key innovations in the SAP SuccessFactors 2H 2022 release on November 15. Join solution experts for a high-level overview of new features and enhancements in the SAP SuccessFactors HXM Suite.

Register now ▶️ https://t.co/uqx3KjUlk1 https://t.co/pIrh3TfDSN"
1590861393061810176,Fri Nov 11 00:18:07 +0000 2022,Just like China https://t.co/iLZBB6FHWT
1590861390566268928,Fri Nov 11 00:18:06 +0000 2022,China’s Singles’ Day shopping festival fuels smartphone price war as major vendors seek to stimulate demand in weak market https://t.co/jnMYg4U8Js
