id,created_at,full_text
1590139494925504512,Wed Nov 09 00:29:33 +0000 2022,@FarmerM555 @librarydenizen @FleurdeLindsay @POTUS It's taking this long for them to take Ukraine. With all the lives and resources lost you really think he's going to move through Europe then on to us? They are struggling to take Ukraine.
1590139491171590146,Wed Nov 09 00:29:32 +0000 2022,"North Korea said Tuesday that claims by the United States that Pyongyang is supplying artillery ammunition to Moscow for its war in Ukraine were groundless, state media KCNA reported.

Full story: https://t.co/ffRwPpSLEu"
1590139485643505664,Wed Nov 09 00:29:31 +0000 2022,Ukraine flag and the WRONG lgbtqlmnop flag. https://t.co/578Qb42jPC https://t.co/0HxR3UNGEy
1590139482199949312,Wed Nov 09 00:29:30 +0000 2022,"@sirenspeaks_ @jamieee2003 @ann_arkansas @NextGenAmerica @AOC think what?  Everything in YOUR stores are all Made in China! Inflation at 500 percent under your Biden, New articles proving putin is afraid of Trump, Ukraine war would NEVER exist under Trump.... I will accept your total un-conditional surrender!  Republicans are very educated"
1590139480421584897,Wed Nov 09 00:29:30 +0000 2022,"@PapalSupremacy Probably Republicans win the senate &amp; house, then they continue to send billions to Ukraine"
1590139479549181953,Wed Nov 09 00:29:29 +0000 2022,Zelenskiy Calls For 'Unwavering Unity' Among Americans In Backing Ukraine https://t.co/SfrijVh6xk
1590139475610386432,Wed Nov 09 00:29:29 +0000 2022,"@RealTsavo @iamsharmi_ @scottwww Oh that was my whole rubric as I planned out who I was going to vote for. If you were a Hard Covidiot or a Stop The Steal nut, or against supporting Ukraine, I voted for the other one. Otherwise I voted Republican. Ended up being pretty split-ticket."
1590139473588719617,Wed Nov 09 00:29:28 +0000 2022,"@lamatzzi Thank you my beautiful Lamatzzi 
🥰🎂💫💥💙💛🎉🎉🎉
🥂🍾Tchin Tchin..for a better world and à glorious Ukraine"
1590139469994524672,Wed Nov 09 00:29:27 +0000 2022,@POTUS You're focused on investing in Ukraine and destroying America!
1590139467587026944,Wed Nov 09 00:29:27 +0000 2022,"Russia has transferred a batch of Western weapons to Iran.

A shipment of weapons and ammunition seized in Ukraine was delivered from Moscow to Tehran.

As noted, the party allegedly NLAW, FGM-148 ""Javelin"" ATGMs + FIM-92 ""Stinger"" MANPADS.

Sky News https://t.co/54DZmYVqgi"
1590139465447903232,Wed Nov 09 00:29:26 +0000 2022,"@ukraine_map The US election has massive global implications. If Republicans win, their democracy gets eroded further and Russia’s purchase of the Republican Party pays dividends."
1590139465347264512,Wed Nov 09 00:29:26 +0000 2022,"@ukraine_world Seriously in civilized country every visitor of this show will sue those creators for such entertaining psychological trauma to be so expensive to fix.

In Soviet Russia you pay to feel like  a victim of Nord Ost."
1590139460443701248,Wed Nov 09 00:29:25 +0000 2022,@Biz_Ukraine_Mag Since first day
1590139454337208320,Wed Nov 09 00:29:23 +0000 2022,@UnemploydVoices @PounceVilla @MinCorpPixel @VirelTV @vijayprashad @faromQc Football fans can get violent &amp; racist in any country.  Ukraine is no exception.  Azov is a batallion with at most 2000 people.  Since they were incorporated into the regular army they do not participate in politics.  They are simply soldiers who defend their country.
1590139451606732802,Wed Nov 09 00:29:23 +0000 2022,@ukraine_world I hope the Russian people have enough intelligence to see this for what it is - grotesque propaganda akin to Hitler’s Eternal Jew.
1590139430589071360,Wed Nov 09 00:29:18 +0000 2022,"@52inchModi Why do you insist on protecting the genocide in Bucha, the innocent people dying, being raped, being tortured, all for a couple regions of land? It's silly, really. You can pull up as much evidence of Ukraine being fascist as you want, but Russia pulls up 5x more. 2/2"
1590139425391931394,Wed Nov 09 00:29:17 +0000 2022,@tekov_yahoser @benjbern @JeanNB10 @RPGreg2600 @Joe19722470 @MariaEastCoast6 @JoJoFromJerz @elonmusk Putin took down the NRA and GOP during Trumps time to help him take Ukraine.
1590139416743653376,Wed Nov 09 00:29:14 +0000 2022,@ABlackPolitical If it wasn't for democrats Ukraine would be a peaceful country right now. https://t.co/4dOhkdH3l3
1590139415036579841,Wed Nov 09 00:29:14 +0000 2022,"@talkingtomysell @HonesTea87 @ReckJason @archt67 @ScottAdamsSays Rhetorical question: it ends when BRICS+ goes into effect in a few years and removes the reserve currency status of US dollar. Same reason US/EU are in Ukraine right now, need to reduce Russian influence to hopefully continue reserve status. But a losing effort in the end."
1590139410078920704,Wed Nov 09 00:29:13 +0000 2022,"Mango Ice-Cream Sandwiches

In this post, you will get to know about ""Mango Ice-Cream Sandwiches""

To Get The Full Recipe, Click The Link In The Comment Section Below:

#Recipe #Recipes #Food #Diet #Delicious #RecipeOfTheDay #Putin #Ukraine #America #Cuisines https://t.co/p7i6edbNjk"
1590139405196759042,Wed Nov 09 00:29:12 +0000 2022,Ukraine says talks with Russia hinge on ‘territorial integrity’ https://t.co/fH1kzZQEG3 via @AJEnglish #Daines #Rosendale #Gianforte
1590139389312745473,Wed Nov 09 00:29:08 +0000 2022,"Cop27: ending war in Ukraine necessary to tackle climate crisis, Zelenskiy says

https://t.co/3jvPjAGnGc"
1590139367406043136,Wed Nov 09 00:29:03 +0000 2022,"Office of President of Ukraine confirms that Western countries are not conducting secret negotiations with Russia
https://t.co/w9boDnobGe"
1590139366466555904,Wed Nov 09 00:29:02 +0000 2022,@ukraine_map Nvm found it for anyone interested https://t.co/uviVRSjxCi
1590139365078241281,Wed Nov 09 00:29:02 +0000 2022,@GREEKGOD7777 Ukraine had lost it on the very 1st day but the question is: Is Russia winning this war?
1590139358178254851,Wed Nov 09 00:29:01 +0000 2022,Glory to Ukraine and its soldiers 🇺🇦 Death to the enemies🔥#Ukraine #UkraineRussiaWar #ukrainecounteroffensive #UkraineWillWin #UkrainianArmy #UkraineWarNews #RussiaIsATerroristState #RussiaIsLosing https://t.co/NofSSvTJ8N
1590139355473285120,Wed Nov 09 00:29:00 +0000 2022,"Ukrainian Drone drop Grenade on Sleeping Russian soldier
#Canada #Denmark #UnitedStates #Kherson #Ukraine
https://t.co/RoWRjAavsE"
1590139351677407232,Wed Nov 09 00:28:59 +0000 2022,Brisbane man Trevor Kjeldal killed fighting in Ukraine https://t.co/aKTUiqcqRx via @couriermail
1590139349848690688,Wed Nov 09 00:28:59 +0000 2022,"@SallgoodIt @sacdamb @jaydendonofrio Climate? Funny how all the “activists” from countries fly to a conference in Egypt expending untold carbon into the fucking air. But yeah stick with your precious message Mr. Ukraine… That, Ukraine, and Covid lockdowns are all methods to take money from the people."
1590139348724645888,Wed Nov 09 00:28:58 +0000 2022,"@Justano14731951 @J_JHelin @cthulhupotamus @DingotheDingo1 https://t.co/hRzQ3dlaI7
Moscow is in Russia"
1590139347902562304,Wed Nov 09 00:28:58 +0000 2022,"@jamieee2003 @sirenspeaks_ @ann_arkansas @NextGenAmerica @AOC think what?  Everything in YOUR stores are all Made in China! Inflation at 500 percent under your Biden, New articles proving putin is afraid of Trump, Ukraine war would NEVER exist under Trump.... I will accept your total un-conditional surrender!  Republicans are very educated"
1590139347416027136,Wed Nov 09 00:28:58 +0000 2022,"@Izarm1313 @WrldofApx @PaulBasher2 @KyivIndependent Ukraine is going to get 300 $B of russian frozen assets, enough to rebuild and even improve infrastruture"
1590139346052870144,Wed Nov 09 00:28:58 +0000 2022,"@AlboMP @JJKALE2 Time for Albanese &amp; Marles to stop their war mongering ways.
Housing US nuclear B52s.
Illsuited nuclear submarines.
Long range missiles.
Lifting defence spending from 2% to 3%.
Supporting US's hostile stance to China.
665 million to arm Ukraine.
We didn't vote for this rubbish!!"
1590139334946000896,Wed Nov 09 00:28:55 +0000 2022,"@GeorgeTakei Yes, VOTE RED!!  Stop the laundering of tax payers money through Ukraine."
1590139310267072512,Wed Nov 09 00:28:49 +0000 2022,"@Gerashchenko_en @ZelenskyyUa I’m trying to feed my family, pay for gas, and keep my family safe. No more billions to Ukraine! Americans are suffering. Sean Penn can shove his Oscar where the sun don’t shine for all I care."
1590139310103142405,Wed Nov 09 00:28:49 +0000 2022,@jamaica_negril @McFaul I get it you don’t care about anything. McFaul and I care about Ukraine. Sorry if that offends your sensitivities.
1590139301958152193,Wed Nov 09 00:28:47 +0000 2022,"@SamiMassoud7 @Alexand28772396 @Slobberr @DiegoMerryVal @SamRamani2 You’re right, you said “full fledged participant”, how silly of me. However, you’re still incorrect.There are no NATO troops engaged in combat. NATO is supporting Ukraine by providing armament &amp; intelligence support. Much like the Iranians w/ their drones &amp; trainers in Crimea."
1590139300100050944,Wed Nov 09 00:28:47 +0000 2022,"That's a new one but a bit surprising I didn't see it months ago: a variant ""Nigerian prince"" email seeking my help in ""rescuing"" a few million Euros out of Ukraine... (No, I didn't.)"
1590139300049715200,Wed Nov 09 00:28:47 +0000 2022,"Ukraine Invasion: Ukraine is intervening in its economy putting it on a war footing and the state is taking control of some companies.
Ukraine May Expand Intervention After Seizure of Oligarch Assets https://t.co/PKB3bjmuLv via @Yahoo"
1590139289463291904,Wed Nov 09 00:28:44 +0000 2022,"@MrHarryKok4You @Silentone_P99 @ClownWorld_ Indeed. In addition, egomaniac Penn, an American actor, is sent to Ukraine the very day Putin invades (Feb. 24, 2022)? I shake my head how people don't see how ALL of this is scripted...on ALL sides."
1590139277123670017,Wed Nov 09 00:28:41 +0000 2022,"@Ihonestlydont19 @ahrehead @MrChingonE @ziggywilde @Mav_rick_Morty @MucusMucous @1717mule @SapienWoman @ziggystardogs @LordButters22 @Vickie627 @LaProudam13 @jkoff609 @PaulStetson13 @JeffreySHarper1 @Michell55854118 @WidowedJoo @BassistOld @Krispi_Largo @VinceGottalotta @kraegkust @Rjocore1 @skeeduu @PeterBartholo14 @Badams820 @NotADeer1 @43Cyoa @Pis0Mojado @mathmomma24 @DigiMalice @jdd2169 @WorkersUtopia @MistressRedWasp @_CapitalOffense @__TeekeeMon @Aimhighffw @therrienv @asjah8 @Fletchgetz @BentDepraved @QStormChaser @YungDiablo222 @DickChibbles556 @mmEyeNewMe @missled2u @_Kel_Varnsen_ @neal_cowboy @PayneTito @MmmGarmonbozia @0ryuge Once Putin saw Biden's humiliating retreat from Afghanistan

he knew the time was right to invade Ukraine"
1590139275810861058,Wed Nov 09 00:28:41 +0000 2022,"@somedieyoungCS @ggbet_en Don't get me wrong, my country accepts your refugees and so do I, I wish the people in Ukraine get help and food and everything. But the most you're getting is money and military equipment to prolong this war just cause Zelinsky doesn't even want to negotiate."
1590139271243235328,Wed Nov 09 00:28:40 +0000 2022,@cafreeland @energir @RachelBendayan Neo nazi leader Ukraine https://t.co/r9cj4E5LhF
1590139263030812672,Wed Nov 09 00:28:38 +0000 2022,Did NATO provoke the invasion of Ukraine? | Fiona Hill and Lex Fridman https://t.co/kUqOFX5KWN via @YouTube
1590139249587732480,Wed Nov 09 00:28:35 +0000 2022,"@GoldenR_Fella Out of these I have donated to United24
Save the Children
Voices of Children
https://t.co/Zeo7S9QWZn"
1590139237529419776,Wed Nov 09 00:28:32 +0000 2022,"November 8th -- Ukraine, this is a red line. https://t.co/wKvUg38ckf"
1590139236862201856,Wed Nov 09 00:28:32 +0000 2022,"Ukraine's president has suggested he's open to peace talks with Russia, softening his refusal to negotiate with Moscow as long as President Vladimir Putin is in power while sticking to Kyiv's core demands. https://t.co/LLgc6Vg5y3"
1590139234471776259,Wed Nov 09 00:28:31 +0000 2022,"Russia says it is ready to negotiate with Ukraine, quoted from Deputy Foreign Minister Rudenko: ""There are no preconditions on our part, except for the main condition: that Ukraine shows good will.""

So what happened to denazification, demilitarization, desatanization?"
1590139230915035136,Wed Nov 09 00:28:30 +0000 2022,@jasondebolt “Warmongering in Ukraine”?? You realise this is Putin’s Russia literally trying to retake Eastern Europe as part of the Soviet Bloc again? Unless we unite and say no and help Ukraine defend its territory it will not end there.
1590139228439998464,Wed Nov 09 00:28:30 +0000 2022,Ukraine’s agency belongs to Ukrainians and no one else
1590139226489704448,Wed Nov 09 00:28:29 +0000 2022,"Here are today's control-of-terrain maps of #Russia's invasion of #Ukraine from @TheStudyofWar and @criticalthreats.

Click here to see our interactive map: https://t.co/V1qE19dtZ2 https://t.co/vZpkDDNX3d"
1590139205476577280,Wed Nov 09 00:28:24 +0000 2022,内容很丰富  Inside the House GOP effort to keep weapons flowing to Ukraine | CNN Politics https://t.co/GKD2si6Qvx
1590139202565730304,Wed Nov 09 00:28:23 +0000 2022,"Why Kherson, Bracing for Battle, Matters So Much to Russia and Ukraine https://t.co/AU9zKQV0zn"
1590139198811799552,Wed Nov 09 00:28:23 +0000 2022,"@USAmbUN @USAmbKyiv ⬆️🤪🤡🤥🤥🤥⬆️

Did you visited the (mass) graves created by Ukraine army??? Bodies without amputated body parts and removed organs. And often Ukraine doctors stole those bodyparts and organs while the victims where still alive!"
1590139198379790336,Wed Nov 09 00:28:22 +0000 2022,@Biz_Ukraine_Mag Sean been lifting hard these days 😳 https://t.co/tgptkA5xde
1590139197645819910,Wed Nov 09 00:28:22 +0000 2022,"Ukraine rejects talks, promises not to give up 'a single centimetre' to Russia in east https://t.co/Rov4WtKcaN via @Yahoo 

#SlavaUkraini"
1590139195649327105,Wed Nov 09 00:28:22 +0000 2022,"@CNN please stop calling the counties a battlefield. America is just voting. Iran is a battlefield, Ukraine is a battlefield. America is just filling out bubbles on paper. People are doing what is best for them, but it most assuredly is not a battlefield. Please show respect."
1590139190410641411,Wed Nov 09 00:28:21 +0000 2022,"@realrobdurden They've been able to give lots and lots of money to the Ukraine, so don't say they haven't been busy."
1590139178238750721,Wed Nov 09 00:28:18 +0000 2022,Glory to Ukraine and its soldiers 🇺🇦 Death to the enemies🔥Today’s latest news in #Ukraine is that 🇷🇺soldiers are surrendering in masses ☠️🐷#UkraineRussiaWar #ukrainecounteroffensive #UkraineWillWin #UkrainianArmy #UkraineWarNews #RussiaIsATerroristState #RussiaIsLosing https://t.co/gG0V7xMX4L
1590139170571550721,Wed Nov 09 00:28:16 +0000 2022,#COP27: @ZelenskyyUa reveals how much forest destroyed by Russias war - and accuses Putin of disrupting global climate action. #Ukraine #UkraineConflict #UkraineCrisis #Zelensky
1590139168176283649,Wed Nov 09 00:28:15 +0000 2022,"@Promodkumar_ @KyivIndependent Yes, but first, Ukraine army will destroy the enemy."
1590139161033707521,Wed Nov 09 00:28:14 +0000 2022,We don't even want to know which flag would be flying in Kyiv if Trump's party had ruled the United States. History will condemn the Republicans if they do not support #Ukraine as much as the Democrats and Biden have. #Ukraine #RussiaIsATerroristState #Midterms
1590139148174000128,Wed Nov 09 00:28:10 +0000 2022,@NoLieWithBTC Inflation is stopped by slowing down the printing press stop funding deficit spending with new money stop giving away billions of dollars to Ukraine for starters
1590139132025917441,Wed Nov 09 00:28:07 +0000 2022,"""Europeans stick by Ukraine, despite mounting challenges."" by BY JASON HOROWITZ AND CATHERINE PORTER via NYT New York Times https://t.co/Z32nLfcesO"
1590139112765652992,Wed Nov 09 00:28:02 +0000 2022,@USAmbUN beautiful ♥️💐💐you are such a wonderful role model for her and a great friend of UKRAINE thank u!!!
1590139107510202368,Wed Nov 09 00:28:01 +0000 2022,First they tell us there are no Nazis in Ukraine - the next thing will be them trying to tell us there are no Nazis in the Palace of Westminster. 🤣
1590139106931068928,Wed Nov 09 00:28:01 +0000 2022,"International policymakers consider supplying the #Ukrainian Air Force with Saab JAS 39 Gripen C/D fighter jets- a game changer. #weapons #aircraft
#defense #Military

https://t.co/8Fgg5Ao1F0"
1590139105224318976,Wed Nov 09 00:28:00 +0000 2022,VIDEO of another batch of captured Russian soldiers. There are in good spirits while receiving medical treatment. Judging by their uniforms and boots these are contract soldiers not conscripts. One looks like an officer #Ukraine #Russia #Putin https://t.co/kP6dGjnbbp
1590139094893441025,Wed Nov 09 00:27:58 +0000 2022,"@bobski0322 @ajamubaraka As to ‘genocide’ — you’ll want to look into the Banderite scum Kyiv are reliant upon.  They’re the Nazi thugs that have been causing the disintegration of Ukraine, and are embedded throughout the security apparatuses there.

They also happen to be Washington’s ‘friends’."
1590139094226853888,Wed Nov 09 00:27:58 +0000 2022,"@ashwinibirla @buccocapital The majority of QE was used to bail out American companies, buy American debts, mortgage backed securities, etc.

Saying it was used to buy weapons is just blatantly false. Most of what Ukraine is given is a loan"
1590139080120991745,Wed Nov 09 00:27:54 +0000 2022,@Mvram61 @lesiavasylenko Lol. The kill ratio is like 7 to 1 in favor of Ukraine.
1590139078804021248,Wed Nov 09 00:27:54 +0000 2022,"@ianbremmer @riotta Not weird if you know Sean Penn (cringe sound) &amp; the fact that he is making a “documentary” on Ukraine (cringier sound) This is all pre-marketing stunts (cringiest sound)
PS to have a taste on how SP makes his “documentaries” I suggest to watch “The Day I Met El Chapo” on Netflix"
1590139072281923585,Wed Nov 09 00:27:52 +0000 2022,Ukraine Warns Russia Is Seeking Iranian Missiles as Battle in Skies Escalates - The New York Times https://t.co/ulJsTL48RS
1590139066989031425,Wed Nov 09 00:27:51 +0000 2022,"@DespicableMeme1 A couple months ago at the grocery store the ""charity"" the robocheckout asked me to donate to was &lt;airquotes&gt;Ukraine&lt;/airquotes&gt;. Presumably the Zelenskyy crime cartel, with 10% for the Big Guy."
1590139056427765760,Wed Nov 09 00:27:49 +0000 2022,"@GermanyAmerica @irongenerale @MommaZKnows @alexbward @alexplitsas Mostly as weaponry ""Made in USA"". 
More weaponry to Ukraine =&gt; government contracts with local producers=&gt; more jobs in the USA=&gt; more money 💰 strong industry 🦾 battleprooven quality =&gt;more international contracts 🌐=&gt; more jobs=&gt; more money 💰💰💰💰💰💰💰💰💰 in the USA"
1590139043018596352,Wed Nov 09 00:27:45 +0000 2022,@IamTheMFWIC @GordonGChang Under normal circumstances. Ukraine has all our weapons.
1590139039847710722,Wed Nov 09 00:27:45 +0000 2022,"@SquidTwitch @homero49212975 Poor soul, it’s so hard to read the news, and much harder to understand what is fake and wat is not, better to call thousands of civics in Ukraine cringe just because it’s hard for you to understand. And you are telling me something about war crimes.ruzzia = terrorists. Learn it."
1590139037649899520,Wed Nov 09 00:27:44 +0000 2022,"No doubt these “former” agents aim to make surveillance, the “war on domestic terrorism” &amp; the fueling of the Ukraine Russia conflict top of their priorities"
1590139028221091841,Wed Nov 09 00:27:42 +0000 2022,Italy's support for Ukraine subject of debate amid widespread protests - https://t.co/OYe7Gs0zq9 https://t.co/SyuRJYEmM1
1590139025532530689,Wed Nov 09 00:27:41 +0000 2022,"Jake Sullivan - US National Security Advisor, said to Russian counterpart - America/NATO will not allow Russia to defeat Ukraine &amp; win this war on Russian terms - Col. Douglas MacGregor https://t.co/XuFEqj2dZQ"
1590139025071149057,Wed Nov 09 00:27:41 +0000 2022,#Russia invades Ukraine LIVE | DW News livestream | Headline news from around the world　https://t.co/73vaqX0x08　This isn’t a #movie #anime
1590139024572043264,Wed Nov 09 00:27:41 +0000 2022,"The Embassy Defends it’s support for #Ukraine as shining light of Freedom, Democracy, Justice and Equality 
(But asks you not read our State Departments 2021 Human Rights Report on Ukraine) https://t.co/JA4S4cozzw https://t.co/a6GY6Z8pnw"
1590139001369137152,Wed Nov 09 00:27:35 +0000 2022,@ColeeCharles Or Democrats can steal your money so they can launder it through Ukraine.
1590138990761750528,Wed Nov 09 00:27:33 +0000 2022,@ClownWorld_ It was awarded to him for acting. You can refuse it but you cant award it to someone else. He thinks he is using his celebrity to bring attention to Ukraine's struggles and it only succeeds in looking ridiculous
1590138979093188613,Wed Nov 09 00:27:30 +0000 2022,"UN to vote on resolution saying Russia must pay reparations. #UnitedNations #Russia #Russian #Ukraine #UkraineRussiaWar️ 

https://t.co/RXDBb0pCRg"
1590138975179911169,Wed Nov 09 00:27:29 +0000 2022,@POTUS Keep sending millions to ukraine. Versus helping your country.
1590138974399778816,Wed Nov 09 00:27:29 +0000 2022,"I will vote for whoever, stops all aid to Ukraine. Breaks ties with global bankers, restores good relations with  Russia, China, North Korea, Iran, etc and stops invading countries like Haiti that are absolutely ZERO threat to our national security."
1590138972940161025,Wed Nov 09 00:27:29 +0000 2022,"@esceptico8 @Gerashchenko_en Perhaps it's a matter of interpretation. I understood him to mean that all those who perish are the best. This particular hero may be more well-known outside of Ukraine, but russia is killing the best as it's the best who stay, stand, and fight."
1590138958889242625,Wed Nov 09 00:27:25 +0000 2022,"@tommyrulznyc @LHSummers @mattyglesias Ukraine has a GDP less than Nebraska. Just like Covid, it’s not the event but the response that has been most deadly."
1590138956699824128,Wed Nov 09 00:27:25 +0000 2022,@olex_scherba I have heard numerous stories from Ukraine of neighbors looking out for neighbors.
1590138954191634432,Wed Nov 09 00:27:24 +0000 2022,@ahrehead @MrChingonE @ziggywilde @Mav_rick_Morty @MucusMucous @1717mule @SapienWoman @ziggystardogs @LordButters22 @Vickie627 @LaProudam13 @jkoff609 @PaulStetson13 @Trumpster20 @JeffreySHarper1 @Michell55854118 @WidowedJoo @BassistOld @Krispi_Largo @VinceGottalotta @kraegkust @Rjocore1 @skeeduu @PeterBartholo14 @Badams820 @NotADeer1 @43Cyoa @Pis0Mojado @mathmomma24 @DigiMalice @jdd2169 @WorkersUtopia @MistressRedWasp @_CapitalOffense @__TeekeeMon @Aimhighffw @therrienv @asjah8 @Fletchgetz @BentDepraved @QStormChaser @YungDiablo222 @DickChibbles556 @mmEyeNewMe @missled2u @_Kel_Varnsen_ @neal_cowboy @PayneTito @MmmGarmonbozia @0ryuge Nothing to do with the invasion of Ukraine buy your capitalist buddy Putin? He's in the clear?
1590138949544349702,Wed Nov 09 00:27:23 +0000 2022,can't mfs realize the discourse around the war on Ukraine has the same dumbshit logic as America's invasion of Iraq? like Both America and Russia used stupid ass justifications for their invasions and people have never realized this?
1590138946771877889,Wed Nov 09 00:27:22 +0000 2022,"Ukrainian quadcopter drone, dropping grenades on Russian trenches.
#Canada #Denmark #UnitedStates #Kherson #Ukraine https://t.co/RmVtweN46g"
1590138944892506112,Wed Nov 09 00:27:22 +0000 2022,"@Mattatack22 @danarestia Dem green policy has created higher gas prices worldwide. Inflation in the US can be directly attributed to the absurd amount of money the US gov’t is spending. The US sent 50+ billion in aid to Ukraine, the most aid sent by any country. Next is UK at 8 bill"
1590138944561508353,Wed Nov 09 00:27:22 +0000 2022,"@Maybe_not_a_Fed @CossackNeppy you can block me, but you can't block the Ukraine Democracy Defense Lend-Lease Act of 2022 😎😎😎🇺🇲🤝🇺🇦 https://t.co/WGdAO5ekCV"
1590138944347607040,Wed Nov 09 00:27:22 +0000 2022,@Jarmo201 @ukraine_map Polls just closed. Nothing is for certain
1590138943609229313,Wed Nov 09 00:27:22 +0000 2022,Ukraine official account posting cringe on facebook.
1590138932905521153,Wed Nov 09 00:27:19 +0000 2022,@normenkunde @EdmundBlackad13 @GruegerS @elonmusk Stop the bullshit. Are you denying the thousands of on-record rapes by russian solders in Ukraine?
1590138928258220032,Wed Nov 09 00:27:18 +0000 2022,Ukraine Is A Banker’s War To Control The Next World Financial System https://t.co/WfTXs082Gy
1590138917025906689,Wed Nov 09 00:27:15 +0000 2022,"“The European Union will not be able this year to allocate a third of the €9 billion aid package promised in May from the macro-financial stabilization program to Ukraine,” said Valdis Dombrovskis, First Deputy Head of the European Commission"
