id,created_at,full_text
1588821952223145986,Sat Nov 05 09:14:06 +0000 2022,@petergotnews @PeterSweden7 We know it definitely exists. Faucci funded it. China manufactured it. Harvard weaponized it.
1588821950948073472,Sat Nov 05 09:14:06 +0000 2022,@donnandavidson @thesiriusreport No. There is legitimate reason why China must keep Zero Covid policy
1588821940386791425,Sat Nov 05 09:14:04 +0000 2022,"China's Defense company Norinco presents the concept of future battalions structure and their components for PLA.
#ZhuhaiAirShow2022 https://t.co/bOMhClXfgN"
1588821930358231041,Sat Nov 05 09:14:01 +0000 2022,"@AparBharat And they never travel to Russia or China it's always US. 
Their dream destination isn't any communists ruled nation but democratic country like US."
1588821929523576833,Sat Nov 05 09:14:01 +0000 2022,@TapiwaTaruving4 @GutuObert China has colonized us already
1588821928588218368,Sat Nov 05 09:14:01 +0000 2022,china anne mcclain... kym whitley... lavell crawford... rob schneider... yes &lt;3
1588821923802193920,Sat Nov 05 09:14:00 +0000 2022,"Now, now…..https://t.co/uypH3Cgx9q"
1588821918467211265,Sat Nov 05 09:13:58 +0000 2022,"@AJEnglish Typical of the Biden doctrine. Make a mess and try to guilt others for your mess. Made a mess in Afghanistan, making a mess in both Ukraine and Korea. I dont know what mess Taiwan will bring since only way that becomes real mess if if Taiwan attacks China."
1588821913958514688,Sat Nov 05 09:13:57 +0000 2022,"@Nelytiez @DanielKibet_ @MathiasSsemanda @Eng_Bonz @Eric_Of_1691 The Ugandans built the satellite,  not the machines for launching.  Please find out how other countries that are not US, China, Russia send their cargo/satellites to orbit. You can't put your flag on a rocket that is not yours."
1588821912506888192,Sat Nov 05 09:13:57 +0000 2022,"@OfficialDGISPR @ImranKhanPTI @ECP_Pakistan @SkyNews @BBCWorld @trtworld @TalkTV @ImranRiazKhan @samiabrahim @arsched @RTErdogan @HassanRouhani @Haqeeqat_TV @ARYNEWSOFFICIAL @BOLNETWORK @UNHumanRights @amnestysasia @zlj517 @KremlinRussia_E @ghaziusama @MaleehaHashmey @ARYSabiirShakir @PAKSupremeCourt @SdqJaan @ArifAlvi @MFA_China @OmarCheemaPTI @fawadchaudhry @TariqJamilOFCL @QasimKhanSuri @Asad_Umar @ShkhRasheed @BabarAwanPK @SenateCA @IntlCrimCourt @IHRCEU @CIJ_ICJ @MalBokhari @SafinaKhann @SHABAZGIL @amnesty @ChParvezElahi @JustinTrudeau @IMFNews @FATFNews @GenAsadOfficial @ChParvezElahi is equally and equivocally involved in terrorism and murders together with terrorist bajwa corrupt generals and PDM terrorists, he is the cause of the all the pain and suffering through playing on both sides with @ImranKhanPTI and the culprits."
1588821890277470208,Sat Nov 05 09:13:52 +0000 2022,"Internet police are quite a piece of shit, in china I have bear it enough, beyond my expectation, I still need to continue this in UK, halo, goddamn justice"
1588821852889419776,Sat Nov 05 09:13:43 +0000 2022,"Forced organ harvesting in China 🇨🇳 
😮 https://t.co/K8EgesrCGS"
1588821845045923842,Sat Nov 05 09:13:41 +0000 2022,"‘The Big One Is Coming’ and the U.S. Military Isn’t Ready-
A U.S. flag officer talks candidly about the fading U.S. deterrent. https://t.co/gKTijalaAs"
1588821843762630656,Sat Nov 05 09:13:41 +0000 2022,"The big question is on whether China is re-opening. The bigger question is about China's economy. But the biggest question of all is whether China is returning to so-called ""pragmatism"". This seems to be the deal-breaker for global…https://t.co/kqqgAZFp0O https://t.co/oyXCMrrwUA"
1588821790263939072,Sat Nov 05 09:13:28 +0000 2022,I am so dead..... China Restaurant vibes. Eish yoweee.🤣😁😂 https://t.co/JmiZ9FO0XS
1588821786820743169,Sat Nov 05 09:13:27 +0000 2022,@Judy70014688 Of China 🇨🇳 😅💙💦🇨🇳💗🇮🇳
1588821780394758144,Sat Nov 05 09:13:25 +0000 2022,"@kennedytcooper I remember a lot of flak for the Ancient One, as it was pretty clearly something done to not upset China."
1588821779262623745,Sat Nov 05 09:13:25 +0000 2022,"@lance_vamplew @JerasIkehorn We’re not alone in finance’s game. We’re a finance created empire that followed their British Empire &amp; precede their new empire, China. 
Previous empires “provide liquidity” through debt instruments💸🌏, until they implode. Chinese had to join us in a “all debt role” in 2013."
1588821778876731392,Sat Nov 05 09:13:25 +0000 2022,@cb_doge @elonmusk Pull out of China and I agree 100%
1588821767443054598,Sat Nov 05 09:13:22 +0000 2022,"@ItWillAllChange @prakashraaj Oh shit
Did u forgot we are living in India

Is waqf in USA or UK

Nah, it's in India

What if they claim our land or my relatives land?

At first covid started in China and other countries, can we keep quiet then..."
1588821762950791169,Sat Nov 05 09:13:21 +0000 2022,"Cardinal Tagle Supports Renewal of Secret Vatican-China Accord 
In a lengthy interview, the Pro-Prefect of the Dicastery for Evangelization, defended the extension of the 2018 provisio...
https://t.co/FcKZcYAd75
#Newsdeskinbox #TheInterview 
#Asia #bishop #car... https://t.co/t6GokQcB8F"
1588821762548338688,Sat Nov 05 09:13:21 +0000 2022,@RickGuzman1 @stclairashley @TheBabylonBee Look up definition of dictator and it defines the Biden administration. You'll think differently when the diesel runs out and you can't get food or gas.. it's amazing to me that democrats have no problems with Biden selling out America to China using his son and brother.
1588821761851682816,Sat Nov 05 09:13:21 +0000 2022,"@RealDonalTrom @FlyerKenyan @Tatiana4MJ @CanadianKitty1 ""Iraq got nukes""
""Russia nuclear threat""
""China Nuclear Threat""
""UN voted against illegal invasion (doesnt apply the vote in favor of Cuba)""
""We protect freedom""
""Defensive alliance""

I'm sure you see it too. Stay fake, it only makes it better."
1588821739626442753,Sat Nov 05 09:13:16 +0000 2022,"@Bruce04494103 Hello. No, we're certainly not giving up on China, however, we are combatting the constant blocking of service coming in from its local authorities and that might sometimes result in disruptions. Please feel free to DM us if you need assistance with the connection. -Drea"
1588821736472326144,Sat Nov 05 09:13:15 +0000 2022,NOT TRUE - CHINA ENCOURAGES PEOPLE TO PRACTICE THEIR CULTURES! https://t.co/SWl4dO1SH7
1588821729836929024,Sat Nov 05 09:13:13 +0000 2022,"@mmamakedonia @rizojovanov @Freewor30833853 @smx6 @WarMonitor3 Fake Macedonians, made in china 😅"
1588821710413115392,Sat Nov 05 09:13:09 +0000 2022,@bopanc @WSJ And imagine Russia persuading China to stop aiming for Taiwan. Clearly China doesn’t mean it
1588821699021406208,Sat Nov 05 09:13:06 +0000 2022,"@SecBlinken @G7 Is there another #Africa? We Africans were, are and will always be stand with #Russia and #China!! @_AfricanUnion @AnnGarrison @KeChepkirui"
1588821696655433728,Sat Nov 05 09:13:06 +0000 2022,"In this sense, Putin is running what amounts to a useful experiment for China in testing out US / allied responses  (not that they wanted him to do this but they will certainly make use of the fact that it's happening) 5/5"
1588821694491160576,Sat Nov 05 09:13:05 +0000 2022,"Of course, there's also Zhou Bo's ""lesson"" re. the build up of China's nuclear arsenal, though that seemed to be a conclusion they had reached for other reasons already 4/"
1588821694076301313,Sat Nov 05 09:13:05 +0000 2022,"A Chinese rocket used to build its space station has crashed back to Earth at 10.01 UTC. 
China's space agency said most remains of the Long March 5 burnt in the atmosphere. 
The uncontrolled return of rocket's core stage has raised questions about responsibility for space junk https://t.co/YEsuVriFlI"
1588821692360822786,Sat Nov 05 09:13:04 +0000 2022,"The other lesson is also hinted at in his op-ed - that ""agreeing not to use nuclear weapons"" could be treated as a bargaining chip to secure other objectives (NATO expansion in this instance, but one can very well imagine the read-across for China) 3/"
1588821690439520257,Sat Nov 05 09:13:04 +0000 2022,It seems unlikely that they have had grounds to reach this conclusion yet but it is certainly one of the worries on the US side when it comes to how China might interpret / misinterpret current and potential dynamics with Russia 2/
1588821688145575936,Sat Nov 05 09:13:03 +0000 2022,"Thanks, Euan. The biggest concern would be if China takes the lesson that it is Russian nuclear threats that have deterred stronger forms of US / western intervention / support for Ukraine, as Zhou Bo essentially suggests in the SCMP 1/5 https://t.co/c3Di6TrQTt"
1588821687604514816,Sat Nov 05 09:13:03 +0000 2022,@loveforhnk I think it's only for fans in china to buy idk why msia fans need to buy from them but except for yzy la... for me I just buy from msia go☠️
1588821681413320705,Sat Nov 05 09:13:02 +0000 2022,"@mr_internet @RishiSunak @SteveBarclay @DrRosena One UK problem is that hemp flowers are not legal here, so farmers cannot grow them and so no seeds, so no chance of self sufficiency. We import from China &amp; E Europe. Hemp does develop 'too much' THC in the wrong/ right conditions so it is the same plant species."
1588821677873696769,Sat Nov 05 09:13:01 +0000 2022,"Due to the current climate in China, I will temporarily identify as a male crossdresser.

PLEASE DO NOT OUT ME UNDER ANY CIRCUMSTANCES!"
1588821670529499136,Sat Nov 05 09:12:59 +0000 2022,@KennethWillcoc1 @thesiriusreport No. There is a very real legitimate reason for China's Zero Covid policy
1588821633321824256,Sat Nov 05 09:12:50 +0000 2022,"Probably how the Soviet Union managed to stay in business way past its date of expiration:

""Lesson: Pay due regard to Mr. Putin’s well-honed capacity for retreat.""

To End the Russia-Ukraine War, Shut Up About Negotiations https://t.co/2vKfLM6umn"
1588821631325331457,Sat Nov 05 09:12:50 +0000 2022,"I'm disgusted with this much Begging China when China's the criminal. Russia won't use nuclear weapons. Russia should've never got into Ukraine to damage own military, reputations."
1588821624580898817,Sat Nov 05 09:12:48 +0000 2022,@6Manish9 @Jay_b_h_a_t_t @RAFIndia_ This is true but desi equipment will be cheap so money won't be big problem. Our concern is 2 front war preparation against both China and Pak. We should always be ready for this scenario.
1588821608755449856,Sat Nov 05 09:12:45 +0000 2022,"US confronts China, Russia at UN over N Korean missile launches - https://t.co/hk2flsIi5q

#News https://t.co/FQ0oA4ERQV"
1588821603189596160,Sat Nov 05 09:12:43 +0000 2022,"US confronts China, Russia at UN over N Korean missile launches - https://t.co/sGCGRLcgcT

#News https://t.co/pefjIW9N3R"
1588821597447942149,Sat Nov 05 09:12:42 +0000 2022,"@TheLegateIN First they sold Nepal land to china , take that back first , if can"
1588821591617863680,Sat Nov 05 09:12:40 +0000 2022,"@Wolfeto92511255 @robertburke84 Why do you pick on the one Jewish state when objectively there are far worse places in the world, e.g. Gaza, Iran, China?

What do the Jews have to do with Irish nationalism???

If Israel wasn't so small it wouldn't be so obvious and thus so weird."
1588821585611620353,Sat Nov 05 09:12:39 +0000 2022,"@SocialNomadRach Speaking of China. Once they have colonised all they can they're at least not going to entertain cringe activists about how we need to ""decololinse history""."
1588821583501598721,Sat Nov 05 09:12:39 +0000 2022,"No Agreement Yet Between US, China on.... #naturalbeauty #beautyisnatural #beautyblogs https://t.co/b497SP6LFH https://t.co/uWXicfwoIH"
1588821564229054464,Sat Nov 05 09:12:34 +0000 2022,@RubyDee73 @SpeakerPelosi Educate yourself please!!!! Trump actually brought business into the country. He “created” jobs! He initiated the highest number of African American employment EVER! Biden closed factories and shipped out or jobs to China. Now there are more slave workers there. He’s the worst!
1588821559577563136,Sat Nov 05 09:12:33 +0000 2022,"@Digital_3d @TaiwanNews886 Whole world knew, taht after the fights in Galwan river Valley, Inida has turned to seek the help mainly from the west against China. So some people can say, thinking in the way like You, that Your country is really a USA client...but nobody cant say like that if he is smart .."
1588821554569572353,Sat Nov 05 09:12:32 +0000 2022,Well well well... Maybe corporate America is afraid of this now as they are about pissing China off. https://t.co/rysSLdpgfS
1588821548445880326,Sat Nov 05 09:12:30 +0000 2022,@KoronaKitaya @Illdbqp @DanielDumbrill @DrewPavlou she's fun in hating the US almost as much as she hates China. A serious source is definitely something else
1588821545023336448,Sat Nov 05 09:12:29 +0000 2022,"@ARanganathan72 @SudhanshuTrived @JaipurDialogues Yeh kalyug hai, bJP and it's Bhakts are a radicalised lot, else,

Why lynching of muslims only
Why #bilkisbano
Why No protest over China taking away our land
Why no protest on Operation Lotus in so many states"
1588821544444141569,Sat Nov 05 09:12:29 +0000 2022,Can you believe China  is FAKE. They are the enemy! THANK YOU!
1588821543676698626,Sat Nov 05 09:12:29 +0000 2022,Life was never the same.
1588821539285536768,Sat Nov 05 09:12:28 +0000 2022,@euronews Germany as it is now is already crippled because of Scholz stupidity to listen to US to sanction Russia. If Germany were to decouple from China then Germany will go kaput.
1588821524517384192,Sat Nov 05 09:12:24 +0000 2022,"@TheInsiderPaper Still, Germany continues to buy energy from Russia and make products in forced-labor factories in China.
Germany, China and Russia are economic allies.
If Russia uses nuclear weapons, they will not take any action."
1588821501129547776,Sat Nov 05 09:12:19 +0000 2022,"https://t.co/OtFxf6CU0e 
Don't forget to follow my pages on LinkedIn 
#linkden #Website #websitedesign #Linktober2022 #Facebook #store #shopifystore  #payments #paymentgateway  #china #frelanceing #chinaworld #bussinessproposal  #onlinebusiness"
1588821498458169346,Sat Nov 05 09:12:18 +0000 2022,"@wi_anette @Bundeskanzler Get out of ideology, don’t be used by the United States. Isn’t the current inflation in Europe caused by the United States. If you refuse Russian resources and China’s trade, what else is left for Germany? Can you use freedom and human rights as a meal? Haha"
1588821474802298881,Sat Nov 05 09:12:13 +0000 2022,"@treasuremenfess 💟 china, th, west enthu"
1588821472692183041,Sat Nov 05 09:12:12 +0000 2022,China’s formal announcement of the (existing) Airbus deal on Friday during Scholz’ visit was an interesting signal considering the drift in the relations bw Germany and France.
1588821472357003264,Sat Nov 05 09:12:12 +0000 2022,"China Bans Celebs With 'Lapsed Morals' From Endorsing Products
https://t.co/UidkOTqoTr"
1588821456489975808,Sat Nov 05 09:12:08 +0000 2022,"January #iron #ore futures on the Dalian Commodity Exchange for the week of October 28 – November 4, 2022, rose by 6.1% from the previous week – to 662.5 yuan/t ($91.35/t).

Thus, iron ore quotations rose for the first time in four weeks.

Read more here🔽
https://t.co/cquHL0kxjO https://t.co/EmjHeDaRDK"
1588821445941297154,Sat Nov 05 09:12:06 +0000 2022,@CIA_in_China Why these guys all look like soyjak is my question. Talk about loser back home jeez.
1588821436483121152,Sat Nov 05 09:12:03 +0000 2022,"This is a joke, I'm not a fan of @KyrieIrving but what the @BrooklynNets are doing and the owner @joetsai1999 this that the USA is China where people cannot have their own opinions... @NBA @KDTrey5"
1588821421320728579,Sat Nov 05 09:12:00 +0000 2022,@zerohedge Unbelievable people in China put up with this type of Govt oppression
1588821408796155906,Sat Nov 05 09:11:57 +0000 2022,"@JerrysTakeChina What you are describing is the old sentiment. That have changed and there is a movement among the west to treat China as the threat, in all aspects, that it is.

The western world have opened its eyes on what China is and what their goals are."
1588821395592863744,Sat Nov 05 09:11:54 +0000 2022,"@upholdreality @MintPressNews A real predicament: Ursula and gang want those Chinese resources, but China has a powerful military and economy. What to do, what to do?"
1588821384838664193,Sat Nov 05 09:11:51 +0000 2022,"Another day, another rumor of China opening passes.

The speed by which each one “seems” more credible than they last, and is passed through wechat groups, is growing.

Everyone waiting for a signal.

It’s a dangerous pattern that only makes Beijing’s job harder."
1588821363313512452,Sat Nov 05 09:11:46 +0000 2022,"@LesleyJ85840609 @Flashma78139552 At one time the UK had the no.1 spot in the world pecking order. 

We dominated the seas; we dominated science and literature - we were elite legit. 

But this superiority apparently this made us evil colonisers. 

So maybe it is time China, India and Russia took over."
1588821351728832513,Sat Nov 05 09:11:43 +0000 2022,@TheLegateIN Oli china is still trying despite being super power  well you can also try but you may end up losing more Territories
1588821342216126466,Sat Nov 05 09:11:41 +0000 2022,"@ConstableChaos It's usually a safety regulation, toys/electrical items, if not up to British regs, won't go through storage, n China imports are often banned for those reasons, I think some were imported n some kids died choking on parts.
https://t.co/GYI3P7Gaoq https://t.co/1itfjmtcz0"
1588821328550846464,Sat Nov 05 09:11:38 +0000 2022,"iQoo 11, iQoo 11 Pro Battery, Fast Charging Details Tipped Again: Report
 The fast charging and battery details of the iQoo 11 series have surfaced again. The iQoo 11 and iQoo 11 Pro are expected to launch in China by the end of December this year. https://t.co/D19vT1wxoO"
1588821326789500932,Sat Nov 05 09:11:37 +0000 2022,"@Exo_Alaska @dwnews Actually, don't bother. If we let russia win, China will move next and we have WW3 with nukes soon, so no point in doing anything."
1588821297852977152,Sat Nov 05 09:11:30 +0000 2022,"Charcter in people China , kyruem X, Pokemon go free coin and charamzander"
1588821280241119234,Sat Nov 05 09:11:26 +0000 2022,"@Shobha_Music Fake, it's  from  china"
1588821272469069827,Sat Nov 05 09:11:24 +0000 2022,United States condemns Russia and China for protecting North Korea's ballistic missile laun… https://t.co/GcnYzrc3K9
1588821264462118912,Sat Nov 05 09:11:22 +0000 2022,"The result of negativity is very bad. When the pot of sin is filled, it is its fate to burst. One day China will shatter like a mirror. We are always stand with you.

#TheTibetNetwork #TibetWatch #tibet_policy #SFTHQ #TibetThirdPole 

@UNHumanRights @COP27P https://t.co/162Zn7orBv https://t.co/WFRLePt4Co"
1588821257512185865,Sat Nov 05 09:11:21 +0000 2022,"it used to be ""Russian Gate"", since the Russians are busy with Ukrainian Nazis, now China stepped in to help with #Midterms2022
Whom is China helping? China is public enemy #1, Americans HATE HATE &amp; HATE China. Sionphobia is the only common ground the democrats &amp; republicans have https://t.co/rOWMcFkxFS"
1588821244564377602,Sat Nov 05 09:11:18 +0000 2022,"Beijing Urges Countries Around South China Sea To 'Jointly Resist' The US
https://t.co/Td4DiOSOly"
1588821234598322179,Sat Nov 05 09:11:15 +0000 2022,"@spat64 @elonmusk @pfizer @Oreo @MDLZ @GeneralMills @GM @VW Boycotting Pfizer, Volkswagen, Audi, SEAT, AND NAZZI GERMANY COMPANYS THAT ARE KILLING PEOPLE AROUND THE CLOCK EVERYWHERE AND SUPPORTING PUTIN AND CHINA SLAVERISM PRO SOVIET"
1588821231171932160,Sat Nov 05 09:11:15 +0000 2022,Now Russia is reduced to N.Korea position by China inciting this war; why would anybody need China's power brokerage when China's the worst guy in whole world?
1588821212976672768,Sat Nov 05 09:11:10 +0000 2022,"@RenoPatron @NBA 😅😅😅😅
He’18 and competition here in french league is way better than NCAA championship or China league

And FIBA ball is the same size as in NBA.

You don’t know anything about basketball, do you ?"
1588821209961357313,Sat Nov 05 09:11:09 +0000 2022,@followwollof66 I feel your pain...rottweiller with a cone on is like a bull in a china shop.. fml. https://t.co/La0Ldv3CF1
1588821204931993600,Sat Nov 05 09:11:08 +0000 2022,United States condemns Russia and China for protecting North Korea's ballistic missile laun… https://t.co/GcnYzqTUw1
1588821199404015617,Sat Nov 05 09:11:07 +0000 2022,China central bank official faces corruption probe https://t.co/ksgb57x18E
1588821196770246656,Sat Nov 05 09:11:06 +0000 2022,"@Segun_Odunayo @freedom_rita Old Soviet republic, East Germany, North Korea and China before Deng Xiaoping’s market reforms, they didn’t have the strength of private enterprise that there capitalist rivals had. The USA, Japan and South Korea for example. https://t.co/OUPyAZnuA0"
1588821179506491394,Sat Nov 05 09:11:02 +0000 2022,"@ThoHasntBeBack China and America,two countries,one system"
1588821169154711552,Sat Nov 05 09:11:00 +0000 2022,"@shashamimi Overheard in Washington: Russia’s war and the Beijing-Moscow entente helped the U.S. get Europe more involved in countering China, and now Mr. Scholz’s visit is giving an opening for Beijing. “China’s agenda is to divide through commerce.”
@charleshutzler
https://t.co/cDXgDpDqt3"
1588821165560119296,Sat Nov 05 09:10:59 +0000 2022,@POTUS NO YOU ARE NOT FING LIAR. YOU CHARGE TARIFFS TO BUSINESSES WHEN THE S  T IS BEING MADE IN CHINA WITH YOUR BUDDY. LIAR
1588821143326445568,Sat Nov 05 09:10:54 +0000 2022,"@NordVPN Are you trying to give up service in China and quit China market? It is out of use for more than a month, I have sent several emails, not working at all."
1588821133985722370,Sat Nov 05 09:10:51 +0000 2022,"@ahfazmustaf Except china, others seem far fetched. Remember announcements around investments by wealth funds in Pak just a few months back? 
Why would they invest or lend to a bankrupt and more so an unstable state?"
1588821116256415744,Sat Nov 05 09:10:47 +0000 2022,@DhariDaluwatte @TonyPerera12 @NewsfirstSL India and China there is going to be a high level committee too I have heard
1588821104973742080,Sat Nov 05 09:10:44 +0000 2022,"@berlin_bridge The double face of German Social-Democracy: stating with NATO/USA that 'China is the big danger for the West', stating while visiting that 'China is an important partner for Germany'."
