id,created_at,full_text
1589243514050576384,Sun Nov 06 13:09:15 +0000 2022,Since we’re struggling to shake off our dependency on Russia we may want to take a closer look at China. Great article! 👉https://t.co/9u04GNntWu
1589243502625722370,Sun Nov 06 13:09:12 +0000 2022,"@DarkPrometheus1 @TRHLofficial You may have noticed there are a lot of redundant federal agencies.  He could have put CDC or USAMRIID at the top of the food chain and told NIAID to spend its energy trying to figure out why we were giving China money for gain of function research, or play with legos"
1589243491162284033,Sun Nov 06 13:09:09 +0000 2022,@ModestMama_ They stand with communist china.
1589243490436673538,Sun Nov 06 13:09:09 +0000 2022,"@ClaudiaWebbe Historically yes, but todays top pollution contributors are China, India and Africa! What do you propose they all dismantle their infrastructures and plunge their people into even more poverty?"
1589243488755159041,Sun Nov 06 13:09:09 +0000 2022,"@MrM278 @process_better @JoeTheGoatArdi @ShamsCharania Why lie?
https://t.co/b6RQaPVU7B"
1589243485886246912,Sun Nov 06 13:09:08 +0000 2022,"@SpiritofHo Don't be a wumao..

Building are collapsing like Jenga towers around China . Don't lie about that 

They cut corners corruption is a big thing in China .

They also pay people to post propaganda about how well China is doing.

@laowhy86 
@serpentza"
1589243483344506880,Sun Nov 06 13:09:07 +0000 2022,@socialiststeve6 Actually it’s China. The USA is trying to attain world peace by making all countries follow its rules and expanding NATO. Technically this would be world peace as there’s no more conflict under 🇺🇸 hegemony. But currently China is the largest threat to global conflict
1589243480882425856,Sun Nov 06 13:09:07 +0000 2022,@bandilenxumaIo @ChrisExcel102 @TaylorRMarshall @elonmusk Go to China and you'll know what are the important things
1589243480512962560,Sun Nov 06 13:09:07 +0000 2022,"Goddag! I admire shapes because of their effect in everyday life. Shapes can be seen in all colors and sizes, all around the world like China or Australia. https://t.co/ki2x04QfWq"
1589243478969839616,Sun Nov 06 13:09:06 +0000 2022,The same thing reported by US/West/media. Also applies to China. https://t.co/hhJzBqw7zD
1589243469079678977,Sun Nov 06 13:09:04 +0000 2022,@JoeBiden @JohnFetterman @JoshShapiroPA hello，Joe，i com form china
1589243469016752128,Sun Nov 06 13:09:04 +0000 2022,"@Alex_Panetta The US two-track approach towards China (""we'll compete with confidence; we'll co-operate wherever we can; we'll contest where we must"") follows the EU. So did the UK. So, Canada is just following closest partners. Differences are implementation. https://t.co/SxjxRhITgg"
1589243467737210881,Sun Nov 06 13:09:04 +0000 2022,"Lawmaker @JohnCornyn :The High Cost of Low Military Spending by @wrmead https://t.co/jrc8t0HOrE
https://t.co/cR18uQF1sf"
1589243461517340674,Sun Nov 06 13:09:02 +0000 2022,"‘This Is A Disgrace’: Experts, GOP Reps Call On The Biden Admin To Shut Down A Secret Chinese Police Station In NYC https://t.co/hPl1PiGnT2 via @dailycaller"
1589243457079767040,Sun Nov 06 13:09:01 +0000 2022,Marathon back in #China  #beijing https://t.co/yrNYkXfDL8
1589243452948377604,Sun Nov 06 13:09:00 +0000 2022,why they run away from China ? coz their VIE company need them to be a foreigner.
1589243451279028224,Sun Nov 06 13:09:00 +0000 2022,"My guy here very worried that we won't be able to do WW3 with China if we keep trying to do WW3 with Russia.

P.S. Look at his last name. https://t.co/1dwHCHUCfy"
1589243451182559233,Sun Nov 06 13:09:00 +0000 2022,"@PerceptivePlum @nexta_tv Seems China sitting back and waiting, weaken the global economy with covid then wait until NATO have expended a large amount of weapons and ammunition in Ukraine. Could be messy but let’s hope not"
1589243444782067712,Sun Nov 06 13:08:58 +0000 2022,"@JoeBiden Trump was literally doing that before you came into office, so stop lying! By the way, how is your son doing? Staying off the drug? Kinda hard to do that when you get all the money you need from China buying your paintings!"
1589243440319139842,Sun Nov 06 13:08:57 +0000 2022,"US, allies clash with China, Russia over NKorea missiles #NewsBreak https://t.co/UpcdMlV2Rt"
1589243436678279168,Sun Nov 06 13:08:56 +0000 2022,"@RLTW260 @Games78711 @davidpgoldman tell me you know nothing about china without telling me. 
Investments in these areas only started a few years ago when the trade war started by the US. and it already broke through so many obstacles. China could only make 23nm even just a couple years ago, and now its at 7nm"
1589243432761196545,Sun Nov 06 13:08:55 +0000 2022,Xi exchanges congratulations with #Madagascar's president over 50th anniversary of diplomatic ties https://t.co/RN0R44UhBh via @cgtnofficial
1589243427371110400,Sun Nov 06 13:08:54 +0000 2022,China Evergrande says its interests in land in Hong Kong sold for $637 million https://t.co/sjah2Mc1cm
1589243415354822657,Sun Nov 06 13:08:51 +0000 2022,"@Molson_Hart In all my years living in Canada and ordering tech supplies from China (a lot), only once did I have a problem with an order."
1589243410611048448,Sun Nov 06 13:08:50 +0000 2022,"@thecigarpig @realTuckFrumper And I will bet an equal amount that you voted for a senile old man who, while he was still lucid, sold out the United States to China and other countries for his own personal gain. That would make you a MAWA unchristian globalist I suppose."
1589243398112030720,Sun Nov 06 13:08:47 +0000 2022,"The average household has lost 9k in income due to inflation. Russia might deploy nuclear weapons. Children have been irreparably harmed by lockdowns. Crime is rising dramatically. China could move on Taiwan.

And these losers are most upset by an $8 fee to keep their check marks"
1589243387697594369,Sun Nov 06 13:08:44 +0000 2022,@MaskareRakesh @_Mordeth @stats_feed The West is massively responsible. And its starting to move to Green energy and decreasing emissions. We didn't know The harm a century ago. We do know and China and India keep growing their emissions
1589243376146292737,Sun Nov 06 13:08:42 +0000 2022,China Is Now a Major Space Power by RAMIN SKIBBA for @wired https://t.co/G4Ju7agCmH #sciseekpicks #science
1589243366268616709,Sun Nov 06 13:08:39 +0000 2022,Westworld-esque aqua theme park in China has made a big splash forward with robo-dolphins https://t.co/T4YnQ6XP55 https://t.co/kO69dUnYkv
1589243353341771776,Sun Nov 06 13:08:36 +0000 2022,Jack Maxey reveals Hunter Biden's connection to Ukraine biolabs and Wuhan China - LifeSite https://t.co/KYqkJks2rT
1589243349583777793,Sun Nov 06 13:08:35 +0000 2022,"Look at this news article from The Daily Caller: ‘This Is A Disgrace’: Experts, GOP Reps Call On The Biden Admin To Shut Down A Secret Chinese Police Station In NYC https://t.co/JB3a6fdhjq"
1589243348073971712,Sun Nov 06 13:08:35 +0000 2022,"@XiXiBAT @Geo_phat @gloryoyinloye17 @toyinomotoso China and Nigeria aren't nearly the same. China is the country with the largest trade surplus. In other words, it is the biggest net exporter in total value terms. They devalue for a reason unlike Nigeria which is a net importer. Wrong comparison."
1589243344789856256,Sun Nov 06 13:08:34 +0000 2022,"Taxes, like the fuel duty escalator, were introduced to mitigate for Britain's climate ""impact""; Milliband introduced Climate Change legislation which was essentially a cynical outsourcing of our pollution to places that could care less like China &amp; India."
1589243343250542593,Sun Nov 06 13:08:34 +0000 2022,@Norsunenergy @ExtinctionR Now do china.
1589243341098864640,Sun Nov 06 13:08:33 +0000 2022,@itsattiya Woh china wali neighbour
1589243340738146307,Sun Nov 06 13:08:33 +0000 2022,"Smart Home Inventions! 😍 Kitchen Gadgets | Tiktok China &amp; Japan #shorts #Reels #gadgets #kitchen #HomeDecor #homeappliances #Trending #Viral

↪️ To Buy This Gadget So, Link In My Bio
👇👇👇
https://t.co/9ZguDal5sI https://t.co/J9VjfbOD68"
1589243326704017408,Sun Nov 06 13:08:30 +0000 2022,"@POTUS Why don’t you use your ill gotten $$$ from China, Ukraine, Russia… to pay off student loans; We the Taxpayers didn’t sign for their loans and it’s unconstitutional &amp; criminal for you to steal from taxpayers."
1589243325676392448,Sun Nov 06 13:08:30 +0000 2022,@MischellUtter @mrbcyber One China policy
1589243320747937793,Sun Nov 06 13:08:29 +0000 2022,"From @WSJopinion: Ukrainians are dying to protect the free world from an active alliance of enemies. Once the U.S. presidential campaigns begin, we will find out soon enough which candidates recognize this reality, writes @DanHenninger. https://t.co/lzuznKQneC"
1589243310069383169,Sun Nov 06 13:08:26 +0000 2022,A course correction in America’s China policy https://t.co/8pKsNRg22Q via @BrookingsInst
1589243307687055360,Sun Nov 06 13:08:25 +0000 2022,"@MilitaryEnthus4 @sludge_princes @olgatokariuk Sure, the news of political opposers being jailed has reach the news we know. China has nothing to do with what you're talking about, why do you mention China?"
1589243303861825536,Sun Nov 06 13:08:25 +0000 2022,I don’t think their actions are legal… https://t.co/dbYKsjf2Cw
1589243299549745153,Sun Nov 06 13:08:23 +0000 2022,"@matinyarare @SHlope Which products do you have in Zimbabwe except stealing chrome ore , granite rocks , unrefined gold, platinum matte to China"
1589243292935680000,Sun Nov 06 13:08:22 +0000 2022,"Mike Pompeo on why the government must ban TikTok right now https://t.co/ACAF8jc3Jv #FoxNews I believe China uses
TikTok as a political weapon, to show the ugly and stupid side of our society!"
1589243269388849153,Sun Nov 06 13:08:16 +0000 2022,"@markcurtis30 I lived in China for many years. Never heard a bad thing about England. Def no grudges over the opium war, I guess since the return of HK.
The goal in China is competing with the US over economic hegemony."
1589243258471092225,Sun Nov 06 13:08:14 +0000 2022,"@Ladymondgreen1 @JGademski @DanielAndrewsMP Only because it would interfere with their secret B&amp;R deal, that was signed a few years before. Funny about that. ... https://t.co/WaAQv2asQk"
1589243254603935758,Sun Nov 06 13:08:13 +0000 2022,@Keir_Starmer I'm sure China and india will do their bit too 😂😂🤡🤡
1589243250556440577,Sun Nov 06 13:08:12 +0000 2022,"@FOX19 1. Biden and Democrats have made Christmas unaffordable.
2. Democrats hate Christmas.
3. Most of the things you buy are from China, including fentanyl."
1589243247666556932,Sun Nov 06 13:08:11 +0000 2022,"Germany is fucking dumb if they think they'll have a 'nice' relationship with china 

Germany is naive .. Scholz is completely out of his depth"
1589243230344065031,Sun Nov 06 13:08:07 +0000 2022,Decoupling from #China? They say no! https://t.co/0AJ4n9YZNh
1589243221074485248,Sun Nov 06 13:08:05 +0000 2022,Russia’s war on Ukraine boosts China’s financial ambitions
1589243211666821123,Sun Nov 06 13:08:03 +0000 2022,"@skylanefenatic @aum2512 @ashoswai Some facts; why India has bad relations with all neighbouring countries  like China, Nepal, Bhutan, Sri Lanka, Bangladesh and Pakistan??"
1589243210068787200,Sun Nov 06 13:08:02 +0000 2022,"She clarified that Russia, China and Iran are planning to interfere in the voting on November 8.

“We are concerned that Russia, Iran and China are trying to influence our elections. https://t.co/LwXBociclm"
1589243205790629893,Sun Nov 06 13:08:01 +0000 2022,Of all the good the @UnitedNationss_   could do and instead they waste their time telling @elonmusk how to run @Twitter Seems to me if they want to lecture someone about human rights they should start with #China or maybe #Iran or possibly #Russia but not a private company.
1589243203407859712,Sun Nov 06 13:08:01 +0000 2022,@liqian_ren France &amp; Belgium (to take examples I’m familiar with) started enforcing French around the same time as China did Mandarin. I challenge you to find someone speaking Walloon or any French dialect frequently as usage in school settings was completely forbidden and punished. 2/2
1589243192616288256,Sun Nov 06 13:07:58 +0000 2022,@CathyYuanZhang What was being priced in last Friday was that a covid-exit strategy is currently under development and hopefully be rolled-out post-winter and successfully transition China back to normal by March 2023.
1589243173205069824,Sun Nov 06 13:07:53 +0000 2022,"@7s1n753 @GuillermaNeblin @chenweihua @dwnews Ukraine do not reject negotiation, what they really reject is terms that award Ruassian's invasion......As a chinese, what would you think if someone condemn China not to have a negotiation with Japs in 1941? It is ridiculous to blame a country not to accept a invasive clause."
1589243167295279105,Sun Nov 06 13:07:52 +0000 2022,"@Bilal08272761 @etight @kanyewest @AB84 Hence, to know if a nation is truly democratic, simply find out if the people themselves cannot be criticized - and in China, you cannot criticize any of the 56 officially-recognized ethnic groups."
1589243164577366016,Sun Nov 06 13:07:51 +0000 2022,"@iluminatibot He's bought thousands of acres close to me in Arkansas to keep cattle from being raised. This is not a joke. He buys small farmers out who can't turn down the $$$$$$$$ offer. Between him and China, we're screwed."
1589243155442192384,Sun Nov 06 13:07:49 +0000 2022,"I’m re-upping this post because it’s important.

Remember the morale hit Russia took when Ukraine sunk the Moskva?

Imagine the hit to national CONFIDENCE if China, or even Iran sunk the USS Harry S. Truman? Just imagine it, and have a better plan as a reault. 🇺🇸 https://t.co/TUcSMjALE9"
1589243141861015552,Sun Nov 06 13:07:46 +0000 2022,"@JustXavierB Socialism is diverse, is what the Chinese call their system, so is Sweden. Indeed, they may be not socialist today because of privatisation that started in early 2000s. But let take China and their socialism how it has leapfrogged China across all areas of competition. https://t.co/tzW7khzqz4"
1589243131265921026,Sun Nov 06 13:07:43 +0000 2022,"@WestemeyerSusan Started in China as way of celebrating being single (11/11), then hijacked (very successfully) by Alibaba as an online shopping event.
https://t.co/gZMGjqVB7D"
1589243121657090049,Sun Nov 06 13:07:41 +0000 2022,"@WhitlockJason Social credit scores( china) digital currency in Europe is months away the FED has beem vocal about digital currencyfor 2 years, open borders is old news.

Alex Jones is not smart, he is not crazy....but he  did take the time to read all the open source docs from the WEF. FACT"
1589243120604303361,Sun Nov 06 13:07:41 +0000 2022,"@VoteAmyCox What a joke, that flag was made in China along with everything else."
1589243110516994049,Sun Nov 06 13:07:38 +0000 2022,"Any Germ markets, &amp; Any Germ formerly based replacements, making a Brittle Tin move? An Any Germ port goes partly China unto? Any Germs may going cold very soon. And Any Germ Chancellor goes off to China to lecture President Xi how to run his economy &amp; undertake foreign policy!?!"
1589243108541157376,Sun Nov 06 13:07:38 +0000 2022,"Akama Miki fact is she's 2000L, Canadian preteen model, singer, her father is Japan, mother is China-German https://t.co/gofWsl166u"
1589243088853118978,Sun Nov 06 13:07:33 +0000 2022,"@newsmax DJT did a lot of good for this Country.  But let’s not forget he followed Anthony Fauci, he appointed Mark Milley, he shut us down for “two weeks to stop the spread” AND prior to taking office, all of his ties, etc were imported from China.  Ron D did none of that"
1589243088467562496,Sun Nov 06 13:07:33 +0000 2022,Desperate Germany inching closer to China... Obvious fact. Has USA pushed Russia and now Germany closer to China https://t.co/cLCTW8XJmG
1589243086794010626,Sun Nov 06 13:07:33 +0000 2022,@RLTW260 @DongsMBM @Games78711 The question is whether China can produce enough 7 nm chips (maybe even 5 nm) for its military at high cost. That invalidates the military argument for the US Oct. 6 chip ban. It hits China's economy (and ours).
1589243085841920003,Sun Nov 06 13:07:33 +0000 2022,".@CalChinaClimate Senior Advisor, and @BerkeleyLawCLEE Executive Director @LouiseBedsworth discusses California’s integrated approach to #climate policy at the China Pavilion at #cop27. #climatechange #COP27 https://t.co/gqjeGaNkh3"
1589243083715403776,Sun Nov 06 13:07:32 +0000 2022,"@crehage @CIA_in_China I myself prefer Coolie, looks cool and sounds cool."
1589243068821409794,Sun Nov 06 13:07:28 +0000 2022,"@sendeerqinwang @Horaceeeee @chenweihua @RFI_Cn Suppressing ethnicity’s, their languages and religion. 
Thats modern China."
1589243066128683010,Sun Nov 06 13:07:28 +0000 2022,"@andrew_lilico The difference now is the USA isn't coming to the rescue, they are bankrupt with a weakened dollar reserve currency.  They can't QE their way out of this one. It looks more likely war will be allowed to happen to weaken Russia/China. Either way the poor will pay."
1589243054720159746,Sun Nov 06 13:07:25 +0000 2022,"@RnaudBertrand Oh let's just be friends.  If it isn't Russia that's the problem it's China
 Why can't we just trade. Let NATO join BRICS and save a fortune in war mongering. Peace and love man."
1589243049481150464,Sun Nov 06 13:07:24 +0000 2022,"Europe and US will look very different in the near future and strategic priorities likely to flip. After two years of recession, the West in 2024 will be having a crisis of identity. Question will be what China does. Will US continue allowing it to keep its head down?  We are in"
1589243042195992577,Sun Nov 06 13:07:22 +0000 2022,"Foreigners in China need to take daily COVID test too.

https://t.co/KRmvdXDTyz

If your test is negative, your QR code stays green and you can live a normal life.

If it's positive, you will be sent off to a quarantine camp.

Would you like to come to China for a vacation? https://t.co/Sf5V8RSf3Z"
1589243027658137600,Sun Nov 06 13:07:19 +0000 2022,"At what point do @ChrisKMellon &amp; @LueElizondo go rogue for the benefit of all humans on Earth?

I wonder if they’ve been more deeply considering it lately given Russia-Ukraine, China-Taiwan &amp; N. Korea-S. Korea?

#ufotwitter has your back 100%"
1589243009073549314,Sun Nov 06 13:07:14 +0000 2022,@rr0od broerr bring his ass ovrr here aint no one talking about going to china ben je gek
1589243005181243394,Sun Nov 06 13:07:13 +0000 2022,"@Gedmark you are not getting it right, China accounts for 40%+ share of world total annually in most modern technologies, eg: 4G/5G new sites deployment, fiber connections, high speed rail, metro railway, solar PV, wind power, EV production, STEM graduates (8x of America). Do some google"
1589243002924720129,Sun Nov 06 13:07:13 +0000 2022,"@josephkiefer77 Russia and/or China...

Pick your poison!"
1589242988412428288,Sun Nov 06 13:07:09 +0000 2022,@MaskareRakesh @_Mordeth @stats_feed USA is decreasing its emissions. China is not. Simple. China is More at fault currently
1589242972478242816,Sun Nov 06 13:07:06 +0000 2022,@HowardMortman Is that why China and Russia are building them like wild fire?
1589242971224158209,Sun Nov 06 13:07:05 +0000 2022,@bopanc @ChristopherJM @WSJ China warning Russia against using nuclear weapon is sensible. Not so sensible helping North Korea with nuclear weapons?
1589242954857984001,Sun Nov 06 13:07:01 +0000 2022,"@PalmerReport #VoteBlue 
I want to be more dependent on China 🇨🇳. 
I want to pay more for my food. 
10-4I want to pay more to heat my home. 
I want to vote for politicians who want to change our country to clean energy. 
And have no clue how to get there."
1589242943092973572,Sun Nov 06 13:06:58 +0000 2022,"How many more times wil I have to unfollow self-described leftists who turn out to be anti-vaxxers? Do they even know what China does, or do they somehow chalk that up to Big Pharma too?"
1589242939053834242,Sun Nov 06 13:06:58 +0000 2022,"🇫🇷 Macron heading to Beijing next?

Just a rumour but after Olaf Scholz’ visit, this would be another important signal for 🇪🇺 Europe &amp; 🇨🇳 China relations.

It could also further strengthen the Euro against the Dollar, as investors gain back confidence in Europe’s economy.

$DXY https://t.co/wJfMA117xY"
1589242915989381120,Sun Nov 06 13:06:52 +0000 2022,"@floracozzi @sludge_princes @olgatokariuk There are elections and oppositions in ukraine and there are almost zero representation of far rights politicians in ukraine's Parliament, less than most country in europe. 

Also, it's funny a china shill suddenly cares about democracy lmao."
1589242915679010817,Sun Nov 06 13:06:52 +0000 2022,"@VoteMarsha Then learn how Former CIA, FBI And NSA Officers have worked before.
China can easily do this by chatting in the office."
1589242904773791745,Sun Nov 06 13:06:49 +0000 2022,"@TraderHarneet What's your rationale for Metal Stocks?
China opening up?"
1589242898583031808,Sun Nov 06 13:06:48 +0000 2022,"Small breakthrough already by African + other developing nations to get climate compensation (known as loss and damage) on the official agenda. US doesn't want to ante up for past actions,  just look forward.  China is supportive, butless keen on mitigation.  Interesting dynamic. https://t.co/4wLoPz9Bk2"
1589242893201702912,Sun Nov 06 13:06:47 +0000 2022,@apmassaro3 Maybe try China then?
1589242889963376640,Sun Nov 06 13:06:46 +0000 2022,"@anarcho_ugly @muhammadbutt @Okwonga And by your logic, we attribute North Korea's human rights abuses on China and Russia.

Stop being so juvenile."
1589242877434920967,Sun Nov 06 13:06:43 +0000 2022,I already sold 150 ELE tokens! get it while you can!!! @Johhn_D0e @hhhfcvnn8 @xiaoxiaoshuton3 @adrinastervatin @LuckyLu25337617 @kicakles @longnhung0204 @4CLabs_China @HildaRaglan https://t.co/z33Y1rsbGL
1589242848419123200,Sun Nov 06 13:06:36 +0000 2022,@FoxNews Big Guy getting nervous about his 10% rebate from China ?? oil reserves went somewhere
1589242844661047300,Sun Nov 06 13:06:35 +0000 2022,@MasssoudH @FT The one china principle doesn't mean the current mainland Chinese regime owns Taiwan.
1589242833495818240,Sun Nov 06 13:06:32 +0000 2022,"@Mahuntsu Lmao. There was a period of China exports, that murked the donkey market a little bit."
1589242828508794886,Sun Nov 06 13:06:31 +0000 2022,@mubarakUG How US treats its guests vs how China treats its guests https://t.co/9j0N1SIiVJ
1589242827640561665,Sun Nov 06 13:06:31 +0000 2022,"$PFE riding the ema since 43ish , active sequence been smooth and had er so that's otw now. lot of covid news and winter is coming so may see uptick/china also been hit hard again 

48 / 49 / 50 big spots to see 53 again 

reject 48 and its 46.39 retest if break / 45.27 / 44.68 https://t.co/r2oQggqZSY"
1589242823647571970,Sun Nov 06 13:06:30 +0000 2022,"@CNeytes80 @cindylb56_black @TM72774 @POTUS Trump wasn't  playing  footsie with China  and Russia.  He made them pay their fair share.   America  was respected, feared &amp; energy  independent.  Biden flushed us in the toilet!"
1589242821902749698,Sun Nov 06 13:06:30 +0000 2022,"Don't put your mobey on the bank, pay cash! The Netherland kies #China. They Will controller everything. @VVD @CDA @D66 @CU @PVV @JA21 @BBB @SP https://t.co/OwM5JOJTdC"
