id,created_at,full_text
1590416957584482304,Wed Nov 09 18:52:05 +0000 2022,So why is it okay that China takes over Brazil?
1590416955827068928,Wed Nov 09 18:52:05 +0000 2022,@zombiestitcher @LoveWilko @GardenHomecraft @Shropshire_Gal Probably made in China too!!....🤣
1590416949573734400,Wed Nov 09 18:52:03 +0000 2022,@HyperboreanK1ng @MFA_China The perpetrators all feel that everyone wants to harm themselves.
1590416943940800512,Wed Nov 09 18:52:02 +0000 2022,"@thevivafrei &gt; Early covid days we see people collapsing in China
&gt; Don't see this phenomena here until the mRNA vax rolls out

Is it possible this ""vaccine"" was developed years before we've been lead to believe? Did China have it first and use it on their population without their knowledge?"
1590416941734559745,Wed Nov 09 18:52:02 +0000 2022,@joshrogin @PostOpinions China is on the frontlines of America’s worldwide  cyberwar.
1590416940958359554,Wed Nov 09 18:52:01 +0000 2022,"🎶 Chickity China, the Chinese chicken
Chickity China, the Chinese chicken
Chickity China, the Chinese chicken
CHICKITY CHINA, THE CHINESE CHICKEN 🎶 
#oneweek https://t.co/8E3NelOhE4 https://t.co/VpkeccRAUc"
1590416934478413825,Wed Nov 09 18:52:00 +0000 2022,"Russia Sends Second-Ever Crude Shipment To China Through “Arctic Silk Road”

https://t.co/bf0KAyRATG https://t.co/ytdknlbpFh https://t.co/L74a6isRcz"
1590416930552381441,Wed Nov 09 18:51:59 +0000 2022,Canada’s foreign minister calls out ‘increasingly disruptive’ China https://t.co/2pvVtAxPrk
1590416912504479745,Wed Nov 09 18:51:55 +0000 2022,"@nationalpost tell elon must be careful china:Why did Buffett reduce his  BYD at an ultra-low price? real reason?
reduced  BYD three times , on Nov 1, he reduced his holdings of 3.297 million H shares HK$169.87.It's about china's politics ,very dangerous,to my youtube: teslavsbyd"
1590416901036916736,Wed Nov 09 18:51:52 +0000 2022,"@davesot82569166 @susan_perino @agnesedwinachi @MikeSington It's not a backbone. It's called FASCISM w the intention of supporting an AUTOCRAT. Will you like it when we become Russia, N Korea, China?"
1590416895874060289,Wed Nov 09 18:51:51 +0000 2022,"@lopezlinette That's the problem doing business in China. No rules. They can ""take it back"" whenever ""they"" want."
1590416888923815936,Wed Nov 09 18:51:49 +0000 2022,"#latestnews COP27: Island nations want China, India to pay for climate damage - https://t.co/EZVny9PcpD (POST_EXCERPT}"
1590416886034214912,Wed Nov 09 18:51:48 +0000 2022,"""Germany Blocks 2 Foreign Investment Deals, Taking a Firmer Line on China"" by Melissa Eddy via NYT https://t.co/sD1mgjj4cb"
1590416866149007360,Wed Nov 09 18:51:44 +0000 2022,"Point 6) losing the initiative on China. Biden’s government has taken a hard stance on Taiwan and public moves are being made to combat Chinas influence in government and business. Trump no longer holds this initiative, the Dems have taken it from him."
1590416857236135936,Wed Nov 09 18:51:41 +0000 2022,@coopersweets1 @DonaldJTrumpJr What about his gulf course in China?
1590416853335420929,Wed Nov 09 18:51:41 +0000 2022,@TheRabbitHole84 TikToks algorithm is decided in China. Rs will never be able to beat that stranglehold unless they ban/censor it.
1590416848658784256,Wed Nov 09 18:51:39 +0000 2022,"@elonmusk Why Twitter keep recommending me anti China Tweets, such a political progapaganda tool."
1590416848398405634,Wed Nov 09 18:51:39 +0000 2022,"Russia's really invested in Texas I guess? Or the Dominionists? China? SaudiArabia? wtf

I can't grok that many ppl voting for enforced misogyny, kids w guns, migrant trafficking, a decaying energy grid &amp; disrupting supply chain for whole country

They voted to be monsters, why?"
1590416848151269376,Wed Nov 09 18:51:39 +0000 2022,"@CTVNews tell elon must be careful china:Why did Buffett reduce his  BYD at an ultra-low price? real reason?
reduced  BYD three times , on Nov 1, he reduced his holdings of 3.297 million H shares HK$169.87.It's about china's politics ,very dangerous,to my youtube: teslavsbyd"
1590416840081440768,Wed Nov 09 18:51:37 +0000 2022,"@Cynical_Adult @JeylPrime @Kittyadoglover ""Communism is an economic ideology that advocates for a classless society in which all property and wealth are communally-owned, instead of by individuals."" 
Not Russia. Not China. Those are authoritarian systems. They use 'communism' the same way our right uses 'freedom'."
1590416806615068672,Wed Nov 09 18:51:29 +0000 2022,"@RamaInExile There were practical schoo of Tibetan Buddhism before invasion of china
Now they have disappeared 

Now only theoretical knowledge is left"
1590416796343242752,Wed Nov 09 18:51:27 +0000 2022,"China &amp; India - World's top CO2 emitters are snubbing U.N. climate summit! Together, these two nations account for 33.6% of planet's carbon-dioxide emissions https://t.co/aGEdRyfcS3"
1590416771739439104,Wed Nov 09 18:51:21 +0000 2022,"China's consumer prices stable, factory prices drop. https://t.co/VoKlhID9Su"
1590416759919869952,Wed Nov 09 18:51:18 +0000 2022,@SteadfastBarb @JanisIrwin @Feisty_Waters ...made in a sweatshop in China
1590416754513018880,Wed Nov 09 18:51:17 +0000 2022,"@TysonMurdockt @EverretBaker @AntonVonClouse @marklevinshow Youre right. And America is full of geniuses I watched oppose their own country regarding the trade war with China.
Youve been tricked by the Democratic party"
1590416753750052864,Wed Nov 09 18:51:17 +0000 2022,"Amazon Disrupt Three Major Counterfeit Networks, 240,000 Items Seized in the Guangdong China Province.
https://t.co/D4RmwMPwAD
https://t.co/u5jO6Mv0zv
#toner #tonercartridges #tonercartridge #InkCartridges #Printing #Ink #Hp #Canon #Ricoh #Konica #Xerox #Lexmark #Closedloop https://t.co/yBlq7DYmJW"
1590416737375518720,Wed Nov 09 18:51:13 +0000 2022,"@punished_ellen People have been predicting China’s downfall for decades now and it has never happened. I sincerely doubt it. Besides, again I’m not sure what this has to do with anything I was talking about originally."
1590416729993535489,Wed Nov 09 18:51:11 +0000 2022,@elonmusk Tell us when u sold out to China?
1590416720229195777,Wed Nov 09 18:51:09 +0000 2022,Travel giant hosts metaverse gourmet event; Chinese airlines vow to promote SAF #DailyBrief China-developed passenger jet nets 300 new orders; Cathay Pacific names new CEO. https://t.co/4Peq6JVg8N
1590416710066405376,Wed Nov 09 18:51:06 +0000 2022,"@JamesMelville Why does China need that, they all look the same"
1590416707092631552,Wed Nov 09 18:51:06 +0000 2022,"@Diggz206 @donwinslow That is NOT true!  I love hearing tRumps crimes laid out like fine china!  So exquisite!  But absolutely nothing being done about them is what pisses me the fuck  off!  #TrumpIsACriminal 
#LockHimUpAlready 
#GQPareEVIL"
1590416683503562752,Wed Nov 09 18:51:00 +0000 2022,"MELBOURNE, Australia — China has at least 200 stealthy J-20 fighters and more than 240 J-16 multirole strike aircraft in service, based on analysis of construction numbers painted on the jets by a Chinese military aviation expert.

https://t.co/UJ81WldmtR"
1590416677766049792,Wed Nov 09 18:50:59 +0000 2022,"@JamaicaGleaner when I was in Jamaica I bought some souvenir for friends and family I was shock to find out they were all made in china.

you all destroyed the craft market because of creed.

you people are full of verbiage and nothing else"
1590416662284578816,Wed Nov 09 18:50:55 +0000 2022,Fury as minister says MoD were told in 2019 ex-RAF Top Guns were recruited by China to train pilots https://t.co/6aRMYo2w80 https://t.co/CMdQUKJsct
1590416645142773765,Wed Nov 09 18:50:51 +0000 2022,"“Russia, China, and the west”
A book authored by me with two very competent and thoughtful writers @AndreasDripke and Hang Nguyen.
The book is worth reading for everyone interested in International Politics and International relationships.

https://t.co/iLRPmCBCKe"
1590416637572034560,Wed Nov 09 18:50:49 +0000 2022,13 % of China’s oil comes from Iran
1590416624469016576,Wed Nov 09 18:50:46 +0000 2022,"China's People's Liberation Army 92493部队 has a Extreme Risk Level 
 https://t.co/y6WkhG1hw2 #china #osint #beijing #technology #military #research #security https://t.co/jkwvW0NtYF"
1590416624188002304,Wed Nov 09 18:50:46 +0000 2022,"@MFA_China That's because whether Democrats or Republicans, they're fed up of China so trying to meddle in their democracy is pointless."
1590416617640718337,Wed Nov 09 18:50:44 +0000 2022,"@vtchakarova then ban all imports coming from china then, you guys wouldn't even have an iphone to play with"
1590416597730353153,Wed Nov 09 18:50:40 +0000 2022,@DavidLanphere @JaniceDean Ummm “recycling” it literally lands it in the ocean. All the way to China! It falls off the ships.
1590416586334441473,Wed Nov 09 18:50:37 +0000 2022,"@LukasNeusser @WarMonitor3 It would wreck Russia's relationship with their only strong ally China. Its not worth nuking Kherson because nothing would be gained, many Russian people would be horrified and NATO would have good cause to get involved."
1590416584400863232,Wed Nov 09 18:50:36 +0000 2022,@FNFlirtyDoc 💯Agree! Trump laying waste to the GOP like a bull in a china shop is the food fight/dumpster fire I've been waiting for. https://t.co/Eca2hQMV2B
1590416575915388930,Wed Nov 09 18:50:34 +0000 2022,Germany blocks sale of chip factory to China over security fears - CNN https://t.co/Jqf3jPcQNP https://t.co/iBUY49vrmz
1590416564352061441,Wed Nov 09 18:50:32 +0000 2022,"@StateDeptSpox @USTreasury Mr Price, please review corrupt actions in #DRC #RareEarths sector. The #ManonoLithium Project (the worlds largest) is under siege from China #ZijinMining and #SimonCong. The #DRC Financial Auditor identified the issue —but bribery prevails! @AvzMinerals @USAmbDRC @KiengeKki"
1590416542860079106,Wed Nov 09 18:50:26 +0000 2022,@HagTruth @bennyjohnson cheap ill-fitting suits made in china 🙄
1590416536145375232,Wed Nov 09 18:50:25 +0000 2022,@zaktivist @JoshuaRatcliff5 @JustStop_Oil Go to China the biggest polluters on the planet
1590416534228578304,Wed Nov 09 18:50:24 +0000 2022,"Between April and now, the governments of US, UK, France, Israel, South Africa and China have sent their envoys to meet with Asiwaju either in his Lagos house or in his Abuja residence. They know he's the next President of Nigeria! https://t.co/2d7Xu7DPBf"
1590416521448550400,Wed Nov 09 18:50:21 +0000 2022,"I've never seen so many beatings in crypto. 

China fud / tether fud was nothing compared to this. We might be hitting capitulation, similar to BTC dropping at 6k to 3k."
1590416515417133056,Wed Nov 09 18:50:20 +0000 2022,@NotAmira_ @POTUS Sounds like you speak for China
1590416514615676928,Wed Nov 09 18:50:20 +0000 2022,@SouthAsiaIndex Putin has run out of Sunni Muslims he can use to fight Russia's wars. The Christian Rus don't want to die for Russia now the Sunni Muslims are wondering why they should die for a country which *supported* US wars on Afghanistan &amp; Iraq. China at least opposed those wars.
1590416513957507072,Wed Nov 09 18:50:20 +0000 2022,"The wide scope of measures aimed at cutting #China off from high-end #semiconductor chips and preventing civilian-to-military transfers means the impact will be far greater than previous, narrower controls, experts say. https://t.co/VZpQuVhMGW"
1590416510555918336,Wed Nov 09 18:50:19 +0000 2022,"@tracesoffaith Yes, in China. I’ve attended the state sponsored 3-Self Church, as well as numerous house churches."
1590416504201555970,Wed Nov 09 18:50:17 +0000 2022,"@chineseciv For those who still hold a dream about ""Taiwan is the real China"", do not forget the Chinese government murdered hundreds of thousands Taiwanese in 228 Incident when they first came to this island, and began decades of White Terror that only ceased after more bloody struggles."
1590416499621376000,Wed Nov 09 18:50:16 +0000 2022,@LauraD_In_Indy @SashaBelleSun @Paultx890 Racist remarks about China were off-putting too
1590416494692687874,Wed Nov 09 18:50:15 +0000 2022,"@philosophy203 @dannie_oa Lmao, China is literally an atheist country but go off"
1590416477810630656,Wed Nov 09 18:50:11 +0000 2022,"@Jut52164630 I am butt hurt, bought at $270 pre split and got stopped out at my entry back in 2020… However this company is way too hyped. The car market is very cyclical and Tesla will get more competition from China and Europe. What also concerns me is the lack of quality"
1590416475596414976,Wed Nov 09 18:50:10 +0000 2022,@Hh81227003 @Youngblod1985 @sunak_is_a_liar @JustStop_Oil Go protest in China. See how that works out for you
1590416471137873921,Wed Nov 09 18:50:09 +0000 2022,"@elonmusk you should understand @China OWNS YOUR FACTORY , as a communist controlled country stealing all your secrets @Timcast Semper Fidelis 
https://t.co/MkSEasC38a"
1590416470630096900,Wed Nov 09 18:50:09 +0000 2022,"TRUMP LIE #23162

""What we've done on trade deals is incredible  with Mexico, with Canada, with South Korea  taking deals that were horrible and making great deals. And now we're in the midst of China and others.""

#TFG  #Trump"
1590416457661583361,Wed Nov 09 18:50:06 +0000 2022,@elonmusk @SpaceNews_Inc China probably stole all your tech designs and realized your way was better
1590416445955256320,Wed Nov 09 18:50:03 +0000 2022,"Oil prices ease on U.S. inventory build, China COVID worries https://t.co/VwTvWPstS9"
1590416438430691329,Wed Nov 09 18:50:02 +0000 2022,ask CHINA thats a question for CHINA https://t.co/67Q5UiIdtS
1590416437726023682,Wed Nov 09 18:50:01 +0000 2022,@SpokespersonCHN With Communist china's government buying western  politicians as prostitutes' for political gain. No wonder  Anti-democratic countries like China are keen on exacerbating political divisions in the world to try and influence political figures to get their desired policy outcomes.
1590416434558951424,Wed Nov 09 18:50:01 +0000 2022,"@Ac44Anna @ananavarro Only you people see a Dem victory as good news.Oh , I forgot, China is happiest of all."
1590416431489126400,Wed Nov 09 18:50:00 +0000 2022,"@blindboypdx @MFA_China Well, according to your logic, China should support the U.S. riots so that China will have the opportunity to send troops to occupy some areas and tell the U.S. it never belongs to the U.S."
1590416430884716544,Wed Nov 09 18:50:00 +0000 2022,"#China is facing increased “instability” and “uncertainty”, Chinese leader Xi Jinping warned the top brass of the country’s military  

(Reports @spatranobis) 

https://t.co/zhPf8nr4r7"
1590416430725414913,Wed Nov 09 18:50:00 +0000 2022,"""The first step is calling it what it is"" https://t.co/0PAU7iPi14"
1590416428515364864,Wed Nov 09 18:49:59 +0000 2022,"@rocketjane1 
Zelensky puts forward a bill for complete mobilization and martial law.
Ukraine losses must be horrendous.
He is also seizing everyones assets including those of the Chinese and his best friends.
Ukraine is on a collision course with China https://t.co/WuWwIwbdmh"
1590416427319975937,Wed Nov 09 18:49:59 +0000 2022,"@72gante @IanDunt Oh I don't know, perhaps because India, Pakistan and China have been fighting since partition and, frankly there are questionable actions on all sides? 

It's hardly like Pakistan is invading Punjab or China is shelling Kolkata is it?"
1590416421603143680,Wed Nov 09 18:49:58 +0000 2022,"So, Binance v/s FTX is basically China versus America https://t.co/4ESRrQ0ebW"
1590416417379463169,Wed Nov 09 18:49:57 +0000 2022,The demographic weight of countries such as China and India exercise a massive pressure on our wages and salaries
1590416416070848512,Wed Nov 09 18:49:56 +0000 2022,"If only the world looked at China &amp; Islam as what they really are, dangerous viruses &amp; parasites. In that case many people would still be alive &amp; many more would be happier.

#Hijab #Terrorism #Mahsa_Amini #Corona #ChineseViruse"
1590416399000031234,Wed Nov 09 18:49:52 +0000 2022,@marlon_humphrey Let us come to hop in
1590416397842411520,Wed Nov 09 18:49:52 +0000 2022,"Wow! This animated infographic! No more, 'but China...' while the clock runs down. https://t.co/X3zueCNEW6"
1590416396500230144,Wed Nov 09 18:49:52 +0000 2022,"The Tianzhou-4 cargo spacecraft, carrying supplies for China's space station, separated from the orbiting station combination at 2:55 p.m. Wednesday (Beijing Time) and switched to independent flight, after completing all assigned tasks, according to the China Manned Space Agency"
1590416395921395712,Wed Nov 09 18:49:51 +0000 2022,"@SamRamani2 Losing Siberia to China will be the biggest one, just wait and see."
1590416385850548224,Wed Nov 09 18:49:49 +0000 2022,"Amazon dismantles 3 counterfeit ops in China, with more than 240,000 items seized - MarketWatch https://t.co/4Eh1MPFQpt"
1590416376321413121,Wed Nov 09 18:49:47 +0000 2022,"All the marketing that the east is ""more based"" than the west is just that, marketing. 

The world is in a very bad state. Optimistic CN bros are coping, but it will only get worse.

Only way things will start looking up is if China and all of Africa becomes Christian and ascend."
1590416361532317697,Wed Nov 09 18:49:43 +0000 2022,@Concern70732755 If we allow this in our country we will be one step closer to China. Social credit scores is the goal of the government and the WEF. This is the hill we must take our stand on.
1590416353751486464,Wed Nov 09 18:49:41 +0000 2022,@Theresa_sSon @philosophy203 you go China before?
1590416351692091392,Wed Nov 09 18:49:41 +0000 2022,"@Frank49049002 @marklevinshow Oh, like the billionaires and Republicans in Congress that got PPP funding and the farmers who TFG gave $12 billion in subsidies when his tariffs wiped out their ability to sell into China. How much of inflation today is attributable to price increases due to TFG’s tariffs?"
1590416350077673473,Wed Nov 09 18:49:41 +0000 2022,"What a sad story.... A person jumped from his unit to protest the ""Zero-COVID"" policy with strick lockdown! This happens everyday is mainland China! The Chinese people are the biggest victims of the Chinese Communist Party of Emperor Xi. #TakeDownTheCCP https://t.co/H3zX8pym0A"
1590416338971168769,Wed Nov 09 18:49:38 +0000 2022,City Lights of China confirms moving from Dupont to Adams Morgan! https://t.co/w4kf02uXgU https://t.co/IFf1PG6ecf
1590416334382596096,Wed Nov 09 18:49:37 +0000 2022,"@Hh81227003 @Youngblod1985 @sunak_is_a_liar @JustStop_Oil And those never happened before?
What exactly do you think you're achieving? The UK is at the forefront of converting to renewables. And anything we do is just pissing in the wind anyway if China doesn't take meaningful action"
1590416328212774912,Wed Nov 09 18:49:35 +0000 2022,@beinlibertarian That adage no longer applies. Our wokist cult-ure mirrors maoist China's cultural revolution. Cancel culture sadly works.
1590416318859182080,Wed Nov 09 18:49:33 +0000 2022,Hungary’s history-making short track speed skating brothers seek new country https://t.co/CuQexqo2SH https://t.co/lQgxUyL0d3
1590416316758134785,Wed Nov 09 18:49:33 +0000 2022,"Disgusting.  This will never be seen as normal. 10, 20, 30 years from now it still won’t be accepted in mainstream society.  This is embarrassing.  China is laughing at us! https://t.co/1fxtsAIt5G"
1590416305118937088,Wed Nov 09 18:49:30 +0000 2022,@RonFilipkowski Lindell uses China &amp; Democrats as the bad guys since he's a Russian stooge.
1590416290841526274,Wed Nov 09 18:49:26 +0000 2022,"the lines ""chickity china the chinese chicken, chickity china the chinese chicken; Harrison Ford, Harrison Ford, Harrison Ford, Harrison Ford, Harrison Ford"" really resonate with my soul"
1590416287871954944,Wed Nov 09 18:49:26 +0000 2022,@DimitrisGregan @MFA_China Sorry not sorry. Global powers internal affairs affect everyone and everyone is allowed an opinion. You just don’t like our opinions. Too bad.
1590416287188275201,Wed Nov 09 18:49:26 +0000 2022,@blackintheempir That's entirely due to the fact that China and India between them have more than 1/3 of the total population of the earth.
1590416282033459200,Wed Nov 09 18:49:24 +0000 2022,@JedediahBila China owns Biden and the Democrats! Wake up!
1590416276836716545,Wed Nov 09 18:49:23 +0000 2022,"@ianrowley677 @superseven23 I'm 63 &amp; I can assure you in my lifetime consumerism didn't start until 70's/80's
Quality Products were made In UK to British Standards and repairable.
Now everything is poor quality made in China to be used &amp; thrown away instead of repaired."
1590416276454637568,Wed Nov 09 18:49:23 +0000 2022,"From increased regulation and third-party oversight to the intersection of #5G and the metaverse, #Vertiv global experts identify their 2023 #datacenter industry trends 👉 https://t.co/kMi0xM49Tn https://t.co/WpqTTAhlYI"
1590416274307567616,Wed Nov 09 18:49:22 +0000 2022,@Conservatives o rishy dishy Crobin left the Labour Party year ago ! The clue is inthe title pm and qs ! Not avoiding the question or answer another one but here the good fairy check you fact s ! But I have questions  german big export is China ! https://t.co/U9TJKe5meZ so why !
1590416273753919489,Wed Nov 09 18:49:22 +0000 2022,"The war of Ukraine is because Russia considers itself to be a player, and the US doesn't. That's it. I've said it 6 month ago. US told it to prove that it's a player. Russia picked up the challenge and choked on it. Russia is not a player. Same challenge will now go to China."
1590416253398568960,Wed Nov 09 18:49:17 +0000 2022,"The American dream to own one’s home has circulated far and wide, from Australia to Canada and China. While the saying goes that an Englishman’s home is his castle, it’s not so much the German dream and Romanians don’t see what all the fuss is about...

https://t.co/A0x6jsscq7 https://t.co/9LlAJJth1H"
1590416245156851713,Wed Nov 09 18:49:16 +0000 2022,"Zak what's your occupation 
Zak what does she work at 
Zak do you live with Mummy and Daddy
Zak using his Chinese phone that walked from China hilarious https://t.co/DIYbGSvBzV"
1590416230640652288,Wed Nov 09 18:49:12 +0000 2022,@nainen66 @KJYUENS Why is it believed in China that Didi has something to do with Esther Yu so they don't like that yue meets him again but obviously they are good friends and brothers
