id,created_at,full_text
1589005664277651456,Sat Nov 05 21:24:07 +0000 2022,@cheesindave @mbrookerhk That’s from China thou
1589005653649293312,Sat Nov 05 21:24:04 +0000 2022,Free Older Adult Diaper Punishment Old People′ S Samples with Free Shipping on https://t.co/Xt9swdDO2s https://t.co/3PQRV26OVn via @madeinchina_b2b
1589005649928949762,Sat Nov 05 21:24:03 +0000 2022,"#luotianyifact :  grand winning entry of the ""Vocaloid: China"" contest, a contest held for choosing the design of the first Chinese Vocaloid. She is developed by Bplats/Shanghai He Nian and Yamaha."
1589005649882800129,Sat Nov 05 21:24:03 +0000 2022,Quit letting China buy land in the United States.
1589005643222249472,Sat Nov 05 21:24:02 +0000 2022,@BetteMidler If you want a country run by communism move to China or Russia.
1589005628424749056,Sat Nov 05 21:23:58 +0000 2022,It’s crazy how Lebron got a lot to say. Right now against @KyrieIrving but couldn’t say shit on the China situation ok we see you puppet 👌
1589005625459347457,Sat Nov 05 21:23:58 +0000 2022,"The Boston Accords have been passed by American. These accords would see a global front of America, Germany, Russia, and China on a united front to stabilize the region and see a 10-year stabilization plan.   however, these accords must be passed by the other countries."
1589005604273934336,Sat Nov 05 21:23:53 +0000 2022,@MichaelP_ussy69 @__iTweet__ @SportsCenter Where’s the other one at. China?
1589005602453590016,Sat Nov 05 21:23:52 +0000 2022,@chuckwoolery @RonDeSantisFL  Republicans will win however Dec starts Social scoring system from China Aka digital currency. Anyone against it will have all they own money homes education children HOSTAGE until they comply - run by China - 5G surveillance system &amp; help from illegals
1589005600390021120,Sat Nov 05 21:23:52 +0000 2022,@xinepeng Ye exactly it’s gonna be interesting to see if he censors things said about China on Twitter now because of backlash
1589005578692878336,Sat Nov 05 21:23:46 +0000 2022,@Okwonga And Winter Olympics in Russia (2014) and China (2022).
1589005576360824832,Sat Nov 05 21:23:46 +0000 2022,@simonahac @JohnMagnusson You can thank Howard for no solar panel manufacturing. When UNSW scientists asked for help he said no. So off they went to China and California. Here endeth the lesson!
1589005576285327361,Sat Nov 05 21:23:46 +0000 2022,@GoodGuyIke_18 Figures.. that pisses the NBA off yet they still do business in China… weird how that works huh?
1589005554349117441,Sat Nov 05 21:23:41 +0000 2022,"@reals1mple @dijoni I hear you. Still wouldn't live there, please go to Joe Rogans podcast and listen to that North Korea survivor story 😢.

That story makes China look like Switzerland or Danmark."
1589005552717553665,Sat Nov 05 21:23:40 +0000 2022,"@MayoIsSpicyy Trump was the best thing for your Country! Your boarders were safe! Gas cheap! You weee relying on Putin for your, thanks to Biden! Plus Biden let Putin build his pipeline ad cancelled your ! Your country is not self reliant! Pretty soon China will own America. 😇"
1589005552394600448,Sat Nov 05 21:23:40 +0000 2022,I'm tired of fighting a European war the Western hemisphere can do better support each other will be unstoppable hear that China not worried about Russia North Korea needs to back off or else bad things are going to start happening stop being influenced by Russia and China
1589005547604516864,Sat Nov 05 21:23:39 +0000 2022,Fed ends enforcement action against one of China's Big Four banks https://t.co/aqaz2VmPJH
1589005544827789312,Sat Nov 05 21:23:38 +0000 2022,It’s important to understand that after collapse in Ukraine the modern Putin’s Russia is not a predator anymore but a food. Mostly for China.
1589005536170606592,Sat Nov 05 21:23:36 +0000 2022,"The uber rich and transnational organized crimers / Putin/China/etc. are playing for keeps,folks. Do not underestimate them. NO fear just be smart. He isn't losing anything,I'd say-it isn't his money that bought Twitter,imo he is a front man just like DFG,meant to shut us up. https://t.co/pA1OnCD5vH"
1589005523915247618,Sat Nov 05 21:23:33 +0000 2022,"@songpinganq I never saw street vendors in Canada. But here in Thailand they're everywhere, i saw lots in Cambodia and Vietnam too. Idk why China hates them so much lol"
1589005515698622465,Sat Nov 05 21:23:31 +0000 2022,@gnuman1979 I'm guessing China or Taiwan?
1589005511965708288,Sat Nov 05 21:23:31 +0000 2022,@travelernjusa @lidangzzz Sufficient mRNA vaccination and populous infections (vaccine and natural immunization) is a must for preventing large-scale Omicron outbreak and Omicron-related deaths. Comparison of pandemic case spikings between EU &amp; US VS. TW&amp;SK&amp; JP well illustrated this. China lacks both.
1589005505363841024,Sat Nov 05 21:23:29 +0000 2022,@MayoIsSpicyy Like previous tweeter colluding with Biden not to show how corrupt he is and how he got money from China? Is that Democracy electing a corrupt Biden by withholding information of his dealings. I like Elon.
1589005502847258624,Sat Nov 05 21:23:28 +0000 2022,@POTUS We don't want to hear form a fake President who got  Loans he didn't have to pay back from Communist China.
1589005499089186816,Sat Nov 05 21:23:27 +0000 2022,@MrAndyNgo @aaroncarter Another Victim of China's War against America
1589005493921406977,Sat Nov 05 21:23:26 +0000 2022,"@TheoFleury14 if you mean true communists, they don't. If you mean the fake communists like in China, they hate the truth for the same reason conservatives hate the truth, it exposes their lies."
1589005480948797440,Sat Nov 05 21:23:23 +0000 2022,"China fears the US might carry out another biological attack.

Remember, that China accused the US military of spreading what they call Covid in Wuhan. https://t.co/P1sRVlP6sI"
1589005467640266753,Sat Nov 05 21:23:20 +0000 2022,"@Noellervschultz @OCHalosFan @RobertKennedyJr if you look hard and deep enough, you can easily find out that the US is under deep influence of China."
1589005447801221120,Sat Nov 05 21:23:15 +0000 2022,Renewed Push to Ban #TikTok as #FCC Commissioner Cites National #Security Concern #china #shorts https://t.co/mSbcJ0ZGzK https://t.co/apIvclDavu
1589005440960319488,Sat Nov 05 21:23:14 +0000 2022,"@HaydenGr3y @oneshottezza @DeathbedsNFT @elonmusk Firstly, ROC still exists now and is commonly called Taiwan. So get your self educated and correct the spell mistakes. Secondly PRC, especially is a communist country by its constitution. Seems you neither know China nor know communism."
1589005432005492736,Sat Nov 05 21:23:11 +0000 2022,"https://t.co/TU5NHsiuhc
Since we know the first person in China was a black person 
https://t.co/GNWjy9I5Og
Then it'd  not racism its denial of the Chinese to accept me as 
THE KING AND LEADER OF ALL THE CHINESE PEOPLE"
1589005431338598400,Sat Nov 05 21:23:11 +0000 2022,"Was in some market in China Town Vegas, and they have KOF drinks??? https://t.co/b7l2xZ6NhD"
1589005424942288897,Sat Nov 05 21:23:10 +0000 2022,"@RefugeOfSinner5 @PaulMitchell_AB You should move to China. 

Enjoy their semi permanent COVID lockdowns because their vaccinations don't work."
1589005411314958337,Sat Nov 05 21:23:07 +0000 2022,Maybe not. Countries are willing to ditch the inflated USD. Russia already holds more gold than USD. China already doing trades in Yuan and Euro with russia and others. Countries are halting the purchase of US treasury bonds. And finally: #Bitcoin is for everybody
1589005399902285824,Sat Nov 05 21:23:04 +0000 2022,"@WhiteHouse @usedgov This is such crap. You take a loan out you are responsible to pay it back, no one else. Made in China Biden is just trying to buy votes..FJB!!!!"
1589005395145945088,Sat Nov 05 21:23:03 +0000 2022,@glory98matondo Does Zouma live in China?
1589005380285530112,Sat Nov 05 21:22:59 +0000 2022,"Wow. Interesting.  

Also I keep hearing he’s beholden to China and the Saudis but not Putin? https://t.co/ZplXlEugw3"
1589005378372521984,Sat Nov 05 21:22:59 +0000 2022,"Indonesia , China , Korea ~ ♡ I Love It"
1589005346814955521,Sat Nov 05 21:22:51 +0000 2022,"@ACTBrigitte Like all the crap tRump sells? Oh, wait......it is all made in China."
1589005278087106562,Sat Nov 05 21:22:35 +0000 2022,"@MrKamikazeJr1 @cz_binance He already is, his statue up his left, (in china)"
1589005271338479616,Sat Nov 05 21:22:33 +0000 2022,"@drlorileeoates Immigration is about bringing in cheap servant labour, yikes, is that true, We do you use India and China for low-wage manufacturing and low-wage services, bringing them here is the next step, I guess, Liberals, there is tongue and cheek here."
1589005262450413569,Sat Nov 05 21:22:31 +0000 2022,"@USForcesJapan China and Russia do this as a normal thing ! What is the big fuss ? 😂
https://t.co/1UGxpTxrod"
1589005245539291137,Sat Nov 05 21:22:27 +0000 2022,@andygawt your off. You seem to be a tool of the Neo Lib/Con machine pushing the idea that we have to push against China. Yes Elon is an attention whore at best &amp; leans right. But the right &amp; the left both love having an enemy to focus on promoting our aim for global unipolar dominance
1589005226299822083,Sat Nov 05 21:22:22 +0000 2022,I hate listening to music on earbuds i wanna do some illegal things like hugging.
1589005217101910016,Sat Nov 05 21:22:20 +0000 2022,All countries accept to remove CUBA from the USA sanctions but ISRAEL &amp; USA disagree to remove CUBA suniction. America is terrorist country in the world. China and RUSSIA is good time to help CUBA and their families https://t.co/XTJQac5D5S
1589005213557719040,Sat Nov 05 21:22:19 +0000 2022,@NPSusa @covie_93 To make China and the Khashoggi murderer happy.
1589005213028884480,Sat Nov 05 21:22:19 +0000 2022,"@financialjuice They can’t just say now they will open up, too soon after Xi’s confirmation of 3rd term where he re-affirmed that China’s Covid policy is the right thing to do. Doesn’t mean that they will not re-open after next CNY, they most likely will. Markets know it and rebound will go on."
1589005212030709761,Sat Nov 05 21:22:19 +0000 2022,@POTUS Apparently except containing Russia and China....
1589005210164174848,Sat Nov 05 21:22:19 +0000 2022,Egyptian official speaks highly of China's efforts in tackling climate c... https://t.co/CZ6gpQJWsl via @YouTube
1589005206792163329,Sat Nov 05 21:22:18 +0000 2022,Elkeson has returned to China as Three Towns are the front runner to sign him as Stanciu is rumoured to look to leave after only one season.
1589005198965739521,Sat Nov 05 21:22:16 +0000 2022,@DonLew87 Nothing about China
1589005193852911616,Sat Nov 05 21:22:15 +0000 2022,"@CCCanidiot @zmacgilchrist @EmilieTaman China. Can't leave the house in lockdown. 

Btw, been in Canada the entire time, never saw a ""man with a gun."" You've been able to go out to the store, other people's houses, and lately the bar, the restaurant, the gym, without even a mask. 

What the hell are you talking about?"
1589005192233881600,Sat Nov 05 21:22:14 +0000 2022,@KingJames before you speak on peoples being hurt speak on the things China does to people #ShutYourSelloutMouth
1589005177700626434,Sat Nov 05 21:22:11 +0000 2022,"Democrats will however indoctrinate your children, and grandchildren to Sex crap, they will raise your taxes, they will sell your oil reserves to China, they will raise gas prices after midterms, they will lock you up in a elderly home not to see family and they will LIE."
1589005168687067136,Sat Nov 05 21:22:09 +0000 2022,"@MiyatakeCalvin @LucasFoxNews You are uninformed! We are one out of only 7 countries in the world that allow abortions up to birth, along with China and North Korea! Come on now, have you done a study on the stages of gestation of a human being? Get enlightened"
1589005161372225536,Sat Nov 05 21:22:07 +0000 2022,@ElderWarriorMTL @CBCNews Now do china and India.
1589005157005942784,Sat Nov 05 21:22:06 +0000 2022,"@markhumphries If anyone should be heckled, it's China Dan."
1589005155542142976,Sat Nov 05 21:22:06 +0000 2022,Why China Didn't Copy the Soviet Union's Economic Policy EXPLAINED https://t.co/aTbHERjcrB #China #USSR #Economy via @SpiritofHo
1589005155051397121,Sat Nov 05 21:22:05 +0000 2022,"When we lived in China, if someone with a particularly thick accent started talking, wife would look at me for help or hand me the phone so I could deal with them... Imagine my dismay now to have to do the same the further north we move in the UK 😅 I thought I knew English!!! https://t.co/fXy0oA9gkK"
1589005144943099904,Sat Nov 05 21:22:03 +0000 2022,"@Sephiro02083354 @DIY_NikolaTesla @xtr0py @IamCelineMarie @Christi94539879 @ChariotPrince @HvassVon @JeremyDHawkins @khirinknight @WayofK1ngs @CicadaMk @_n_Jack @AlwayzDazed @Nikolaj_Nobody @CueTeam17 @knux007 @Ladyliberty993 @mkfawkes2 @Edibal2 @christianitycom @JoyceMeyer @vcopeland @able2know @facebook @neffex @CIA @china @jacindaardern @POTUS @JoeBiden I remember going thru the same thing. It seems too personal &amp; profound for anyone else to possibly have seen what I've seen, but I learned humility early in life, most don't. We all saw something nobody else saw. We find each other so we can combine it all, but first, consensus."
1589005126324584448,Sat Nov 05 21:21:59 +0000 2022,"@yujiinss Saying no one cares but the hate even went to South Morning China Post 💀

Knetz hate (that also part of kpop stans) hate every successful idols is not something new"
1589005122067386368,Sat Nov 05 21:21:58 +0000 2022,"@PhillipsPOBrien @Odin_Arg All manual labor,,, never as long as human slaves are free, and made in china."
1589005114404225025,Sat Nov 05 21:21:56 +0000 2022,China vows to continue with ‘dynamic-clearing’ COVID strategy https://t.co/14xJi0uFOM
1589005101557256192,Sat Nov 05 21:21:53 +0000 2022,"@guardian ""china has no intent in stopping caring for it's citizens, global supply chains that tried to exploit them be damned"""
1589005096246906880,Sat Nov 05 21:21:51 +0000 2022,"@EBHarrington Most interesting. I can't see the USA ever recovering its balance and getting ahead of this TBH. *Maybe* EU regulators can mitigate the worst harms. Else the only player left is China, who would give the likes of Musk short shrift, not necessarily with our best interests in mind."
1589005082913550336,Sat Nov 05 21:21:48 +0000 2022,"@KimDotcom Exactly. The average person can only think of things like this superficially because they neither have the intelligence, nor interest in finding out the truth. The West cannot allow this competing NWO led by China-Russia to continue. It's that simple."
1589005073367048192,Sat Nov 05 21:21:46 +0000 2022,Video captures screaming woman dragged to quarantine camp in China https://t.co/KJci6vYZWo
1589005068988461056,Sat Nov 05 21:21:45 +0000 2022,@labelles_china Being in electronics a lot of people would ask my advice on products to buy. Every time they would ignore advice on quality and buy the cheapest. Probably the same reason they chose the cheapest trump they could find. Lies instead of action. Sad sad sad
1589005064978714624,Sat Nov 05 21:21:44 +0000 2022,@PierrePoilievre Trudeau really thinks a supply chain issue is caused by Climate Change? Making Canadians suffer and taxing them to death will not stop countries like China and Korea etc on their use of coal and other greenhouse emissions. Canada is NOT the problem globally.
1589005043432566784,Sat Nov 05 21:21:39 +0000 2022,"@POTUS Well you have helped no one but Russia, China, and the Drug Cartels."
1589005041087959040,Sat Nov 05 21:21:38 +0000 2022,"Audi (does boycott Twitter now)belongs to VW, which is owned by Traton, includes Navistar with goal to sell a Bill Gatees financed new electric car, and MAN  all those have to boycott free speech to sell in China the cars which earns  the same Bill Gates money that shorted Tesla;"
1589005035673092096,Sat Nov 05 21:21:37 +0000 2022,"@unusual_whales Of course Steve Hanke predicted the inflation July 2021 exactly due to 41% increase in M2. Europe also printed trillions of Euros and GBP. Joe Biden lied that inflation is worldwide. China, Switzerland and Japan have low inflation. They did not run the presses."
1589005022230376449,Sat Nov 05 21:21:34 +0000 2022,@SaycheeseDGTL Still silent about wats happening in china though 💀
1589005020074479616,Sat Nov 05 21:21:33 +0000 2022,"@nancyholmquist9 @chan_lambda @realravensfan2 @JoeBiden I'd be super improved, you'd lose all the jobs gradually. You'd hand China or some other country global currency power. You'd also crumble your national defense because you'd no longer able to pay for it &amp; then be bullied into poverty but at least you'd be progressive libs"
1589005019764133889,Sat Nov 05 21:21:33 +0000 2022,"Who knew there was a huge #SmugglingRing in #China?  Read about the $51.4 Million #wine #smuggling #ring #Bust by the #ChineseGovernment in @VinePair.
https://t.co/ODddsv1q5J
#winelovers #TaxEvasion #WBO #VinoJoy #police #investigation  #retailers"
1589005013623635968,Sat Nov 05 21:21:32 +0000 2022,"@newscientist I think I read that a WHILE back, for several years, china's been using them on their remote borders, and there have been complaints about the ai used. 

Kinda alarming to see it's the norm now on a battlefield. Very terminator/robo cop vibe."
1589004997588836352,Sat Nov 05 21:21:28 +0000 2022,Most likely coming from foreign  Sources. Our Republic is lost. Sad to say. This country has been owned  By China and  WEF For quite a while now. Operated by lying conniving politicians and lobbyists. 535 in DC and it's clear none of them are working  for the people. https://t.co/eqyVepwukp
1589004997437841409,Sat Nov 05 21:21:28 +0000 2022,"@andygawt If Elon lets Trump back into Twitter it will seal the deal. If Elon cuts service to Ukraine, it will seal the deal. If Elon wants to pander to China. if Elon betrays anyone else, it will seal the deal. Waiting on Elon to send Starlink to Iran to seal the deal. Tik Tok? Twitter?"
1589004988755619840,Sat Nov 05 21:21:26 +0000 2022,@LBC In 2007 UK GDP was $3Trillion. It has not hit this number because £ started tanking from 2007. £ tanked because of Mark Carneys chairmanhip since 2007 as much any other factor. Factors like actions against Covid/ Ukrain war/ China being locked down affect us more than Brexit
1589004980098592768,Sat Nov 05 21:21:24 +0000 2022,Flights grounded as out-of-control Chinese rocket to return to Earth https://t.co/e2RCPklFwb
1589004974868287488,Sat Nov 05 21:21:22 +0000 2022,@DrewPavlou 9/10 support the communist party of China
1589004973483782144,Sat Nov 05 21:21:22 +0000 2022,"@joetsai1999 Let’s put some criticism on China, which you support, who did a complete genocide against the innocent Uyghurs. You said you hate holocausts right? Why do you support the Chinese Holocaust? Are you a hypocrite? I’d love to see you and other NBA owners speak out against China"
1589004969302102016,Sat Nov 05 21:21:21 +0000 2022,"@apmassaro3 ... I think the West (G7) has played it all or nothing, but that Russia is still too big a bite for them. And it seems that everyone kept quiet and waited for the right moment to turn their backs on the US: China, India, Hungary, Arab countries, Turky ..."
1589004969255923712,Sat Nov 05 21:21:21 +0000 2022,"The 5th China International Import Expo opened to visitors on Nov 5 in Shanghai. Companies from 127 countries and regions are promoting their products. Over the past four years, the #CIIE has seen cumulative deals valued at $272.3 billion. https://t.co/QdgNlh2X8K"
1589004966261567488,Sat Nov 05 21:21:20 +0000 2022,LOL rip china stonks AGAIN https://t.co/JkTTg630Xf
1589004931478228992,Sat Nov 05 21:21:12 +0000 2022,Xi Jinping schools Scholz during quick trip to China https://t.co/tLK5t6vPXG via @YouTube
1589004926310563840,Sat Nov 05 21:21:11 +0000 2022,Indian firm paying British PM Sunak’s wife US$13 million a year still operating in Russia despite Ukraine war: report | South China Morning Post https://t.co/NHjmyN4DNG
1589004925518114816,Sat Nov 05 21:21:11 +0000 2022,@PutinsBitchBoy they used fake china news to weaken the $ and give stonk ponzi a lift along with more swaps.  momentum is down next week 3580
1589004894207627265,Sat Nov 05 21:21:03 +0000 2022,"● #Tesla is a global #EV maker across N.#America, #Europe, #China. 
#BYD is concentrated in China, but expanding footprints now in Thailand, Brazil etc.

Tesla moat comes from extensive #supercharging network across America &amp; Europe.
Tesla also sells self-driving feature"
1589004892965830656,Sat Nov 05 21:21:03 +0000 2022,"Nuclear weapons must not be used over Ukraine, China’s president says in clear response to Russia https://t.co/0SBfX3CrTJ"
1589004888322998272,Sat Nov 05 21:21:02 +0000 2022,@cclouiess @Louis_Tomlinson China Suarez I’m listening to #LouisTomlinson          's (@Louis_Tomlinson) the single #OutOfMySystem (Out Of My System) from #FaithInTheFuture
1589004855913623552,Sat Nov 05 21:20:54 +0000 2022,"#Tesla vs. #BYD: American &amp; Chinese #EV manufacturer

● Tesla trades at around ~$655 B, almost 8-10x that of BYD.

--------
#US #China #Battery #Chips #Cars #Equity #Auto #Capex #CATL #Panasonic #Sales #Deliveries #Earnings #WallStreet #Buffett https://t.co/JLDwZixdrp"
1589004851627053057,Sat Nov 05 21:20:53 +0000 2022,"@JohnnyF01559876 @ABswl16 @HomeWJoeBrown @jimmykimmel Did Trump cause the Covid spread in every single country? 

Damn near = no war

When will you blame China for Covid? 

Californians were taking more road trips to red states during lockdowns.  What are you talking about?"
1589004831574089728,Sat Nov 05 21:20:48 +0000 2022,"@Audrey_512A @RealGeorgeWebb1 I think George may or may not be ""intimating"" all of that. However, intimations don't stand up in court. What does stand up in court is that Eugene Yu and his company Konnech was sending U.S. poll data information to China, and they have put GP and CE in jail for a process crime."
1589004822803615745,Sat Nov 05 21:20:46 +0000 2022,Germany's Scholz urges Xi to exert influence on Russia https://t.co/NtbHtJy4y5
1589004818420752384,Sat Nov 05 21:20:45 +0000 2022,@LanderPeterjohn @CheekyMark1917 @Bevin83994661 In conclusion it is identity politics &amp; if anything is the reason why Cantonese is on a downward spiral. My parents would always say HK is worst off after the handover as though it was China's fault that we live in western countries and are unable to make a positive difference.
1589004816709455872,Sat Nov 05 21:20:45 +0000 2022,"@ChinaDaily All those who trade with
modern China will become
rich and lucky like Australia.
Guaranteed."
1589004793565286400,Sat Nov 05 21:20:39 +0000 2022,@William67689150 @wendyc78757 @LucasFoxNews And. You have any idea how much coal China is burning to make those photo cells? Are you aware they use slave labor to make them so cheap? Are you aware of the cobalt and lithium mining needed for the batteries?  Kids do that. Like 8 year olds. Dirty Green. No thanks. Do better.
1589004791598178304,Sat Nov 05 21:20:39 +0000 2022,@SaycheeseDGTL Except when it’s the uighyurs in China
