id,created_at,full_text
1589681604087386112,Mon Nov 07 18:10:03 +0000 2022,"@S_TRPC3 @YourAnonNews I'm not so worried about antiquated Russia so much, I hear they're down to pitch Forks 😂 
But it sure would be scary if USA joined China 🤯"
1589681602007007233,Mon Nov 07 18:10:03 +0000 2022,"@AFP Will Twitter be accused of meddling in midterm election? Just imagine if the owner of Chinese app issues such an endorsement, all the China haters and McCarthyist politicians and media will have a field day. Sick."
1589681600559808517,Mon Nov 07 18:10:03 +0000 2022,Check out this item in my Etsy shop https://t.co/cOMTGoDi5u
1589681598995521540,Mon Nov 07 18:10:02 +0000 2022,"But ChInA gOoD cApItALiSm BaAaAd 

https://t.co/RIT6qR3ZWp"
1589681598018244609,Mon Nov 07 18:10:02 +0000 2022,@JBurnetti @w_terrence @IvankaTrump The reason that she has so many trademarks in China is so that the Chinese people could not make knock-offs of her clothesline so she owns the patents
1589681588786589696,Mon Nov 07 18:10:00 +0000 2022,"Canada has just upped the ante in the global competition to secure critical minerals🔋

🇨🇦 $LI 🇺🇸 $LIACF
#Lithium #China #EV
https://t.co/ltULdkjdpC"
1589681588735909888,Mon Nov 07 18:10:00 +0000 2022,"Rime ice on #trees presents mesmerizing natural #scenery, turning Xilinhot in north #China's Inner Mongolia Autonomous Region into a white wonderland. ❄️❄️❄️
#snow #nature #NatureBeauty #naturelovers https://t.co/AzNxU3MTtd"
1589681587314393090,Mon Nov 07 18:09:59 +0000 2022,"@Typo_mum @tMayor_McCheese Meh, if controlling Covid is your #1 priority and you think protesters should be in jail, maybe you should think about moving to China"
1589681584596488193,Mon Nov 07 18:09:59 +0000 2022,talking to americans about anything involving china is crazy pls tell me why someone brought up hk protests and i was like “oh the extradition bill ones?” and they were like “what’s that” girl…
1589681582339936256,Mon Nov 07 18:09:58 +0000 2022,"12) ming dynasty china had a huge demand for silver coinage, and lots of it came in the form of mexican pesos and spanish silver dollars. the silver dollars were sometimes called ""buddha heads"" because king charles iv has a fat face https://t.co/ztqORcLnH5"
1589681582176337921,Mon Nov 07 18:09:58 +0000 2022,@NobodyI17837853 @comicyehu Yep. China is out as a market. India had a population almost as big. Ms Marvel was well received in India despite having a Muslim cast because of its usage of Bollywood songs and music and Indian actors in the cast. Imagine how good a Hindu character could do in that market.
1589681580859338752,Mon Nov 07 18:09:58 +0000 2022,@Seb_Melmouth China: more like Wakanda - not for Long
1589681573179555840,Mon Nov 07 18:09:56 +0000 2022,@2ndUnitedStates @maricotona @prius_silver @georgehahn Just one more area where we're lagging waaay behind China.
1589681572328132608,Mon Nov 07 18:09:56 +0000 2022,"@Olesya2701 @LzjHTU8oFmsTAcZ I hope you can stop the war.
Stop killing innocent Ukrainians.Don't worry about the US invading you, China will become an important balance force.
I'll explain to you tomorrow."
1589681570243555331,Mon Nov 07 18:09:55 +0000 2022,"china
I vote for BTS (@BTS_twt) for Favorite Pop Duo or Group at the #AMAs"
1589681567949295616,Mon Nov 07 18:09:55 +0000 2022,@PenguinLiberat2 @DatCheesy @Koba_Gold @BalkanExploreri well I have friends in China too lmao and they tell me the opposite
1589681559220924416,Mon Nov 07 18:09:53 +0000 2022,Check out this item in my Etsy shop https://t.co/JuuQ4xutIT
1589681554351181825,Mon Nov 07 18:09:52 +0000 2022,China’s second-largest chipmaker poised for $2.5 billion IPO in Shanghai - https://t.co/fWvwzHOHXP #businessnews #finance #marketnews https://t.co/MZWki3T9HN
1589681534352896001,Mon Nov 07 18:09:47 +0000 2022,China loves Democrats. https://t.co/gXbB6a83qJ
1589681525234499591,Mon Nov 07 18:09:45 +0000 2022,Copper retracing from large gains made last week but still holding firm -2.28%. #Copper #Metals #Investing #Analysis #Commodities #China https://t.co/nR8BMzBABm
1589681512550924288,Mon Nov 07 18:09:42 +0000 2022,"@GovRonDeSantis CRT was never taught in public schools 

And teaching a ‘feel good’, patriotic, whitewashed version of history to students is what they do in authoritarian countries like China 

Our children need to learn the good, the bad and the ugly about America 

That is what makes US Great"
1589681508176236545,Mon Nov 07 18:09:41 +0000 2022,"@AbhishekRatani @IncomeSharks @StephenKing In case you missed his reply: Inflation, wages aren't going up (inflation), high gas prices, federal interest rates rising, peoples 401ks down, high rent, stock market down, lack of labor force, threat of China and Russia, Labor market cooling, unemployment rising"
1589681507173818371,Mon Nov 07 18:09:40 +0000 2022,"ANALYSIS | Canada is set to reveal its China strategy. For a sneak peek, look to Washington | CBC News https://t.co/FXNzv60PNB “Canada talks a great game about wanting to move supply chains from China, but doesn't follow through.” @JustinTrudeau love affair with China."
1589681506204921857,Mon Nov 07 18:09:40 +0000 2022,@runews They can go to Russia :D And Africa wiil become pure paradise - with China and Russia. Why to leave?
1589681500962054145,Mon Nov 07 18:09:39 +0000 2022,@JoJoFromJerz Apparently you like high gas prices paying more for groceries and selling out to China. 🤦‍♂️🤷‍♂️
1589681496264429568,Mon Nov 07 18:09:38 +0000 2022,"@Explorelife777 @charlyaztec I'm not pro-US, nor anti-China..

just clarifying.

not trying to compete with a Nationalist either"
1589681494473068544,Mon Nov 07 18:09:37 +0000 2022,Mona Emma Jesse Ivan #荣城 Uriah Hoover #China Marcus Garcia https://t.co/tPSvglz0V3
1589681485963202560,Mon Nov 07 18:09:35 +0000 2022,@Bud_Bailey3 @DanScavino Maybe he will get a cold or the China Flu.
1589681466862366720,Mon Nov 07 18:09:31 +0000 2022,"@XHNews Interestingly to China, outage is entirely the deed of Kremlin's folly to aggress borders of its neighbour Ukraine . Time to draw the consequence, if China wants its 1949 borders recognised in full, it must admit with a strong voice, Russia is plain wrong in this (mis)adventure ."
1589681460889661441,Mon Nov 07 18:09:29 +0000 2022,@JoJoFromJerz Down 50% this year. When will China no longer have need for Tesla and push their consumers to buying Chinese EVs with incentives and technology they learned from Tesla? https://t.co/FeKZunFpm8
1589681459409059840,Mon Nov 07 18:09:29 +0000 2022,@CalltoActivism And where are the servers for this app hosted? China?
1589681450512973824,Mon Nov 07 18:09:27 +0000 2022,"@atrupar You never controlled Borders in the last presidency when you had the chance with trumpy.And tfg is going to let you do anything to China, he loves them."
1589681444301189120,Mon Nov 07 18:09:25 +0000 2022,"@rajan_menon_ I can see how China would view use of tactical NW in Ukraine as extremely dangerous, particularly due to potential for escalation to strategic NW. Would be catastrophic for entire world, including China."
1589681442204028928,Mon Nov 07 18:09:25 +0000 2022,@JoJoFromJerz Jo is a proud fascist who is very happy with war &amp; inflation. Jo will be happy when millions die worldwide from starvation. Jo feels it is important we have less humans as they're destroying the planet. Jo feels the west should pay more for energy while China build coal plants
1589681437481275394,Mon Nov 07 18:09:24 +0000 2022,@HalSparks I don't think he knows what fentanyl is. We manufacture it here. More of it is coming from Mexico because China is imploding. It has a medical use. People actually NEED it for their pain.
1589681436860485632,Mon Nov 07 18:09:24 +0000 2022,@MartinHonnold @PrestonPysh @jameslavish well its not illegal to buy btc in china or to use cash so its very easy..
1589681433949634560,Mon Nov 07 18:09:23 +0000 2022,"The yuan dropped at the start of what may be another volatile week for Chinese markets after health officials vowed to “unswervingly” stick to a Covid Zero approach

https://t.co/ns4lRncnU2"
1589681431806083072,Mon Nov 07 18:09:22 +0000 2022,"Yiangos (2010 - Modern VLSFO) On Subs RSea/China Vitol Dynacom [Israel Load] (TCE: RV USD 83K @ 57 days / Actual USD 114K @ 48 days)
https://t.co/WI5SBrXzNu"
1589681429193297922,Mon Nov 07 18:09:22 +0000 2022,"@HankMullaney @q80american @EpochOpinion @JohnFetterman LOL. Too long a list but start with his “China’s bad air” incoherence, and work your way back through his fake law enforcement claims, all the way to threatening to kill his ex. 
There’s plenty of material out there."
1589681423367426048,Mon Nov 07 18:09:20 +0000 2022,@joncoopertweets Joe Biden for China https://t.co/JK3ToNbRqr
1589681423174467584,Mon Nov 07 18:09:20 +0000 2022,"@saifedean I can vote for a new state rep every two years, senator every six, and president every four.  I don't get to vote billionaire CEOs in or out. Your ""statist"" logic only exists in places like Russia and China, not democratic governments of, by and for the people."
1589681421144444928,Mon Nov 07 18:09:20 +0000 2022,"In 2018, Shi Zhengli, known in China as ""the bat woman,"" in collaboration proposed a ""$14 million grant proposal to genetically manipulate bat coronaviruses to see how they might cause pandemics."" Which was REJECTED by The Defense Advanced Research Projects Agency (DARPA) for..."
1589681420439793664,Mon Nov 07 18:09:20 +0000 2022,"@nypost This is retarded, that's not even a nazi uniform or helmet lmao.

That's just a generic parade uniform wearing a Brodie helmet (1st pic) used by US/UK/China at both wars. Nazis used the Stahlhelm (2nd pic). https://t.co/otjGg778sh"
1589681409949462528,Mon Nov 07 18:09:17 +0000 2022,Competition with China: Chinese views on Deterrence https://t.co/P5eF7TcWRq
1589681395437182976,Mon Nov 07 18:09:14 +0000 2022,Why would China want to interfere in Canadian politics. Canada already has as much Communism as China has. https://t.co/MQwJ6PSG3g
1589681387577421826,Mon Nov 07 18:09:12 +0000 2022,"...🇨🇳...A video presented at AirShow China 2022 by China Ordnance Equipment Group (part of Norinco), a foreign trade defense company, about the range of Chinese exported weapons. https://t.co/z3hYQURv4n"
1589681385052086273,Mon Nov 07 18:09:11 +0000 2022,"@elonmusk Shared power paralyses government, weakens the US political system, hinders US foreign policy and enables China to grow ever stronger and more influential"
1589681368396869632,Mon Nov 07 18:09:07 +0000 2022,"@SteveSwift3 @melindiscott Ironically, whilst cars are sat running to keep the drivers warm… these protests do more damage than good. Plus, the UK is smaller than the smallest US state meaning we have zero impact. China and India then the US all need to be onboard or it’s pointless."
1589681363770392576,Mon Nov 07 18:09:06 +0000 2022,"🤖 Curious about #AI startups in China?

This one combines AI with a timeless lesson: Trademark your IP in China. Now.

Check out this video of the “达利 DALL·E ” AI art generator app being advertised on Bilbili

Except it's not the GPT-3 trained DALL·E that you’re familiar with. https://t.co/6u4cZXYbc6"
1589681361325281280,Mon Nov 07 18:09:06 +0000 2022,"@rileyb_gone_pt2 @HollyWeed0 @VcfCommunism no American jobs have been the leading reducer of poverty, it is american factories ""exploiting"" cheap Chinese labor that has led to Chinese success. China is irrelevant without us. We see this as jobs leave for India and they fall into destitution. China is mid collapse."
1589681350214180869,Mon Nov 07 18:09:03 +0000 2022,@laurenboebert Inflation is a worldwide phenomenon. Please provide evidence of how Biden and Dems caused this. You might just as well blame China (Covid/supply chain issues) or Russia (Ukraine Invasion/Global Grain/Energy supply disruption). Or is Biden responsible for them as well?
1589681348771336192,Mon Nov 07 18:09:03 +0000 2022,@MatRey01 @CambridgeIndy @GeorgeMonbiot @camlitfest A one child policy like China eh ? It all boils down to Communism in the end for greens.
1589681343025537024,Mon Nov 07 18:09:01 +0000 2022,"@jacktomalis @atrupar ""To stop fentanyl from getting into counterfeit drugs, the DEA is focusing on what's called precursor chemicals — the ingredients needed to make fentanyl. Milgram said the materials are made in China then shipped to Mexican cartels before arriving at the U.S. border."""
1589681342253568002,Mon Nov 07 18:09:01 +0000 2022,"As #COP27 kicks off in Sharm El-Sheikh, explore a suite of new research aimed at supporting a global, green + just transition, from climate negotiations to China's global power plants: https://t.co/xefRJqulug https://t.co/0EODaWMIV8"
1589681337262542851,Mon Nov 07 18:09:00 +0000 2022,"@SenHawleyPress Note Josh says nothing about solutions for inflation, oil production, China relations, and myriad other problems facing this country and hard working Americans. https://t.co/x14g5sOdW0"
1589681336838561794,Mon Nov 07 18:09:00 +0000 2022,"第五届进博会首发首展新品亮相
From November 5 to 10, the Fifth China International Import Expo was held in the National Convention and Exhibition Center (Shanghai). Many new technologies, new achievements and new exhibits that launched the first exhibition attracted attention. https://t.co/QKyeIP3ITy"
1589681328613896193,Mon Nov 07 18:08:58 +0000 2022,"@premmirth @ayush_rwl @whatsinitforme @DerekJGrossman No question about that - I never talked about India in my posts.
My question is that there's no justification for what Russia invasion (NATO expansion etc).
I would say the same if China invaded India, or Pakistan attacked in Kashmir."
1589681326482857984,Mon Nov 07 18:08:57 +0000 2022,"@Idexbull Ironic, considering they acquired Timios for the sole purpose of using their top line revenue to create a false narrative about the company.  Same with IDEX China…which I believe is flat out fraud. It’s all about that narrative…but didn’t quite work out!"
1589681326416097280,Mon Nov 07 18:08:57 +0000 2022,@BBCPolitics They want us to be cold and annoyed. You can not stop oil if there cared one bit for.the environment they would ask china to stop coal
1589681319059288065,Mon Nov 07 18:08:55 +0000 2022,"@business Not just China, in a nutshell：”the whole world!”. Even though those who are being ruled by him are starving, nobody dares to stand up and fight for their fundamental rights ,for those who wish to comprehend The Real Thing, go and live in Shanghai, or as a first step, Hong Kong!"
1589681302227529730,Mon Nov 07 18:08:51 +0000 2022,"@MinteeKneeze The right is using it as a piggy back issue to close the border. My concern is the mounting blame game on china. We are being conditioned for all out assault. ""You killed my brother!"". When, in fact, that brother killed himself. It is very nuanced and no simple matter."
1589681292974907392,Mon Nov 07 18:08:49 +0000 2022,Ban Tik Tok in america Its supporting China and brainwashing our kids in every negitive way!
1589681292148617217,Mon Nov 07 18:08:49 +0000 2022,Canadian intelligence warned PM Trudeau that China covertly funded 2019 election candidates: Sources - National | https://t.co/3QZPKAnmBR https://t.co/92N2gr0BVj
1589681283097309184,Mon Nov 07 18:08:47 +0000 2022,"@EGNationnn @Elias92905563 @thetruedarkseid @SnyderVerse18 Justice League failed because it was Frankenstein’d, WW84 was shit and released during pandemic, same with TSS. Black Adam I have no clue, maybe China banned it or something?"
1589681280828178433,Mon Nov 07 18:08:46 +0000 2022,@bhawanasomaaya Looks some festival of China. Check again. #Fake?
1589681280547164160,Mon Nov 07 18:08:46 +0000 2022,"If everything happened differently in the world and China having 1-2 million covid deaths, western capitalist are going to count all that as victims and deaths due to the cause of communism."
1589681278441648128,Mon Nov 07 18:08:46 +0000 2022,Aye glue yourselves to the M25 but say nowt about China building thousands of new power plants #JustStopOil #COP27 bellends
1589681277791539200,Mon Nov 07 18:08:46 +0000 2022,@WeAreCanProud China has been funding and promoting teudeau for a decade
1589681268484378625,Mon Nov 07 18:08:43 +0000 2022,"Largest Nonindex flow today (15 min delayed): 

$TSLA call $220 2023-02-17 - Prem: $38,857,500
$BKNG call $1700 2023-03-17 - Prem: $13,850,000
$BTU call $27 2023-07-21 - Prem: $12,125,100
$BILL call $100 2023-01-20 - Prem: $11,837,980

 Link (+ live flow): https://t.co/Bgv0sSRAew https://t.co/j9Gfu4MRBD"
1589681257096806401,Mon Nov 07 18:08:41 +0000 2022,"Honde e:N2 Concept Previews China-Only Sedan, Shows EV Design Direction https://t.co/d9EMapO8Wj"
1589681248272023553,Mon Nov 07 18:08:39 +0000 2022,@PostOpinions Whose editorial board decides what to do in China ?
1589681245575057409,Mon Nov 07 18:08:38 +0000 2022,Is the Apple factory in China on the @elonmusk number system? #apple #tesla #elonmusk https://t.co/HiG5S9jMY1
1589681244891410433,Mon Nov 07 18:08:38 +0000 2022,@newsmax Because you have NOT upheld our constitution &amp; you have been in bed with China &amp; Russia doing underhanded deals that has hurt Americans &amp; has caused our gas &amp; food prices to soar &amp; you have almost fully destroyed American.
1589681230286827520,Mon Nov 07 18:08:34 +0000 2022,"This is a huge - I hope it gains traction! 
But we all seem to be looking elsewhere. People seem to be laser focused on divisive policies and initiatives that make us feel shame.

 https://t.co/QMdL1mAYve"
1589681209583730690,Mon Nov 07 18:08:29 +0000 2022,"@dmunjal @atrupar More spam.  

And of course, you need to get the last word in, even if that ""last word"" completely undermines your claim that China is shipping fentanyl to the US.

Evolution evaded you.  You are the person warning labels on toasters target."
1589681208178638849,Mon Nov 07 18:08:29 +0000 2022,"Welcome to our speakers @ywang1224, Carrie Friese(@LSEsociology), Noam Yuchtman (@LSEManagement), @PJDunleavy (@LSEPress)!

We are looking forward to an insightful discussion on policy and governance in China.

🔴Now Live! https://t.co/pM5JFXN7l6 https://t.co/WBzbzVUxxt"
1589681206593224704,Mon Nov 07 18:08:29 +0000 2022,@GBNEWS If anyone owes reparations it’s China for their contribution to carbon emissions and for unleashing covid 19 on the world.
1589681206295027713,Mon Nov 07 18:08:29 +0000 2022,"Thanks, @elonmusk  
After my Pandemics book came out--blaming #China and #NIH for the #Virus--my institute @PRISource was banned from running ads on Twitter.
The ban has now been lifted.
Breathe the free air, little bird. https://t.co/zTDeO5cuu4"
1589681204080840704,Mon Nov 07 18:08:28 +0000 2022,@sherry2diamond @WillResistAdmin @POTUS Communist parties are almost exclusively always red you 🤡🤡🤡🤡🤡🤡🐑🐑🐑🐑🐑🐑🐑🐑 look at russia and china. Both EXTREMELY red 🤡🤡🤡🤡🤡🤡🤡🤡
1589681202369564674,Mon Nov 07 18:08:28 +0000 2022,"THANK YOU, CHINA. NO TO WWIII. 
https://t.co/IcYj8OqSh7 via @scmpnews"
1589681191103631360,Mon Nov 07 18:08:25 +0000 2022,"@emmaward2550 @JoeBiden @BarackObama Ah yes Trump, who called Putin a genius, the man who lied about Covid during the pandemic, the man who stole classified documents and probably tried selling them to China. The man who divided this nation more than anyone else. The one who can’t take a loss, claiming foul play!"
1589681172917157888,Mon Nov 07 18:08:21 +0000 2022,"Contact with BOSS directly! Stage lighting factory in Guangzhou China. sharpy beam . Par light . Led moving head light. Laser. Fog machine. 250W 260W 271W 275W 295W 350W 380W 480W 600W 1200W moving head light. Alibaba: https://t.co/sbpgXVn4wy
Phone/WhatsApp :+ 86 17818118947 https://t.co/aL4WOj4vIv"
1589681166386606080,Mon Nov 07 18:08:19 +0000 2022,@hedgequote I don't think P2P in the US is an exact P2P. I think its more of mutual insurance what lemonade is doing. And regulations might hinder it. A perfect case of p2p was what wechat did in china.
1589681149806546944,Mon Nov 07 18:08:15 +0000 2022,"China on Sunday reported its highest number of new COVID-19 infections in six months

https://t.co/unipZPmulI"
1589681146061033475,Mon Nov 07 18:08:14 +0000 2022,@crypto_relief @PrestonPysh @jameslavish Like they do in China?
1589681142973665281,Mon Nov 07 18:08:13 +0000 2022,"@60Minutes The Chinese government looking after their Children by regulating an addictive app is presented as sinister.

The American government not doing so, letting the free market run its course is presented as a yellow peril trope, that China is supplying some sort of digital opium."
1589681139073306626,Mon Nov 07 18:08:13 +0000 2022,"@BrianKi10023389 @SurreyPolice They don't live in China. Doh. ""Global Britain?? Leading the way?? 🤣🤣"
1589681136959381505,Mon Nov 07 18:08:12 +0000 2022,"@JackFarley96 Between the winter virus season and a global economic war, I fail to see China loosening policy at least until spring. Winter is going to hit many nations  hard from freezing, to starvation, to debt crisis. That will have a effect on geopolitical policies."
1589681129803907072,Mon Nov 07 18:08:10 +0000 2022,@smc429 @elonmusk You have no idea what fascism is if you think that Rittenhouse didn't have a legitimate case. We are living with a fascist regime now. They don't recognize the Constitution or the Bill of Rights. Americans are in prison for protests which was and is their right. Just like China.
1589681127702560770,Mon Nov 07 18:08:10 +0000 2022,"@mehdirhasan @GOPLeader what happened to all the opioid addictions occasioned by American big Pharma? China my foot,the real problem is home grown!!!"
1589681122044440576,Mon Nov 07 18:08:08 +0000 2022,"I hope Russia &amp; China don't team up to bomb US cities like Russia is bombing #Ukraine 
I wonder who the #MAGA #Republicans would ask to help us? 
MAGA HATES #AMERICA
MAGA = #DomesticTerrorists
#VoteThemAllOut #VoteBlueForSoManyReasons https://t.co/FxscIhMCFT"
1589681120223772672,Mon Nov 07 18:08:08 +0000 2022,"@Anythin83228331 @TippyToz_ @angrryred @elonmusk China is not doing good, their technological development and infrastructure is largely dependent on U.S. imported silicon. Since they cannot manufacture it. Naturally a communist country will never succeed to the extent a capitalist system can. It's all theatrics with China."
1589681115144818689,Mon Nov 07 18:08:07 +0000 2022,"@ThatmattersNews the NBA is a joke! Read the book, and make your own opinion! I Love basketball, but its getting harder, and harder to watch!  Ps. Don't say anything about China either or u in triuble"
1589681113316077569,Mon Nov 07 18:08:06 +0000 2022,Ok…. But what about china taking our land? https://t.co/1D5OCbVnhK
1589681110933417985,Mon Nov 07 18:08:06 +0000 2022,"@Iromg LouiseHarris: The UK is killing the world.
Reality: China operates 3,000 coal burning power plants.
LouiseHarris: But white people are the problem.
Reality: China plans on building 500 more coal burning power plants.
LouiseHarris: White men are the problem.
Reality: China?"
1589681107913805824,Mon Nov 07 18:08:05 +0000 2022,@LeoDiCaprio @rhrn_climate @UNHumanRights @COP27P Quit buying things from China where manufacturing accounts for the greatest amount of pollution on the planet.
1589681099244027906,Mon Nov 07 18:08:03 +0000 2022,"(It's an archaic term, really--back in the early 20th century they called a drum kit with a bunch of extra shit attached--china blocks, chimes, whatever other gizmo you wanted--as a ""contraption set"", or trap set/the traps for short.)"
1589681096937164800,Mon Nov 07 18:08:03 +0000 2022,China-Pakistan working secretly on virus deadlier than Covid: Report #Pakistan https://t.co/y8BOwIY168
1589681089265950720,Mon Nov 07 18:08:01 +0000 2022,"#1 most aspirational career for pre-teens in the US: Influencer...in China: Astronaut. 

""You allow those two societies to play out for a few generations...I can tell you what your world is going to look like."" https://t.co/0QAUJ5SSE5"
1589681085423976450,Mon Nov 07 18:08:00 +0000 2022,"China, the developers of Tik Tok clearly understands how dangerous social media platform is. They have measures in place for their children. Take heed. https://t.co/ldET5t4S3l"
