id,created_at,full_text
1590913518261379072,Fri Nov 11 03:45:15 +0000 2022,📰 eNEWS HEADLINES: Best Rhone harvest in 5yrs | AU inventory climbs | eCommerce alc revenue | AU wine available in China | CHA in Tuscany | Ukraine joins OIV | Global 2022 production summary - https://t.co/1kL0ensjJe https://t.co/LwC7Ibsugu
1590913517280198658,Fri Nov 11 03:45:14 +0000 2022,"I personally don’t like how Trump or DeSantis responsed to the China Virus. 

A whole new candidate would be fine with me.

They both are amazing and we need them both on our side… 

But their judgement was off with vaccines and shutdowns. I can’t have that again."
1590913506823770112,Fri Nov 11 03:45:12 +0000 2022,"@GundamNorthrop The Chinese 🇨🇳 have fed the #CCP for more than 70 years, and it is interesting that the CCP is now forcing the Chinese to live in starvation. Do they still support #China's invasion of #Hongkong, #EastTurkistan, and #Tibet?"
1590913506647642113,Fri Nov 11 03:45:12 +0000 2022,"@zlj517 I used to like you and admire you! I thought you did a great job before! But #XiJinping is leading China into disasters after disasters. After what he did to #胡锦涛,I stopped supporting the CCP and its entire foreign relations entourage. It is shameful to work for such a bastard"
1590913499198558210,Fri Nov 11 03:45:10 +0000 2022,"@Kanthan2030 G20 minus G7 is BRICS+ n it’s aspirants
A club with many players from “jungle” which is abt to get irrelevant, riddled with Anti- Russia speeches n anti- China rhetoric, what kind of meaningful economic discussion can sane ppl expect?

It’s going to b another useless clown show🤦🏻‍♂️"
1590913497780858880,Fri Nov 11 03:45:10 +0000 2022,"@jayneairplane @CoryBMorgan Move to China, then. Ridiculous"
1590913495142658050,Fri Nov 11 03:45:09 +0000 2022,"ED seizes files from TRS MP’s son, hints at China-hawala link https://t.co/kqW7jBbtCT"
1590913485357350914,Fri Nov 11 03:45:07 +0000 2022,would you be surprised to find out that @theJagmeetSingh is one of the 11 spies on china`s payroll who is influencing policies? it kind of explains the coalition govt &amp; the policies coming out of parliament @NDP @OntarioNDP @bcndp @TodaysNDPMB @CBCNews @CTVNews @globalnews @AP https://t.co/IwHiskv2Pb
1590913480122855426,Fri Nov 11 03:45:06 +0000 2022,"@Ervinism41 @blackintheempir China has demographic problems and an over-leveraged property bubble that's bursting. And, another Covid lockdown. 

Russia is currently suffering a military catastrophe in Kherson as the withdrawal becomes a botched panic. See Russian telegram channels."
1590913476255703040,Fri Nov 11 03:45:05 +0000 2022,"@ZoeSchiffer Nope every move has been to sink the company. Plan
Writes off the loss vs gains sold n Telsa
Removes the damage to his ego
$ from Saudis and China for battery minerals. 
Telsa buys Twitter after bankruptcy with cost synergies
Financial engineering like solar city saving Telsa."
1590913471839109121,Fri Nov 11 03:45:04 +0000 2022,India's relationship with China cannot be normal unless there is peace in border areas: Jaishankar https://t.co/9UA0Xajj5J
1590913471281266689,Fri Nov 11 03:45:03 +0000 2022,"6,000 China-Europe trains via Khorgos mark important milestone https://t.co/0FB2UK8GvG #news #rail #trains https://t.co/1b1w9QZe8w"
1590913469691400192,Fri Nov 11 03:45:03 +0000 2022,BEHIVE architects roof a restaurant on jiaozi avenue in curvy ridged organic skin   https://t.co/d4SNPhfp3Q https://t.co/JDC4DJVfZ0
1590913469519650818,Fri Nov 11 03:45:03 +0000 2022,"@GundamNorthrop Well, @Apple, looks like it is time to make a decision as to what is more important: profits or employees! Let's stop supporting #China!"
1590913463689572353,Fri Nov 11 03:45:02 +0000 2022,"China's wetlands conservation efforts have illustrated its genuine commitment to ensuring harmonious coexistence between humans and nature. Find out more about these ""fantastic"" wild animals and their habitats in China #COP14 https://t.co/Eq227p2MkT"
1590913461516926976,Fri Nov 11 03:45:01 +0000 2022,"@GreyDeLisle Once upon a time this sort of thing was called gossip. Do you know that you would be penalized for this in China’s, through their social credit score system? Which is where we’re headed. I love it when people call out other’s shitty behavior with their own shitty behavior. 🤦🏻‍♀️"
1590913455988826112,Fri Nov 11 03:45:00 +0000 2022,"On the afternoon of November 10, #Dehong Prefecture of #China  donated a batch of love kits worth 166,000 yuan to the Myanmar-China Friendship Association's Mu Sister Branch.@zlj517 @SpokespersonCHN @zhang_heqing https://t.co/PWtGiPA0oG"
1590913455669874689,Fri Nov 11 03:45:00 +0000 2022,"The heads of state of #China &amp; the #US have maintained regular contact through various means, and the Chinese side takes seriously the US proposal for a meeting btw the two presidents in Bali, Chinese FM spokesperson said Thur, adding that two sides are in communication on it. https://t.co/9JBMYJkeGm"
1590913449185640448,Fri Nov 11 03:44:58 +0000 2022,"@BrankoMilan @vijayprashad Interestingly, Mao's China did sustain big increase in life expectancy, after early 1960s, with very low tech in most sectors ('walking on two legs'). So a very poor country can sustain life with the right system.  (Also, think of modern Cuba.)"
1590913435973582848,Fri Nov 11 03:44:55 +0000 2022,"@paulperry1974 @MarshaBlackburn It’s a no brained, close the boarder, deport all illegals, drill oil and gas like we always have and that gets inflation under control. To get our national debt under control, I would drill enough to supply other Countries. We need sanctions on China and Russia and etc."
1590913415799001088,Fri Nov 11 03:44:50 +0000 2022,"The 5th China International Import Expo wrapped up today, with tentative deals worth a total of US$73.52 billion reached for one-year purchases of goods and services. https://t.co/pn0IWQGATO"
1590913404109484032,Fri Nov 11 03:44:47 +0000 2022,"https://t.co/OhrbInUACr WOW,Out Of No Where This Comes Out.?WELL W-T-? I Can`t Belive This SHIT.?WOW.?"
1590913399407661057,Fri Nov 11 03:44:46 +0000 2022,"This is a good moment to reflect on the wisdom of following the US into another unnecessary imperial war and the loss of Australian lives that that would mean.

Stop provoking China. https://t.co/TQN6TC9ewN"
1590913393715994625,Fri Nov 11 03:44:45 +0000 2022,@HeerJeet What are your thoughts on China Mieville?
1590913390259867648,Fri Nov 11 03:44:44 +0000 2022,@GaryPor08512506 @DwightHoward Ah…Taiwan isn’t China
1590913381607034881,Fri Nov 11 03:44:42 +0000 2022,"@POTUS Let us know when China Russia and India are on board with the climate bullshit. Until then, get back to our pipelines and our natuaral recourse production."
1590913361985814528,Fri Nov 11 03:44:37 +0000 2022,"China Stocks Pare Gain As Rising Cases Thwart Reopening Hopes - BBG  
https://t.co/dY6syW4fKq"
1590913357963411457,Fri Nov 11 03:44:36 +0000 2022,@Icywithaburn @DanAlbas Why? It's Harper's 31 year FIPA IPA deal with China where he sold Canada to China. Nothing to do with Trudeau. He wasn't PM at the time.
1590913355937906688,Fri Nov 11 03:44:36 +0000 2022,@hazharoon Anyways after a few days India will be India put pakistan will either be divided or become China. Don't forget how India cut pakistan into two and now we have Bangladesh
1590913351613579265,Fri Nov 11 03:44:35 +0000 2022,@Slxm03 Ah…Taiwan isn’t China
1590913342209945602,Fri Nov 11 03:44:33 +0000 2022,"@proofofwork1 @RelocationBoss His long game is creating China’s version of WeChat, social credit score ish"
1590913341349822464,Fri Nov 11 03:44:32 +0000 2022,China unveils giant new drone that may point to future of air warfare -analysis https://t.co/h6KFtO54CQ via @RaptureForums
1590913316846981121,Fri Nov 11 03:44:27 +0000 2022,"@AP Um, say what?  Isn't the US the 2nd biggest emitter of greenhouse gases??  Who will he talk to - China and himself?"
1590913316037488641,Fri Nov 11 03:44:26 +0000 2022,"Dian cuisine or, as some people call it, Yunnan cuisine, features more obvious ethnic characteristics than any of #China's many regional cooking styles. Steamed Yunnan-style chicken soup is a signature Dian dish. https://t.co/CpNDaZJcw8"
1590913313936146434,Fri Nov 11 03:44:26 +0000 2022,@ChuckCallesto @Cherob14 America has turned into the most corrupt nation on earth. It is mind boggling for the rest of the world to see the truth of what is happening. Right NOW China would destroy America if it starts which it will. Americans will want to start thinking about this your Government is bad
1590913312078049280,Fri Nov 11 03:44:25 +0000 2022,"2 in-1 Dual Wireless Charger Pad for iPhone 13/Samsung Wireless Charger Qi Fast Charger for Airpods 3 PRO on https://t.co/Qq3FVfBcyz https://t.co/O5J1oZOzIf 来自 @madeinchina_b2b 
Wireless charger for Samsung, Wireless charger for Android, wireless charger lamp"
1590913307879567360,Fri Nov 11 03:44:24 +0000 2022,"@trophieschahiye @GWR 410-0 &amp; 93000-0..... This is History.... 
IMF loan - Begging
China - Begging
America - Begging
Saudi - Begging
Nedharland - Begging(League)
Zimbabwe - Begging(Fake Bean)
Guys.... Pls change your name from ""Pakistan"" to ""Beggistan"".... and soon will change to ""Chinestan""... 🤡🤡🤡 https://t.co/aCVvamG5s6"
1590913305975361536,Fri Nov 11 03:44:24 +0000 2022,"@NPT1776 @NinaBirchfield Not only my government not represents me, it hates me because I have a free spirit and wants to voice my disapproval of this system. Feeling if I am still in the red China."
1590913300715687936,Fri Nov 11 03:44:23 +0000 2022,"@DaveMacLachlan1 Back in the USSR- Beatles
China Grove- Doobie Brothers
Panama - Van Halen
Livin in the USA- Steve Miller Band"
1590913292578455553,Fri Nov 11 03:44:21 +0000 2022,"The scarf tells the story of the silk spread from China to Lyon, France, via the Silk Road. Starting from Chinese classical architecture representing Xi'an, it finally transformed into a gorgeous dress in Europe after a long journey. @cnsilkmuseum #NSM #SilkRoadWeek #SilkRoads https://t.co/n1TpxtAITS"
1590913278485889024,Fri Nov 11 03:44:17 +0000 2022,@AmieWohrer It’s the China way.
1590913263809998850,Fri Nov 11 03:44:14 +0000 2022,"@zhang_heqing Thats because China does not seek to preserve peace and democracy. China does not go to the aid of their allies in a conflict. BUT China is guilty of proxy economic war , not with weapons but with Yuan and Dollars"
1590913263528992769,Fri Nov 11 03:44:14 +0000 2022,"@TimothyDSnyder There is hope, but China has a long, long game. Don't count them out."
1590913244687900674,Fri Nov 11 03:44:09 +0000 2022,"@kennardmatt @GlowingandDark Do people finally see clearly now, or are they still deluded? D vs R is over. It's as if the NFL had two teams and every game the fans bet on the winner, but the house paid china with the winning purse every time and people expected a good game but it was rigged from the start."
1590913241777340416,Fri Nov 11 03:44:09 +0000 2022,"@mgerrydoyle This is very concerning. China bullied all  commercial airlines and hotel chains into pretending Taiwan wasn't a real country so they could continue to do business in China a few years ago.  If they haven't already, it will only be a matter of time until the CCP leans on Elon."
1590913240313303041,Fri Nov 11 03:44:08 +0000 2022,"@annonomsly @nationalpost Mentioned before China.

Fuck yeah this shithole is a cautionary tale!"
1590913236115021824,Fri Nov 11 03:44:07 +0000 2022,@henryporter24 @danthegeeman @YahooFinance The gop thinks we should be producing more energy but instead dems want the green new deal like it will do anything with China and india polluting more and more
1590913235821432832,Fri Nov 11 03:44:07 +0000 2022,"FINAL: China Spring 72, Fort Worth Western Hills 7

#txhsfb"
1590913221606617088,Fri Nov 11 03:44:04 +0000 2022,https://t.co/s9aimAPn0y Noritake #Ireland Serving Bowl Tipperary Fine Chin https://t.co/Q03yL6Qwad
1590913220768071680,Fri Nov 11 03:44:04 +0000 2022,China Quants Seek Billions in New Funds After Sidestepping Rout - Bloomberg https://t.co/3M2SyshYYG https://t.co/u6EyFjluh4
1590913184893911040,Fri Nov 11 03:43:55 +0000 2022,@GloballuxuryVIP And why would anyone want to own anything in china ? No thx
1590913161363718144,Fri Nov 11 03:43:50 +0000 2022,Why isn’t important commentary like this carried in mainstream media. A thoughtful piece running counter to much of the commentary on Australia/China from someone with a long and deep history on the subject. https://t.co/IhBNydQsLV
1590913140836835330,Fri Nov 11 03:43:45 +0000 2022,"Glavin: Trudeau still inexplicably blasé about China's interference in Canada's elections https://t.co/vxAr1gNPpL via @ottawacitizen
@justintrudeau is only concerned about power and will do anything and accept anything to hold on to power.
#TrudeauMustGo"
1590913132561854464,Fri Nov 11 03:43:43 +0000 2022,"China, Canada, Australia, Chile, Congo, CATL, lithium, cobalt, nickel, mining, processing, refining, IRA, and more, in our latest MAX episode with special guest @hjesanderson as he helps us make sense of the ""Volt Rush.""

Thank you Henry for the insights! https://t.co/RMqqHgHQj7 https://t.co/6GQidRp9f3"
1590913125309898752,Fri Nov 11 03:43:41 +0000 2022,"Grassroots technicians have been dispatched in Xingye County, south China's Guangxi Zhuang Autonomous Region to apply agricultural technology, boosting rural revitalization https://t.co/ZAwXCo3NOV"
1590913120285118464,Fri Nov 11 03:43:40 +0000 2022,@Resist_05 I'm not sure that China is actually ideologically aligned with the likes of Soros and his creepy-cohorts...
1590913114526318592,Fri Nov 11 03:43:38 +0000 2022,@seashellm1shell kick him so far he hits china
1590913114350161922,Fri Nov 11 03:43:38 +0000 2022,"@giacdiane @OleGelo5 @JMann1992 @ACTBrigitte Are you the next Ultra Maga hot babe?
https://t.co/imB51Tc3GV"
1590913112269819905,Fri Nov 11 03:43:38 +0000 2022,"👀The China Space Station in Tianzhou-4's camera as it was departing for re-entry.
(c) CMSA https://t.co/Gi5cwXkKW5 https://t.co/cycEOg2LaF"
1590913105315381248,Fri Nov 11 03:43:36 +0000 2022,#OpinionLine Scholz took the right decision to go ahead with his visit to #China despite all the opposition and criticism. https://t.co/cBDWavccot
1590913104871034881,Fri Nov 11 03:43:36 +0000 2022,Biden to seek firmer footing for China relations in first Xi meeting of presidency https://t.co/bPnSmfhf3N
1590913091356790784,Fri Nov 11 03:43:33 +0000 2022,"sosdependencia Apple limits AirDrop on iPhones in China after filesharing feature was used by protesters | China | The Guardian https://t.co/H1gwcE05w3, see more https://t.co/bXGQ77Y5sI"
1590913066677731328,Fri Nov 11 03:43:27 +0000 2022,"Pmile，Welcome to Wuhan, Hubei, China to taste the most authentic Hubei cuisine. I'm waiting for you in Hubei!🫶🍜🥠🍢
FLIRT WITH MILE^^
@milephakphum 
#MilePhakphum https://t.co/tCttimCpvD"
1590913050806292480,Fri Nov 11 03:43:23 +0000 2022,That went to buy flat-screen TVs made in China
1590913019185606657,Fri Nov 11 03:43:16 +0000 2022,"The 60th #Chengdu Chrysanthemum Exhibition was held at Renmin Park in Chengdu City, #Sichuan. A total of 200,000 pots of chrysanthemums are on display. 
Chrysanthemums, which symbolize happiness and vitality, are a popular #flower in #China. #photo #Flowers #gift #beauty https://t.co/s4zJcspQMn"
1590913014718660611,Fri Nov 11 03:43:15 +0000 2022,"@Chellaney Simply put, US has decided to share the world with China by weakening Russia and Europe. A very undesirable step in Indian context. India will not be allowed to pursue independent military and economic policies as an independent regional power in South &amp; SE Asia."
1590913013401681921,Fri Nov 11 03:43:14 +0000 2022,"@BlueATLGeorgia @JoeBlow59824862 @RepMTG Actually, our election was called on 11/8. One and done. As every state was until recently when the cabal started incorporating fraud. Dead people and phantom voters from China are too slow to get their votes in, so we don’t count them."
1590913006502047744,Fri Nov 11 03:43:13 +0000 2022,"@InfernoXhell @DanielDumbrill @BrummerTimothy @LorenaDyson @markesports232 @homer2288 @ChinaUncensored @SB_Police @hkpoliceforce @DrewPavlou The government here support the status quo as do the opposition, China wrote into law that they will eventually use non peaceful means to annex Taiwan, this doesn't need any shift in the status quo from Taiwan either"
1590913005990060032,Fri Nov 11 03:43:13 +0000 2022,Biden to seek firmer footing for China relations in first Xi meeting of presidency https://t.co/LBAQRXdeeZ
1590912969239662594,Fri Nov 11 03:43:04 +0000 2022,Billionaire Gautam Adani's expansion into Sri Lanka has put him in the middle of a fight between India and China https://t.co/kwRDXUYDe6
1590912961132236802,Fri Nov 11 03:43:02 +0000 2022,"@I_start_over @nopeyourewrong0 @gr33nstr33tz @the2centz @Breaking911 @GovRonDeSantis @FoxNews @nypost @WSJ good lord human, no president is going to have everything we like. This isn’t BK have it your way 
Safeguarding 5G from China
Moving US embassy to Jerusalem 
Creates Act 
No denying more secure border 
Doubling standard tax deduction put moneyback in everyone’s pocket 
Relax"
1590912960574410754,Fri Nov 11 03:43:02 +0000 2022,"@RichSandersen @mtracey USA is currently illegally occupying syria. And who has Iran and China (two asshole governments) threatened with imperialism? Don’t say Taiwan, USA has stuck to the one China policy for the benefit of cheap labour and massive profits it gave to US corporations for decades"
1590912960117235712,Fri Nov 11 03:43:02 +0000 2022,"Called it. I bet if @ChuckGrassley had his election stolen from him, he would want our elections fixed ASAP so the next election won’t be stolen from him again. Now ask why China has been buying farmland under his watch these last few decades. Trump has ALWAYS had to go it alone https://t.co/bKhtPdWkVR"
1590912953250811905,Fri Nov 11 03:43:00 +0000 2022,"there is no relaxation of quarantine for foreigners especially when it compares to chinese nationals. 
we need to undergo 7+7+7+7 days of quarantine unless you dont get sick or infected. astonishing set of policies. @China__Focus @CathayPak @JiRongMFA"
1590912951195955201,Fri Nov 11 03:42:59 +0000 2022,@CRose2u @PhilConnorsII @camdephilob @RepTroyNehls @elonmusk Oh and since joe has been in office we've been giving china our oil reserves
1590912937233117186,Fri Nov 11 03:42:56 +0000 2022,🇰🇭 &amp; 🇨🇳 sign two healthcare agreements on dispatch of 19 Chinese traditional medicine experts to Cambodia and establishment of the Cambodia-China Traditional Medicine Centre. https://t.co/Pnalqy9k5O
1590912935450521600,Fri Nov 11 03:42:56 +0000 2022,"Oil heads for a weekly loss of over 6% as China continues to grapple with swelling Covid cases, weighing on the outlook for demand https://t.co/ksddvb1yxf"
1590912925384204288,Fri Nov 11 03:42:53 +0000 2022,China branch 😭😭😭 https://t.co/NhkOO7CuFM
1590912921236017153,Fri Nov 11 03:42:52 +0000 2022,@PeterDutton_MP Pity you don’t think of the carnage &amp; Atrocities of War when Sabre Rattling with China.. 😔
1590912918773985280,Fri Nov 11 03:42:52 +0000 2022,@DOliveiraFX @Bellehos China banning zero Covid? While cases surging there? https://t.co/SD7WUlIiHv
1590912918736232448,Fri Nov 11 03:42:52 +0000 2022,"@MaitreyaBhakal @MaitreyaBhakal , I don't fully understand. Help me out please!

Does that mean Islam practised in China must be conducted in Chinese? What does he specifically mean by orientation?"
1590912891225374720,Fri Nov 11 03:42:45 +0000 2022,"@TimothyDSnyder China and Russua can still do a lot of damage, and I'm not sure De Santis will be much better."
1590912889014996993,Fri Nov 11 03:42:45 +0000 2022,@plantationdrip China will never have an economic slowdown.
1590912876851900417,Fri Nov 11 03:42:42 +0000 2022,"The Duterte administration, however, didn’t exert effortful measures to really upgrade our relationship with Spain and the rest of Hispanidad. No trade agreements were signed, not even with Spain via the European Union. Instead it heavily focused on ties with China."
1590912863363006464,Fri Nov 11 03:42:39 +0000 2022,"@CRose2u @PhilConnorsII @camdephilob @RepTroyNehls @elonmusk There were files of transactions made that raises questions like 10% of a 1.5 billion dollar deal goes to the ""big guy"" which joe has on the license plates of his cars, that was from china through burisma in Ukraine, so just ponder all that"
1590912859243835392,Fri Nov 11 03:42:38 +0000 2022,"""If I say nothing, our competitor will be worried. Let's keep it that way.""
——When asked what he's busy with, Yang Wei, chief designer of the J-20 stealth fighter jet answered thusly.#China #Chinarama https://t.co/val9rj4O0n"
1590912854269788166,Fri Nov 11 03:42:36 +0000 2022,"Aquino’s ASEAN foreign policy was complemented with its “lawfare” strategy in South China Sea. By lodging and winning an arbitral case against China at the Permanent Court of Arbitration (PCA), the country was able to garner ASEAN-wide support and even internationalize the issue."
1590912852537544705,Fri Nov 11 03:42:36 +0000 2022,@CentroLeaks China next region?
1590912844413161472,Fri Nov 11 03:42:34 +0000 2022,"During the late President Noynoy Aquino’s term, the Philippines helped spearhead ASEAN integration as means of intensifying regional cooperation and hopefully reducing trade dependence on China, which was starting to become more explicitly expansionist and aggressive."
1590912843083239424,Fri Nov 11 03:42:34 +0000 2022,@moisesv @gurgavin That's not really the point. What matters is how China reacts.
1590912842626400256,Fri Nov 11 03:42:34 +0000 2022,"@GeorgePapa19 @Patrici15767099 Agree, too invested in China."
1590912836209111041,Fri Nov 11 03:42:32 +0000 2022,"Chrysanthemums were introduced from China during the Nara period. In Japan, it was touted as the ""King of Hundred Flowers"" as the most noble flower. This flower is one of the national seals and a crest (mon) used by the Emperor of Japan and members of the Imperial Family. https://t.co/RX8ZVLimwi"
1590912810628022272,Fri Nov 11 03:42:26 +0000 2022,@amyklobuchar It is not reproductive freedom it is abortion freedom. China restricted reproductive freedom to two children or 3 if first two were girls. Rest must have been aborted.
1590912809508143105,Fri Nov 11 03:42:26 +0000 2022,"@matthew_gail @justinamash @elonmusk Trump Trump, Saudia Arabia,China, Russia"
1590912800318459904,Fri Nov 11 03:42:23 +0000 2022,"@Svinhuvud @sammy479 @Reuters Am*rica is an imperialist State, Russia isn't. Russia  just wants to reunify it's territory. Same with the China and 'Taiwan' situation. Arguably Ukraine (and definitely Taiwan) are not countries."
1590912798162550786,Fri Nov 11 03:42:23 +0000 2022,china wholesale eco-friendly white pp spunbondnonwoven fabric for multi use https://t.co/8tlkpXdZjP
1590912793834065920,Fri Nov 11 03:42:22 +0000 2022,The US is interested in regime change in Russia &amp; China https://t.co/QD3xBErtmk via @YouTube
1590912788180140033,Fri Nov 11 03:42:21 +0000 2022,"@NewLeftEViews @alexbhturnbull1 @darioperkins The intersection of 

Japanese Banks lend to Cayman Entity with underlying China Real Estate activity?

Never seen that data join in the BOJ data. Can provide any hints?"
1590912785537716226,Fri Nov 11 03:42:20 +0000 2022,https://t.co/vWch1CY6PM Fine China Oval Serving Dish 18 karat gold paint G https://t.co/ltEP0y2t6e
1590912784845352960,Fri Nov 11 03:42:20 +0000 2022,WHICH MIDI KEYBOARD.
